"_id",job_link,answer,date,question,source
602e3af0ed0dadcccc432b36,https://www.quora.com/Which-are-the-most-underrated-professions-in-India?-,"Paperboys!  Believe me, working as a paper boy is not a cakewalk. It needs a great discipline and presence of mind. You need to fight the weather, get scolded by your customers and employers, still you will be underrated, unappreciated and underpaid. I used to work as paperboy some 9 years back in my city ( then town). I joined it not for money, but to learn discipline and for sharper mind. We must wake up at 4 o’clock in the morning. Get ready by 4:30 am, reach our distribution spot. Then we must carefully listen to our supervisor/head’s directions. We must start arranging them on bicycles and start our trip. Seniors were given at least 200 newspapers ( both english and telugu). As I was a kid, they would give me only 100 newspapers. I used to distribute “The HINDU” and “EENADU” newspapers in  Continue Reading Paperboys!  Believe me, working as a paper boy is not a cakewalk. It needs a great discipline and presence of mind. You need to fight the weather, get scolded by your customers and employers, still you will be underrated, unappreciated and underpaid. I used to work as paperboy some 9 years back in my city ( then town). I joined it not for money, but to learn discipline and for sharper mind. We must wake up at 4 o’clock in the morning. Get ready by 4:30 am, reach our distribution spot. Then we must carefully listen to our supervisor/head’s directions. We must start arranging them on bicycles and start our trip. Seniors were given at least 200 newspapers ( both english and telugu). As I was a kid, they would give me only 100 newspapers. I used to distribute “The HINDU” and “EENADU” newspapers in  Continue Reading",2021-02-18T10:01:20.121Z,"Which are the most underrated professions in India? ",Quora
602e3b0eed0dadcccc432b51,https://www.quora.com/What-was-the-shortest-interview-you’ve-had-that-led-to-a-job-offer?-,"23rd December 2016, College Placement : A decent IT company came for the placements in our college. Our reporting time was 9 am but the HR of the company came at 12 pm. There were 2 rounds. 1st Group Discussion following up with HR interview. Out of approx 100 people 40 of them were selected for the HR round. Thankfully, I was also one among them. Then the interview process began. My turn was among the last ones. So, first the students of Computer Engg were called for the interview. Each of them were interviewed for more than 20 mins. Seeing this i was little bit scared because being a Mechanical Engg i didn’t knew much about IT. I also came to know that they were asking question related to networking and data structures which i had no clue clue about. Then after 2 hrs my turn came up for the in Continue Reading 23rd December 2016, College Placement : A decent IT company came for the placements in our college. Our reporting time was 9 am but the HR of the company came at 12 pm. There were 2 rounds. 1st Group Discussion following up with HR interview. Out of approx 100 people 40 of them were selected for the HR round. Thankfully, I was also one among them. Then the interview process began. My turn was among the last ones. So, first the students of Computer Engg were called for the interview. Each of them were interviewed for more than 20 mins. Seeing this i was little bit scared because being a Mechanical Engg i didn’t knew much about IT. I also came to know that they were asking question related to networking and data structures which i had no clue clue about. Then after 2 hrs my turn came up for the in Continue Reading",2021-02-18T10:01:50.864Z,"What was the shortest interview you’ve had that led to a job offer? ",Quora
602e3b33ed0dadcccc432b62,https://www.quora.com/What-is-the-best-online-home-based-job?-,Every one want a know about how to start a trading business from home. Trading Business is one of the most profitable business options. If you are planning to start trading business and looking for trading business ideas here is a list of 10 Best Small Investment Trading Business Ideas. These business ideas can be started with small or slightly moderate investment. Trading means buying and selling items or goods for earning higher profits. The goods can be standard goods or customized items. The companies dealing in trading business are known as trading companies. Trading companies do not manufacture goods directly they buy it from multiple manufacturers or wholesaler and sell it to end customer or retailers. Trading companies either maintain their own stock in a shop or warehouse or they o Continue Reading Every one want a know about how to start a trading business from home. Trading Business is one of the most profitable business options. If you are planning to start trading business and looking for trading business ideas here is a list of 10 Best Small Investment Trading Business Ideas. These business ideas can be started with small or slightly moderate investment. Trading means buying and selling items or goods for earning higher profits. The goods can be standard goods or customized items. The companies dealing in trading business are known as trading companies. Trading companies do not manufacture goods directly they buy it from multiple manufacturers or wholesaler and sell it to end customer or retailers. Trading companies either maintain their own stock in a shop or warehouse or they o Continue Reading,2021-02-18T10:02:27.259Z,"What is the best online home based job? ",Quora
602e3b51ed0dadcccc432b79,https://www.quora.com/How-can-I-get-a-job-in-Canada-from-India?-,Include Related Answers  Ramit Kundu,2021-02-18T10:02:57.652Z,"How can I get a job in Canada from India? ",Quora
602e3b87ed0dadcccc432b97,https://www.quora.com/Which-is-the-best-government-job-in-India-and-why?-,"I'll give you a brief idea about some of the top-rated government jobs in India. Job- security and work-life balance are the two aspects for which anyone would fall for these jobs: 1.Indian Foreign Service (IFS): Indian Foreign Service officers are selected through Civil Service exams conducted by UPSC. The perks of this job are: Starting salary is between 60000–70000 per month.They get wonderful accommodation in the world's best cities.Free education in international schools for their children.Free medical care.Offical Luxury car.2. Indian Administrative Service and Indian Police Service (IAS and IPS): IAS and IPS are the most sought government jobs in India. The perks of these jobs are unmatchable. Entry-level pay Rs. 50,000 along with daily allowance.Big bungalows when posted as DMSpecialiContinue Reading I'll give you a brief idea about some of the top-rated government jobs in India. Job- security and work-life balance are the two aspects for which anyone would fall for these jobs: 1.Indian Foreign Service (IFS): Indian Foreign Service officers are selected through Civil Service exams conducted by UPSC. The perks of this job are: Starting salary is between 60000–70000 per month.They get wonderful accommodation in the world's best cities.Free education in international schools for their children.Free medical care.Offical Luxury car.2. Indian Administrative Service and Indian Police Service (IAS and IPS): IAS and IPS are the most sought government jobs in India. The perks of these jobs are unmatchable. Entry-level pay Rs. 50,000 along with daily allowance.Big bungalows when posted as DMSpecialiContinue Reading",2021-02-18T10:03:51.368Z,"Which is the best government job in India and why? ",Quora
602e3bc2ed0dadcccc432bba,https://www.quora.com/What-is-the-best-way-to-find-a-job-in-Dubai?-,"Honestly speaking, Dubai has a very hard job market right now. I took about 5 months to find a job and I only found it through my family here. Same goes for my girlfriend she looked for a job for almost 9 full months on all the online platforms she could find. The only way she found a job was because my brother put her in touch with a friend. To further this point you have to understand our history. I am an Indian expat from a relatively wealthy family who has made Dubai their home for 30+ years. My girlfriend is a white american from Texas. Both of us have university degrees from the USA and good work experience. If you want some major advice Ill tell you one thing. DO NOT come to Dubai on a visit or tourist visa and start looking for a job. It will take way too long and you will spend all  Continue Reading Honestly speaking, Dubai has a very hard job market right now. I took about 5 months to find a job and I only found it through my family here. Same goes for my girlfriend she looked for a job for almost 9 full months on all the online platforms she could find. The only way she found a job was because my brother put her in touch with a friend. To further this point you have to understand our history. I am an Indian expat from a relatively wealthy family who has made Dubai their home for 30+ years. My girlfriend is a white american from Texas. Both of us have university degrees from the USA and good work experience. If you want some major advice Ill tell you one thing. DO NOT come to Dubai on a visit or tourist visa and start looking for a job. It will take way too long and you will spend all  Continue Reading",2021-02-18T10:04:50.754Z,"What is the best way to find a job in Dubai? ",Quora
602e3c15ed0dadcccc432be2,https://www.quora.com/What-are-the-jobs-that-make-you-richer?-,"Naman Nepal I like Mathematics, specially when it comes to business or money. Let’s dive straight in.  Making a million does not seem to be a big deal. You build a product, or a service and get only 5,000 people to pay $17 per month for a year. That’s it. Having a product that sells for more would require you lesser customers. How awesome is that? And, when you have a product out in the market, you work hard for it to succeed. Or, is it smart? Here are five more things that will make you millions with any business. Niche marketsThe 21st century has opened doors to several niche markets that are pretty small, with less customers but with tons of opportunities to get high turnovers. All you need to do is get into a market that has a positive slope. You’ll get to a million sooner or later. MonetizationBusinesses be Continue Reading Continue Reading",2021-02-18T10:06:13.399Z,"What are the jobs that make you richer? ",Quora
