"_id",job_link,answer,date,question,source
603cff62b30e99eeabcd5b45,https://www.quora.com/How-can-one-choose-photography-as-a-career-option?-,"Atul Chauhan You can earn much more as a photographer, based on your talent, skills, portfolio and business acumen, it would be wise to make sure that’s your passion and love for photography that’s driving your decision to go down the path of becoming a professional photographer. Here some tips to become professional photographer: Start out by asking the right question: professional photography can be excellent choice for a career if you can manage the right balance between your creative passion and entrepreneurial instincts. Just like starting out in any other business, put together a list of questions that you need to answer for yourself before you begin your photography career. Get right photography education: A lot of professional photographers have taken photography courses at school, university and  Continue Reading Continue Reading",2021-03-01T14:51:13.998Z,"How can one choose photography as a career option? ",Quora
603cff71b30e99eeabcd5b61,https://www.quora.com/What-does-a-professional-photographer-cost-in-Kenya?-,"In Kenya, professional photography was not taken serious until recently. Kenya photographers were regarded as a paparazzi job. Not many Kenyans pursued photography as a professional career. Also the lack of affordable professional gears attributed in low interests in photography as a freelance job. But lately things have really changed because professional cameras are now affordable and the business in photography in Kenya has risen significantly. Kenyans have embrace and valued the art of professional photography. Pricing has depended on which town your photographer is located in and the type of photography. Photographers in Nairobi are regard as the top photographers. A really good photographer like Joewell Photography can charge you USD30 for an hour. But on average a shoot may cost aroun Continue Reading In Kenya, professional photography was not taken serious until recently. Kenya photographers were regarded as a paparazzi job. Not many Kenyans pursued photography as a professional career. Also the lack of affordable professional gears attributed in low interests in photography as a freelance job. But lately things have really changed because professional cameras are now affordable and the business in photography in Kenya has risen significantly. Kenyans have embrace and valued the art of professional photography. Pricing has depended on which town your photographer is located in and the type of photography. Photographers in Nairobi are regard as the top photographers. A really good photographer like Joewell Photography can charge you USD30 for an hour. But on average a shoot may cost aroun Continue Reading",2021-03-01T14:51:29.132Z,"What does a professional photographer cost in Kenya? ",Quora
603cff8fb30e99eeabcd5b7c,https://www.quora.com/Should-I-study-photography?-,"here are some reasons why you SHOULD study photography (in my opinion) 1. photography makes you see the world as a beautiful place.I am a photographer and I see beauty everywhere from mountain ranges to deep oceans (landscape); from a leaf to a drop of water (macro); from the West hemisphere to the East (travel); from downtown to another city (cityscape) and from one studio to another studio filled up with wonderful people (portrait and fine art). Photography gives you a pair of fresh eyes to let you appreciate the beautiful world around you. ""Everything is beautiful if one has the eyes to see it.""2. photography makes you a careful person.Every photographer knows that the difference between one single dot of noise and a clean image. We have to make the photos perfect before sharing onlin Continue Reading here are some reasons why you SHOULD study photography (in my opinion) 1. photography makes you see the world as a beautiful place.I am a photographer and I see beauty everywhere from mountain ranges to deep oceans (landscape); from a leaf to a drop of water (macro); from the West hemisphere to the East (travel); from downtown to another city (cityscape) and from one studio to another studio filled up with wonderful people (portrait and fine art). Photography gives you a pair of fresh eyes to let you appreciate the beautiful world around you. ""Everything is beautiful if one has the eyes to see it.""2. photography makes you a careful person.Every photographer knows that the difference between one single dot of noise and a clean image. We have to make the photos perfect before sharing onlin Continue Reading",2021-03-01T14:51:59.337Z,"Should I study photography? ",Quora
603cffadb30e99eeabcd5b96,https://www.quora.com/Is-30-years-too-old-to-switch-careers-and-become-a-professional-photographer?-,"I am 66 years old and have been shooting professionally since I was 18. I have shot everything from a Graflex 4x4, Mamiya RB67, various twin lense cameras, scores of 35 mm and now digital after having learned all I could about Photoshop and editing. First of all you need to be in good physical shape. You have gear to lug everywhere. You put a lot of shoe miles in. You need to invest in the best gear that you can afford. You need to have back up gear and back up to the back up. You need people skills in order to deal with clients with impossible requests. You need to know your equipment completely so that you can operate it even in a dark theater. You need to take so many photos over the years that you instinctively know what the photo will look like on the computer screen and as a print. You  Continue Reading I am 66 years old and have been shooting professionally since I was 18. I have shot everything from a Graflex 4x4, Mamiya RB67, various twin lense cameras, scores of 35 mm and now digital after having learned all I could about Photoshop and editing. First of all you need to be in good physical shape. You have gear to lug everywhere. You put a lot of shoe miles in. You need to invest in the best gear that you can afford. You need to have back up gear and back up to the back up. You need people skills in order to deal with clients with impossible requests. You need to know your equipment completely so that you can operate it even in a dark theater. You need to take so many photos over the years that you instinctively know what the photo will look like on the computer screen and as a print. You  Continue Reading",2021-03-01T14:52:29.451Z,"Is 30 years too old to switch careers and become a professional photographer? ",Quora
603cffbcb30e99eeabcd5ba2,https://www.quora.com/What-defines-a-professional-photographer?-,"Rolando Gómez I glanced through the answers and most focused on “what is” a professional photographer, but the key word in the question was “defines.” So I’m going to focus on the word from a transitive verb angle, which means, “to identify…” after I dispel the myth that a professional’s primary income is photography. Making your primary income in anything doesn’t make you a professional anymore than a hot dog stand vendor being called a culinary chef.  The Making Money Answer While professional photographers do get paid, not all make their primary source of income through photography. I know professional photographers that are doctors, airline pilots, lawyers, CEO’s, etc., including several heart surgeons, that run a professional photography studio and photograph weddings, seniors, family portraits, sport Continue Reading Continue Reading",2021-03-01T14:52:44.265Z,"What defines a professional photographer? ",Quora
603cffcbb30e99eeabcd5bac,https://www.quora.com/Which-kind-of-photography-has-a-lot-of-scope?-,Rishi E I would ask scope in terms of GrowthMoney/incomeSustainable businessWell Photography is booming as the social media is consuming so much media everyday and the eyes move from hoardings to phones. We are always around phones and see a huge amount of media. In terms of money business and growth- overall Photography or videography has a lot of scope if you like creating content and have some basic skills. Broadly seeing anything that tells a story has a huge scope now. Going in detail- Wedding photographer has a huge scope. It's a never dying billion $ industry and gets affected by inflation. Skills are definitely required but if you ask Scope I'd say yes- it has a lot of opportunities and is a dynamic industry to be in.,2021-03-01T14:52:59.501Z,"Which kind of photography has a lot of scope? ",Quora
603cffdfb30e99eeabcd5bc2,https://www.quora.com/What-happens-if-you-have-a-love-marriage-totally-against-your-family’s-wishes?-,"I can exactly relate to the state in which you are. I was in the same situation few years ago and my battle ended few months ago. We married on valentine's Day with both of our families heartfelt wishes.  I grew up in a very caring family. I never remember an occasion in which my parents said 'no' to anything that made me happy. I confessed my love to my parents when I was 22. I was in a total shock when they vehemently opposed it. My girl has squint eyes. My parents started worrying about what people would think instead of why I loved this girl. Its surprising how that "" chaar loog (society) "" would affect your choices in life. I wanted to shout that I don't give a fuck to what people think. I think they also doubted my ability to make the most important decision of any one's life. ""Marria Continue Reading I can exactly relate to the state in which you are. I was in the same situation few years ago and my battle ended few months ago. We married on valentine's Day with both of our families heartfelt wishes.  I grew up in a very caring family. I never remember an occasion in which my parents said 'no' to anything that made me happy. I confessed my love to my parents when I was 22. I was in a total shock when they vehemently opposed it. My girl has squint eyes. My parents started worrying about what people would think instead of why I loved this girl. Its surprising how that "" chaar loog (society) "" would affect your choices in life. I wanted to shout that I don't give a fuck to what people think. I think they also doubted my ability to make the most important decision of any one's life. ""Marria Continue Reading",2021-03-01T14:53:19.722Z,"What happens if you have a love marriage totally against your family’s wishes? ",Quora
603cfffeb30e99eeabcd5bd8,https://www.quora.com/What-do-economics-PhD-students-do-after-getting-their-PhDs?-,"Siddhartha K. Rastogi I hold one and I have many friends / colleagues / seniors / juniors, who hold a doctorate in Economics from mainly India or USA, but also from EU and South-East Asia. So I'd just enlist what they do after getting their doctorate in Economics (with my opinions about the profiles):   Most often and most desirably, they chose Academics. Academic profiles have three facets - teaching (often the less exciting but necessary evil); research (most exciting, satisfying, funded travel opportunities for conferences, and occasionally, monetarily rewarding too); and consultancy (for government as well as private corporations or NGOs, depending upon one's tastes and expertise; a mixed bag of good and bad, rewarding or painful, all depends on the clients and the types of assignments).Some chose pure researContinue Reading I hold one and I have many friends / colleagues / seniors / juniors, who hold a doctorate in Economics from mainly India or USA, but also from EU and South-East Asia. So I'd just enlist what they do after getting their doctorate in Economics (with my opinions about the profiles):   Most often and most desirably, they chose Academics. Academic profiles have three facets - teaching (often the less exciting but necessary evil); research (most exciting, satisfying, funded travel opportunities for conferences, and occasionally, monetarily rewarding too); and consultancy (for government as well as private corporations or NGOs, depending upon one's tastes and expertise; a mixed bag of good and bad, rewarding or painful, all depends on the clients and the types of assignments).Some chose pure researContinue Reading",2021-03-01T14:53:50.586Z,"What do economics PhD students do after getting their PhDs? ",Quora
603d000eb30e99eeabcd5be0,https://www.quora.com/How-should-one-start-a-career-in-photography?-,"Terry Constanti There are different areas of specialisation with professional photography. You can do any and all of them but you may find that, to start out professionally, you won’t be a master of each ‘genre’ to the extent that you need to be to charge people. So, work out what your strengths and interests are and look to those areas of photography where you can apply them. If there’s an area you want to work in but you aren’t yet that good at, study it, practice that, read, set yourself “assignments” on variations of that, do it till you feel confident you can walk into a professional assignment and complete it. If you can find someone willing to take you on as an assistant or second shooter or if there is a photography club nearby where you can get the benefit of other people’s experiences, connect up. S Continue Reading Continue Reading",2021-03-01T14:54:05.999Z,"How should one start a career in photography? ",Quora
603d002fb30e99eeabcd5c00,https://www.quora.com/Can-I-make-enough-money-if-I-choose-photography-as-my-career?-,Dhaval Singh Rajput Thanks for asking this question many people will get benefit from this. Note : I am Not a Photographer but i know someone who is. So you want to know CAN YOU MAKE ENOUGH money IF YOU CHOOSE PHOTOGRAPHY AS A CARRER. MY first Question to you : Ask a Question to you “ How Much Money Is enough for you.” Answer this question in Number like earning 20K/month minimum. Second Question is “ Do you Love doing photography” or “It is your passion” or “Are you crazy about it”. First answer this 2 question then read ahead. You can earn 50k / month by doing photography. Now various type of photography is out there. For BloggerBlogger sometime need specific photo for there blog. There you can come in picture . You can took photo for them. 2. Taking photo of Instagram model People who tell them Instagram model hire a p Continue Reading Continue Reading,2021-03-01T14:54:39.405Z,"Can I make enough money if I choose photography as my career? ",Quora
603d003eb30e99eeabcd5c08,https://www.quora.com/How-do-you-convince-your-parents-that-photography-is-not-that-bad-for-a-career?-,We don’t need anyone’s permission to choose a certain path in life / follow our dreams. We only need to decide that we want to do it and overcome our fear of doing it. We just need to forgo this bullshit notion that: we need to convince our parents (we don’t)we need to make our parents proud (we don't)we need to make our parents happy (we don’t)we need to provide our parents with a peace of mind (we don’t)we and our parents need to be on the same page - have the same definitions and beliefs (we don’t)we absolutely need our parents money (we don’t)our parents need to understand (they don’t)our parents need to support us and our ideas (they don’t)our parents need to be our fans (they don’t).As young adults we are crippled by so many erroneous assumptions (beliefs) about family and what it means Continue Reading We don’t need anyone’s permission to choose a certain path in life / follow our dreams. We only need to decide that we want to do it and overcome our fear of doing it. We just need to forgo this bullshit notion that: we need to convince our parents (we don’t)we need to make our parents proud (we don't)we need to make our parents happy (we don’t)we need to provide our parents with a peace of mind (we don’t)we and our parents need to be on the same page - have the same definitions and beliefs (we don’t)we absolutely need our parents money (we don’t)our parents need to understand (they don’t)our parents need to support us and our ideas (they don’t)our parents need to be our fans (they don’t).As young adults we are crippled by so many erroneous assumptions (beliefs) about family and what it means Continue Reading,2021-03-01T14:54:54.346Z,"How do you convince your parents that photography is not that bad for a career? ",Quora
603d0070b30e99eeabcd5c2e,https://www.quora.com/What-do-you-do-when-you-are-good-at-something-but-not-good-enough?-What-is-the-extra-push-that-takes-you-there?-,Very nice question . I think most of the people in today's competitive world feel the same. Maybe these points work for you.. 1. Mindset  In general there will always be people who are better than you in your respective field (of course not if you're a prodigy or at such a level that you're beyond comparison )  but if instead of being inspired by them if you start bitching about this then you need to change your mindset. There's nothing bad in looking up to someone as an inspiration.   2. Do not give up!!This  comic strip can explain better than me (i know it is talking about  beginners and you are clearly ahead of that phase but it is quite similar to your situation and makes a  good point)   3. InterestLets  say you are good at something but you have the feeling that you are not  meant to d Continue Reading Very nice question . I think most of the people in today's competitive world feel the same. Maybe these points work for you.. 1. Mindset  In general there will always be people who are better than you in your respective field (of course not if you're a prodigy or at such a level that you're beyond comparison )  but if instead of being inspired by them if you start bitching about this then you need to change your mindset. There's nothing bad in looking up to someone as an inspiration.   2. Do not give up!!This  comic strip can explain better than me (i know it is talking about  beginners and you are clearly ahead of that phase but it is quite similar to your situation and makes a  good point)   3. InterestLets  say you are good at something but you have the feeling that you are not  meant to d Continue Reading,2021-03-01T14:55:44.726Z,"What do you do when you are good at something but not good enough? What is the extra push that takes you there? ",Quora
603d0082b30e99eeabcd5c37,https://www.quora.com/What-did-you-learn-too-late-in-life?-,"Bhakti Chilekar I learned late in my life is money is not important, getting a love interest till your 20′s/30′s is not important. You can be happy without materialistic things but you can't be happy without being yourself. I always wanted to do phd, studies is something which I love, which gives me inner peace. I did my masters in biochemistry from finest college in Mumbai for my subject. I have my own house but my family was not so financially settled, so I had to leave my dream of phd. I worked in corporate and seriously I was earning well. My 1 month salary after end of 10th year of corporate job is double than my college fees from 10th Std till my masters. I used to spend 30-40k a month on my makeup, costly Shopping blah blah. My life was very successful for people in society but was I happy? Nope. I Continue Reading Continue Reading",2021-03-01T14:56:02.437Z,"What did you learn too late in life? ",Quora
603d00a9b30e99eeabcd5c5b,https://www.quora.com/Why-are-high-school-drop-outs-looked-down-upon?-,"Chloe Bristow It was my second month as a senior in high school. That's when I made the decision that was supposed to ruin my life. I was in the middle of first period -- Math class. I would say I hated math but that would just undermine the displeasure school brought about in general. Now it was nothing personal. School was just something I never asked for. An inherited debt so to speak. One that chipped away at some of the better parts of me for years. Anyway, I remember I was looking down at my desk avoiding eye contact with the teacher. The teacher was walking the ranks of her students, passing back homework from the day prior. Mine wasn’t there. To be honest, it was never there. I just couldn’t entertain the idea of spending time on it. So, I never did it, but I also had no intention of arguing the conse Continue Reading",2021-03-01T14:56:41.938Z,"Why are high school drop outs looked down upon? ",Quora
603d00d2b30e99eeabcd5c7b,https://www.quora.com/Why-do-many-middle-class-Indian-parents-force-their-kids-into-studying-engineering-or-medicine?-Why-do-they-not-support-other-career-options?-,Include Related Answers  Parikshit Sivan,2021-03-01T14:57:22.737Z,"Why do many middle-class Indian parents force their kids into studying engineering or medicine? Why do they not support other career options? ",Quora
603d010bb30e99eeabcd5ca3,https://www.quora.com/How-can-you-work-in-the-IT-sector-and-do-photography-at-the-same-time?-,"Senthil Kumar  Okay!! Is photography your passion? If yes, then you can do it (Morning Walk, Late night Office :) , Office trips and may be a friend’s wedding etc etc. ) you just carry your passion all the time with you and capture the moment when you feel like and this is not your passion then just don’t do it. P.S.: I’ve stopped capturing moment because I want to live the moment rather wasting in capturing ( yeah!! i know Old school - but I love it like that)",2021-03-01T14:58:19.626Z,"How can you work in the IT sector and do photography at the same time? ",Quora
603d0149b30e99eeabcd5cd1,https://www.quora.com/Is-photography-the-best-option-to-switch-your-career?-,"If you are here, then perhaps you are thinking about pursuing photography as a career and you probably want to know if it’s a good career. Photography has had many ups and downs throughout the years but luckily now with so many platforms to use like Instagram, Pinterest and Facebook it is flowering. With advancements in technology, photography equipment is available to anyone and most young people are thinking the same. Should they start a photography career? Is photography a good career? Yes, photography is a good career but if you are going to end up having a successful photography career or not, completely depends on your set of skills, creativity, the type of photography you opt for as a photographer and how smartly you work. Having a drive for success and being a hard-working person is so Continue Reading If you are here, then perhaps you are thinking about pursuing photography as a career and you probably want to know if it’s a good career. Photography has had many ups and downs throughout the years but luckily now with so many platforms to use like Instagram, Pinterest and Facebook it is flowering. With advancements in technology, photography equipment is available to anyone and most young people are thinking the same. Should they start a photography career? Is photography a good career? Yes, photography is a good career but if you are going to end up having a successful photography career or not, completely depends on your set of skills, creativity, the type of photography you opt for as a photographer and how smartly you work. Having a drive for success and being a hard-working person is so Continue Reading",2021-03-01T14:59:21.900Z,"Is photography the best option to switch your career? ",Quora
603d0189b30e99eeabcd5cfb,https://www.quora.com/How-can-I-start-a-career-in-commercial-photography?-,"Learning to Become a Professional Commercial Photographer A photographer can be called a modern painter whose paint brush is his camera. With all the smart phones having good cameras built in them, everybody like to click pictures of everything they feel is pleasing. But it takes a lot of practise and preparation to transform an amateur into an expert commercial photographer in Sydney. Let us have a look at some important tips that one needs to follow if they want to build a career as a professional. Passion: The first quality of any photographer or any other professional is passion. If you are not passionate about your job, you will end up doing mediocre job. When you are beginning to build a career as food photographer in Sydney or any other field you need to find that one field which inteContinue Reading Learning to Become a Professional Commercial Photographer A photographer can be called a modern painter whose paint brush is his camera. With all the smart phones having good cameras built in them, everybody like to click pictures of everything they feel is pleasing. But it takes a lot of practise and preparation to transform an amateur into an expert commercial photographer in Sydney. Let us have a look at some important tips that one needs to follow if they want to build a career as a professional. Passion: The first quality of any photographer or any other professional is passion. If you are not passionate about your job, you will end up doing mediocre job. When you are beginning to build a career as food photographer in Sydney or any other field you need to find that one field which inteContinue Reading",2021-03-01T15:00:25.373Z,"How can I start a career in commercial photography? ",Quora
