"_id",job_link,answer,date,question,source
603d019cb30e99eeabcd5d09,https://www.quora.com/What-are-some-career-choices-other-than-Engineering-and-Medicine-which-are-beneficial-and-which-one-can-prepare-for-admission-within-a-month?-,"Manav Patel Hello friends there are so many choices of eclect your career anstaed of enggineering and medical course I am an engineer and I had research on before choosing enggineering line there are 5 to 6 best career opportunities that I am going to tell you .. 1> PHOTOGRAPHY : The photography is the best option for thoes people who interested in taking photos.  In this field you can get easily admission in any collage there are no big amount of investment in photography study. Only 1 things in need that is you should have your camera and your tripod\U0001f600 2> Mass communication Other best option is mass communication this is the one the best option thoes people who are interested to build the future in the anchoring,stagehost,travellinguide.    3) Career Info for a Degree in Cinematography & Film Producti Continue Reading Continue Reading",2021-03-01T15:00:43.977Z,"What are some career choices other than Engineering and Medicine which are beneficial and which one can prepare for admission within a month? ",Quora
603d01ebb30e99eeabcd5d3d,https://www.quora.com/Is-a-career-in-the-film-industry-transferable-to-other-careers-in-different-industries?-,Christopher Kingery,2021-03-01T15:02:03.636Z,"Is a career in the film industry transferable to other careers in different industries? ",Quora
603d01feb30e99eeabcd5d54,https://www.quora.com/When-will-IITs-achieve-standards-like-MIT-and-Stanford?-,"This is the respective rankings of the colleges mentioned in the question according to the trusted QS rankings. MIT and Stanford stand at top.  And IITs stand far behind.  These rankings were based on five parameters.  Now. let’s see their scores in different parameters. These are MIT’s scores.   It has all its scores around 100 in all parameters namely Overall score, academic reputation, employer reputation, faculty student ratio, citations per faculty, international faculty and international students. These are Stanford’s scores. It also has scores around 100.   These are scores of the two topmost IITs in the rankings. First, IIT Delhi:   And then IIT Bombay:   We notice that their scores are nowhere as compared to MIT and Stanford. If we plot the graph comparing IITs with top institutions on these five pa Continue Reading This is the respective rankings of the colleges mentioned in the question according to the trusted QS rankings. MIT and Stanford stand at top.  And IITs stand far behind.  These rankings were based on five parameters.  Now. let’s see their scores in different parameters. These are MIT’s scores.   It has all its scores around 100 in all parameters namely Overall score, academic reputation, employer reputation, faculty student ratio, citations per faculty, international faculty and international students. These are Stanford’s scores. It also has scores around 100.   These are scores of the two topmost IITs in the rankings. First, IIT Delhi:   And then IIT Bombay:   We notice that their scores are nowhere as compared to MIT and Stanford. If we plot the graph comparing IITs with top institutions on these five pa Continue Reading",2021-03-01T15:02:22.651Z,"When will IITs achieve standards like MIT and Stanford? ",Quora
603d0233b30e99eeabcd5d6f,https://www.quora.com/How-can-one-become-better-at-photography?-,"""Skill in photography is acquired by practice and not by purchase"" When students in the very first lecture often ask me this question, it always gives a bright smile on the face, because I also started my photography career with the same question, and after struggling for 10 years, I am quite able to answer some aspects of this question. I assume if this question is rolling your minds, then might you fall in one of the following categories - You are about to start your career.You have started learning already, have some knowledge in it, but want to polish your photography skills.So first find which category you belong to. Let's take a look at each of them in brief. What if you are about to start your career -If we divide learning in three steps, beginner, mature and professional, or expert, we Continue Reading ""Skill in photography is acquired by practice and not by purchase"" When students in the very first lecture often ask me this question, it always gives a bright smile on the face, because I also started my photography career with the same question, and after struggling for 10 years, I am quite able to answer some aspects of this question. I assume if this question is rolling your minds, then might you fall in one of the following categories - You are about to start your career.You have started learning already, have some knowledge in it, but want to polish your photography skills.So first find which category you belong to. Let's take a look at each of them in brief. What if you are about to start your career -If we divide learning in three steps, beginner, mature and professional, or expert, we Continue Reading",2021-03-01T15:03:15.524Z,"How can one become better at photography? ",Quora
603d025cb30e99eeabcd5d93,https://www.quora.com/How-can-I-learn-photography-skills?-,"Kingshuk Pal Photography is absolutely an Art! Starting photography is not like starting a rocket engine! The thing you need first is a camera. Any camera you have. If you don't have one, try borrowing it. Don't go for high end DSLR cameras at the beginning. They are complicated. Buy any camera around 50k ₹ to start with.Even a digital camera is enough to start with if you have interest. But say no to smartphone cameras if you are sincerely interested to start photography.Read instruction manuals of the camera first. Learn how to care it, what conditions are best for your camera.Spend time focusing on subjects with the camera. For practice, start with stationary objects kept at various distances to focus. Then move on to moving objects. You will gradually learn about manual focus, auto focus, 3-D trackinContinue Reading Continue Reading",2021-03-01T15:03:56.944Z,"How can I learn photography skills? ",Quora
603d026fb30e99eeabcd5d9c,https://www.quora.com/Does-Hillary-Clinton-realize-how-important-the-coal-industry-is-to-America?-,"Nan Zhou I think the better to look at it is how important it WAS to the U.S..  Just to give you a little bit of background about myself. I have been working in investment banking for the last ~10 years and I have spent most of that time advising mining companies which include coal.  I remember when I was in my analyst years and even associate years (so really up until 3-4 years ago), we used to compile comparable company operating and trading data for all the listed companies in the given sub-sector eg coal. U.S. used to have like ~10 decent sized coal mining companies. I recently asked my analyst to do a page listing out all the coal companies existed 5 years ago vs now, by region. (I will try to paste it in here tmr). U.S. is now down to ONE listed coal company and even that one is struggling.  Tim Continue Reading Continue Reading",2021-03-01T15:04:15.108Z,"Does Hillary Clinton realize how important the coal industry is to America? ",Quora
603d02cbb30e99eeabcd5de3,https://www.quora.com/Should-I-become-a-cinematographer?-,Include Related Answers  Should I become a cinematographer?,2021-03-01T15:05:47.386Z,"Should I become a cinematographer? ",Quora
603d02e3b30e99eeabcd5dee,https://www.quora.com/What-job-requires-the-most-patience?-,"Saurabh Singh The Bus Conductor Ever traveled in an Indian Bus? I am not talking about the long route ""Volvo's"" , but rather the more conventional intra city government buses. Well, most of the people including me would rather pay 200 bucks & take a taxi than the bus. The reason is pretty simple, the insane amount of people that travel in these buses. Each route, each bus, every time of the day.    Now imagine being a bus conductor in these buses. Its absolutely crazy. There are a lot of factors which contribute to this.  The low wages-Doing the job of the conductor in India, doesn't pay you much . Atleast the driver has a seat where he can sit. The conductor usually has to stand & in some cases he is so tuned into things that he prefers to stand even if there is a seat available. Long working hours- Continue Reading Continue Reading",2021-03-01T15:06:11.387Z,"What job requires the most patience? ",Quora
603d02fab30e99eeabcd5e0a,https://www.quora.com/What-are-the-most-suitable-career-options-for-an-INFJ-personality-type?-,"Paul Barber Suitable and Unsuitable careers for INFJ According to MBTI dimensions, INFJ find happiness in contributing to the welfare of others. They like interacting with people and guiding them to realize their human potential. They can understand and use human systems creatively. As well as, they like problem-solving and various creative works. These are their basic nature. So, finding a profession relating to these interests and skills would be a stepping stone to their professional success. Suitable Careers CounselorAs per MBTI theories, these people are naturally equipped with the high level of counseling skill inside. Their personality will be defined as a natural counselor who tends to work in various organization and unions in the society. INFJ can devise their career in this vast zone to get the  Continue Reading Continue Reading",2021-03-01T15:06:34.493Z,"What are the most suitable career options for an INFJ personality type? ",Quora
603d0334b30e99eeabcd5e37,https://www.quora.com/What-should-I-do-with-my-career-now?-Please-read-the-details.-,Include Related Answers  What should I do with my career now?,2021-03-01T15:07:32.249Z,"What should I do with my career now? ",Quora
603d037bb30e99eeabcd5e58,https://www.quora.com/What-are-the-first-things-to-learn-when-learning-photography-as-a-career?-,"What Are The First 10 Steps To Become A Professional Photographer? Be confident in your equipment, know your equipment, most photography is high pressure.Make sure your website looks stunning, your website will sell your photography.Put your prices on your website so that you get rid of time wasters, set an hourly rate, a half day rate and a full day rate.Look for commercial work for businesses, that is where the real money is.Network at local business networks, wedding events, anywhere where your potential client hangs out, you will pick up work that way.Do your first 3 jobs for free so that you can build a portfolio of professional work, find friends or relatives that need a photographer.Build a local following on social media, Facebook, Linkedin and Instagram are your best sites to startContinue Reading What Are The First 10 Steps To Become A Professional Photographer? Be confident in your equipment, know your equipment, most photography is high pressure.Make sure your website looks stunning, your website will sell your photography.Put your prices on your website so that you get rid of time wasters, set an hourly rate, a half day rate and a full day rate.Look for commercial work for businesses, that is where the real money is.Network at local business networks, wedding events, anywhere where your potential client hangs out, you will pick up work that way.Do your first 3 jobs for free so that you can build a portfolio of professional work, find friends or relatives that need a photographer.Build a local following on social media, Facebook, Linkedin and Instagram are your best sites to startContinue Reading",2021-03-01T15:08:43.011Z,"What are the first things to learn when learning photography as a career? ",Quora
603d03c6b30e99eeabcd5e82,https://www.quora.com/Is-photography-as-a-career-for-introverts?-,Include Related Answers  Is photography as a career for introverts?,2021-03-01T15:09:58.345Z,"Is photography as a career for introverts? ",Quora
603d03dab30e99eeabcd5e92,https://www.quora.com/Is-it-ever-too-late-to-start-over-again-if-your-job-skills-are-no-longer-in-demand-in-the-workforce?-,"Hi. Your question is: Is it ever too late to start over again if your job skills are no longer in demand in the workforce? ‘No longer employed’ is the space where, with the right training, some of the best ‘life Coaches’ come from. There are some key skills that are missing in the world today. They create permanent employment for those who master them as a life coach through qualified training. A fulfilling new Career of Purpose awaits those who get the training for the ability to: understand that‘spirituality’ is the study of ‘spirit’- which is that part of every Human being,that, when it leaves, then the physical body is left dead and ready for burialunderstand the function of ‘spirit’ in relation to our ‘physical’ being and the role ‘spirit’ and ‘physical’ are each supposed to play.master thContinue Reading Hi. Your question is: Is it ever too late to start over again if your job skills are no longer in demand in the workforce? ‘No longer employed’ is the space where, with the right training, some of the best ‘life Coaches’ come from. There are some key skills that are missing in the world today. They create permanent employment for those who master them as a life coach through qualified training. A fulfilling new Career of Purpose awaits those who get the training for the ability to: understand that‘spirituality’ is the study of ‘spirit’- which is that part of every Human being,that, when it leaves, then the physical body is left dead and ready for burialunderstand the function of ‘spirit’ in relation to our ‘physical’ being and the role ‘spirit’ and ‘physical’ are each supposed to play.master thContinue Reading",2021-03-01T15:10:18.656Z,"Is it ever too late to start over again if your job skills are no longer in demand in the workforce? ",Quora
603d0406b30e99eeabcd5ea4,https://www.quora.com/Do-most-photographers-need-another-job-to-earn-a-living?-,"The sad truth is that there are very few Photographers, who don't need another form of support, or have to have some other source of income to be able to pursue their passion. It's not a profession that you enter to make the ""big money"". There are exceptions of course, the Annie Liebowizs of the world are the rock stars of photography. Making fame and fortune is as rare as the garage band becoming the Rolling Stones. The upside is that there are other jobs that let you peruse your passion. In my time, I've worked as a photojournalist, a book illustrator, photo lab technician, and a wedding photographer. As a freelance, I've done construction work in progress photos, and school directories portraits, fashion, band pictures and all sorts of images for publications and online. None of those jo Continue Reading The sad truth is that there are very few Photographers, who don't need another form of support, or have to have some other source of income to be able to pursue their passion. It's not a profession that you enter to make the ""big money"". There are exceptions of course, the Annie Liebowizs of the world are the rock stars of photography. Making fame and fortune is as rare as the garage band becoming the Rolling Stones. The upside is that there are other jobs that let you peruse your passion. In my time, I've worked as a photojournalist, a book illustrator, photo lab technician, and a wedding photographer. As a freelance, I've done construction work in progress photos, and school directories portraits, fashion, band pictures and all sorts of images for publications and online. None of those jo Continue Reading",2021-03-01T15:11:02.641Z,"Do most photographers need another job to earn a living? ",Quora
603d041ab30e99eeabcd5eb6,https://www.quora.com/Is-it-worth-it-to-major-in-photography?-,Include Related Answers  Is it worth it to major in photography?,2021-03-01T15:11:22.844Z,"Is it worth it to major in photography? ",Quora
603d0446b30e99eeabcd5ec8,https://www.quora.com/How-is-the-placement-scenario-at-XIC-for-advertising-and-marketing-communications?-,"Aakash Arya I had worked for Times of India a little over a year when I joined XIC. The original plan was to continue working part-time, since I had an excellent rapport with the HR & my higher ups. The course was tough. The choice between a secure/fun job & a diploma in journalism was even tougher. I decided to do the course. I wanted to learn Photography. By the end of the course, I was a good photographer. My photographs were being displayed across many competitions and galleries. However, photography was a passion, not a career goal. When I had to submit my final paper, I chose Satyajit Ray & his films. (Irrelevant to the question. Sorry. I was taken back.) Anyway, at the end, I felt that I was good at many things, I was comfortable with many career paths. When the placements came in, nothing felt ri Continue Reading",2021-03-01T15:12:06.091Z,"How is the placement scenario at XIC for advertising and marketing communications? ",Quora
603d0467b30e99eeabcd5edf,https://www.quora.com/How-many-hours-does-a-freelance-photographer-work?-,"Probably at 50–60 hours a week depending on where he/she is at in their career. If they want to be very successful, they will put in whatever time they need to to achieve their goals. I know a lot of photographers that use photography as a supplement to their day jobs and maybe put in 15–20 hours. Depends on what you want to accomplish. Kyle Powell",2021-03-01T15:12:39.143Z,"How many hours does a freelance photographer work? ",Quora
603d048fb30e99eeabcd5ef5,https://www.quora.com/How-should-I-spend-my-time-after-quitting-my-first-job?-,"After he lost his job in the summer of 2010, Brandon Stanton the founder of now very popular blog Humans of New York made the decision that he was going to spend the next period of his life thinking not about money (he worked as a bond trader), but about how he spent his time. He loved taking photographs at the time, and he had this idea that he would move to New York (no job, no place to live, no friends, no nothing) and stop 10,000 people on the streets and take their portrait, and create kind of a photographic census of the city. Today Humans of New York is not what he initially thought it would be. It evolved and became the collection of stories told by people he stops on the streets of New York each day, supplemented by their portraits. He didn’t care about gaps appearing on his resume.  Continue Reading After he lost his job in the summer of 2010, Brandon Stanton the founder of now very popular blog Humans of New York made the decision that he was going to spend the next period of his life thinking not about money (he worked as a bond trader), but about how he spent his time. He loved taking photographs at the time, and he had this idea that he would move to New York (no job, no place to live, no friends, no nothing) and stop 10,000 people on the streets and take their portrait, and create kind of a photographic census of the city. Today Humans of New York is not what he initially thought it would be. It evolved and became the collection of stories told by people he stops on the streets of New York each day, supplemented by their portraits. He didn’t care about gaps appearing on his resume.  Continue Reading",2021-03-01T15:13:19.903Z,"How should I spend my time after quitting my first job? ",Quora
603d04beb30e99eeabcd5f06,https://www.quora.com/Do-people-who-are-good-at-drawing-have-jobs?-,"Yes! I count myself pretty good at drawing, and have what I consider a great job…as a software engineer. “Huh?” Yes, the fact is that there’s a huge amount of talented artists out there, who’ve spent decades training their skills, making contacts, and learning the business of art, illustration, photography, design, storyboarding, comics, on and on. That’s an incredible competitive force to pit yourself against. Take a look at the leading artists in your field. Back in the day, I used to compare myself against Larry Elmore or Michael Whelan’s fantasy art, Marc Silvestri and David Finch for comics, and others. Sit your own work side by side and be honest about your skills. You’re about to embark on a very difficult career, with low pay for maybe years while you establish a network and a body of Continue Reading Yes! I count myself pretty good at drawing, and have what I consider a great job…as a software engineer. “Huh?” Yes, the fact is that there’s a huge amount of talented artists out there, who’ve spent decades training their skills, making contacts, and learning the business of art, illustration, photography, design, storyboarding, comics, on and on. That’s an incredible competitive force to pit yourself against. Take a look at the leading artists in your field. Back in the day, I used to compare myself against Larry Elmore or Michael Whelan’s fantasy art, Marc Silvestri and David Finch for comics, and others. Sit your own work side by side and be honest about your skills. You’re about to embark on a very difficult career, with low pay for maybe years while you establish a network and a body of Continue Reading",2021-03-01T15:14:06.263Z,"Do people who are good at drawing have jobs? ",Quora
603d04e5b30e99eeabcd5f1e,https://www.quora.com/Do-we-really-need-a-backup-plan-in-life?-,"Yes. Always have a back up plan. A back up plan in life is so important because you just never know what could happen to you, or your loved ones: I recommend the following things to have a back up plan for: Money- Always aim to have more than enough money. Save as much as you can and keep money aside for a rainy day. Sometimes that rainy day might actually be more than 1 day and when that happens you want to make sure that you have plenty to last you a while. I say have money saved for at least 3 month to survive and cover basic needs such as food, rent, toiletries, transport, and any other expenses that you may have.Have a place to go- You don’t ever want to be left without a roof over your head. It might be difficult to arrange for this or fairly easy, but either way, try to either purchaseContinue Reading Yes. Always have a back up plan. A back up plan in life is so important because you just never know what could happen to you, or your loved ones: I recommend the following things to have a back up plan for: Money- Always aim to have more than enough money. Save as much as you can and keep money aside for a rainy day. Sometimes that rainy day might actually be more than 1 day and when that happens you want to make sure that you have plenty to last you a while. I say have money saved for at least 3 month to survive and cover basic needs such as food, rent, toiletries, transport, and any other expenses that you may have.Have a place to go- You don’t ever want to be left without a roof over your head. It might be difficult to arrange for this or fairly easy, but either way, try to either purchaseContinue Reading",2021-03-01T15:14:45.244Z,"Do we really need a backup plan in life? ",Quora
603d04f5b30e99eeabcd5f25,https://www.quora.com/Can-you-still-become-a-photographer-even-if-you-do-not-go-to-college?-,"Caleb Nettles The answer is YES! Photography is awesome because you can become professional without formal training. The real question is how dedicated are you to succeeding with photography? Like any art, you have to comit time, sweat, sleep, money and a whole lot of energy to become great at it. If you work hard and don’t give up when it gets tough and discouraging, you can definitely become a pro without a degree. How to become a professional depends on what kind of photography you’re doing, but their are basics that apply to all photography. I’d highly recommend dedicating a few months to just get good and confident with your equipment, editing style, and to research and learn as much as you can about the type of photography you’re into and also practice practice practice. Ask friends to model for you, Continue Reading",2021-03-01T15:15:01.860Z,"Can you still become a photographer even if you do not go to college? ",Quora
