"_id",job_link,answer,date,question,source
603cfb9fb30e99eeabcd58b4,https://www.quora.com/What-is-the-scope-of-photography-as-a-profession?-,Include Related Answers  What is the scope of photography as a profession?,2021-03-01T14:35:10.954Z,"What is the scope of photography as a profession? ",Quora
603cfbbcb30e99eeabcd58cc,https://www.quora.com/Is-photography-a-good-career?-,"Pictures are a powerful medium. They can inform, amuse, shock or amaze and if presented in the right manner, they can be beautiful and creative. Are you creative and imaginative? Do you have an eye for aesthetic detail and composition. Do you enjoy presenting things visually and communicating ideas to others through photographs. Is photography more than a hobby to you and do you feel a ripple of excitement when you imagine displaying your art to others? If your answer to all these questions is yes, then this passion can offer you a lot as a profession. Sometimes back, the idea of being a professional photographer might not have appealed to many but today lots of people want to be photographers. The rise of mass communication and the growing importance of the media and fashion is probably a  Continue Reading Pictures are a powerful medium. They can inform, amuse, shock or amaze and if presented in the right manner, they can be beautiful and creative. Are you creative and imaginative? Do you have an eye for aesthetic detail and composition. Do you enjoy presenting things visually and communicating ideas to others through photographs. Is photography more than a hobby to you and do you feel a ripple of excitement when you imagine displaying your art to others? If your answer to all these questions is yes, then this passion can offer you a lot as a profession. Sometimes back, the idea of being a professional photographer might not have appealed to many but today lots of people want to be photographers. The rise of mass communication and the growing importance of the media and fashion is probably a  Continue Reading",2021-03-01T14:35:40.467Z,"Is photography a good career? ",Quora
603cfbf5b30e99eeabcd58f2,https://www.quora.com/What-is-the-scope-of-photography-in-India?-,"Just like any other non-standard career option - standard ones include engineers, doctors, lawyers, CA, MBA and government employment - photography can also be considered a good career option in India.  Clicking a photo has become as easy a point and shoot these days with the number of high resolution 'prosumer' (professional consumer) DSLRs available in the market and the kind of results they generate. Thanks also, partly, to the numerous softwares available to correct any flaws in post processing. But, the true beauty of a photograph lies in the composition, timing, lighting and most of all the story it tells. That is where talent comes in. Unfortunately talent alone will not allow you to click stunning photographs.  Most of the time you will need a set of good quality lenses (primes Continue Reading Just like any other non-standard career option - standard ones include engineers, doctors, lawyers, CA, MBA and government employment - photography can also be considered a good career option in India.  Clicking a photo has become as easy a point and shoot these days with the number of high resolution 'prosumer' (professional consumer) DSLRs available in the market and the kind of results they generate. Thanks also, partly, to the numerous softwares available to correct any flaws in post processing. But, the true beauty of a photograph lies in the composition, timing, lighting and most of all the story it tells. That is where talent comes in. Unfortunately talent alone will not allow you to click stunning photographs.  Most of the time you will need a set of good quality lenses (primes Continue Reading",2021-03-01T14:36:37.148Z,"What is the scope of photography in India? ",Quora
603cfc4ab30e99eeabcd592d,https://www.quora.com/Is-photography-a-career?-,"A person can make an advance career in photography especially in mass media. To pursue a career in this field, there are many universities that provide various degrees and online courses. These online courses varies from 6 months to 2 years depending over the level of expertise. These courses are further divided into 4 parts. The first one is the Basic course where you’ll be given basic knowledge about photography which will be followed by Foundation course where you’ll be learning about the modes of photography especially in the fields of lightening, exposure, panorama mode and exterior mode. The third one is advanced course where the students are taught about professional courses which will be then finalised with workshops. Here you’ll be learning about all the different types of profess Continue Reading A person can make an advance career in photography especially in mass media. To pursue a career in this field, there are many universities that provide various degrees and online courses. These online courses varies from 6 months to 2 years depending over the level of expertise. These courses are further divided into 4 parts. The first one is the Basic course where you’ll be given basic knowledge about photography which will be followed by Foundation course where you’ll be learning about the modes of photography especially in the fields of lightening, exposure, panorama mode and exterior mode. The third one is advanced course where the students are taught about professional courses which will be then finalised with workshops. Here you’ll be learning about all the different types of profess Continue Reading",2021-03-01T14:38:02.274Z,"Is photography a career? ",Quora
603cfc58b30e99eeabcd5935,https://www.quora.com/How-do-I-make-photography-to-be-my-full-time-job?-,"Anton Magus Making photography your full-time job is easy. Just quit whatever you are doing now and spend your days taking photographs of events, weddings, engagements, fashion, portraits and maybe landscapes. The truly difficult part is earning enough money to survive. A good first step is to look at the work produced by a professional in whatever sphere of photography you are aiming for. You need to honestly ask yourself if your work is equally as good or better than the professional’s work? If not, then you will need to increase your skills through practice and training before you go in full time. If your work is really good then you have to know how to set up a marketing and sales plan to get business. Prepare a portfolio of prints of your best work and also get you best images onto a well-designed a Continue Reading Continue Reading",2021-03-01T14:38:16.814Z,"How do I make photography to be my full-time job? ",Quora
603cfc68b30e99eeabcd594b,https://www.quora.com/What-are-some-unique-jobs-and-careers-you-can-have-with-photography?-,"Real estate photography. I travel much of northwest Montana. The houses/ranches/buildings I shoot are often those of the well to do. They can afford homes that have incredible views of mountains, lakes, rivers, etc. The trip to/from the property is exciting, as is the destination. Often, I meet the owners, learning of their lifestyle, past and present. This is usually quite interesting, as are their plans for when the property sells. The pay is not much but the exploring is very rewarding. This is my semi-retired profession. There is not enough money in it to be self sufficient on a full time basis. I would not be interested in working in the city. There’s more opportunity to make money but the venues would lack the vistas I so enjoy. Rural is to my liking. Something outside of the city. Not Continue Reading Real estate photography. I travel much of northwest Montana. The houses/ranches/buildings I shoot are often those of the well to do. They can afford homes that have incredible views of mountains, lakes, rivers, etc. The trip to/from the property is exciting, as is the destination. Often, I meet the owners, learning of their lifestyle, past and present. This is usually quite interesting, as are their plans for when the property sells. The pay is not much but the exploring is very rewarding. This is my semi-retired profession. There is not enough money in it to be self sufficient on a full time basis. I would not be interested in working in the city. There’s more opportunity to make money but the venues would lack the vistas I so enjoy. Rural is to my liking. Something outside of the city. Not Continue Reading",2021-03-01T14:38:32.964Z,"What are some unique jobs and careers you can have with photography? ",Quora
603cfc99b30e99eeabcd596e,https://www.quora.com/How-can-I-start-my-photography-career-after-I-graduated?-,"Start shooting! Shoot everything, shoot anything. Study composition. Look at other EXCELLENT photographers work to try to understand how /why they composed the image as they did. If you are going to photography people - study how people move, stand, what they do with their hands and arms and legs and hips. See how light falls on subjects, study light. understand the difference between the quantity and quality of light. Learn to use your camera - learn to use your camera in MANUAL (so you can repeat set-ups) understand how your shutter and aperture and ISO affect the image and image quality. Get yourself set up with an EXCELLENT print shop that you have confidence in. Understand and begin to master Photoshop. Your camera needs to be your eyes to the world - Photoshop needs to be your brain  Continue Reading Start shooting! Shoot everything, shoot anything. Study composition. Look at other EXCELLENT photographers work to try to understand how /why they composed the image as they did. If you are going to photography people - study how people move, stand, what they do with their hands and arms and legs and hips. See how light falls on subjects, study light. understand the difference between the quantity and quality of light. Learn to use your camera - learn to use your camera in MANUAL (so you can repeat set-ups) understand how your shutter and aperture and ISO affect the image and image quality. Get yourself set up with an EXCELLENT print shop that you have confidence in. Understand and begin to master Photoshop. Your camera needs to be your eyes to the world - Photoshop needs to be your brain  Continue Reading",2021-03-01T14:39:21.616Z,"How can I start my photography career after I graduated? ",Quora
603cfccbb30e99eeabcd5985,https://www.quora.com/How-do-I-get-more-work-as-a-freelance-photographer?-,"Brian Fitzgerald Hi Trina! Thanks for the ask. First of all, as my old mentor used to frequently say about the term ‘freelance’, “there’s nothing ‘free’ about it”. There’s no ‘best’ way. But there ARE a lot of poor ways, or ways that will stop you dead in your tracks or cause you to fail before you get anywhere. Poor ways might include: spending too much on gear without any solid plan for paying for it through your photography efforts; getting saddled with too much debt investing in your business before you have paying clients (related to the first point); spending too much on a formal photography education before having a plan to recoup that investment when done (see points one and two, above). Seeing a pattern? Overthinking, over investing, and trying to be ‘perfect’ from the start of your career will limit  Continue Reading Continue Reading",2021-03-01T14:40:11.409Z,"How do I get more work as a freelance photographer? ",Quora
603cfcdab30e99eeabcd5999,https://www.quora.com/Can-you-have-a-successful-photography-career-while-working-another-full-time-job?-,"I started my photography business in 1972. I was working full time and doing weddings on weekends. After about 6 years I went full time. During those 6 years I was using my profits to purchase better equipment, backgrounds, office equipment and supplies, and most important, building my clientele. Also I was doing mostly weddings. After those years of weddings and then going full time Photography I started taking engagement pictures, family pictures, portraits,senior portraits, anniversaries, reunions, then also some commercial work. One thing that hel more than anything else was joining the VPPA (Virginia Professional Photography Association). Most states have their own Photography association. You learn tips and get training on business, posing, lighting tips on how to make better picture Continue Reading I started my photography business in 1972. I was working full time and doing weddings on weekends. After about 6 years I went full time. During those 6 years I was using my profits to purchase better equipment, backgrounds, office equipment and supplies, and most important, building my clientele. Also I was doing mostly weddings. After those years of weddings and then going full time Photography I started taking engagement pictures, family pictures, portraits,senior portraits, anniversaries, reunions, then also some commercial work. One thing that hel more than anything else was joining the VPPA (Virginia Professional Photography Association). Most states have their own Photography association. You learn tips and get training on business, posing, lighting tips on how to make better picture Continue Reading",2021-03-01T14:40:26.060Z,"Can you have a successful photography career while working another full time job? ",Quora
603cfce9b30e99eeabcd59a1,https://www.quora.com/Would-it-be-advisable-for-one-to-quit-his-job-and-pursue-a-career-in-photography-even-though-one-has-no-other-means-of-income?-,Include Related Answers Mark Calvert Uzochukwu Mbamalu,2021-03-01T14:40:41.057Z,"Would it be advisable for one to quit his job and pursue a career in photography even though one has no other means of income? ",Quora
603cfd2db30e99eeabcd59d2,https://www.quora.com/Is-it-the-right-decision-to-quit-a-job-and-take-trading-in-the-stock-market-as-a-career?-,Include Related Answers  Is it the right decision to quit a job and take trading in the stock market as a career?,2021-03-01T14:41:49.923Z,"Is it the right decision to quit a job and take trading in the stock market as a career? ",Quora
603cfd3eb30e99eeabcd59dd,https://www.quora.com/How-shall-I-plan-the-change-of-my-career-from-desk-job-to-photography?-,Melissa Coffield,2021-03-01T14:42:06.076Z,"How shall I plan the change of my career from desk job to photography? ",Quora
603cfd97b30e99eeabcd5a1c,https://www.quora.com/Is-it-okay-to-prefer-ASO-in-MEA-only-because-you-love-photography?-,"Include Related Answers Rahul Shrivastava An ASO in MEA gets posted to several countries during her/his career and also gets to travel to several more on official/personal trips. As such, if one is interested in photography, life in MEA does provide a lot of opportunities. But work of an ASO is a full time job and activities such as photography can be pursued only as a hobby during free time. The job content should primarily attract you to a profession else you’ll be frustrated soon.",2021-03-01T14:43:34.775Z,"Is it okay to prefer ASO in MEA only because you love photography? ",Quora
603cfe0bb30e99eeabcd5a62,https://www.quora.com/How-do-I-shake-the-feeling-that-I’m-not-being-sufficiently-intellectually-stimulated?-,"That stress in your life is worrisome.  If your work is causing it, change how you do it or change how you think.  The mind isn't a machine that gobblesup endless digital arrays of information without a rest.  Constant intellectualstimulation when you may need a little break and  an atmosphere that reststhe brain will do wonders for the stress. Perhaps you would like to look into answering questions on Quora.  Some of the questions will addle the mind,  put you in a trance,  rob you of sanity,but stressful?  It's fun to gambol among the imaginary stacks of the digitalage,  have research to back up your outrageously accurate answer and winthe readership of a cook with a TV show who may thank you for your answer.  This is not a bunch of yahoo -ites  but an extremely talented,experie Continue Reading That stress in your life is worrisome.  If your work is causing it, change how you do it or change how you think.  The mind isn't a machine that gobblesup endless digital arrays of information without a rest.  Constant intellectualstimulation when you may need a little break and  an atmosphere that reststhe brain will do wonders for the stress. Perhaps you would like to look into answering questions on Quora.  Some of the questions will addle the mind,  put you in a trance,  rob you of sanity,but stressful?  It's fun to gambol among the imaginary stacks of the digitalage,  have research to back up your outrageously accurate answer and winthe readership of a cook with a TV show who may thank you for your answer.  This is not a bunch of yahoo -ites  but an extremely talented,experie Continue Reading",2021-03-01T14:45:31.241Z,"How do I shake the feeling that I’m not being sufficiently intellectually stimulated? ",Quora
603cfe3db30e99eeabcd5a82,https://www.quora.com/Which-profession-do-you-like-and-why?-,Include Related Answers  Which profession do you like and why?,2021-03-01T14:46:21.259Z,"Which profession do you like and why? ",Quora
603cfe5eb30e99eeabcd5a97,https://www.quora.com/How-can-I-accelerate-my-personal-growth-efficiently?-,"Siddhartha Ghosh Stop wasting time on porn tube sites.Don't follow the crowd, follow your own way. Do what you love.Limit your social website activities.Don't only learn from success stories, learn from failure stories “why did they fail'? Find it and learn from it.Try to be a good presenter in office meetings. Trust me, it will lead you to a successful career.Control your emotions and try to be proactive.Chase your vision and dream. Success will start following you.Try to be creative. You should maintain a diary to list your creative ideas.Make an awesome and productive video which is related with your career and upload it to your YouTube account.Be practical. Life will be easy.When you are working, use your smartphone only for calling, not for any other purpose like gaming, checking notifications etc.MakContinue Reading",2021-03-01T14:46:54.777Z,"How can I accelerate my personal growth efficiently? ",Quora
603cfe6eb30e99eeabcd5aa2,https://www.quora.com/Can-I-choose-photography-as-a-career?-,"Bob Fately Of course you can (well, if you live in a free country) - but as for whether you will succeed at all depends on many things: your talent, luck, the particular field in which you apply yourself (sports? fine art? wedding? commercial? portraiture/studio? etc.). It’s a tough business, in large part thanks to digital technology, which has brought camera gear to the masses (from auto-everything DSLRs to phones) as well as often lowered the viewing resolutions required. That latter point may need some explanation… In the “old days”, the photographer expecting to sell or display large prints a) had to know the craft well enough to achieve proper exposure without blown highlights as well as get the composition right, etc. and b) have an enlarger (or a lab) capable of making poster-sized wall-hanging Continue Reading",2021-03-01T14:47:10.727Z,"Can I choose photography as a career? ",Quora
603cfe7db30e99eeabcd5ab5,https://www.quora.com/What-is-some-good-advice-for-a-student-unsure-of-their-future?-,"Vikram Dhar There is a popular line, 'No matter how much people plan, future is always uncertain, but a well defined direction going towards something, and some plan takes a person somewhere towards that direction. Some plan is better than no plan' Let me tell me something interesting. I did my Civil engineering from NIT, Hamirpur, and after that did my Masters in Computer Science from US. I was happy that life is all set, but 911 attack happened in US in 2001, during my Master's program and all jobs disappeared, and visa restrictions around 2002–2003, created a scenario where it was difficult to find a job in US. I was depressed, and did odd jobs in US for a year, before I came back to India and started my career. If one door is closed, 4 more are there to be opened up. It took me 3–4 months to settle  Continue Reading Continue Reading",2021-03-01T14:47:25.595Z,"What is some good advice for a student unsure of their future? ",Quora
603cfeacb30e99eeabcd5acb,https://www.quora.com/What-is-the-salary-of-wildlife-photographer-in-India?-,"Vibhor Kashyap  Well if depends on the type of photographer you are.. A freelance photographer gets payed according to his work the more you work the higher you get paid and it's limitless.. If you are a photographer who is being funded by someone else then the pay is limited. There exists another category where a freelance photographer collaborates with channels and magazines and provides them what they need,Here you get paid a lot… if you are mainly talking about a kinda permanent job then it starts from somewhere around 15k while you are an intern or kind of an assistant. But it later on increases as you grow up in the field",2021-03-01T14:48:12.103Z,"What is the salary of wildlife photographer in India? ",Quora
603cff0bb30e99eeabcd5b07,https://www.quora.com/Which-city-suits-me-Melbourne-or-Adelaide?-,"As someone who lives in Australia, South Australia and has been to Melbourne on multiple occasions, I believe you would enjoy Adelaide more. Melbourne has a lot of traffic, is much more lively, and has a greater variety of schools, universities, and perhaps even more job opportunity (depending on the career). Pretty much your typical city life. Depending where you live, Melbourne is also very multicultural. Adelaide is much more quiet, has a handful of reasonably sized shopping malls, but a lot more local supermarkets, and due to the smaller population seems to be more friendly. It is also relatively multicultural, and I know a few Indians here. Both Melbourne and Adelaide have an array of parks and nature reserves. I am sure in both states there are many beautiful places to photograph. Howev Continue Reading As someone who lives in Australia, South Australia and has been to Melbourne on multiple occasions, I believe you would enjoy Adelaide more. Melbourne has a lot of traffic, is much more lively, and has a greater variety of schools, universities, and perhaps even more job opportunity (depending on the career). Pretty much your typical city life. Depending where you live, Melbourne is also very multicultural. Adelaide is much more quiet, has a handful of reasonably sized shopping malls, but a lot more local supermarkets, and due to the smaller population seems to be more friendly. It is also relatively multicultural, and I know a few Indians here. Both Melbourne and Adelaide have an array of parks and nature reserves. I am sure in both states there are many beautiful places to photograph. Howev Continue Reading",2021-03-01T14:49:47.452Z,"Which city suits me Melbourne or Adelaide? ",Quora
603cff1fb30e99eeabcd5b13,https://www.quora.com/What-are-career-options-for-a-Photographer?-,"Koyel Biswas There are many career opportunities in the photography field. Here are few of the most exciting ones: Photojournalism - This entails taking photos for print and online media. Your task is to take photos of newsworthy events. The exciting part of this job is that it is dynamic; no news piece is the similar to another. If you love the adrenaline rush of danger and controversy that journalism carries, this is definitely your line of pursuit.Commercial photography - this branch has more diversity pegged to it; merchandise, home décor, fashion, automobile trends and other areas of your choosing. The photos are usually taken and sold to advertisers and product lines. It is exciting because of its fluidity and versatility hence nonrestrictive.Advertising - Advertising photography requires an eye fContinue Reading Continue Reading",2021-03-01T14:50:07.768Z,"What are career options for a Photographer? ",Quora
603cff33b30e99eeabcd5b27,https://www.quora.com/How-is-photography-as-a-career-in-India?-,"There is nothing like bad in photography. It is a creative field of work which requires your creativity passion and hard work nothing else. I have seen and met many female photographers of india. Some of my mentors like veronica gera, monisha and many more. There is no such gender discrimination in this field it's just if you work good you will have more opportunities no matter of which gender you are of which caste you belong.",2021-03-01T14:50:27.466Z,"What is the best advice for someone who wants to start a career in photography in India? ",Quora
603cff52b30e99eeabcd5b39,https://www.quora.com/Can-women-take-up-photography-as-profession?-,"Thanks for asking. YES!! One of my very close friend is doing so. She was actually a hobbyist photographer and was mainly involved in job but due to some reason she had to drop her job and now she is full time photographer. Not just photographer, she is covering wedding shoots, event shoots, interior shoots and many more and she is earning a decent living from these works. So, in my real life she is a ideal to all women who just stop themselves from pushing their limits to reach their desired destiny. I hope this inspires all the women out there. Thanks!!",2021-03-01T14:50:58.393Z,"Can women take up photography as profession? ",Quora
