"_id",job_link,answer,date,question,source
60421a21ed76476feda1e59b,https://www.quora.com/Is-a-PMI-certified-Project-Management-professional-redundant-and-replaced-by-a-Release-Train-Engineer-in-a-Scaled-Agile-organization?-,"Charles Brown Not by the RTE, specifically no. SAFe does not intend to make folks redundant. SAFe trains everyone and then launches trains. SAFe is a Lean-Agile Framework and the roles are virtual. A PMI trained Project Manager can assume many roles as long as he can learn to do the new roles in new the new way. Jeff Sutherland once said that the Project Manager role was split into three parts for Scrum. The ScrumMaster, the Product Owner and the Team. The team gets to self organize, the Product Owner gets the business facing roles and represents the business to the team, and the ScrumMaster facilitates with Continue ReadingNot by the RTE, specifically no. SAFe does not intend to make folks redundant. SAFe trains everyone and then launches trains. SAFe is a Lean-Agile Framework and the roles are virtual. A PMI trained Project Manager can assume many roles as long as he can learn to do the new roles in new the new way. Jeff Sutherland once said that the Project Manager role was split into three parts for Scrum. The ScrumMaster, the Product Owner and the Team. The team gets to self organize, the Product Owner gets the business facing roles and represents the business to the team, and the ScrumMaster facilitates with the team. This splitting makes some product managers feel that they have lost a lot of power. But it is not so. It is like a drill instructor does not lose power when he leads a team of trained professionals. He uses an entirely different approach to leadership, transformational or servant leadership. Command and control leadership is only for raw recruits. Continue Reading",2021-03-05T11:46:41.520Z,"Is a PMI certified Project Management professional redundant and replaced by a Release Train Engineer in a Scaled Agile organization? ",Quora
60421a44ed76476feda1e5db,https://www.quora.com/Why-do-IT-companies-need-project-managers-when-they-follow-Agile?-,"Because : Companies still needs a bigger picture or road map in the starting of the project.Companies still need someone who can have the complete view (within and outside the project) and can act accordinglyCompanies still need someone to do all the communication with various stakeholders which sometimes is quite difficult for agile team membersCompanies still need someone to think ahead in terms of delivery and can anticipate risksCompanies still need someone to make the team revisit design, requirements etc. When it is realised that the initial planning was poor or insufficientCompanies stilContinue ReadingBecause : Companies still needs a bigger picture or road map in the starting of the project.Companies still need someone who can have the complete view (within and outside the project) and can act accordinglyCompanies still need someone to do all the communication with various stakeholders which sometimes is quite difficult for agile team membersCompanies still need someone to think ahead in terms of delivery and can anticipate risksCompanies still need someone to make the team revisit design, requirements etc. When it is realised that the initial planning was poor or insufficientCompanies still need someone to make people collaborate where the so called collaborative team is actually not collaboratingCompanies still need someone who can deliver projects when the senior management is happily under mis conception that their agile ways of working are perfectCompanies still need someone who can take the pain of missed deadlines and budget constraints etc. And soak it all up and let the team do thier job.Companies still need someone who can manage people and make sure team remains in working mode inspite of conflictsCompanies still need someone who has come from the same path where the current development team is and can guide them effectively using his/her experience…………… Because : Companies still needs a bigger picture or road map in the starting of the project.Companies still need someone who can have the complete view (within and outside the project) and can act accordinglyCompanies still need someone to do all the communication with various stakeholders which sometimes is quite difficult for agile team membersCompanies still need someone to think ahead in terms of delivery and can anticipate risksCompanies still need someone to make the team revisit design, requirements etc. When it is realised that the initial planning was poor or insufficientCompanies stilContinue Reading",2021-03-05T11:47:16.407Z,"Why do IT companies need project managers when they follow Agile? ",Quora
60421a5aed76476feda1e604,https://www.quora.com/What-is-the-difference-between-Scrum-and-Agile-in-project-management?-,Joseph Kennedy  Milton R Brown,2021-03-05T11:47:38.471Z,"What is the difference between Scrum and Agile in project management? ",Quora
60421a97ed76476feda1e672,https://www.quora.com/Can-traditional-project-management-tools-and-techniques-really-be-applied-in-conjunction-with-agile-software-development-methods-or-do-these-methods-require-new-project-management-tools-and-techniques?-,"Cliff Gilley, Agile Practitioner for Almost 20 YearsAnswered 5 years ago · Author has 19K answers and 40.2M answer views Cliff Gilley Traditional methods and tools for project management tend to focus on a specific, known plan and managing the time, resources, and scope to achieve that plan over a long period of time. Agile project management approaches require that you focus on shorter, iterative development, accept that there are (sometimes large) unknowns, and focus on delivering value over following a plan. The two are almost entirely in opposition to one another, which is why the tools of traditional project management (such as Gantt charts, Work Breakdown Structure, and other tools) tend to be difficult, if not impossibl Continue ReadingTraditional methods and tools for project management tend to focus on a specific, known plan and managing the time, resources, and scope to achieve that plan over a long period of time. Agile project management approaches require that you focus on shorter, iterative development, accept that there are (sometimes large) unknowns, and focus on delivering value over following a plan. The two are almost entirely in opposition to one another, which is why the tools of traditional project management (such as Gantt charts, Work Breakdown Structure, and other tools) tend to be difficult, if not impossible, to apply to agile projects. I wrote a blog post on a similar theme not too long ago, you might find it of interest - Death By Gantt Chart.",2021-03-05T11:48:39.872Z,"Can traditional project management tools and techniques really be applied in conjunction with agile software development methods or do these methods require new project management tools and techniques? ",Quora
60421aaded76476feda1e699,https://www.quora.com/Are-Gantt-charts-associated-with-a-waterfall-type-project-management-or-do-they-lend-themselves-for-agile-frameworks-as-well?-,"In this answer I will do my best to give you a high quality answer to your question based on my experience and knowledge. Firstly let's answer the question in its most basic forms. Are Gantt charts associated with waterfall type project management? Answer: Yes Do they lend themselves for agile frameworks as well? Answer: No So let's explore why, Gantt charts have been around alooooooong time, like many many decades.Morpheus says 1910 I have no idea if that is true but its longer than agile by a lot.Gantt charts rely on quantitive measurements which are known ahead of time.For example a house or mass Continue Reading In this answer I will do my best to give you a high quality answer to your question based on my experience and knowledge. Firstly let's answer the question in its most basic forms. Are Gantt charts associated with waterfall type project management? Answer: Yes Do they lend themselves for agile frameworks as well? Answer: No So let's explore why, Gantt charts have been around alooooooong time, like many many decades.Morpheus says 1910 I have no idea if that is true but its longer than agile by a lot.Gantt charts rely on quantitive measurements which are known ahead of time.For example a house or mass manufactured circuit board will need a specific number of component parts depending upon a detailed specification or architecture design to come in to existanceGantts utilize and rely on duplicityContinuing with the house and mass produced circuit board those deliverables are very easily predicted and duplicated with the same specificationsTimescale convergence through experienceAs the duplicity of these projects is so similar trends in timescales and effort will converge.The predictability of building a replica house or circuit board becomes increasingly more reliable as you make more and more of the productWaterfall has different fundamentalsWith this increasing consistency you get to the fundamentals of the waterfall methodology which are fixed time and scope with variable resources This leads us to why they are not suitable for agile frameworks. The key principles of agile are fixed resources and time with variable scopeThis is a complete inverse of the waterfall mindsetMindset shiftThis rejection of the waterfall mindset means the tools traditionally used for waterfall management are not as suitable for agile projectsAgile projects rely of progressive elaboration and planning horizonsProgressive elaboration meansContinuously improving and detailing a plan.This occurs as more detailed information and more accurate estimates become available.Planning horizons are used to accompany progressive elaboration as it encourages deferring details until they are requiredEssentially we can understand less about something which will happen 5 years from now when compared with a task to be completed in the next two weeksAgile encourages changes through its process as the next iterations worth of effort are always negotiable until it is begun based on flexible priorities.Waterfall projects normally have clear dependency structures which determine prioritiesE.g. For a house you don't try to put the roof on without the walls in placeSo to sum up, Gantt charts are not very good at displaying a list of future priorities with different levels of detail in the breakdown of what's involved to fulfill the acceptance criteria. Thus for agile project management backlogs are king. They are becoming widely used at many levels across an organization, for example if you look at something like the SAFE framework. It has many backlogs for all types of functions in an organization. Some of my other answers may also be useful: Oliver Dolan's answer to What are the differences between traditional project management and PM using Agile?Oliver Dolan's answer to Has your organization used SAFe to implement enterprise Agile? How did it go?Oliver Dolan's answer to What is the best way to improve corporate agility?Hopefully it helps GoodLuck Oliver Dolan If you like the answer, please give it an up-vote because it motivates me to write more of them for you In this answer I will do my best to give you a high quality answer to your question based on my experience and knowledge. Firstly let's answer the question in its most basic forms. Are Gantt charts associated with waterfall type project management? Answer: Yes Do they lend themselves for agile frameworks as well? Answer: No So let's explore why, Gantt charts have been around alooooooong time, like many many decades.Morpheus says 1910 I have no idea if that is true but its longer than agile by a lot.Gantt charts rely on quantitive measurements which are known ahead of time.For example a house or mass Continue Reading",2021-03-05T11:49:01.484Z,"Are Gantt charts associated with a waterfall type project management or do they lend themselves for agile frameworks as well? ",Quora
60421ac2ed76476feda1e6bd,https://www.quora.com/What-is-the-project-manager-responsibility-in-Agile?-,"All good Agile frameworks that I know do not have a role like traditional project manager. Project (or product management) is handled through other roles, using a combination of responsibilities that collaborate on the need. For example, in Scrum, the PO is responsible for product vision, longer term planning, and stakeholder communication. The Team is responsible for deciding how to implement the product, for short term planning, and communication with other teams and technical stakeholders. If I see the term “Agile project manager”, I suspect foul play. I have never seen that role work anywhere, and it usually means that organisation has corrupted or compromised on Agile values and principles, in an effort to accommodate Agile to their old corporate culture and ways of working.",2021-03-05T11:49:22.396Z,"What is the project manager responsibility in Agile? ",Quora
60421ad5ed76476feda1e6e3,"https://www.quora.com/What-is-the-best-way-to-manage-both-a-roadmap-and-a-backlog?-We-currently-use-JIRA-and-Confluence-for-most-'project-management'-but-am-willing-to-venture-to-other-tools,-if-they'll-help.-","Woody Arnold, CTO, VPE, Certified Scrum Master, Agile Practitioner since 2000, 8 yrs @eBayAnswered 6 years ago · Author has 355 answers and 932.6K answer views Woody Arnold 1. ""We currently use JIRA and Confluence for most 'project management' but am willing to venture to other tools if they'll help."" You don't need a different tool.  JIRA can meet your needs. 2.  ""What is the best way to show that we're drowning?"" Are you tracking ""velocity""?  If not, you HAVE TO.  I am always surprised how many companies don't do this.  I had to introduce this in my last three companies.  This is critical.  Executives are swayed by numbers, facts, historicals.  You need to be able to show them ""supply vs. demand"" in terms they can understand.  (If you use points, you may need to t Continue Reading1. ""We currently use JIRA and Confluence for most 'project management' but am willing to venture to other tools if they'll help."" You don't need a different tool.  JIRA can meet your needs. 2.  ""What is the best way to show that we're drowning?"" Are you tracking ""velocity""?  If not, you HAVE TO.  I am always surprised how many companies don't do this.  I had to introduce this in my last three companies.  This is critical.  Executives are swayed by numbers, facts, historicals.  You need to be able to show them ""supply vs. demand"" in terms they can understand.  (If you use points, you may need to translate them to something more concrete like ""man days"" for executive consumption.) 3. ""I'm coming to the realization that a backlog and roadmap should be separate but I'm having a hard time tying the two together in a view for executives."" This is a critical comment and is at the root of your challenge -- the backlog and the roadmap are separate but dependent.  The roadmap should be a separate ""view"" from the backlog, but it should NOT be ""separate"" from the backlog. 4. ""I'm having trouble managing our backlog for a product which has many stakeholders, customers, bugs, 1-off operational feature requests, and large strategic initiatives (larger features).""  Yup, been there, seen that.  You need to ""bucketize"" things more.  Here's a framework I've used in Jira:1. Large Feature Development -  mostly Stories, but could contain Tasks and Bugs.  These items are Tied to Strategic Initiatives, Stakeholders, Customers etc.  Tactically in Jira these should be in an Epic.  (Do you use Epics?  If not, you should.)  You might have an Epic for each Stakeholder, Customer or Initiative.  You also might need to phase or timebox your Epics so you can track them e.g. Customer X Phase 1, Q1, or Jan. 2. Enhancements - these are Stories or Tasks that aren't tied to the above (not tied to an Epic).  If you want, you could create an Epic called Enhancements as a bucket to track these items. 3. Maintenance - this is mainly bug fixes, but could also contain tasks.  5.  ""The product and tech team can hardly keep its head above water with the bugs and operational support let alone the new feature requests."" Once you start tracking velocity by the buckets above, you may be surprised how little of your capacity is going toward #1 (e.g. ""let along new feature requests"".  In one of my last companies it was 50% on average, but would dip down to 25% at times when quality issues or customer complaints spiked! If you are tracking velocity, but don't have buckets, run a simple query -- look at all ""issues"" completed in the last few months by issue type.  What percent are Stories?  Pretty low I bet?  This is a good proxy.  If you're not tracking velocity or points, just do a percent by count e.g. assume each issue is worth 1 point. You need to be able to show this data to show management how your capacity is being spent (how demand exceeds supply, and how over burdened your team is).  The problem with most companies is: 1. they aren't tracking velocity and 2. they haven't created high level buckets that executives can understand.  So executives assume they have 100% of engineering capacity for Feature Development, AND plans and roadmaps are created using that assumption, and engineering teams get F*cked. SummarySo in summary, you need to create more hierarchy in Jira.  How do you eat an elephant? One bite at a time.  You need one backlog, but you have to be able to ""roll it up"", ""drill it down"", and ""slice and dice it"".  You need to create various ""views"".  One for executive consumption and prioritization, and others for various teams and day to day management.  Jira is not great at hierarchy, but it can do it now and its getting better.  Have you checked out the new Portfolio Management capabilities?  I haven't used it yet, but it is suppose to help with some of these challenges. Out of the box Jira has essentially 4 levels of natural hierarchy:1. Project  (which I think is a misnomer personally)2. Epic3. Story/Task/Bug4. Sub-Task (child to Story/Task/Bug) You should leverage these levels to enable roll out and drill down and help you manage your backlog.  Sub-tasks are generally way under utilized.  People are often lazy and create a Task vs. creating a sub-task to a Story.  Also use Projects carefully, because moving issues between projects requires ""moving"" the tickets.  Projects can have different workflows and meta data so moving tickets between projects should be infrequent IMO.  Projects should be aligned to Cross Function Teams IMO.  Sometimes this means one Project for a whole Engineering organization or a Project per Strategic Initiative.  I've generally used the Component field to track component teams, but there's now a Team field as well.  I've also added ""Strategy"" and ""Product"" fields at times.  Using fields is not ideal however, as this creates a dependency on data entry.  Things like Epics, populate this data automatically when you drag the issue into that bucket.",2021-03-05T11:49:41.737Z,"What is the best way to manage both a roadmap and a backlog? We currently use JIRA and Confluence for most 'project management' but am willing to venture to other tools, if they'll help. ",Quora
60421ae9ed76476feda1e709,https://www.quora.com/What-topics-should-a-master-thesis-on-agile-software-project-management-have?-,"A masters thesis is a personal matter. It is going to absorb hundreds of your hours, take you away from friends and family for a significant period of time, and leave you a changed person. I would strongly recommend that you discuss this with your supervisors. They know you and should be best placed to advise you. From my experience, however, one thing I can advise is to go narrow. One of the challenges I faced in my masters thesis (on agile transformation) was that I was constantly taking too broad a focus, and that stretched me very thin. You need to ask yourself: What is it about agile software Continue ReadingA masters thesis is a personal matter. It is going to absorb hundreds of your hours, take you away from friends and family for a significant period of time, and leave you a changed person. I would strongly recommend that you discuss this with your supervisors. They know you and should be best placed to advise you. From my experience, however, one thing I can advise is to go narrow. One of the challenges I faced in my masters thesis (on agile transformation) was that I was constantly taking too broad a focus, and that stretched me very thin. You need to ask yourself: What is it about agile software project management that motivated you to think this was the domain in which you would write a masters thesis? If you are truly struggling in finding a focus, then you could consider the approach I took (although bear in mind that I was clear on my topic first). You could undertake your literature review with the stated intent of finding gaps in current practice. Then consider those gaps, explore them in your discussion. Then choose ONE of them to form the question for the remainder of your research. When I completed my masters, I would research a theme until it felt like I had found as much as I was going to, then I sat back and used thematic analysis to find what was being discussed. I then used insights from that to help provide more focused search parameters, and went around again … and then again … and then again. This was an iterative and incremental approach, which felt totally appropriate and natural given my research domain. However, it does take longer. If this sounds attractive to you as a research approach, then look at the research techniques of: Problematization[1] (looking for gaps in current practice)Ground Theory Lite[2] (iterative research conducted on secondary sources)And maybe have a look at my masters thesis, where I discuss this research approach more fully: ‘The Paradox of Agile Transformation. Why trying too hard to be Agile stops organizations from becoming truly agile’. Footnotes[1] http://Alvesson, M., & Sandberg, J. (2011). Generating research questions through problematization. Academy of Management Review, 36(2), 247-271.[2] http://Braun, V., & Clarke, V. (2006). Using thematic analysis in psychology. Qualitative research in psychology, 3(2), 77-101. A masters thesis is a personal matter. It is going to absorb hundreds of your hours, take you away from friends and family for a significant period of time, and leave you a changed person. I would strongly recommend that you discuss this with your supervisors. They know you and should be best placed to advise you. From my experience, however, one thing I can advise is to go narrow. One of the challenges I faced in my masters thesis (on agile transformation) was that I was constantly taking too broad a focus, and that stretched me very thin. You need to ask yourself: What is it about agile software Continue Reading",2021-03-05T11:50:01.850Z,"What topics should a master thesis on agile software project management have? ",Quora
