"_id",job_link,answer,date,question,source
6041fe79ed76476feda1b20e,https://www.quora.com/Which-is-the-best-Agile-Project-Management-Sofware?-,"Why Agile Methodology? This model of project management is used by teams and business to save time, money, and provide the flexibility to make changes. It allows for better flexibility than traditional methods of project management. Faster, smaller. The projects can proceed faster. Communication. The teams collaborate and communicate easily to ensure the process stays on track. Feedback. The teams will not have to wait until the delivery phase and can track speed of the development process regularly. Trust. Agile teams understand the goals and build their path to achieve the goals. Control. The agil Continue ReadingWhy Agile Methodology? This model of project management is used by teams and business to save time, money, and provide the flexibility to make changes. It allows for better flexibility than traditional methods of project management. Faster, smaller. The projects can proceed faster. Communication. The teams collaborate and communicate easily to ensure the process stays on track. Feedback. The teams will not have to wait until the delivery phase and can track speed of the development process regularly. Trust. Agile teams understand the goals and build their path to achieve the goals. Control. The agile development gives project control as each step of the project is visible to both parties.  List of Agile Project Management Tools Now you have got the basic idea of Agile, let’s explore top 5 Agile project management tools. ProofHub  ProofHub is a smart full-fledged Agile project management methodology used by leading organizations. Teams can effortlessly share ideas, compile documents, start discussions and move forward with this collaborative tool. Plan, organize, collaborate and deliver great things at work. Give velocity to your company’s growth with ProofHub. Start using free trial for managing your team. Wrike Effective project management is all about making instant changes where needed in order to save up on costs and increase the revenues. Wrike is ideal for centralizing and connecting multiple projects and spiking up your team’s efficiency. It gets a lot of bad rep for its utilitarian interface, but just like with teamweek’s tool, setting up your project tasks will be a walk in the park. Although Wrike is up to date with their releases and enhancements, their mobile versions get a bit of a lag in the process. This might frustrate if you expect to see changes on your mobile devices at the same time as they happen on your desktop. Smartsheet Smartsheet defines how teams collaborate on projects and tasks such as managing the operation, tracking marketing campaigns, and planning events. Smartsheet considers the various solutions for business including different roles and industries. It unifies cross-functional priorities, has free and open collaboration, and allows you to create teams without limitations. Active Collab Active Collab was devised as a great solution for businesses. With Active Collab you will not have to keep your clients on the sidelines anymore. You can determine what every user can see and access, keep them informed and shared what’s important. It offers project planning, allows to share files, time tracking, expense tracking, brainstorming, discussing important topic and more. Asana Asana is the ultimate cloud-based project and task management tool for planning, organizing, and tracking the progress of the tasks. From start to finish, Asana has the feature your team needs ㅡ from Boards to Timelines. For Agile project management, Asana track launches and iterations, simply project and sprint plans, communication with teammates. Why Agile Methodology? This model of project management is used by teams and business to save time, money, and provide the flexibility to make changes. It allows for better flexibility than traditional methods of project management. Faster, smaller. The projects can proceed faster. Communication. The teams collaborate and communicate easily to ensure the process stays on track. Feedback. The teams will not have to wait until the delivery phase and can track speed of the development process regularly. Trust. Agile teams understand the goals and build their path to achieve the goals. Control. The agil Continue Reading",2021-03-05T09:48:41.885Z,"Which is the best Agile Project Management Sofware? ",Quora
6041fe92ed76476feda1b23a,https://www.quora.com/What-are-best-online-courses-for-agile-project-management?-,"Be careful when you talk about Agile and project management.In Agile “project management” is not the focus. Scrum is currently the most used Agile frameworks and in the Scrum guide[1] the developers of Scrum state when talking about Sprints: “Each Sprint may be considered a project with no more than a one-month horizon. Like projects, Sprints are used to accomplish something.” Agile is about cooperation, about a working product, about giving the best value for money and not about the plan. Yes, that means project plan. If I may suggest a course of action towards learning Agile it would be to find Continue ReadingFootnotes[1] https://scrumguides.org/scrum-guide.htmlBe careful when you talk about Agile and project management.In Agile “project management” is not the focus. Scrum is currently the most used Agile frameworks and in the Scrum guide[1] the developers of Scrum state when talking about Sprints: “Each Sprint may be considered a project with no more than a one-month horizon. Like projects, Sprints are used to accomplish something.” Agile is about cooperation, about a working product, about giving the best value for money and not about the plan. Yes, that means project plan. If I may suggest a course of action towards learning Agile it would be to find a live course. Agile is hard to learn without interaction with others. It is a mindset and that means a more hands on approach to master it. Footnotes[1] https://scrumguides.org/scrum-guide.html",2021-03-05T09:49:06.539Z,"What are best online courses for agile project management? ",Quora
6041febaed76476feda1b287,https://www.quora.com/What-tools-have-you-used-for-agile-project-management?-,"Saad Naseer, Software Engineer at Freelancing (2016-present)Answered 7 months ago · Author has 277 answers and 11.7K answer views Saad Naseer I have been an IT specialist for over 6 years now and have used a lot of different Agile project management applications that can help you achieve all of your goals and milestones that you set for yourself or your company. These applications are as follows: nTaskTrelloAsanaWrikeTeamGanttPaymoJIRAThere are many other options for you in the market if you want to work with these. But if you want an opinion, you should use nTask as it provides the most diverse array of features than any of the other softwares out there. These features include: Project ManagementTask ManagementIssue ManagementBug ManagContinue ReadingI have been an IT specialist for over 6 years now and have used a lot of different Agile project management applications that can help you achieve all of your goals and milestones that you set for yourself or your company. These applications are as follows: nTaskTrelloAsanaWrikeTeamGanttPaymoJIRAThere are many other options for you in the market if you want to work with these. But if you want an opinion, you should use nTask as it provides the most diverse array of features than any of the other softwares out there. These features include: Project ManagementTask ManagementIssue ManagementBug ManagementRisk ManagementTime Tracking",2021-03-05T09:49:46.709Z,"What tools have you used for agile project management? ",Quora
6041fee0ed76476feda1b2cd,https://www.quora.com/Can-I-become-an-agile-project-manager-by-completing-the-project-management-curriculum-on-coursera?-,"You can, but your exact current situation will affect how easy it is. Are you already working in a role where you can transition internally? Do you have other experience in product/project management, leadership, or Agile methodologies? Any relevant experience you have (even if it's a stretch) can help you get your first project management position. I changed roles a few months ago, and with it I have even more motivation to learn everything I can about Product Management to refine my skill. Here's my strategy so far, but you may want to tweak it to focus on Project Management: Quora. Answer eveContinue ReadingYou can, but your exact current situation will affect how easy it is. Are you already working in a role where you can transition internally? Do you have other experience in product/project management, leadership, or Agile methodologies? Any relevant experience you have (even if it's a stretch) can help you get your first project management position. I changed roles a few months ago, and with it I have even more motivation to learn everything I can about Product Management to refine my skill. Here's my strategy so far, but you may want to tweak it to focus on Project Management: Quora. Answer everything I'm familiar with in the Product Management category. Learn more about anything that I can't answer.Take Coursera courses on Agile methodologies and design principles. Absolutely, positively take the Human-Centered Design course. It's fantastic.Read BooksLean Startup by Eric RiesPractitioner's Guide to Product Management by Jock BusutillPlanning Extreme Programming by Kent Beck and Martin FowlerIntercom on Product ManagementRead BlogsProduct Labs on MediumMind the ProductEach of these resources provide unique approaches to product management. Although some can be contradictory, it's been quite helpful to compare each set of methods and practices. Of course, one of the best ways to learn anything is by doing. Perhaps even better than that, to learn by teaching/mentoring someone else.",2021-03-05T09:50:24.399Z,"Can I become an agile project manager by completing the project management curriculum on coursera? ",Quora
6041fef3ed76476feda1b2f5,https://www.quora.com/Does-Agile-project-management-work-for-hardware-development?-,"It can work, but there are challenges around it. Typically you might have joint hardware/software teams working on a product - this was my experience. We were building a medical diagnostic device with of course a physical design and technology, an operating system, and specialised modules for diagnostic algorithms. In our case, we had an overall (waterfall) project plan for the device, and only the software subteam worked explicitly agile. Some things to consider - if using sprints, lengthen them. Hardware development cycle times are usually longer. You cannot be quite as experimental - prototy Continue ReadingIt can work, but there are challenges around it. Typically you might have joint hardware/software teams working on a product - this was my experience. We were building a medical diagnostic device with of course a physical design and technology, an operating system, and specialised modules for diagnostic algorithms. In our case, we had an overall (waterfall) project plan for the device, and only the software subteam worked explicitly agile. Some things to consider - if using sprints, lengthen them. Hardware development cycle times are usually longer. You cannot be quite as experimental - prototyping and doing early manufacturing runs are expensive so up front design is useful for the hardware components, while the software is relatively easy and cheap (maybe) to change. You could even run one long hardware sprint in parallel with shorter software sprints so as hardware is pushed out, the software team can iterate on a more frequent basis. If you are building hardware/software hybrids, be aware that late hardware changes has a big impact on software downstream. Of course sometimes hardware redesign must happen, but you must make allowance for this in terms of software rework. Software teams building hardware/device products often have to write software to correct hardware design flaws - this is the nature of the beast. For me working on this project in an agile way was very rewarding. The project was experimental and largely proved and tested as we went, so agile helped us cope better with frequent hardware changes and other problems better than a standard project management approach would have. We did have battles and frequent arguments with the project management team, and with our business sponsors as it was almost impossible to provide accurate forward estimates of completion. It can work, but there are challenges around it. Typically you might have joint hardware/software teams working on a product - this was my experience. We were building a medical diagnostic device with of course a physical design and technology, an operating system, and specialised modules for diagnostic algorithms. In our case, we had an overall (waterfall) project plan for the device, and only the software subteam worked explicitly agile. Some things to consider - if using sprints, lengthen them. Hardware development cycle times are usually longer. You cannot be quite as experimental - prototy Continue Reading",2021-03-05T09:50:43.312Z,"Does Agile project management work for hardware development? ",Quora
6041ff06ed76476feda1b320,https://www.quora.com/How-do-you-explain-experience-in-working-in-agile-project-management?-,"Ok, interesting question to answer :) for me, there are a number of ways to explain your experience in agile project management. I would propose the most important as being: Your understanding of the agile and project management principlesHow well do you understand the traditional ideasHow up to date are you on the newest project management conceptsWhat about scaling up and taking care of multiple teamsCan you converse and educate othersYour ability to apply the material and ideasWhat do you chose to implementWhat will give the most reward for least invasion in to daily life within a businessWhoContinue ReadingOk, interesting question to answer :) for me, there are a number of ways to explain your experience in agile project management. I would propose the most important as being: Your understanding of the agile and project management principlesHow well do you understand the traditional ideasHow up to date are you on the newest project management conceptsWhat about scaling up and taking care of multiple teamsCan you converse and educate othersYour ability to apply the material and ideasWhat do you chose to implementWhat will give the most reward for least invasion in to daily life within a businessWho do you need to educate within the businessCan you identify different types of stakeholders and how to manage themSupportiveMarginalNeutralNon supportiveCan you facilitate:Conflict managementChange controlScope creepGold platingetc....Are you certified?PMI-ACPPSPOScrum master etc…Your results attained from the applicationThis will ultimately define how effective you were in the points aboveGetting favorable results for a project is what a project manager is meant to doHow were your financials for the results achievedDid you come in under or over budgetHow was the scheduleThe project delivered very late, on time or ahead of schedule?Did you manage scope effectively?Was the client happy with what they paid for?Was the quality and grade sufficientHow many defects outstandingCan the business take your deliverable and support and maintain itThe feedback from others who have worked for and alongside youHow did suppliers experience working with youWas your emotional intelligence on pointWere the stakeholders happy, disappointed or exhilaratedWas the customer satisfied, dissatisfied or elatedHow did the team feel the project was managedWould they work with you at the helm again?Ultimately there is no one way to measure someones experience in agile project management. However there are KPI’s and points of interest which will highlight whether someone is legit or just bluffing.  But if you probe around the points above whilst also trying your best as humanoid to remain impartial. You will most likely find out whether the person is a legit agile project manager or a dud. Hopefully this helps GoodLuck! Oliver Dolan If you like the answer, please give it an up-vote because it motivates me to write more of them for you Ok, interesting question to answer :) for me, there are a number of ways to explain your experience in agile project management. I would propose the most important as being: Your understanding of the agile and project management principlesHow well do you understand the traditional ideasHow up to date are you on the newest project management conceptsWhat about scaling up and taking care of multiple teamsCan you converse and educate othersYour ability to apply the material and ideasWhat do you chose to implementWhat will give the most reward for least invasion in to daily life within a businessWhoContinue Reading",2021-03-05T09:51:02.791Z,"How do you explain experience in working in agile project management? ",Quora
6041ff1ced76476feda1b34b,https://www.quora.com/Can-anyone-provide-good-recommendations-for-learning-about-Agile-project-management-for-web-design-and-development?-,"There is nothing called “Agile Project Management”. It all depends upon which framework are you using in your software development &/or maintenance project/product. Organizational structure, willingness to change and adapt, industry domain, and several factors affect management. As you mentioned, it is web design and development effort, I will recommend go for scrum. But to reach a final conclusion, I will dig into factors mentioned above. It is difficult to adopt scrum or any other Agile framework because it demands cultural change which is quite difficult. Process and practice change is compar Continue ReadingThere is nothing called “Agile Project Management”. It all depends upon which framework are you using in your software development &/or maintenance project/product. Organizational structure, willingness to change and adapt, industry domain, and several factors affect management. As you mentioned, it is web design and development effort, I will recommend go for scrum. But to reach a final conclusion, I will dig into factors mentioned above. It is difficult to adopt scrum or any other Agile framework because it demands cultural change which is quite difficult. Process and practice change is comparatively easy but not the mindset. There is nothing called “Agile Project Management”. It all depends upon which framework are you using in your software development &/or maintenance project/product. Organizational structure, willingness to change and adapt, industry domain, and several factors affect management. As you mentioned, it is web design and development effort, I will recommend go for scrum. But to reach a final conclusion, I will dig into factors mentioned above. It is difficult to adopt scrum or any other Agile framework because it demands cultural change which is quite difficult. Process and practice change is compar Continue Reading",2021-03-05T09:51:24.341Z,"Can anyone provide good recommendations for learning about Agile project management for web design and development? ",Quora
6041ff60ed76476feda1b3cb,https://www.quora.com/What-are-some-interesting-and-unique-research-topics-on-agile-project-management?-,"Chuck Cobb The real challenge in the area of Agile Project Management, in my opinion, is how to blend Agile and traditional plan-driven project management principles and practices in the right proportions to fit a given situation.  Many people have the mistaken belief that ""Agile"" and ""Waterfall"" are binary and mutually exclusive choices and PMI has not even scratched the surface of how to integrate the two - Agile and traditional plan-driven project management are still treated as separate and independent domains of knowledge with little or no integration between the two.I've developed some online trai Continue ReadingThe real challenge in the area of Agile Project Management, in my opinion, is how to blend Agile and traditional plan-driven project management principles and practices in the right proportions to fit a given situation.  Many people have the mistaken belief that ""Agile"" and ""Waterfall"" are binary and mutually exclusive choices and PMI has not even scratched the surface of how to integrate the two - Agile and traditional plan-driven project management are still treated as separate and independent domains of knowledge with little or no integration between the two.I've developed some online training courses that should give you some further ideas of things to work on in this area - you can check that out here: http://agile-project-management.teachable.com/ Chuck CobbAuthor of ""The Project Manager's Guide to Mastering Agile"" Continue Reading",2021-03-05T09:52:32.494Z,"What are some interesting and unique research topics on agile project management? ",Quora
6041ff77ed76476feda1b3f7,https://www.quora.com/Which-is-the-most-valued-certification-for-agile-project-management?-,"This could be a lengthy topic, it is certainly one where people will have opinions, all with value. I personally would mention two: CSM. Certified Scrum Master is widely recognized and has value because of that. You’ll see it on job posts and many people know of it. It also provides training in the most popular agile methodology.PMI-ACP. Agile Certified Professional from the Project Management Institute provides a broader look at agile methods, not just Scrum and covers other aspects in more depth, which means it has value of a different kind.Regardless of what you choose, continued learning is Continue ReadingThis could be a lengthy topic, it is certainly one where people will have opinions, all with value. I personally would mention two: CSM. Certified Scrum Master is widely recognized and has value because of that. You’ll see it on job posts and many people know of it. It also provides training in the most popular agile methodology.PMI-ACP. Agile Certified Professional from the Project Management Institute provides a broader look at agile methods, not just Scrum and covers other aspects in more depth, which means it has value of a different kind.Regardless of what you choose, continued learning is important and continuous improvement is a very agile mindset! Good luck with your learning. This could be a lengthy topic, it is certainly one where people will have opinions, all with value. I personally would mention two: CSM. Certified Scrum Master is widely recognized and has value because of that. You’ll see it on job posts and many people know of it. It also provides training in the most popular agile methodology.PMI-ACP. Agile Certified Professional from the Project Management Institute provides a broader look at agile methods, not just Scrum and covers other aspects in more depth, which means it has value of a different kind.Regardless of what you choose, continued learning is Continue Reading",2021-03-05T09:52:55.880Z,"Which is the most valued certification for agile project management? ",Quora
6041ff93ed76476feda1b42e,https://www.quora.com/Why-are-the-disadvantages-of-Agile-project-management?-,,2021-03-05T09:53:23.617Z,"Why are the disadvantages of Agile project management? ",Quora
6041ffaeed76476feda1b45d,https://www.quora.com/How-do-Atlassian-Jira-+-GreenHopper-and-AtTask-compare-when-it-comes-to-agile-project-management?-,Tom Marsh,2021-03-05T09:53:50.808Z,"How do Atlassian Jira + GreenHopper and AtTask compare when it comes to agile project management? ",Quora
6041ffd3ed76476feda1b4a6,https://www.quora.com/What-are-the-quality-indicators-of-agile-project-management?-,,2021-03-05T09:54:27.032Z,"What are the quality indicators of agile project management? ",Quora
60420019ed76476feda1b525,https://www.quora.com/What-are-the-characteristics-of-agile-project-management?-,"“Agile Project Management” is not well-defined. Here’s my definition: Agile Project Management involves blending Agile principles and practices with more traditional, plan-driven project management principles and practices in the right proportions to fit any given situation. The characteristics are that it goes beyond the traditional plan-driven project management approach that is typically focused on delivering well-defined requirements within a given cost and schedule to a broader focus on delivering customer value in an environment that may not be so well-defined.",2021-03-05T09:55:37.937Z,"What are the characteristics of agile project management? ",Quora
