"_id",job_link,answer,date,question,source
60420cfeed76476feda1cd5f,https://www.quora.com/Can-Agile-project-management-be-used-in-industrial-construction-projects?-,"Martinus Johan Wahyudi, Software Developer (2002-present)Answered January 20, 2021Can agile project management be used in non-software contexts? Martinus Johan Wahyudi Well, if you took the essence of software, which is complex solution, than of course you can applied to other complex problems too. Agility is stressed in how we able to adapt on unknown changes. The principles still same with traditional project management, regarding planning, organize, action, and controlling. the difference is on how iteration make shorter and focus directly to high impact outcome first, that can be decision input for the next action while also taking account about possibility of changes when reach the outcome. So yes, to make sure how you want to deal with the agile project Continue ReadingWell, if you took the essence of software, which is complex solution, than of course you can applied to other complex problems too. Agility is stressed in how we able to adapt on unknown changes. The principles still same with traditional project management, regarding planning, organize, action, and controlling. the difference is on how iteration make shorter and focus directly to high impact outcome first, that can be decision input for the next action while also taking account about possibility of changes when reach the outcome. So yes, to make sure how you want to deal with the agile project management or traditional, you must identify what iind of problems you will face.",2021-03-05T10:50:38.552Z,"Can Agile project management be used in industrial construction projects? ",Quora
60420d20ed76476feda1cda2,https://www.quora.com/Is-there-any-relationship-between-Agile-project-management-and-Six-Sigma?-,"Yes, there can be if you understand both. One of the game changing aspects of Six Sigma is that it provides a project management framework for the data driven creative improvement of processes and products. Six Sigma is a team based approach. The five phases and 12 steps of Six Sigma are often presented as sequential when in fact there is overlap and iterations. Agile can effectively help you manage you project with your team, steadily move through the phases and the execution of the 12 steps. Good luck!",2021-03-05T10:51:12.660Z,"Is there any relationship between Agile project management and Six Sigma? ",Quora
60420d37ed76476feda1cdcc,https://www.quora.com/What-do-developers-need-to-know-about-their-new-responsibilities-when-transitioning-to-Agile-Project-Management?-,"What do developers need to know about their new responsibilities when transitioning to Agile Project Management? Scrum derives from the Lean Product Development teams viewed by Takeuchi and Nonaka. These teams, like the Toyota Prius team, required a special management style, where management provided challenging goals and then backed off and let the team figure out what to do. This generates self-organization on a cross functional team. Understanding how lean product development works, the dynamics of these teams that generate 5-10 times normal performance is critical. The biggest impediment fo Continue ReadingWhat do developers need to know about their new responsibilities when transitioning to Agile Project Management? Scrum derives from the Lean Product Development teams viewed by Takeuchi and Nonaka. These teams, like the Toyota Prius team, required a special management style, where management provided challenging goals and then backed off and let the team figure out what to do. This generates self-organization on a cross functional team. Understanding how lean product development works, the dynamics of these teams that generate 5-10 times normal performance is critical. The biggest impediment for implementing agile is having people who do not have the mindset required. As a manager, I created Scrum to not only make the teams hyperproductive, but to enable me to be a hyperproductive manager. Scrum is not hostile to management, it is simply designed to implement self-organization to enable teams to innovate faster. Managers can implement certain ground rules, but then they need to remove impediments for the team, not tell them what to do. It frees up management time to focus on strategy, building customer relations, and streamlining company operations. The comments on Product Owners burning out are often the result of teams moving too fast for a Product Owner to keep up. You need to build a Product Owner team. One of the MIT area companies I work with had a seven product owner team in 2010 and now they have 35 product owners. So management failure to staff and train the product owner function can be a big problem. Again, this is the result of failure to execute with an agile mindset. Agile is a mindset and a motion like a martial art. If you are a women with an 8th degree black belt in Karate, like one of my Scrum users, virtually no-one can beat you in unarmed combat. Yet people say, karate is hard, it takes too long to learn, you have to follow the instructions of the master for years, you can get hurt, and on and on. These comments have nothing to do with the Karate process. They have to do with the Karate mindset and the inability or the unwillingness to achieve it. Continue Reading Mike Fontner",2021-03-05T10:51:35.335Z,"What do developers need to know about their new responsibilities when transitioning to Agile Project Management? ",Quora
60420d53ed76476feda1cdff,https://www.quora.com/What-is-the-site-to-get-free-case-studies-on-Agile-project-management?-,Riya Verma  Stefan Wolpers,2021-03-05T10:52:03.243Z,"What is the site to get free case studies on Agile project management? ",Quora
60420d6aed76476feda1ce2d,https://www.quora.com/What-can-be-a-thesis-topic-regarding-cultural-differences-and-agile-project-management?-,"Look at power dynamics and pair programming and test-driven development. Look at extreme programming. Look for overwhelmingly uniform cultures. Brogrammers come to mind. Look at who is designing the project and who is doing the work. Look at things that are allowed, ignored, and excused. Who is the QA? Who is first to be fired? Where is turnover due to better opportunities and when are people treated like commodities? Look at places like 99 designs for pure-commodity slave wages. Look at places like Toptal that have harder barriers to entry than most jobs but pay less. Seriously though, see if Continue ReadingLook at power dynamics and pair programming and test-driven development. Look at extreme programming. Look for overwhelmingly uniform cultures. Brogrammers come to mind. Look at who is designing the project and who is doing the work. Look at things that are allowed, ignored, and excused. Who is the QA? Who is first to be fired? Where is turnover due to better opportunities and when are people treated like commodities? Look at places like 99 designs for pure-commodity slave wages. Look at places like Toptal that have harder barriers to entry than most jobs but pay less. Seriously though, see if you can make sense around power dynamics and extreme programming. Look at power dynamics and pair programming and test-driven development. Look at extreme programming. Look for overwhelmingly uniform cultures. Brogrammers come to mind. Look at who is designing the project and who is doing the work. Look at things that are allowed, ignored, and excused. Who is the QA? Who is first to be fired? Where is turnover due to better opportunities and when are people treated like commodities? Look at places like 99 designs for pure-commodity slave wages. Look at places like Toptal that have harder barriers to entry than most jobs but pay less. Seriously though, see if Continue Reading",2021-03-05T10:52:26.034Z,"What can be a thesis topic regarding cultural differences and agile project management? ",Quora
60420d7ded76476feda1ce53,https://www.quora.com/How-can-Agile-project-management-be-applied-in-consulting-assignments?-,"Aalok, This reply is indirectly related to your question and may help answer it more fully. I have studied over 330 management consulting projects from the past decade. Identifying patterns in the data, and using Agile and Six Sigma, identified 33 places to change the New Need-to-Sustained Impact process. The result is that strategy design, merger design, key decisions, and similar client/consultant dialogues can be conducted using 1/3 of the effort. Part of the key was working out what needs to be discussed, in what sequences, and how. This research wasn’t on project management of consulting assignments, it was on project conduct of mgmt consulting assignments, but you could replicate the thinking by starting with a few projects to study. Hope that helps. Advanced Collaboration Process - SchellingPoint Website",2021-03-05T10:52:45.792Z,"How can Agile project management be applied in consulting assignments? ",Quora
60420d95ed76476feda1ce7c,https://www.quora.com/What-are-the-benefits-and-tradeoffs-of-pair-programming?-,"Tradeoffs: Exhausting. It's my practical experience that coding 1 hour in pair is so intensive like coding 3 hours alone. More rest is needed between the pair programming sessions. And more coffee.When a problem comes up two people are stuck with it. Just for this reason sometimes I suggest leaving pair programming until we find the solution.Two persons are absorbed by one task.All developers should have similar working environments. It's not too easy to do pair programming, when the environment is totally unknown for one member of the pair. (Using the same IDE is barely enough, though sometimContinue ReadingTradeoffs: Exhausting. It's my practical experience that coding 1 hour in pair is so intensive like coding 3 hours alone. More rest is needed between the pair programming sessions. And more coffee.When a problem comes up two people are stuck with it. Just for this reason sometimes I suggest leaving pair programming until we find the solution.Two persons are absorbed by one task.All developers should have similar working environments. It's not too easy to do pair programming, when the environment is totally unknown for one member of the pair. (Using the same IDE is barely enough, though sometimes I feel uncomfortable with different code validation settings or different color scheme.When a bad pair is formed. There are good pairs and bad pairs. For example joining two junior developers doesn't make much sense but joining two pros also might not be the best fit because they will be endlessly arguing about the most marginal things.Benefits: More effective knowledge sharing. Two people will know the written code and (technical, functional, historical, business) environment of that code. It's quite important at agile development, where there is no so much written documentation. It's also a very good opportunity to learn about an internal module of the developed software or a third party framework, when one person of the pair has already some knowledge about it.""More eyes see more things"". If one person doesn't spot a mistake the other will do it.Two persons are inspiring each other and refine each other's ideas.If one person has lower claims about code quality the other will force him/her to go for the higher level.Only one workstation is needed. :) Tradeoffs: Exhausting. It's my practical experience that coding 1 hour in pair is so intensive like coding 3 hours alone. More rest is needed between the pair programming sessions. And more coffee.When a problem comes up two people are stuck with it. Just for this reason sometimes I suggest leaving pair programming until we find the solution.Two persons are absorbed by one task.All developers should have similar working environments. It's not too easy to do pair programming, when the environment is totally unknown for one member of the pair. (Using the same IDE is barely enough, though sometimContinue Reading",2021-03-05T10:53:09.797Z,"What are the benefits and tradeoffs of pair programming? ",Quora
60420dcaed76476feda1cee3,https://www.quora.com/Is-Agile-project-management-tool-of-Azure-DevOps-a-good-replacement-for-JIRA?-,,2021-03-05T10:54:02.621Z,"Is Agile project management tool of Azure DevOps a good replacement for JIRA? ",Quora
60420ddfed76476feda1cf0c,https://www.quora.com/What-are-the-unique-challenges-Agile-project-managers-face-with-distributed-teams?-,"Agile project management is an approach that takes team collaboration into account to maximize work efficiency and to meet end goals. Those involved with agile projects know the struggle of executing a project efficiently with distributed teams. Certainly, there are a number of challenges involved while managing an agile project with distributed teams or a team that is working remotely. In the present scenario, it is more likely to happen that high priority projects will still need to be handled remotely. Given the current circumstances, the hardships for agile project managers are increasing. S Continue ReadingAgile project management is an approach that takes team collaboration into account to maximize work efficiency and to meet end goals. Those involved with agile projects know the struggle of executing a project efficiently with distributed teams. Certainly, there are a number of challenges involved while managing an agile project with distributed teams or a team that is working remotely. In the present scenario, it is more likely to happen that high priority projects will still need to be handled remotely. Given the current circumstances, the hardships for agile project managers are increasing. Some of the major hurdles that agile project manager faces are as follows: 1- Initial Resource Planning One of the biggest and common challenges faced by agile project managers is initial planning for resources. The project needs to be handled in a delicate work frame and the person responsible is not always sure of the available resources in terms of costs, labor and work efficiency of the team. Due to this reason it becomes quite laborious to plan out an effective initial strategy. 2- Progress Tracking To deliver a high quality product, agile requires distribution of tasks among the team. With a distributed team, it becomes quite a handful for agile project managers to keep track of everyone’s progress. 3- Funding and Financing Not every agile project is fully funded but there is always room to move things around and get the means that are required. When working with remote teams on an agile project, it is hard to figure out how much the labor or increments for employees can cost. A proper budget needs to be settled for the project which often gives project managers a hard time. Agile project management is an approach that takes team collaboration into account to maximize work efficiency and to meet end goals. Those involved with agile projects know the struggle of executing a project efficiently with distributed teams. Certainly, there are a number of challenges involved while managing an agile project with distributed teams or a team that is working remotely. In the present scenario, it is more likely to happen that high priority projects will still need to be handled remotely. Given the current circumstances, the hardships for agile project managers are increasing. S Continue Reading",2021-03-05T10:54:23.634Z,"What are the unique challenges Agile project managers face with distributed teams? ",Quora
60420df3ed76476feda1cf3a,https://www.quora.com/Can-agile-project-management-be-used-in-non-software-contexts?-,Martinus Johan Wahyudi,2021-03-05T10:54:43.514Z,"Can agile project management be used in non-software contexts? ",Quora
60420e2bed76476feda1cfb1,https://www.quora.com/How-is-Agile-project-management-for-an-open-source-software-different-than-regular-software?-,Wim ten Brink,2021-03-05T10:55:39.688Z,"How is Agile project management for an open source software different than regular software? ",Quora
60420e3ced76476feda1cfde,https://www.quora.com/What-agile-project-management-idea-or-skill-do-students-find-difficult?-,Chuck Cobb Phil Wolff,2021-03-05T10:55:56.315Z,"What agile project management idea or skill do students find difficult? ",Quora
60420e4ced76476feda1d007,https://www.quora.com/Is-agile-project-management-challenging-when-you-try-to-expand-the-number-or-scope-of-projects?-,"Yes, it is challenging to scale Agile beyond small, single-team projects but it certainly can be done. There are frameworks like SAFe that are designed for that purpose and there are lots of ways to blend an appropriate level of project/program management with an Agile development approach. It requires some skill to do that but it definitely can be done. Joshua Render",2021-03-05T10:56:12.799Z,"Is agile project management challenging when you try to expand the number or scope of projects? ",Quora
60420e63ed76476feda1d036,https://www.quora.com/How-can-agile-project-management-practices-be-successfully-implemented-in-heavily-regulated-industries-like-pharmaceuticals?-,Chuck Cobb 1,2021-03-05T10:56:35.528Z,"How can agile project management practices be successfully implemented in heavily regulated industries like pharmaceuticals? ",Quora
60420e84ed76476feda1d072,https://www.quora.com/What-are-the-most-important-scientific-books-and-papers-on-agile-project-management-in-marketing?-,"I’ve never heard of the term “Agile Marketing” but I would recommend “The Lean Startup” by Eric Ries. It sounds like that is what you’re looking for. Chuck Cobb Author of ""The Project Manager's Guide to Mastering Agile"" Check out: Agile Project Management Academy",2021-03-05T10:57:08.449Z,"What are the most important scientific books and papers on agile project management in marketing? ",Quora
60420ebaed76476feda1d0d2,https://www.quora.com/What-is-the-difference-between-waterfall-and-agile-project-management?-,"What is the difference between conventional project management and agile project management? The words “conventional project management” might be confusing. I prefer to call that “traditional plan-driven project management”. The term “Agile Project Management” also might be confusing to some people. Some people think that means only a pure Agile approach and that’s not what it is. Here’s how I would define the difference between a plan-driven approach and an adaptive (or Agile approach): A traditional plan-driven approach follows what is called a “Defined Processs Control Model” that is assumed to be a repeatable process and it typically follows a series of well-defined phases (typicall Continue ReadingThe words “conventional project management” might be confusing. I prefer to call that “traditional plan-driven project management”. The term “Agile Project Management” also might be confusing to some people. Some people think that means only a pure Agile approach and that’s not what it is. Here’s how I would define the difference between a plan-driven approach and an adaptive (or Agile approach): A traditional plan-driven approach follows what is called a “Defined Processs Control Model” that is assumed to be a repeatable process and it typically follows a series of well-defined phases (typically called “Waterfall”). This approach is most appropriate for a situation with a low level of uncertainty where the requirements for the project and a plan for the project with cost and schedule goals can be defined upfront prior to the start of the project. The emphasis of that model is on planning, control, and predictability. The problem with the traditional plan-driven model is that it doesn’t work well in a situation where there is a high level of uncertainty. That kind of environment requires a lot more flexibility and adaptivity to further define the project as it is in progress rather than starting out with detailed requirements and a plan upfront. That’s basically what an Agile approach is and it follows what is called an “Empircal Process Control Model”. This article explains the difference between these two models: What is Scrum and What is Agile - How Are They Different? The world of project management is going through huge changes at the moment as the result of the influence of Agile. For a long time, PMI did not recognize Agile as a legitimate form of project management. In 2013, PMI created the PMI-ACP certification that recognized the importance of Agile but Agile and traditional plan-driven project management have still been treated as somewhat separate and independent domains of knowledge with little or no integration between the two. The challenge for project managers is to create an integrated approach that blends these two different models in the right proportions to fit a given situation rather than force-fitting a project to a totally plan-driven - that’s what “Agile Project Management” is. Here are some articles on the future of project management and the impact of Agile with more detail on this: Future of Project Management - What Is the Impact of Agile?",2021-03-05T10:58:02.100Z,"What is the difference between waterfall and agile project management? ",Quora
60420ee1ed76476feda1d11b,https://www.quora.com/How-do-you-manage-scope-creep-in-agile-projects?-,"Malte Scholz, Co-founder and Chief Product Builder at Airfocus (2017-present)Answered 1 year ago · Author has 81 answers and 40.1K answer views Malte Scholz According to the airfocus glossary, ""scope creep (sometimes called feature creep in product management) refers to a tendency for the requirements and deliverables of a project to slowly expand or become distracted over time. A project’s scope will often widen over its lifecycle as requests from customers and stakeholders for new features and functionality come in. This is a natural (and essential) part of any product development process, but issues arise when teams get sidetracked on the wrong things. Customer needs can change after the initial requirements for a product have been set, so effect Continue ReadingAccording to the airfocus glossary, ""scope creep (sometimes called feature creep in product management) refers to a tendency for the requirements and deliverables of a project to slowly expand or become distracted over time. A project’s scope will often widen over its lifecycle as requests from customers and stakeholders for new features and functionality come in. This is a natural (and essential) part of any product development process, but issues arise when teams get sidetracked on the wrong things. Customer needs can change after the initial requirements for a product have been set, so effective product management requires a high degree of flexibility. That said; any changes made must align with the overarching product vision — otherwise, teams risk wasting resources (and creating weaker products) by focusing on the wrong things.  Why does scope creep happen? Scope creep can emerge in different ways, but most typically it occurs when teams start adding in additional functionality or features that haven’t been properly prioritized in the roadmap. While the roots of scope creep are typically found in external factors, it sometimes arises as a result of lack of consensus within teams, internal miscommunication, or weaknesses in product or (or project) management processes. How to manage scope creep To stay on top of scope creep, it's vital to have clearly prioritized product roadmap in place that documents changes to the project requirements and displays their impact on priorities or timelines. An effective product roadmap can also be the basis of a change control process, which includes: Monitoring a product’s current statusUnderstanding the original scope of a project and its core objectiveCapturing actual progress, then comparing it to the core objective to know how much the current project has diverged from the original planDetailing the causes of any change in requirements and defining how much product development has changed as a resultEvaluating change requests to recommend actions or decide if they should be challengedEnsuring all changes are processed, documented, and broken down into actionable tasks""You'll find more insights about here: What is scope creep. If you have more questions about “Production”, “Marketing”, ""Business Models"" and more they have a frequently asked questions there and a ton of more info.­",2021-03-05T10:58:41.094Z,"How do you manage scope creep in agile projects? ",Quora
60420ef2ed76476feda1d13d,https://www.quora.com/What-are-the-latest-open-source-test-management-tools-or-agile-project-management-tools-available?-,I recommend zentao project management tool which is open source version. it's also efficient and easy to use more features with cheaper price.,2021-03-05T10:58:58.713Z,"What are the latest open source test management tools or agile project management tools available? ",Quora
