"_id",job_link,answer,date,question,source
6041fc78ed76476feda1ae18,https://www.quora.com/Are-there-any-growth-hacking-tips-for-SaaS?-,"A fantastic answer by Matthew Howells-Barby aka Matthew Barby (don’t know which profile is real). https://www.matthewbarby.com/goodies/Growth%20Hacking%20Your%20SaaS%20Startup%20-%20a%20Guide.pdf It goes through: List of HacksPre-Launch Strategy ..................................................................................................4 Get Concept Feedback from Reddit.....................................................................4 Give Away a Relevant Free Tool/Course..............................................................5 Crowdsource Funding .................................... Continue ReadingA fantastic answer by Matthew Howells-Barby aka Matthew Barby (don’t know which profile is real). https://www.matthewbarby.com/goodies/Growth%20Hacking%20Your%20SaaS%20Startup%20-%20a%20Guide.pdf It goes through: List of HacksPre-Launch Strategy ..................................................................................................4 Get Concept Feedback from Reddit.....................................................................4 Give Away a Relevant Free Tool/Course..............................................................5 Crowdsource Funding ...........................................................................................7 Invite Influencers to Beta Test..............................................................................8 Run a Pre-Launch Giveaway .................................................................................9 Track Pre-Launch Visitors for Social Remarketing............................................11 Hack LinkedIn to Find Out Who Visits Your Site ...............................................13 Run an Early Adopter Focus Group....................................................................15 Submit Your Startup to BetaList.........................................................................16 Create a PR Hit-List..............................................................................................17 Create a Press Kit.................................................................................................19 Optimise Your Website for Search.....................................................................20 Post-Launch Strategy ..............................................................................................23 Get Featured on Product Hunt...........................................................................23 Get Featured on Hacker News ...........................................................................26 Set Up & Respond to Press Request Alerts .......................................................28 Event Hashtag Hijacking......................................................................................31 Feature Industry Influencers on Your Blog .......................................................32 Create a Viral Sign-Up Form ...............................................................................34 Set Up Metrics Dashboards ................................................................................35 Add Data Capture Forms ....................................................................................36 Set Up Automated Email Workflows..................................................................38 Use Your Email List to Grow Your Social http://Following..........................................403 Chats ........................................................................................................41 Track & Follow-up on Branded Mentions..........................................................43 Send Physical Gifts to Users That Reach Milestones .......................................44 Experiences of Successful SaaS Startup Founders ..............................................47 Cyril Nicodème – VoilaNorbert...........................................................................47 Scott Savarie – Napkin.........................................................................................50 Reilly Sweetland – FollowUpThen ......................................................................51 Conrado Lamas (PR/Comms) – Email tracking made simple with double check marks .....................................................52 Alex Turnbull – Groove........................................................................................53 Again, here is the link for you: https://www.matthewbarby.com/goodies/Growth%20Hacking%20Your%20SaaS%20Startup%20-%20a%20Guide.pdf P.S> You can read about some of my learning here: Zachary Lukasiewicz's answer to What are some things a marketing student should do every day to hone their skills? You can learn about my podcast here: Start Here You can follow me on Quora here: Zachary Lukasiewicz You can view a growth hacker’s resume here: The Digital Desk of Zachary Paul Lukasiewicz A fantastic answer by Matthew Howells-Barby aka Matthew Barby (don’t know which profile is real). https://www.matthewbarby.com/goodies/Growth%20Hacking%20Your%20SaaS%20Startup%20-%20a%20Guide.pdf It goes through: List of HacksPre-Launch Strategy ..................................................................................................4 Get Concept Feedback from Reddit.....................................................................4 Give Away a Relevant Free Tool/Course..............................................................5 Crowdsource Funding .................................... Continue Reading",2021-03-05T09:40:08.535Z,"Are there any growth hacking tips for SaaS? ",Quora
6041fc8ced76476feda1ae41,https://www.quora.com/What-is-the-average-ratio-of-support-staff-to-customer-counts-in-a-SaaS-model?-,"Jason M. Lemkin Typically support consumes about perhaps 5%-7% of your revenue at scale (excluding customer success) in most SaaS models. It could be more or less, but that’s a rough way to think about it. So at $100m in ARR, you might be spending $5m-$7m on your support team. As you can see, that puts a lot of pressure on costs. But spend a lot more in the early days for sure. Happy customers beget more happy customers. Make sure the phone is picked up by ring #3. Make sure every Intercom chat is answered in 60 seconds of less. Have instant support while you can. It’s your top marketing and customer retention  Continue ReadingTypically support consumes about perhaps 5%-7% of your revenue at scale (excluding customer success) in most SaaS models. It could be more or less, but that’s a rough way to think about it. So at $100m in ARR, you might be spending $5m-$7m on your support team. As you can see, that puts a lot of pressure on costs. But spend a lot more in the early days for sure. Happy customers beget more happy customers. Make sure the phone is picked up by ring #3. Make sure every Intercom chat is answered in 60 seconds of less. Have instant support while you can. It’s your top marketing and customer retention investment. Continue Reading",2021-03-05T09:40:28.967Z,"What is the average ratio of support staff to customer counts in a SaaS model? ",Quora
6041fcb6ed76476feda1ae98,https://www.quora.com/What-are-some-of-the-best-posts-on-growth-hacking?-,"Below are the best articles about growth hacking which have greatly improved my understanding. Mobile Growth Stack: Andy Carvell’s epic article on all the channels available for growth is a bible for growth hackers. If you’re just getting started with Growth — this one is a must read.2015: The Mobile Growth Stack Revised 2. 100 days of Google Dev: A Youtube series detailing app indexing, deep-linking & all the basics for growing your app — again a must read for all folks interested in mobile.  3. Practical Tips for your app: Deepak’s presentation is a must read f Continue ReadingBelow are the best articles about growth hacking which have greatly improved my understanding. Mobile Growth Stack: Andy Carvell’s epic article on all the channels available for growth is a bible for growth hackers. If you’re just getting started with Growth — this one is a must read.2015: The Mobile Growth Stack Revised 2. 100 days of Google Dev: A Youtube series detailing app indexing, deep-linking & all the basics for growing your app — again a must read for all folks interested in mobile.  3. Practical Tips for your app: Deepak’s presentation is a must read for each beginner. Detailed tips for launching your app to getting the right analytics are included. Growth Hacks: Practical Tips for your Mobile Apps 4. Making referrals work: AirBnB and it’s referral program are legendary when it comes to viral loops. Hacking Word-of-Mouth: Making Referrals Work for Airbnb - Airbnb Engineering 5. Mobile App survival funnel: Uninstalls is a huge problem for mobile apps. A simple but complete guide about areas of the app you can focus to reduce uninstalls. Mobile App’s Survival Funnel: How to stop uninstalls [Infographic] — Growth Bug - App World 6. Growth Hacking Uber: I enjoyed the depth in this article. As product managers caught in the feature war, we underestimate the power of solving problems to the smallest detail. Growth Hacking Uber 7. Losing 80% of your users is normal: Andrew Chen sheds light on the retention rate for apps and why losing 80% of your acquired users is normal. New data shows losing 80% of mobile users is normal, and why the best apps do better 8. List of the best growth hacking resources: Apompliano has put together an enviable list of growth resources. Master List of Growth Resources 9. Decisions facebook took to grow their product: Answers fromChamath and Andy Johns about how they grew the facebook product. What are some decisions taken by the ""Growth team"" at Facebook that helped Facebook reach 500 million users? 10. Lessons from the Growth Conference: Initial app experience, resurrecting lost users & more lessons about growing your product. Growth Hackers Conference: Lessons Learned If you liked my answer please leave feedback as comments. Currently building & growing Gaana — India’s Favorite Music app. I would love it if you give it a try. You can follow me on Twitter. This was first published on Top 10 growth hacking articles you must bookmark my medium blog. Below are the best articles about growth hacking which have greatly improved my understanding. Mobile Growth Stack: Andy Carvell’s epic article on all the channels available for growth is a bible for growth hackers. If you’re just getting started with Growth — this one is a must read.2015: The Mobile Growth Stack Revised 2. 100 days of Google Dev: A Youtube series detailing app indexing, deep-linking & all the basics for growing your app — again a must read for all folks interested in mobile.  3. Practical Tips for your app: Deepak’s presentation is a must read f Continue Reading",2021-03-05T09:41:10.768Z,"What are some of the best posts on growth hacking? ",Quora
6041fccced76476feda1aec6,https://www.quora.com/Why-am-I-so-afraid-of-email-marketing?-,"Thomas Connors Did you maybe have a bad dream where an email marketing campaign was chasing you through a darkened street, but no matter how much you ran you weren’t fast enough to get away? If not, it could be because an email marketing campaign can seem pretty intimidating from the outset. I’ll try and break it down for you as best I can. I always suggest running both an inbound and outbound campaign simultaneously. This will allow you to maximize your potential reach and, hopefully, improve your overall conversions. An inbound campaign is what you would send to people who have opted-in to receiving your mark Continue ReadingDid you maybe have a bad dream where an email marketing campaign was chasing you through a darkened street, but no matter how much you ran you weren’t fast enough to get away? If not, it could be because an email marketing campaign can seem pretty intimidating from the outset. I’ll try and break it down for you as best I can. I always suggest running both an inbound and outbound campaign simultaneously. This will allow you to maximize your potential reach and, hopefully, improve your overall conversions. An inbound campaign is what you would send to people who have opted-in to receiving your marketing emails. They found you organically though your blog/content and signed up to receive your email newsletter. These people are obviously primed to hear from you and are likely to engage with your offerings, but building an organic list this way can be a slow process. An outbound (or cold) campaign goes out to a list of people who haven’t heard of you before that you likely purchased from a data provider. It takes a little more convincing with this audience to get them to engage, but the beauty of a cold email campaign is that you’ll be sending to a wide list of people in one shot. Some purchased lists can reach up to multiple thousands of contacts. An inbound campaign takes less watching over. Presumably, you’ll know what kind of content these contacts want to see because they’ve converted on a piece of content you’ve written. You’ll want to nurture them slowly until they’re ready to make a buying decision. Always guide them back to your website where you’ll have calls to action and internal links to guide them around. Check in on your inbound email list every now and again to ensure you aren’t sending to too many old email addresses, as too many bounces might trigger a spam filter. There are a few things to keep in mind with an outbound campaign. · Use the right tool for the job. Traditional ESPs are incapable of sending to a cold list of contacts, especially a large one. Clickback MAIL was designed from the ground up to carry out cold email campaigns, and does so using its own IPs so your sender score remains intact. · Keep your contact list clean. Always purchase your contact list from a reputable data provider. Still it’s worth it to clean your list before you send your campaign. Purchased lists can contain old email addresses, bad data, and spam traps which can land you on a blacklist. Being that these lists are often much larger than your average inbound list, it’ll be quite the task to stay on top of its cleanliness yourself. Clickback MAIL features a built-in email verifier that will clean your list before you send your campaign. · Don’t be spammy. This sounds obvious, but there are tons of words, phrases and design choices that can trigger spam filters and send you to the junk folder instead of the inbox. Clickback MAIL features a live spam checker that will remove any such practices for improved deliverability. Remember, just because you’re running a cold campaign, doesn’t mean you have to come across as cold. Just like you would with an inbound campaign, develop a buyer persona and target them with your email and landing page content. Never make the email about you or your sale…it’s always about the recipient and how you can solve an issue they might be having. Develop a cadence that’s going to work for your recipient as well. This will come as a result of much testing and experimentation. Don’t be scared, email marketing is just another tactic to have in your digital marketing arsenal. (And if you start having that dream about the email chasing you, maybe try not eating right before bed.) Hope that helps! Disclaimer: I work at Clickback. Continue Reading",2021-03-05T09:41:32.374Z,"Why am I so afraid of email marketing? ",Quora
6041fcf2ed76476feda1af11,https://www.quora.com/How-can-I-lower-my-customer-acquisition-cost?-,"Metvy, Helps to connect with people around you.Answered November 20, 2020 · Author has 745 answers and 267.9K answer views Metvy Customer Acquisition Cost (CAC) generally represents the costs that are used in the process of acquiring a user. A good measure of efficacy is your paid channels’ customer acquisition costs (CACs). It’s also an important indicator of your overall marketing success.  Lower CAC = More customers = Additional ROI. There are countless of strategies you can implement to lower your customer acquisition cost. But we’re going to give you the most important ways to reduce CAC: Calculate Customer Acquisition Cost correctly. Your CAC is your total sales and marketing cost divided by your total number of new cuContinue ReadingCustomer Acquisition Cost (CAC) generally represents the costs that are used in the process of acquiring a user. A good measure of efficacy is your paid channels’ customer acquisition costs (CACs). It’s also an important indicator of your overall marketing success.  Lower CAC = More customers = Additional ROI. There are countless of strategies you can implement to lower your customer acquisition cost. But we’re going to give you the most important ways to reduce CAC: Calculate Customer Acquisition Cost correctly. Your CAC is your total sales and marketing cost divided by your total number of new customers. If you’re a new business, look into average CACs for your industry and spend some time calculating a reasonable CAC that would enable your business to be profitable.Focus on proper users for you. If you define your target better, you win. It is that simple. All you need to do is to define your target as soon as possible.If you don’t have a significant budget for running intent-based ads, retargeting can be a cost-effective way to get new customers at a reasonable CAC.If you focus on acquiring users, you need to pay attention to customer retention metric as well. Customer retention is simply the metric that is used to count customers and track customer activities. Acquiring a new user is much more expensive than keeping existing one. There are a few different strategies to improve your customer retention rates. One in particular is doing deep analysis of customer churn: Why are customers churning and what can you do to prevent it? Is it an easy fix?Constantly improving and optimizing aspects of your paid media strategy is imperative for reducing CAC in the long term.Customer acquisition is an expensive process, however with proper tips you can lower your CAC. Do follow Metvy on Quora for more business, marketing, work, and other value-based content.",2021-03-05T09:42:10.851Z,"How can I lower my customer acquisition cost? ",Quora
6041fd19ed76476feda1af5e,https://www.quora.com/What-is-the-single-most-successful-channel-or-strategy-for-your-SaaS-business-growth?-,"Kinjal Shah, Engager (2019-present)Answered 10 months ago · Author has 104 answers and 20K answer views Kinjal Shah IMO - a great product teamed with amazing experience is the single most successful channel or strategy for SaaS business growth. If you don’t think your product is robust enough or has immense helpful features attached to it, then definitely your business growth is bound to be affected heavily. Today, users want to use products that benefit them in a major way. For example, mobile apps such as calculators, notes, calendar are useful but do they make a huge difference to your user's life? Not really. And hence they are now in-built apps in your phone. You don’t have to go that extra mile to downl Continue ReadingIMO - a great product teamed with amazing experience is the single most successful channel or strategy for SaaS business growth. If you don’t think your product is robust enough or has immense helpful features attached to it, then definitely your business growth is bound to be affected heavily. Today, users want to use products that benefit them in a major way. For example, mobile apps such as calculators, notes, calendar are useful but do they make a huge difference to your user's life? Not really. And hence they are now in-built apps in your phone. You don’t have to go that extra mile to download and install them. However, when you talk about apps such as Instagram, money manager, Netflix, YouTube, Spotify, they go beyond the usual music and video apps. The user experience they provide is far more credible than your phone’s in-build music apps. THat’s the difference. Great products are the ones that are ordinary but provide an extraordinary user experience.",2021-03-05T09:42:49.204Z,"What is the single most successful channel or strategy for your SaaS business growth? ",Quora
6041fd2ded76476feda1af87,https://www.quora.com/Why-is-customer-retention-the-ultimate-growth-strategy?-,"Who said it is the ultimate strategy? To practise it you need to have some (a sufficient number of) existing customers. For a startup with no existing customers, the ultimate strategy is relentless acquisition ! The ‘ultimate’ (or any) strategy depends on the life cycle of the business. So much about ‘ultimate’, now to the question: Retention is a very good growth strategy for most established businesses, because it alone contributes to all (often conflicting) customer objectives. Which are they? There are only 3 things any business must do with its customers. Nothing more - just these three: GeContinue ReadingWho said it is the ultimate strategy? To practise it you need to have some (a sufficient number of) existing customers. For a startup with no existing customers, the ultimate strategy is relentless acquisition ! The ‘ultimate’ (or any) strategy depends on the life cycle of the business. So much about ‘ultimate’, now to the question: Retention is a very good growth strategy for most established businesses, because it alone contributes to all (often conflicting) customer objectives. Which are they? There are only 3 things any business must do with its customers. Nothing more - just these three: Get customersKeep customersGrow customersTranslated from plain English into business-speak, these are Acquisition, Retention and Customer Development (value growth). Apart from the obvious cost difference (people blindly quote unchecked sources that differ from 5% to 5 times (!) cost difference - but whatever the numeric value, retention ‘per-capita’ is always cheaper) - Retention automatically generates advantages in the other 2 areas: It helps Acquisition because retained customers share their satisfaction and boost the brand reputation (indirect contribution), and often refer prospects form their personal networks (direct contribution). Those referred acquisitions do not need the high marketing and sales cost of others, who never heard about your company.It helps Value Growth (cynically called cross-sell and up-sell for ‘wallet share’) because long-term relationships provide better insight into customer needs, which you may profitably satisfy. At the same time, the relationship builds trust and increases the acceptance of your better targeted and needs-based offers.Do the Retention right, and you will experience better acquisition and customer development rates, organically and without extra effort or spend. = = = = = = = Caveat: nobody said that you always want to retain all your customers. Not equally, at least: If you correctly segment your existing customer base by lifetime value, there are customers you want to retain ‘at any cost’. Because the investment in providing a better experience, privileges and pampering, gift and surprises - is always worth it, considering the profitability of those customers (and the value loss, should they churn).Then there may be some which you don’t want to retain at all. In every multitude there is a ‘reverse Pareto’ - just like a minority contributes to the majority of your profits, another minority contributes to the majority of your losses (offsetting much of the others’ profit). Some companies deliberately try to get rid of them - or at least do not spend a penny on their retention.The bulk majority between the above is not homogeneous. It can further be segmented into additional levels of desirability and therefore - differentiated retention strategies…But here we go into the ocean of the broader Customer Relationship Management discipline (nothing to do with some software called CRM, btw ;) Happy to answer any questions triggered by the story so far.",2021-03-05T09:43:09.877Z,"Why is customer retention the ultimate growth strategy? ",Quora
