"_id",job_link,answer,date,question,source
6041fea1ed76476feda1b258,https://www.quora.com/What-are-the-different-practices-for-customer-retention-for-an-e-commerce-company?-,"Michael has collected the right points, and I can also confirm them. And I can add to his list: ECommerce companies vary. So do their customer retention strategies. Some marketers try to keep their customers by offering lower prices; others rather concentrate on good quality and outstanding customer support. What I believe works, is building a lovable brand presence for your eCommerce company that engages customers. Let me explain: #1: Customers who love you cost less.It’s 6 to 7 times more expensive to acquire a new customer than to keep one. Just think about advertising. (source) Remarketing i Continue ReadingMichael has collected the right points, and I can also confirm them. And I can add to his list: ECommerce companies vary. So do their customer retention strategies. Some marketers try to keep their customers by offering lower prices; others rather concentrate on good quality and outstanding customer support. What I believe works, is building a lovable brand presence for your eCommerce company that engages customers. Let me explain: #1: Customers who love you cost less.It’s 6 to 7 times more expensive to acquire a new customer than to keep one. Just think about advertising. (source) Remarketing is always cheaper than showing ads to a new audience. And the ones who trust you are more likely to check back after receiving a gentle reminder. #2: Customers who love you are more likely to recommend you to others.The best marketers are satisfied customers. The data speaks for itself: 92% of consumers around the world say they trust a friend’s recommendation. (source) This is the so-called word of mouth, my friend. The best thing is, it costs you nothing. #3: Customers who love you are loyal to your brand.Did you know that more than 1 billion people will be digital buyers in 2016? (source) This means that more and more eCommerce stores will want their attention – besides you. It’s impossible to always offer the best prices. Your best competitive strategy is to create a strong emotional attachment with your customers. Making customers love you is key. That’s why at Antavo we’ve built s a loyalty management platform for B2C retailers (I’m Co-founder of this company, by the way.) Of course, a fun and playful loyalty program (which is more than your typical ‘spend-a-dollar-earn-a-point’ program) is not the only tool you can use. Try: a live help desk.personalized offers.transactional messages, etc.These can also help you maintain customer retention. If you want to learn more, my colleague has written an ebook about this topic: Get out of the Customer Retention Jungle in 4 Easy Steps Michael has collected the right points, and I can also confirm them. And I can add to his list: ECommerce companies vary. So do their customer retention strategies. Some marketers try to keep their customers by offering lower prices; others rather concentrate on good quality and outstanding customer support. What I believe works, is building a lovable brand presence for your eCommerce company that engages customers. Let me explain: #1: Customers who love you cost less.It’s 6 to 7 times more expensive to acquire a new customer than to keep one. Just think about advertising. (source) Remarketing i Continue Reading",2021-03-05T09:49:21.327Z,"What are the different practices for customer retention for an e-commerce company? ",Quora
6041feb6ed76476feda1b27e,https://www.quora.com/What-are-some-quantitative-metrics-angel-investors-look-for-in-a-pitch?-,"Casey Allen In order of importance to me.  Note: very few other investors will have the same order or points. But that's exactly the point. We're all humans too. 1. NUMBER of years that the founders have spent in this industry. The more the better. 2. NUMBER of startups before this that they've worked on together. The higher it is, the drastically better the chances they will kick ass together and won't break up year two. 3. NUMBER of startups launched by any of them, but specifically, the CEO. Outcomes of these past startups is less important to me (although I will ask about them). Mental and emotional prepa Continue ReadingIn order of importance to me.  Note: very few other investors will have the same order or points. But that's exactly the point. We're all humans too. 1. NUMBER of years that the founders have spent in this industry. The more the better. 2. NUMBER of startups before this that they've worked on together. The higher it is, the drastically better the chances they will kick ass together and won't break up year two. 3. NUMBER of startups launched by any of them, but specifically, the CEO. Outcomes of these past startups is less important to me (although I will ask about them). Mental and emotional preparation is what I'm gunning for. I want to know that the founders know the brutal journey they are signing up for. If there were multiple concepts that they bailed on in the early days, especially when the concepts were pre-rev, this is usually a large warning sign for me, however. I'm fine with pivots, but I want to invest in finishers, not starters. 4. NUMBER of said companies that exited. It helps massively knowing that the CEO has made a company valuable enough to be acquireable. And that he's the type that can seal the deal. 5. NUMBER of customers that the founders have talked to and hopefully sold or gotten LOIs from. Hopefully in the hundreds and tens, respectively. Any other non-financial metric would be noise if it were the first meeting or in the deck. Continue Reading",2021-03-05T09:49:42.242Z,"What are some quantitative metrics angel investors look for in a pitch? ",Quora
6041fec8ed76476feda1b2a1,https://www.quora.com/What-are-the-best-metrics-for-measuring-customer-engagement?-,"You may be asking yourself ‘if this article is about marketing and I’m in Customer Success, why am I using my precious time to read it?’ That would be a valid question. But the answer may not be what you think. It’s not about inter-departmental cooperation or collaboration, or even about learning from your peers. It’s about gaining insight into customer engagement to understand how they’re interacting with your company. Customer Success Metrics Customer Health Score. Net Promoter Score. Qualitative Customer Feedback. Customer Churn Rate. Monthly Recurring Revenue. Customer Lifetime Value. Customer Ret Continue ReadingYou may be asking yourself ‘if this article is about marketing and I’m in Customer Success, why am I using my precious time to read it?’ That would be a valid question. But the answer may not be what you think. It’s not about inter-departmental cooperation or collaboration, or even about learning from your peers. It’s about gaining insight into customer engagement to understand how they’re interacting with your company. Customer Success Metrics Customer Health Score. Net Promoter Score. Qualitative Customer Feedback. Customer Churn Rate. Monthly Recurring Revenue. Customer Lifetime Value. Customer Retention Cost. First Contact Resolution Rate. Businesses these days are making significant efforts to delight their customers, and for good reasons. One of the key areas where businesses focus their efforts is in creating online self-serve applications with a great user experience in order to help customers get what they need and when they need it. A combination of these core metrics: Activity Time, Visit Frequency and Core User Actions uncovers the level of user engagement for any web-application or service. To get to the combination of customer engagement metrics that is right for your particular service requires some thinking and modeling of the expected user behavior. For the best customer success products in the industry, learn more about the Activate, Engage & Retain Customers on Digital Stage | Evolving Systems suite of customer engagement technology and contact sales to get started with the concepts in this article today! You may be asking yourself ‘if this article is about marketing and I’m in Customer Success, why am I using my precious time to read it?’ That would be a valid question. But the answer may not be what you think. It’s not about inter-departmental cooperation or collaboration, or even about learning from your peers. It’s about gaining insight into customer engagement to understand how they’re interacting with your company. Customer Success Metrics Customer Health Score. Net Promoter Score. Qualitative Customer Feedback. Customer Churn Rate. Monthly Recurring Revenue. Customer Lifetime Value. Customer Ret Continue Reading",2021-03-05T09:50:00.453Z,"What are the best metrics for measuring customer engagement? ",Quora
6041feeced76476feda1b2e8,https://www.quora.com/What-is-best-Magento-e-commerce-development-company?-,"MageMonkeys.com is known for its perfection and edge-cutting solution that we produce incorporating the latest technologies for your online eCommerce store. Magento is a widely acclaimed CMS for eCommerce development and aligns your business with the new era of developments. Mage Monkeys is known for the rapid and effective Magento development, from design to complete build we look up the project at every step. Our business analyst does thorough research of the market and then arrive at a solution to help you create a fully functional and adaptable website. We curate the best of technology keep Continue ReadingMageMonkeys.com is known for its perfection and edge-cutting solution that we produce incorporating the latest technologies for your online eCommerce store. Magento is a widely acclaimed CMS for eCommerce development and aligns your business with the new era of developments. Mage Monkeys is known for the rapid and effective Magento development, from design to complete build we look up the project at every step. Our business analyst does thorough research of the market and then arrive at a solution to help you create a fully functional and adaptable website. We curate the best of technology keeping in mind the audiences and their requirements. MAGENTO SOLUTION WE OFFER AT MAGE MONKEYS Magento CustomizationOur custom Magento Development Solution services help you transform your online eCommerce store into a top-listed eCommerce enterprise. Magento Extension DevelopmentIntegrate your Magento online store with the Magento extensions. We also help you develop your very own custom Magento extensions. Magento Theme / Design IntegrationA theme is the front face of your store. Our design professionals create the uniques & professional Magento Theme design for your website. Shopping Cart DevelopmentWe provide a Shopping cart eCommerce development solutions to help you sell online efficiently with your own eCommerce store worldwide. Magento Speed OptimizationYou will never experience sluggishness in Magento site speed. We let you optimize your Magento Site for better speed and performance. Easy Order ManagementOptimize your eCommerce website with easy order management and workflow with simple extensions. Control and manage your order easily from the manager. Magento Enterprise DevelopmentWe work thoroughly with all the enterprise models of Magento aiming to provide robust and flexible eCommerce solutions. Magento Module DevelopmentWe let you install configure and activate a module without worrying about the code. We help you develop custom Magento Module. 3rd Party App IntegrationGive immense flexibility and fully functional software eCommerce solution with the 3rd Party applications. They will make the shopping experience a memorable one Easy Installation And UpgradeWith every new version, we are an expert. Install updates into your Magento store with the help of our experts and get smooth functionality into the eCommerce store. On-Time DeliveryWith the quality, we believe in deadlines and use the best project management tools to timely deliver your website and applications. WHY CHOOSE US? Magento programmers with extraordinary professional experienceLatest Technologies and High StandardsCompetitive pricingBrilliant Magento themesThe effective back-end for website controlHigh work ethicsCompetent coders with result-driven strategiesBonus add-one of customization and website testing24/7 availability for support MageMonkeys.com is known for its perfection and edge-cutting solution that we produce incorporating the latest technologies for your online eCommerce store. Magento is a widely acclaimed CMS for eCommerce development and aligns your business with the new era of developments. Mage Monkeys is known for the rapid and effective Magento development, from design to complete build we look up the project at every step. Our business analyst does thorough research of the market and then arrive at a solution to help you create a fully functional and adaptable website. We curate the best of technology keep Continue Reading",2021-03-05T09:50:36.947Z,"What is best Magento e-commerce development company? ",Quora
6041feffed76476feda1b30e,https://www.quora.com/What-unlocks-great-customer-experience-for-banks?-,"Over the years banking products have become more and more commoditised. The number of players in the market has also increased. There are two levers that a bank can use to differentiate their proposition to grow market share and profitability. The first lever is Relationship which can be strengthened by building trust. The other one is Service which relates directly to customer experience. Below are some examples of customer experience trends: 1. Omnichannel Customer Service In the past, service hours were restricted to the period from nine to five, with support simply not available outside these Continue ReadingOver the years banking products have become more and more commoditised. The number of players in the market has also increased. There are two levers that a bank can use to differentiate their proposition to grow market share and profitability. The first lever is Relationship which can be strengthened by building trust. The other one is Service which relates directly to customer experience. Below are some examples of customer experience trends: 1. Omnichannel Customer Service In the past, service hours were restricted to the period from nine to five, with support simply not available outside these ‘working hours’. Customers have now been enabled with a tool set to operate 24x7 with convenient multi-product, multi-language support that is available over the phone, via a website, on a mobile app or in a branch. 2. RPA, AI, Machine Learning, Blockchain, and Chatbots will grow Banks have progressively adopted robotic process automation (RPA), artificial intelligence (AI), block chain and machine learning, which will continue to revolutionise customer service experience. Chatbots will provide intelligent and personalised conversational experiences, while instantly solving the customer's query 24x7. Blockchain’s ability to improve efficiency, accuracy, security, transparency, and execution speed will see this technology get more acceptances. Read more..",2021-03-05T09:50:55.540Z,"What unlocks great customer experience for banks? ",Quora
