"_id",job_link,answer,date,question,source
6041eee8ed76476feda19883,https://www.quora.com/Why-do-e-commerce-brands-need-customer-retention-marketing?-,,2021-03-05T08:42:15.965Z,"Why do e-commerce brands need customer retention marketing? ",Quora
6041ef05ed76476feda198aa,https://www.quora.com/How-do-I-prevent-customer-churn-with-retention-marketing?-,Kinjal Shah,2021-03-05T08:42:45.535Z,"How do I prevent customer churn with retention marketing? ",Quora
6041ef3fed76476feda198f3,https://www.quora.com/How-can-businesses-cut-their-expenses-related-to-online-marketing-and-customer-retention?-,"I truly believe that Content Marketing is the way to go for most businesses doing anything of any worth online. I read yesterday about a Cabinet Maker who had grown from $0 to $40M online just using a content marketing strategy. So many companies do not invest in putting out free value, they see it as giving away their gold. If you post a daily video, post, article or blog, then you will garner views, clicks, and possible conversions for your business. And this will lower your marketing expenses relating to online marketing. In terms of customer retention, not so sure about this, but obviously if w Continue ReadingI truly believe that Content Marketing is the way to go for most businesses doing anything of any worth online. I read yesterday about a Cabinet Maker who had grown from $0 to $40M online just using a content marketing strategy. So many companies do not invest in putting out free value, they see it as giving away their gold. If you post a daily video, post, article or blog, then you will garner views, clicks, and possible conversions for your business. And this will lower your marketing expenses relating to online marketing. In terms of customer retention, not so sure about this, but obviously if we attract the right person in the right place then the chances of retention (stickiness) are higher. I believe in a strong onboarding sequence designed to get people fully up to speed on the product or services as quickly as possible. This will help with retention and should not be that intensive from a cost point of view. For example I send all my clients physical books & resources once they become a client, this has a cost to it but I find the my client love being so looked after in that first few days so the cost is well worth it in the long run for retention. These kinds of things will increase your retention, so measure your costs again the increase in retention and this should give you the value case/ROI. Hope this helps!Sharnee I truly believe that Content Marketing is the way to go for most businesses doing anything of any worth online. I read yesterday about a Cabinet Maker who had grown from $0 to $40M online just using a content marketing strategy. So many companies do not invest in putting out free value, they see it as giving away their gold. If you post a daily video, post, article or blog, then you will garner views, clicks, and possible conversions for your business. And this will lower your marketing expenses relating to online marketing. In terms of customer retention, not so sure about this, but obviously if w Continue Reading",2021-03-05T08:43:43.306Z,"How can businesses cut their expenses related to online marketing and customer retention? ",Quora
6041ef64ed76476feda19925,https://www.quora.com/What-is-the-customer-retention-for-cause-marketing-campaigns-verses-traditional-ones?-,"Great question. Check out the latest research report from Cone, The 2010 Cone Cause Evolution Study, which has lots of info on this subject. You also might want to start with this post. http://selfishgiving.com/cause-marketing-news/cone-study-local-nonprofits-now-time-for-cause-marketing The important thing to remember is that while other forms of marketing will often enhance your visibility with consumers, cause marketing increases your favorability. In short, it does something different from traditional marketing to build loyalty with consumers. That said, we can't overstate cause marketing's ca Continue ReadingGreat question. Check out the latest research report from Cone, The 2010 Cone Cause Evolution Study, which has lots of info on this subject. You also might want to start with this post. http://selfishgiving.com/cause-marketing-news/cone-study-local-nonprofits-now-time-for-cause-marketing The important thing to remember is that while other forms of marketing will often enhance your visibility with consumers, cause marketing increases your favorability. In short, it does something different from traditional marketing to build loyalty with consumers. That said, we can't overstate cause marketing's case. It belongs in the marketing mix. But it's just that: a part of the marketing mix and not the only ingredient you need for a successful retention program. Great question. Check out the latest research report from Cone, The 2010 Cone Cause Evolution Study, which has lots of info on this subject. You also might want to start with this post. http://selfishgiving.com/cause-marketing-news/cone-study-local-nonprofits-now-time-for-cause-marketing The important thing to remember is that while other forms of marketing will often enhance your visibility with consumers, cause marketing increases your favorability. In short, it does something different from traditional marketing to build loyalty with consumers. That said, we can't overstate cause marketing's ca Continue Reading",2021-03-05T08:44:20.402Z,"What is the customer retention for cause marketing campaigns verses traditional ones? ",Quora
6041ef7ced76476feda19945,https://www.quora.com/What-are-some-average-customer-retention-rates-for-companies-who-utilize-network-marketing?-,"Denis Mehmedovic, Optimize your Sales & Marketing with @Spire CRM and BI system. www.spire.todayAnswered 4 years ago · Author has 361 answers and 475.9K answer views Denis Mehmedovic When you are asked what is the most important factor that your business needs to achieve success what would be your answer? Our answer would be customer retention. Those people, who consume your products, recommend your brand and services to friends and family are part of a primary structure that contributes directly to the success of any enterprise. If you usually buy something in the same store for two years and every time you make a new purchase but you get a different benefit. This makes you more than happy to continue shopping there. You are made to feel special, whether because of pricing Continue Reading When you are asked what is the most important factor that your business needs to achieve success what would be your answer? Our answer would be customer retention. Those people, who consume your products, recommend your brand and services to friends and family are part of a primary structure that contributes directly to the success of any enterprise. If you usually buy something in the same store for two years and every time you make a new purchase but you get a different benefit. This makes you more than happy to continue shopping there. You are made to feel special, whether because of pricing, or quality , but the key is the offered customer experience. Retailers already know that betting on loyalty is a great way to retain customers, as well as having competitive prices and an efficient strategy that keeps track of customers who are most loyal to your business. The importance of loyalty The loyal customer represents 65% of a company’s turnover. Keeping those who already know your products and have a certain level of relationship with your brand is much cheaper than investing in new consumers. Here are some of the facts: By keeping a satisfied customer loyal your company adds more value to the business, creating brand authority at little extra cost.About 95% of unsatisfied customers will simply stop buying without giving a reason or a complaint. Attracting those customers who buy and do not return can bring more harm than profit in the long term.To win a new customer you will need to invest in marketing – that is something that is expensive. If your loyalty program is not implemented effectively, your business will not be able to retain consumers, who can opt for your competitor.3 Efforts to take into account when attracting new customers 1 More investment will be needed You will need to invest in marketing, training and ads to attract new customers. Within new customers there is no guarantee that any of them will return to your store without you implementing strategies and more investments. 2 There is a possibility of attracting the wrong customers If you do not plan a well-targeted campaign you risk attracting customers who will not add value to your business. Only a small part of the target audience will effectively convert more sales. 3 More effective care will be needed If you have not made a truly structured business plan, your business may not be able to respond to all requests you made. If you do not have a truly effective loyalty program within your company, the chances of the competition taking over your space will be much greater. People seek quality, satisfaction and the best conditions according to their preferences.",2021-03-05T08:44:44.593Z,"What are some average customer retention rates for companies who utilize network marketing? ",Quora
6041efc0ed76476feda199a6,https://www.quora.com/Why-is-email-marketing-preferred-for-customer-retention?-,Khushi Gautam,2021-03-05T08:45:52.392Z,"Why is email marketing preferred for customer retention? ",Quora
6041f14ced76476feda19b9f,https://www.quora.com/What-part-of-the-marketing-funnel-includes-customer-retention?-,"Ok. Let’s cut the crap. No bull shit No Unidentified marketing terms. In one line I can answer your question. The answer is: At every part of the funnel, customer retention is included. But this is not so simple. Let me tell you a story. One fine day, Gautham was walking from his workplace to his house. He suddenly saw a board “Free dental check-up”. Since it was free, Gautham decides to visit the dentist for a free check-up. The dentist invites him with a smile and tells him to relax on a comfortable cosy dental chair in a chilled AC room. It was definitely a feel-good factor. “FREE” comforts. So the check-up was FREE The dental check-up; starts with a brief intro and Gautham already feels like he is at home. The doctor says that Gautham has very strong teeth. Gautham is happy. He then says Mr.Gautham, your teeth have a small cavity. However, it is in the initial stage. You may wish to wait but I do not recommend. Gautham is in his cosy mood, says let's do it. Not a problem. He fixes an appointment next week. Next week he visits the dentist and again a pleasant AC room and a comfy seat. As the filling process starts, the doctor says let us not take a risk of infection, we do a temporary filling. Gautham feels doc is so empathetic, and he agrees. Rs 500 is the bill. Next week, a second appointment was scheduled. Gautham will visit the same doctor because he trusts him as the doctor showed his empathy to Gautham. A permanent filling has been fixed. Rs 1000 is the bill. The doctor says all your teeth are completely healthy and you are good to go now. Then the doctor says, “Do you drink tea regularly”? Gautham says yes. The doctor says this is why your front teeth are brown. Seeds of fear have been generated. Gautham asks what now? I don't want these brown teeth. So the doctor says we are having a special “gentleman smile” offer, where we have a teeth whitening session for all the teeth including molar. Sounds good? Gautham agrees. Rs 2000 is the bill. Gautham is now happy with his white teeth. He thanks the doctor and steps out of his room. His assistant called Gautham and gave him a coupon. The coupon says, 10% discount for family members. From free check-up in the top of the funnel, Gautham pays 500 + 1000 + 2000 rupees. Not only that, as Gautham is now happy with his white teeth, but his wife will also now enter the funnel with the new discount coupon. Moral: Funnel has the potential to retain or throw out the customer at every stage. It can also bring more customers through referral at any stage given that you know how to sell your product/service",2021-03-05T08:52:18.596Z,"What part of the marketing funnel includes customer retention? ",Quora
6041f99eed76476feda1a809,https://www.quora.com/What-are-some-good-customer-retention-schemes-in-the-clothing-market?-,"What are the KPIs of customer retention? How to improve customer retention and perform sales better! Here are the KPIs of customer retention! Customer retention is the process in which a business focuses on repeating their existing customers to increase their profitability. According to a study, 80% of any company’s profits in the future depend on their existing customers. Selling to existing customers is easier than acquiring new customers unless they have a dissatisfying experience. Selling to existing customers not only reduces your cost but also helps in increasing conversion rates.  1) Build trust — Without a doubt, loyal customers Continue ReadingHow to improve customer retention and perform sales better! Here are the KPIs of customer retention! Customer retention is the process in which a business focuses on repeating their existing customers to increase their profitability. According to a study, 80% of any company’s profits in the future depend on their existing customers. Selling to existing customers is easier than acquiring new customers unless they have a dissatisfying experience. Selling to existing customers not only reduces your cost but also helps in increasing conversion rates.  1) Build trust — Without a doubt, loyal customers are the best asset of a business. If you want your customers to keep coming back to you, you have to earn their trust. Build good relations with your customer during your first sale. This will assist you in building trust. 2) Record customer details — Keep a good record of the details of your customer with the help of technology. This record will enable you to retarget your existing customers easily. 3) Offer special deals — When you know who your customers are, you can identify their needs and expectations easily. When you retarget these customers with special offers according to their needs, boom! They purchase again. 4) Reward your best customers — You can reward your best customers with vouchers, gift hampers, etc. to motivate them and other customers to buy even more. These small factors make your customers feel appreciated and they tend to purchase more. 5) Personalized email — You can send your customers engaging emails that are personalized for each individual. You can send thanks-giving email after they finish purchasing your product. Email Marketing is one of the best ways to keep your customer’s attention even after they finish purchasing. 6) Improve customer service — Your customers should be able to connect to you easily. If you want to retain your customers, make sure that they get a proper after-service. This will increase customer satisfaction which in turn will make them purchase more products from you. 7) Follow up — Do not forget to follow up and take your customer’s feedback. By doing this, you will get to know if you have room for improvement. Make your customers feel that customer satisfaction is your utmost priority. Thanks!",2021-03-05T09:27:58.994Z,"What are some good customer retention schemes in the clothing market? ",Quora
6041f9b3ed76476feda1a88a,https://www.quora.com/How-do-I-become-more-market-competitive-by-customer-retention-programs?-,,2021-03-05T09:28:19.360Z,"How do I become more market-competitive by customer retention programs? ",Quora
6041f9dded76476feda1a8e9,https://www.quora.com/What-are-the-best-B2C-Marketing-strategies-to-be-followed?-,"Want the absolute best strategy, and a long held secret of the most successful companies? The strategy that few if any of your competitors are using. This one strategy can quadruple conversion and save you a ton of advertising money. And it works really well in B2C businesses. Instead of guessing what media to use, this is the simple key: Research. And it doesn’t have to thousands of hours spent in deep caves looking for a secret. You can do it yourself or hire someone to help for less than a couple hundred dollars. And the results will blow your mind! Research at least 7 demographics and psycho Continue ReadingWant the absolute best strategy, and a long held secret of the most successful companies? The strategy that few if any of your competitors are using. This one strategy can quadruple conversion and save you a ton of advertising money. And it works really well in B2C businesses. Instead of guessing what media to use, this is the simple key: Research. And it doesn’t have to thousands of hours spent in deep caves looking for a secret. You can do it yourself or hire someone to help for less than a couple hundred dollars. And the results will blow your mind! Research at least 7 demographics and psychographics about your ideal prospect. You may end up having several groups of ideal prospects. Age, sex, marital status, income, own/rent, kids, grandkids, political party- all of the potential combinations for your product or service. Consider each group separately as you move to the next step. Research the compelling message you are crafting for each group. You can’t send them all the same message- it will turn everyone off. You want to target each group so they read your message and say ‘wow, that’s for me!’ And you can’t do that talking to a millennial guy, a professional single woman, and a boomer with the same discussion. Then research which media can deliver your compelling message. Every media is merely a delivery tool. FB might work for some, but not others. Instagram might work, while another group moves to action with snail mail or a postcard. By researching and targeting, you will stop sending 5,000 postcards with no results. Or spending $1000 on Facebook with zero conversions. Finally research which media can deliver your compelling message to your ideal prospect at a reasonable price. This single step will save you more money, get you better conversions, and stop you from wasting money than any other hack. This secret has made me a lot of money. Don’t tell anyone else… Want the absolute best strategy, and a long held secret of the most successful companies? The strategy that few if any of your competitors are using. This one strategy can quadruple conversion and save you a ton of advertising money. And it works really well in B2C businesses. Instead of guessing what media to use, this is the simple key: Research. And it doesn’t have to thousands of hours spent in deep caves looking for a secret. You can do it yourself or hire someone to help for less than a couple hundred dollars. And the results will blow your mind! Research at least 7 demographics and psycho Continue Reading",2021-03-05T09:29:01.001Z,"What are the best B2C Marketing strategies to be followed? ",Quora
6041f9f4ed76476feda1a917,https://www.quora.com/How-can-a-marketer-use-technology-to-improve-customer-retention-and-enhance-their-bond-with-customers?-,"To the best of my knowledge, none. Customer service is best learned through both a ‘sunny’ disposition and on the job experience. You would learn more about actually being involved as a Waiter/waitress in making customers happy and getting them to return, than in a classroom.",2021-03-05T09:29:24.580Z,"How can a marketer use technology to improve customer retention and enhance their bond with customers? ",Quora
6041fa1bed76476feda1a963,https://www.quora.com/How-does-one-develop-a-good-customer-base-and-customer-retention-in-retail-when-online-is-eroding-the-market-by-the-day?-,"Digital marketing is quickly evolving and customer engagement is shifting towards personalization and individual experiences. It’s simply not enough to know what your customers bought last week. It’s time to go forward and get involved with their interests today in order to predict what products or services they might be willing to buy tomorrow. We present you five strategies that can double customer engagement in 2019. Before reviewing your strategy, you need to understand that the digital world is constantly changing. So, it’s normal that your last year’s strategy won’t be as effective now. If you want to drive customer engagement, you need to know how and when to reach your customers. For example, Xenia-homes does an incredible job of engaging their customers from the moment that book with the vacation rental company.  xenia-homes You can start by leaving you multi-channel strategy behind and replacing it with an omnichannel marketing strategy. They might seem the same but they are quite different. Omni-channel Marketing is Critical Many business owners and marketers think that multi-channel marketing is an amazing strategy. After all, it allows you to push a message through different channels as many times as you want in order to reach as many people as possible. But how effective can that be? The omnichannel marketing strategy focuses on the customer’s journey and on delivering coordinated content. It’s all about creating a personalized experience to make sure the customer is engaged and ready to purchase. In fact, we’re currently working with Clementines to build a consistent omnichannel marketing strategy. This Pioneer square based shop sells one of the kind items for women. Our focus is to create personalized experiences for every single customer that makes a purchase.  Clementines However, this process requires different approaches. Every customer has different needs, which demand a customized approach. So, make sure to keep that in mind even if you have the best customer journey strategy in the world! Consistent Messaging Will Get Customers Attention There has never been as much content online as in 2019. You probably feel overwhelmed every time you get online. There are information and advertisement hosted by brands and organizations everywhere. Facebook murals, Youtube videos, even in your favorites games. It is true that certain marketing methods are not as effective as they used to be… But consistent messaging is still a great strategy to get your message out there. By being consistent, you are expressing how serious and dedicated you are about your brand.",2021-03-05T09:30:03.057Z,"How does one develop a good customer base and customer retention in retail when online is eroding the market by the day? ",Quora
6041fa2ded76476feda1a985,https://www.quora.com/Why-is-marketing-for-customer-retention-so-important?-,,2021-03-05T09:30:21.575Z,"Why is marketing for customer retention so important? ",Quora
