"_id",job_link,answer,date,question,source
6041fafced76476feda1ab28,https://www.quora.com/Would-continued-UK-membership-in-the-customs-union-and-the-single-market-mean-the-retention-of-freedom-of-movement?-,"Short story: Yes. It’s an All-or-Nothing proposition. The Single Market and European Customs Union both feature some version of the entitlement enabling people: “to move freely for work reasons from one EU Member State to another without suffering discrimination as regards employment, remuneration or other conditions of work and employment.”[1] This is re-iterated and expanded as one of the “Four Freedoms” of the Single Market, namely: Free Movement of Goods.Free Movement of Capital.Freedom to Establish and Provide Services.Free Movement of Persons.The last Freedom considerably expands the scope and Continue ReadingFootnotes[1] Cross-border workers - Taxation and Customs Union - European CommissionShort story: Yes. It’s an All-or-Nothing proposition. The Single Market and European Customs Union both feature some version of the entitlement enabling people: “to move freely for work reasons from one EU Member State to another without suffering discrimination as regards employment, remuneration or other conditions of work and employment.”[1] This is re-iterated and expanded as one of the “Four Freedoms” of the Single Market, namely: Free Movement of Goods.Free Movement of Capital.Freedom to Establish and Provide Services.Free Movement of Persons.The last Freedom considerably expands the scope and rights set in the Customs Union, which applies largely to Cross-Border Workers, defined as: Cross-border workers are persons who work in one EU Member State but live in another. It should however be stressed that the definition of what a cross-border worker exactly is may vary from one field to another (e.g. tax law, right of residence, welfare entitlements)[2] The last freedom is largely encapsulated in the Citizen’s Rights Directive 2004/38/EC, which is applicable to all EEA Citizens (including countries like Norway, Iceland, et al.) and the Treaty of Rome which sets the rules for the Non-Discrimination and Citizenship of the Union principle. As such, being a member of any of these bodies (the Single Market, Customs Union, EEA) obliges the member to the Free Movement of Persons principle. Its an All or Nothing Proposition… That said, there is nothing preventing 3rd nations from establishing their own Custom’s Union arrangement with the EU. The Custom’s Union between Turkey and the EU is an oft cited example as it does not feature Freedom of Movement. However, this union did require Turkey to adjust tarrifs and Duties to match the EU and is recognized to have a net beneficial effect on Turkey’s GDP. For the UK to opt-out of Freedom of Movement, it would have to establish it’s own Trade Agreement/Custom’s Union with the EU. I imagine that the compromises the UK will have to make to meet this requirement could potentially evaporate any perceived advantages of freedom of Movement, as I am not aware of any special leverage the UK can use. Footnotes[1] Cross-border workers - Taxation and Customs Union - European Commission[2] Cross-border workers - Taxation and Customs Union - European Commission Short story: Yes. It’s an All-or-Nothing proposition. The Single Market and European Customs Union both feature some version of the entitlement enabling people: “to move freely for work reasons from one EU Member State to another without suffering discrimination as regards employment, remuneration or other conditions of work and employment.”[1] This is re-iterated and expanded as one of the “Four Freedoms” of the Single Market, namely: Free Movement of Goods.Free Movement of Capital.Freedom to Establish and Provide Services.Free Movement of Persons.The last Freedom considerably expands the scope and Continue ReadingFootnotes[1] Cross-border workers - Taxation and Customs Union - European Commission",2021-03-05T09:33:48.476Z,"Would continued UK membership in the customs union and the single market mean the retention of freedom of movement? ",Quora
6041fb28ed76476feda1ab7d,https://www.quora.com/Is-it-right-to-switch-from-one-career-plan-to-another?-,"This is my career track: 14:  Music or Sales.  Maybe even pirating.  I don't know.  Whatever selling burnt cds is considered.15: Janitor.16. Juvenile delinquent.17. Recruiting.18. Retail Sales / Recruiting.19. Retail / Automotive Sales / Recruiting.20. Automotive Sales.21. Automotive Sales.22. Failed business owner / Recruiting / Marketing Manager.23. Real Estate Investment Sales / Stock Broker / Investor Relations for Investment Fund.24. VP of Marketing & Operations Manager for Lead Generation Firm.25. Raise money for Politics / Recruiting / Entertainment Management.26. VP of Ma Continue ReadingThis is my career track: 14:  Music or Sales.  Maybe even pirating.  I don't know.  Whatever selling burnt cds is considered.15: Janitor.16. Juvenile delinquent.17. Recruiting.18. Retail Sales / Recruiting.19. Retail / Automotive Sales / Recruiting.20. Automotive Sales.21. Automotive Sales.22. Failed business owner / Recruiting / Marketing Manager.23. Real Estate Investment Sales / Stock Broker / Investor Relations for Investment Fund.24. VP of Marketing & Operations Manager for Lead Generation Firm.25. Raise money for Politics / Recruiting / Entertainment Management.26. VP of Marketing & Front end UI testing (No clue why I was doing this) for Discount Membership / Customer Retention.  Failed at starting a Nightlife company and recovering a Bar.27. Customer Retention.  28. Customer Retention.  Failed at making a Clothing Line while acting as COO.29. Customer Retention / Strategy and Marketing Consultant / Author of The Etiquette of Social Media: How to Connect and Respond to Others in the World of Social Media. So, to answer your question...  Is it right?   Well, considering how many changes I made in my life to get to where I am today, I certainly hope it wasn't wrong.  I don't think I'd be quite happy selling burnt CD's, working as a janitor, recruiting, working in sales, working in real estate or for an investment fund, lead generation firm, entertainment company, in politics, at a discount membership, a nightlife company or even a bar.  I'd probably be happy with a clothing line, but that's another story.   With where I am today, I think I'm quite content with the changes I made in my life.  Sometimes, we're unhappy with the hand we are dealt and have to make a decision whether to stick with the plans at hand or change them.  Other times, fate, or the universe, or a global financial crisis ends up changing our paths for us.  At the end of the day, what matters most is that you are able to continue seeking out the courage and strength to find something you find passion in. (Probably had more careers.  Can't think of them at the moment.  Definitely had many more job duties than what is listed.) This is my career track: 14:  Music or Sales.  Maybe even pirating.  I don't know.  Whatever selling burnt cds is considered.15: Janitor.16. Juvenile delinquent.17. Recruiting.18. Retail Sales / Recruiting.19. Retail / Automotive Sales / Recruiting.20. Automotive Sales.21. Automotive Sales.22. Failed business owner / Recruiting / Marketing Manager.23. Real Estate Investment Sales / Stock Broker / Investor Relations for Investment Fund.24. VP of Marketing & Operations Manager for Lead Generation Firm.25. Raise money for Politics / Recruiting / Entertainment Management.26. VP of Ma Continue Reading",2021-03-05T09:34:32.043Z,"Is it right to switch from one career plan to another? ",Quora
6041fb42ed76476feda1abb3,https://www.quora.com/Why-do-utility-companies-offer-energy-efficiency-rebates?-,"Will Gaherty, flying trapeze foolAnswered 6 years ago · Author has 201 answers and 365.1K answer views Will Gaherty While other reasons are not irrelevant, there is actually a business reason that drives it: The marginal cost of ""generating"" power by conservation is lower than the loaded cost of building deliverable capacity.   In a typical power utility, building meaningful capacity in the form of a power plant and related infrastructure is both expensive and slow.  Paying someone to conserve (and so make that power available to other users) is moderately expensive, but fast.  And perhaps surprisingly, but likely because conservation is in their personal interests anyway, subsidizing conservation is often c Continue ReadingWhile other reasons are not irrelevant, there is actually a business reason that drives it: The marginal cost of ""generating"" power by conservation is lower than the loaded cost of building deliverable capacity.   In a typical power utility, building meaningful capacity in the form of a power plant and related infrastructure is both expensive and slow.  Paying someone to conserve (and so make that power available to other users) is moderately expensive, but fast.  And perhaps surprisingly, but likely because conservation is in their personal interests anyway, subsidizing conservation is often cheaper than alternatives like building new capacity or relying on purchases on the open market.",2021-03-05T09:34:58.678Z,"Why do utility companies offer energy efficiency rebates? ",Quora
6041fb94ed76476feda1ac58,https://www.quora.com/What-are-examples-of-extremely-profitable-yet-little-known-businesses?-,"So, just let's start with one of the most underrated businesses which can really fetch a huge profit.  Before starting let me make it very clear that the price of various ingredients may vary according to availability but they are reasonable and accurate according to my knowledge. (Basically, there won’t be many variations) Let's look at the price at which packed roasted channa is being currently sold in the market 250 rs per kg. From basic math, we can make it that a kg of chana would cost around 250 rs per kg in retail prices. Price in wholesale would obviously be different but believe me, it wo Continue ReadingSo, just let's start with one of the most underrated businesses which can really fetch a huge profit.  Before starting let me make it very clear that the price of various ingredients may vary according to availability but they are reasonable and accurate according to my knowledge. (Basically, there won’t be many variations) Let's look at the price at which packed roasted channa is being currently sold in the market 250 rs per kg. From basic math, we can make it that a kg of chana would cost around 250 rs per kg in retail prices. Price in wholesale would obviously be different but believe me, it won’t be less than rs 160–180 per kg.) Let us look at manufacturing cost:- The price of high-quality roasted channa per kg is approximately 75rs per kg.- here roasted channa means plain channa which we eat and this could be much cheaper if we buy in huge bulk quantities. Then afterward we can improvise it.  Cost of ingredients would be around a maximum of 20 rs. per kg- Mainly ingredients include Salt, Edible oil, Sugar, Onion powder, Preservatives, Garlic powder, etc other things according to your taste. Now I am not going to explain each and every ingredient according to the specified gram required and the cost I have estimated is roughly accurate and variation of 5 rs can come. Value-added services would cost you around 10–15 rs. per kg - Services such as labour cost, electricity, packaging, and storage come under these type of services and there might be some other cost which hardly matters. If I calculate the total cost of the above product assuming that the best quality ingredient and other all conditions are taken into account then it will cost 115rs/kg maximum. Calculating tax on the above item which is 5%(Reduced GST rate on Roasted Gram) so after paying tax also it will cost you around 121 rs per kg. So, it is being sold in the market for around 250 rs per kg and its manufacturing cost is just 121 rs kg, hence a profit of around 100%. Now, imagine if you could manufacture this channa on a very large scale this would certainly lower your manufacturing cost by 10–20% again a profitable situation. But here comes the challenge it is a little easy to acquire raw products and manufacture this but when it comes to marketing and selling its bit a lengthy process because the market of this product is too much fragmented and lot of work needs to be done in building a brand besides this you also can’t directly sell it to retailers you have to find wholesale dealers which is again a headache. So, we can conclude that an easily 50–60% return on investment can be made but one needs to work a lot to make his space in this market and sell his product. Thanks for Scrolling JAI HIND P.S.: Don’t forget to upvote the answer and follow me, it acts as a source of encouragement for further reading and writing answers on Quora. So, just let's start with one of the most underrated businesses which can really fetch a huge profit.  Before starting let me make it very clear that the price of various ingredients may vary according to availability but they are reasonable and accurate according to my knowledge. (Basically, there won’t be many variations) Let's look at the price at which packed roasted channa is being currently sold in the market 250 rs per kg. From basic math, we can make it that a kg of chana would cost around 250 rs per kg in retail prices. Price in wholesale would obviously be different but believe me, it wo Continue Reading",2021-03-05T09:36:20.056Z,"What are examples of extremely profitable yet little known businesses? ",Quora
6041fba5ed76476feda1ac7d,https://www.quora.com/What-can-you-say-about-the-info-that-PWA-has-a-higher-retention-rate-of-customers-with-fewer-investments-in-the-marketing?-,"Arup Mukherjee, SaaS Chatbot (AI based)Answered October 1, 2020 Arup Mukherjee Hi, The world of technology is adding newness to the outcome for customer benefits from business POV. Talking about PWA for Customer Retention, you need to first understand what is PWA and what it offers in the technology frame. There are many sites that struggled with conversions even though they had a fully functional native app. It was later realized that the applications were highly demanding on internet connectivity and the heavy database they occupied. There is a reasonable chance that your native application may be hurting your brand image because of its development. Progressive Web Apps ar Continue ReadingHi, The world of technology is adding newness to the outcome for customer benefits from business POV. Talking about PWA for Customer Retention, you need to first understand what is PWA and what it offers in the technology frame. There are many sites that struggled with conversions even though they had a fully functional native app. It was later realized that the applications were highly demanding on internet connectivity and the heavy database they occupied. There is a reasonable chance that your native application may be hurting your brand image because of its development. Progressive Web Apps are profoundly responsive web applications intended for r mobile platforms and can prove to be a great alternative to the ever-expanding number of native applications. PWA takes into account pop-up messages and sync with your own subtleties to deliver quality administrations, much like any iOS or Android application. PWA is deeply engaging with the one-click structure of a native mobile application with easily being accessed as a website too. Complement visibility: In real native app is secondary when the customers search for you on their browsers. This aberration is overcome by PWA, as it offers the same app functions as searchable web pages. How it retains customers? Fast and reliable UX experience.Push notifications enabled.Offline accessibility.A smoother UI interface.The points result in: Increase in customer retention rate by 2X.The conversion rate increased up to 70% times as it loads easily and with smooth navigation.Web pages visited per session, per user, doubled across all browsers.Per session, time increased by 74%, again across all browsers (resource)Less down Marketing Cost: While your brand/website is enhanced with PWA technology, it redefines a better version that will build loyalty to drive repeat business in less spending. PWA is certifiably not a swap for native applications, in any case, it presents a financially savvy answer for utilizing certain functionalities.",2021-03-05T09:36:37.664Z,"What can you say about the info that PWA has a higher retention rate of customers with fewer investments in the marketing? ",Quora
