"_id",job_link,answer,date,question,source
604202d6ed76476feda1ba58,https://www.quora.com/What-is-the-future-scope-of-data-science-with-Python-in-India?-,"The future is bright. Data science have been around for a long time. It just wasn't explicitly called that. Fields such as statistical data analysis, data warehousing and high performance computing have been in existence for a long time. Connecting insights, analytics and infrastructure. Where we now need three people: One looking through the numbers in Excel.One trying out different models in R or Python.One putting a pipeline into production to stream the results in real or near-real time.We will need only one, who could do the above end-to-end. Now talking about Python with data science. Most of Continue ReadingThe future is bright. Data science have been around for a long time. It just wasn't explicitly called that. Fields such as statistical data analysis, data warehousing and high performance computing have been in existence for a long time. Connecting insights, analytics and infrastructure. Where we now need three people: One looking through the numbers in Excel.One trying out different models in R or Python.One putting a pipeline into production to stream the results in real or near-real time.We will need only one, who could do the above end-to-end. Now talking about Python with data science. Most of the Data analyst, Machine Learning and NLP companies in india using Python because of the following reasons: Python is easy to learn: Python's main advantage is that anyone can learn it quickly and easily. The language was designed to be simple and ""sugar-lite"".Visualization / Graphics: Python is not as good as R (yet), but we’ll see more and more cool APIs (e.g., Plotly) and Data Visualization libraries that make the partial advantage of R insignificant compared to Python. You can do really cool stuff with Python.NumPy and pandas (Python Data Analysis Library) allow you to read/manipulate data efficiently and easily.Matplotlib allows you to create useful and powerful data visualizations. I have also listed more data visualization packages in Python: Yilun (Tom) Zhang (張 逸倫)'s answer to What's some good python data visualization website?Scikit-learn allows you to train and apply machine learning algorithms to your data and make predictions.PyBrain (PyBrain) and Tensorflow (https://www.tensorflow.org/versi...) for some neural network.Cython allows you to convert your code and run them in C environment to largely reduce the runtime and improve your model performance.PyMySQL allows you to easily connect to MySQL database, execute queries and extract data.BeautifulSoup to easily read in XML and HTML type data which is quite common nowadays.iPython notebook for interactive programming as in R.Large community = Documentation = Brainpower: with Python, you can find a large (and still growing!) active community. At the end of the day, if you get lost you can rely on a this large community of experts to help you find a proper solution for coding problems (even niche ones) and answers to questions related to Data Science.I hope that helps. All the best and feel free to drop me a message if you have any specific questions. Keep Learning. The future is bright. Data science have been around for a long time. It just wasn't explicitly called that. Fields such as statistical data analysis, data warehousing and high performance computing have been in existence for a long time. Connecting insights, analytics and infrastructure. Where we now need three people: One looking through the numbers in Excel.One trying out different models in R or Python.One putting a pipeline into production to stream the results in real or near-real time.We will need only one, who could do the above end-to-end. Now talking about Python with data science. Most of Continue Reading",2021-03-05T10:07:18.367Z,"What is the future scope of data science with Python in India? ",Quora
60420320ed76476feda1bae1,https://www.quora.com/What-are-the-major-differences-between-Python-and-R-for-data-science?-,"Sumit Rana, MBA Statistics & Big Data, Stanford University (2000)Answered 1 year ago · Author has 1.1K answers and 608K answer views Sumit Rana R vs Python is one of the most common but important question asked by lots of data science students. Today I am going to tell of the major difference between R and Python. We know that R and Python both are open source programming languages. Both of these languages are having a large community. Both of these languages are having continuous development. That’s is the reason these languages add new libraries and tools in their catalog. The major purpose of using R is for statistical analysis, on the other hand Python provide the more general approach to data science. Both of the languages are state Continue ReadingR vs Python is one of the most common but important question asked by lots of data science students. Today I am going to tell of the major difference between R and Python. We know that R and Python both are open source programming languages. Both of these languages are having a large community. Both of these languages are having continuous development. That’s is the reason these languages add new libraries and tools in their catalog. The major purpose of using R is for statistical analysis, on the other hand Python provide the more general approach to data science. Both of the languages are state of the art programming language for data science. Python is one of the simplest programming languages in terms of its syntax. That’s why any beginner in a programming language can learn R without putting extra efforts. On the other hand, R is built by statisticians that are a little bit hard to learn. There are some reasons that will help us to find out why we should not use both R and Python. R R is one of the oldest programming language developed by academics and statisticians. R comes into existence in the year 1995. Now R is providing the richest ecosystem for data analysis. The R programming language is full of libraries. There are a couple of repositories also available with R. In fact, CRAN is having around 12000 packages. The rich variety of library makes it the first choice for statistical analysis and analytical work. Key features of R Consists of packages for almost any statistical application one can think of. CRAN currently hosts more than 10k packages.Comes equipped with excellent visualization libraries like ggplot2.Capable of standalone analysesPython On the other hand Python can do the same tasks as R programming language does. The major features of python are data wrangling, engineering, web scraping and so on. Python is also having the tools that help in implementing the machine learning at large scale. Python is one of the simplest languages to maintain and it is more robust than R. Now a day Python is having the cutting edge API. This API is quite helpful in machine learning and AI. Most of the data scientist uses only five Python libraries i.e Numpy, Pandas, Scipy, Scikit-learn and Seaborn. It is quite handy to use Python over R. Key features of Python programming language:- Object-oriented languageGeneral PurposeHas a lot of extensions and incredible community supportSimple and easy to understand and learnpackages like pandas, numpy and scikit-learn, make Python an excellent choice for machine learning activities.R or Python Usage Python has developed by Guido van Rossum in 1991. Python is the most popular programming language in the world. It has most powerful libraries for math, statistic, artificial intelligence and machine learning. But still python is not useful for econometrics and communication, and also for business analytics. On the other hand, R is developed by academics and scientist. It is specially designed for machine learning and data science. R is having the most powerful communication libraries that are quite helpful in data science. In addition, R is equipped with many packages that are used to perform the data mining and time series analysis. Why not use Both? Lots of people think that they can use both the programming languages at the same time. But we should prevent to use them at the same time. Majority of people are using only one of these programming languages. But they always want to have access to the capability of the language adversary. For example, if you use both the language at the same time that may face some of the problems. If you use R and you want to perform some object-oriented function than you can’t use it on R. On the other hand, Python is not suitable for statistical distributions. So that they should not use both the language at the same time, because there is a mismatch of their functions. But there are some ways that will help you to use both of these languages with one another. We will talk about them in our next blog. Let’s have a look at the comparison between R vs Python. R is more functional, Python is more object-oriented. R is more functional, it provides variety of functions to the data scientist i.e Im, predict and so on. Most of the work done by functions in R. On the other hand Python use classes to perform any task within the python. R has more data analysis built-in, Python relies on packages. R provides the build in data analysis for summary statistics, it is supported by summary built-in functions in R. But on the other hand we have to import the statsmodel packages in Python to use this function. In addition there is also a built in constructor in R i.e is dataframe. On the other hand we have to import it in Python. Python also helps to do linear regression, random forests with its scikit learn package. As mentioned above it also offers API for machine learning and AI. On the other hand R is having the greatest diversity of packages. R has more statistical support in general. R was created as a statistical language, and it shows . statsmodels in Python and other packages provide decent coverage for statistical methods, but the R ecosystem is far more large. It’s usually more straightforward to do non-statistical tasks in Python. With well-placed libraries like beautifulsoup and request, web scraping in Python is much easier than R. This applies to other tasks that we don’t see closely, such as saving the database, deploying the Web server, or running a complex selfie. There are many parallels between the data analysis workflow in both. R and Python are the clearest points of inspiration between the two (pandas were inspired by the Dataframe R Dataframe, the rvest package was inspired by the Sundersaute), and the two ecosystems are getting stronger. It may be noted that the syntax and approach for many common tasks in both languages are the same. Lets Sum Up R vs Python Now you have got a detailed comparison on R vs Python. Both of these languages are having their own strength and weakness. You can use either one for data analysis and data science. Both of these languages are having a similarity in terms of their syntax and approach. You can pick any one of them, no one will let you down. Now you may come to know the basic strengths of these languages over each other. Now you may be more confident to choose the best one as per your needs. If you are the students of R programming language then you can get the best R programming assignment help or R programming homework help from our experts.",2021-03-05T10:08:32.986Z,"What are the major differences between Python and R for data science? ",Quora
60420355ed76476feda1bb42,https://www.quora.com/What-are-the-best-data-visualization-conferences?-,"Here is a list of some of the best data visualization conference scheduled for 2014. Attending these events can be a good way to connect with experts, learn and share around data visualization. The Lift ConferenceFeb. 5-7, 2014 – CICG, Geneva, Switzerlandwebsite : Lift Conference 2014Lift Conference is one of Europe’s key events about innovation and digital technologies. It features a special blend of inspiring speeches by some of the world’s best speakers, truly interactive workshops, exhibitions of interactive media projects and prototypes to play with …and the legendary Fondue! Visualized Continue ReadingHere is a list of some of the best data visualization conference scheduled for 2014. Attending these events can be a good way to connect with experts, learn and share around data visualization. The Lift ConferenceFeb. 5-7, 2014 – CICG, Geneva, Switzerlandwebsite : Lift Conference 2014Lift Conference is one of Europe’s key events about innovation and digital technologies. It features a special blend of inspiring speeches by some of the world’s best speakers, truly interactive workshops, exhibitions of interactive media projects and prototypes to play with …and the legendary Fondue! VisualizedFeb. 6-7, 2014 – New York, USAwebsite : New Home Test - VisualizedVisualized is an inspiring two-day gathering of the brightest minds and social innovators from around the world who are changing how we understand and interact with data. Expect to learn from powerful data-driven narratives. Expect to gain new ideas for designing data experiences. Expect to laugh at intelligent deviance. Perhaps more than anything else, expect a progressive, smart, and unique event that feels more like a community than just a conference. Strata ConferenceFeb. 11-13, 2014 – Santa Clara, CA, USA ; Oct. 15-17, 2014 – NYC, NY, USA ; Nov. 19-21, 2014 – Barcelona, Spainwebsite : O'Reilly Strata ConferenceStrata is more than a conference. It’s the essential training and information source for data science and big data—with industry news, reports, in-person and online events, and much more. Data Visualization SummitApril 9-10, 2014 – Santa Clara, CA, USAwebsite : Data Visualization SummitThe Data Visualization Summitis the perfect opportunity to share insights and best practices with leaders and experts from across the industry in an interactive environment. OPENVIS ConferenceApril 24-25, 2014 – Boston, MA, USAwebsite : Bocoup OpenVis ConfA two-day single track conference about the practice of visualizing data on the web. CHI 2014April 26 – May 1st 2014 – Toronto, Canadawebsite : http://chi2014.acm.org/The ACM CHI Conference on Human Factors in Computing Systems is the premier international conference of Human-Computer Interaction.CHI 2014 is a celebration of the conference’s one of a kind diversity; from the broad range of backgrounds of its attendees, to the diverse spectrum of communities and fields which the conference and its research have an impact on. CHI 2014 will take place at the Metro Toronto Convention Centre in Toronto, Canada, a city itself known for its one of a kind cultural diversity. EuroVis 2014June 9-13, 2014 – Swansea, Wales, UKwebsite : Eurovis 2014 | The Eurographics Conference on Visualization | HomeEuroVis 2014, hosted by Swansea University in the UK, is the 16th annual visualization gathering organized by the Eurographics Working Group on Data Visualization and supported by the IEEE Visualization and Graphics Technical Committee (IEEE VGTC). EuroVis has been a Eurographics and IEEE co-supported international visualization symposium held in Europe annually since 1999. Since 2012 EuroVis is a conference. Eyeo FestivalJune 10-13, 2014 – Minneapolis, USAwebsite : Eyeo Festival | Converge to InspireEyeo assembles an incredible set of creative coders, data designers and artists, and attendees — expect enthralling talks, unique workshops and interactions with open source instigators and super fascinating practitioners. Join us for an extraordinary festival. SIGGRAPHAug. 10-14, 2014 – Vancouver, Canadawebsite : Home | SIGGRAPH 2014The SIGGRAPH conference and exhibition is a five-day interdisciplinary educational experience including a three-day commercial exhibition that attracts hundreds of exhibitors from around the world. SIGGRAPH is widely recognized as the most prestigious forum for the publication of computer graphics research. In addition to SIGGRAPH’s leading-edge technical program, the conference’s installations provide close-up views of the latest in digital art, emerging technologies, and hands-on opportunities for creative collaboration. Data Visualization SummitSept. 25-26, 2014 – Boston, USAwebsite : Page on theinnovationenterprise.comThe Data Visualization Summitis the perfect opportunity to share insights and best practices with leaders and experts from across the industry in an interactive environment. IEEE VIS 2014Nov. 9-14, 2014 – Paris, Francewebsite : IEEE VIS 2014IEEE VIS 2014 is the premier forum for advances in visualization. The event-packed week brings together researchers and practitioners from academia, government, and industry to explore their shared interests in tools, techniques, and technology. Conferences not yet announcedSee Conferencewebsite : see conference - the conference on visualization of informationpush.conferencewebsite : http://push-conference.com/ Here is a list of some of the best data visualization conference scheduled for 2014. Attending these events can be a good way to connect with experts, learn and share around data visualization. The Lift ConferenceFeb. 5-7, 2014 – CICG, Geneva, Switzerlandwebsite : Lift Conference 2014Lift Conference is one of Europe’s key events about innovation and digital technologies. It features a special blend of inspiring speeches by some of the world’s best speakers, truly interactive workshops, exhibitions of interactive media projects and prototypes to play with …and the legendary Fondue! Visualized Continue Reading",2021-03-05T10:09:25.668Z,"What are the best data visualization conferences? ",Quora
60420374ed76476feda1bb7b,"https://www.quora.com/What-are-20-questions-to-detect-fake-data-scientists?-The-answers-should-contain-math-formulas-or-a-few-lines-of-code,-not-just-vague-generalizations.-","Besides some questions on statistics / ML, give them raw data and a question to work on. The data does not need to be large, the problem not complex. But you need the following 3 things: The data needs to be dirty in some places, some examples:birth dates in the futureemail addresses that include donnotcontactme@please.com and similarmissing values, naturallymaybe some duplicate ID's?The problem needs to have a clear business context. Do not let them predict titanic survivors, rather have them predict churn for a ficticious airliner or so.Ask that they present their findings to you as if you weContinue ReadingBesides some questions on statistics / ML, give them raw data and a question to work on. The data does not need to be large, the problem not complex. But you need the following 3 things: The data needs to be dirty in some places, some examples:birth dates in the futureemail addresses that include donnotcontactme@please.com and similarmissing values, naturallymaybe some duplicate ID's?The problem needs to have a clear business context. Do not let them predict titanic survivors, rather have them predict churn for a ficticious airliner or so.Ask that they present their findings to you as if you were a non-technical person from the business side.Be clear that this is raw data, be clear what the business problem is and give them decent time to work on it. Those who have been knee-deep into the dirty-reality of real-life data will: Look for exceptions and weird stuff up-front.They'll notice if the results do not make real-world sense.If they get odd results (cfr above point), they'll circle back and look for the weird stuff in the data and/or double check.Will try to keep business relevance in mind or at least not present you with an AUC, p-value... as a result. (cfr requirement 3)Based on previous experiences with other people, the above is what distinguishes somebody who did some online tutorials/courses* from those who have been knee-deep in the dirty reality before. It might be hard though to fit a case like that into an interview. But on the other hand, it does not need to be big and complex to work imho. And it does not fit the question requirement of containing some maths/lines of code. But you won't weed out the above category with that alone. *Nothing wrong with only courses & tutorials. But i find it a bit of a leap to proclaim oneself data scientist (or similar title) after a couple of those. Besides some questions on statistics / ML, give them raw data and a question to work on. The data does not need to be large, the problem not complex. But you need the following 3 things: The data needs to be dirty in some places, some examples:birth dates in the futureemail addresses that include donnotcontactme@please.com and similarmissing values, naturallymaybe some duplicate ID's?The problem needs to have a clear business context. Do not let them predict titanic survivors, rather have them predict churn for a ficticious airliner or so.Ask that they present their findings to you as if you weContinue Reading",2021-03-05T10:09:56.834Z,"What are 20 questions to detect fake data scientists? The answers should contain math formulas or a few lines of code, not just vague generalizations. ",Quora
