"_id",job_link,answer,date,question,source
6042039aed76476feda1bbc0,"https://www.quora.com/What-should-I-learn-in-data-science-in-100-hours?-I-am-free-for-the-next-10-days-and-would-like-to-learn-whatever-I-can-in-the-next-10-days,-and-I-can-put-in-10-hours-a-day.-What-can-I-learn-to-get-a-hang-of-it-and-get-started?-","Kao Zi Chong Man, I envy you. What an opportunity you have ahead. If you have 100 hours spread over 10 days, you want this experience to be as diverse as possible. And it's a huge investment, so you might as well get pretty serious about it and aim at the results like an internship depending on the outcome. Honestly, I don't see the point of MOOCs for this, even though they give you sense of accomplishment. If you have decent knowledge of basic math and programming, it will be much more fun diving into the code and aiming at getting real results. And 100 hours, damn, if you honestly, dutifully put in 100 hou Continue ReadingMan, I envy you. What an opportunity you have ahead. If you have 100 hours spread over 10 days, you want this experience to be as diverse as possible. And it's a huge investment, so you might as well get pretty serious about it and aim at the results like an internship depending on the outcome. Honestly, I don't see the point of MOOCs for this, even though they give you sense of accomplishment. If you have decent knowledge of basic math and programming, it will be much more fun diving into the code and aiming at getting real results. And 100 hours, damn, if you honestly, dutifully put in 100 hours in the next 10 days, that will cover 1% of becoming a world expert in the field. That's a lot in a very short time. Get ready. There will be plenty of time to learn all the internals of your libraries and algorithms, but you don't need them right now. I am going to give you an enormous task that will require all your focus and ideally you will get a very broad exposure to the main tools. Days One and Two Download StackExchange data: Stack Exchange Data Dump : Stack Exchange, Inc. : Free Download & Streaming : Internet Archive You will need an RDBMS to handle the data, so the first day would look like this: Install and configure MySQL. Import the dump into the databaseRead SQL basics. Spend some time doing simple exercises to get the hang of manipulating the data. Write a script that pulls, for example, set of questions about Python and SQL that have >3 answers and the best answer is written by someone who has >= 10 chose answers in either of those two topics. Observe performance issues.Read about indexes in SQL. Hashing, sorting etc. Speed up the query from the bullet 2 so that it run instantaneously.Write a class in Python that handles the queries for you. This will require you to learn about Python MySQL driver. As a result you need a tool that pulls required data from your database and presents it in a convenient format.I don't know about your background, but I think it's totally doable even for a beginner, all you need is some general experience with Python. For the second day, you will need to get familiar with reading data using pandas and manipulating numerical data with numpy. The documentation is quite voluminous, you don't need to read all of it, just be comfortable with importing CSV files, extracting and adding columns, merging two datasets and that's it. Day Three While on the actual job you will often run queries on the whole database, it's important to get the gist of how to work with small data and still get meaningful results. Play aroung with pulling random subsamples and compare the distributions of, say, scores, with the ground truth - the distribution of all scores. Let's move further. You have a whole SE database in front of you, but I'll stick to StackOverflow since it contains a lot of data I'm familiar with. One exercise off the top of my head - build a timeline of languages' popularity. Why is it so cool? How do you extract the questions about the languages and omit the ones related only to technology? (e. g. asking about Python syntax and not about how to mate Django with MongoDB)Lots of tags there, you need to visualize the results, so filter your sources wiselyYou get to learn at least one visualization frameworkLots of cool picsOf course, once you did that example, there are many more interesting properties of your data that you should explore. Asking the right questions is a key ability. Days Four and Five Data Scientist was named ""The sexiest job of 21st century"". You know what else is sexy? Graph theory. How are the tags connected? Is it possible to build a technology map using just SO answers? What metrics would you choose to calculate the proximity of two tags? How would you visualize the graph? Have you tried Gephi? Once you are done, the graph needs to be described. Thing is, the picture of a graph has poor value in terms of comprehensibility - you need to stare and stare at it before you know for sure what's going on. So, you will need to learn about clustering algorithms (at least k-means and DBSCAN), K nearest neighbors. If you go full von Neumann on this task, some graph metrics and algorithms won't hurt. I suggest you try networkx and some parts of scikit-learn for this, they make everything much easier. Why is it so cool? You learn about different formats of data. CSV, Gephi, list of edges, ets.K-means is very useful algorithm that will serve you well in the futureDiscovering the meaningful groups is one of the most important tasks when you explore the dataDistribute the workload as you prefer, I'd spend the first day tinkering with networkx and Gephi just because graphs, you know. The second day I'd give to clustering, because there are going to be some non-trivial things like ""how the hell do I get vector representations for each tag that would preserve the distances between them?!"" Day Six OK, now you have general understanding of what's going on in your database. But you haven't touched the texts yet - word counts don't count (terrible pun unintended). So, today you need to read briefly about text analysis. For this step good ol' Latent Semantic Indexing would be enough, everything you need you will find in scikit-learn, also you will need to work with SQL. General pipeline you want to see: Select the data you will work withBuild text features with special extractors in scikit (TF-IDF Vectorizer is the best)Assign the labels for the text. Let's say for example that you want to predict how many point will the answer get based only on the text. So, you take a score as a label and the feature vector is TF-IDFIt would be better to prepare several datasets in the numpy format, one for every hypothesis. I will give you a couple just to get you started: Predict the score of the answer.Classify the main topic of the answer (choose, say, 20 languages and sample answers about them).Be sure that your datasets are clean and you know what's inside. This description might seem easy, it's not. Day Seven, Eight, Nine Okay, so you have clean datasets from the previous day. I will assume that you have one dataset for classification and one for prediction (you should know the difference by the fifth day). On the fifth day you need to focus on regression models. Granted, scikit gives you a wide range of tools. You definitely want to try at least there methods: Linear model. There are tons of them, first compare how they perform, then read a bit about the best ones to know the difference better. Hint: take a good look at ElasticNet regression. If you are mathematically savvy, read a couple of chapters from Bishop's ""Pattern Recognition and Machine Learning"", he gives a good explanation why it works. Skip this if you don't have enough timeRegression treesKNN regression. They usually perform quite well, never underestimate these methods.Ensemble models. Random Forests and AdaBoost.The whole idea is not to become an algorithm expert instantly, but to get it to work first, ask questions later. The same stands for classification task. Take your time to read and think about metrics of quality. Imagine that you are building a smart content platform that sorts the news - how would you evaluate the performance in that case? It's absolutely necessary to perform cross-validations for all of your models. Read about k-fold CV, find out how to do it with scikit and cross-validate the hell out of your models. Day Ten Since you are on your way to become a data scientist, this adventure wouldn't be complete without the most interesting part of your work. You will need to present it. The format is only your choice (you will rarely have this luxury again in the future). A semi-academic paper, presentation, blog post, app - whatever you like. Tell your story. Describe your findings in the dataset, tell about your hypotheses, give a couple of suggestions why they may be true of false, describe the algorithms, present the results of cross-validations in a clear format and, in the name of Sir Ronald Fisher, show more pics. As for this part, there's no way to overdo it. And I guarantee you, if you do make great presentation and show it to the right people, your entry-level offer will follow very soon.",2021-03-05T10:10:34.234Z,"What should I learn in data science in 100 hours? I am free for the next 10 days and would like to learn whatever I can in the next 10 days, and I can put in 10 hours a day. What can I learn to get a hang of it and get started? ",Quora
604203ceed76476feda1bc2a,https://www.quora.com/What-should-everyone-know-about-making-good-charts-and-graphs-to-represent-data?-,"Heiko Tröster There are a lot of things to consider before making a chart or a graph. 1- Define which kind of charts you want to make: Informational Vs. Analytical, Recommendation/Justification, etc. 2- Know and target your audience. Knowing who you will show the charts to will help determine what data you present, the recommendations you make and how you present the data. . If your audience is C-suite level or the board, you may want to present mostly high-level data with specific call outs and action items. Determining this will keep you focus on your message, and impactful. 3- Then comes the visual part: ch Continue ReadingThere are a lot of things to consider before making a chart or a graph. 1- Define which kind of charts you want to make: Informational Vs. Analytical, Recommendation/Justification, etc. 2- Know and target your audience. Knowing who you will show the charts to will help determine what data you present, the recommendations you make and how you present the data. . If your audience is C-suite level or the board, you may want to present mostly high-level data with specific call outs and action items. Determining this will keep you focus on your message, and impactful. 3- Then comes the visual part: choose the right type of chart that will go the best to the data you have and let you tell the right story. Not every graph can convey the same message. Here you have a complete list of the many charts that exist, when and how to use them: How To Choose The Right Data Visualization Types It is pretty enlightening and very helpful when it comes to creating your own charts! I will provide shortly some examples here, but I encourage you to read the complete article above. 1) Gauge Charts  When to Use Gauge Charts Gauge charts are also known as dial charts or speedometer charts. These charts use needles and colors to show data similar to a reading on a dial/speedometer. These charts provide an easily digested visual. They are great for displaying a single value/measure within a quantitative context such as to the previous period or to a target value. What to Avoid Gauge charts are great for KPIs and single data points. After that they can get a bit messy. With only one data point you can’t easily compare different variables. You also can’t trend data using gauge charts. All of this makes taking actionable insight from a gauge chart difficult. Also, they take up a lot of space. You probably will get more bang for your buck using one chart to summarize multiple KPIs. 2) Pie Charts  When to Use Pie Charts Aaah, the infamous pie chart! That has had a bad couple of years.. In fact it has become pretty cliché to talk about how bad pie charts are. We understand the pie chart doesn’t do a lot. But it does do some things quite well. In general, pie charts are useful for when demonstrating the proportional composition of a particular variable, over a static timeframe. Your audience isn’t always going to be data scientists. Accordingly, your data presentation should be tailored to your particular audience. Which brings us to another pie chart strength: people are familiar with pie charts. Any audience member will feel comfortable interpreting what the pie chart is presenting. As a bonus, circles generate more positive emotions: our brains like to look at circles over sharp corners. In the end, a pie chart simplifies the data story and encourages the audience. What to Avoid Pie charts are also not the best data visualization type to make precise comparisons. This is especially true when there are multiple small pieces to the pie. If you need to see that one slice is 1% larger than another, it is better to go with a bar chart. Another thing about multiple pieces to your pie, you don’t want too many. Pie charts are most effective when just displaying two portions. They lose presentation value after 6 segments. After six it is hard for eyes to decipher what the slices proportion. It also become difficult to label the pie chart and valuable dashboard/reporting real estate is often wasted in the process. Which brings us to the last issue: circles take up space. If you are using multiple pie charts in a dashboard it is probably best to more effectively combine the data in one chart. We recommend checking out the stacked bar chart for these cases! You can also have a look at the different pie charts that are commonly used. 3) Maps  When to Use Maps Besides just being cool, maps are great at visualizing your geographically data by location. The data on a map is often displayed in a colored area map like above or a bubble map. Since maps are so effective at telling a story they are used by governments, media, NGOs, nonprofits, public health departments… Maps aren’t just for displaying data they direct action. What to Avoid Everyone loves maps. That doesn’t mean you always need to display one. Obviously if location isn’t a necessary part of your data story, you don’t need a map. They take up a lot of room so only use them when necessary. Also don’t just fill your maps with data points. So, to conclude: keep the text simple, use visualizations whenever possible, include video and animation when appropriate, and make your reports/presentations interactive to engage your audience! Continue Reading",2021-03-05T10:11:26.358Z,"What should everyone know about making good charts and graphs to represent data? ",Quora
60420416ed76476feda1bcb2,https://www.quora.com/What-are-the-best-resources-for-learning-data-visualization?-,"There are lots of sources for learning data visualization nowadays and most certainly google is your friend. You have ebooks, articles, published researches and online training courses. However, I would suggest choosing the most convenient and yet practical way and that is thru online training courses. Take for example the training course Effective Data Visualization where you get to be taught by a Instructor who has 20 years of experience providing technology services to media companies like CNN, PBS, and Disney. He earned a B.S. from Northwestern University & a M.S. in Business Intelligence  Continue ReadingThere are lots of sources for learning data visualization nowadays and most certainly google is your friend. You have ebooks, articles, published researches and online training courses. However, I would suggest choosing the most convenient and yet practical way and that is thru online training courses. Take for example the training course Effective Data Visualization where you get to be taught by a Instructor who has 20 years of experience providing technology services to media companies like CNN, PBS, and Disney. He earned a B.S. from Northwestern University & a M.S. in Business Intelligence from St. Joseph University. This comeas as highly recommended owing to the fact that you get the knowledge and information from people who knows how visualization works based on impressive credentials. Below is the course description and road map so maybe you get to figure out how the training course progresses. Hope this helps in any way! Course Description You can crunch numbers all day, but your amazing insights will be lost unless you can communicate them effectively. Whether you are generating charts for your boss, or creating sophisticated dashboards for a large organization, this course will give you the practical information you need to achieve success. What am I going to get from this course? Create and effectively utilize data visualizations, know what to expect from data visualizations, and work with data science teams to get the visualizations they need. After this course, managers will be better equipped to plan and execute visualization projects and use data visualizations to improve their work. Prerequisites and Target Audience What will students need to know or do before starting this course? There are no prerequisites for this course, although a basic knowledge of Microsoft Excel is helpful, and a basic background in statistics can also be applied. Who should take this course? Who should not? This course is designed for anyone who needs to read and understand data visualizations, as well as anyone who is tasked with presenting data visualizations, either on a large or small scale. While the course covers many of the practical nuts-and-bolts aspects of visualizing data, it is not for software engineers who develop visualizations. Curriculum Module 1: Course Overview and Objectives Lecture 1 Course Overview and Objectives This brief introduction gives and overview of the course, the intended audience, and the learning objectives. We will review the course modules and the theme or thesis of the course. There are no prerequisites for this course. Lecture 2 Gathering Data Learn how to gather data from disparate sources, clean and normalize data, and deal with data from legacy systems. Quiz 1 Gathering Data Review the concepts discussed in the lecture about gathering data. Module 2: Turning Data into Information Lecture 3 Turning Data into Information Learn how to get insights from your data (and how to be sure that insights are actually insights), and visualize them clearly. You will also learn how to determine the potential of your dataset and identify its weaknesses, and how to identify the key questions you want to answer (KPIs). Module 3: Getting the Big Picture Lecture 4 Getting the Big Picture Learn about the different data relationships you will be visualizing and the best choice of chart/graph options for each. You will also learn about the limitations of visualizations (sometimes tables are a better choice), and design tips for making your visualizations successful. Quiz 2 Reflection: Consider a recent visualization Consider a recent data visualization you created, or perhaps on that was presented to you. What would you do to improve it? Print it out if possible, and mark it with pen or pencil to indicate the changes you would make. Also indicate where it was successful. If possible, re-create the visualization with your changes and compare them. Make specific reference to the points covered in the lecture: 1. Does the visualization have a clear focus? 2. Does it direct the viewer's attention to one particular point? 3. Is the point of the visualization clear? 4. Is the visualization free of clutter? 5. Is the right amount of information presented? 6. Is the design simple, not distracting, and free of clutter? Module 4: Getting the Truth out of Your Data Lecture 5 Getting the Truth out of Your Data Use data science techniques to ensure that your data and your visualizations are not misleading or communicating the wrong information. Module 5: Pitfalls in Data Visualization Lecture 6 Pitfalls in Data Visualization Learn about how data visualizations can lie, or mislead unintentionally. Learn best practices for avoiding common pitfalls and problems in the visual presentation of you data. Module 6: Challenges in Data Visualization Lecture 7 Challenges in Data Visualization Learn how to work with big data, how to communicate your insights effectively, how to plan and manage data visualization projects, and how to make sure your visualizations get out to your audience so they can be effectively utilized. Quiz 3 Challenges in Data Visualization Review of the key points in the lecture on the challenges of data visualization Module 7: What to Look for in a Dashboard Lecture 8 What to Look for in a Dashboard Learn about the dashboard and its potential for communication, both to small teams and large organizations. Learn what makes a dashboard successful, and how to measure the success of your dashboard development project. Quiz 4 Reflection: What are your KPIs? It's very important at the outset of your data visualization project, and throughout its life, to define the metrics that are most important to your audience. In this reflection, define your KPI's. You should have no more than six. They should be specific to an audience, for example, your team, or the entire company. (If you have more than one audience in your project, pick one). Make sure that the KPIs you choose meet these criteria: 1. It's quantifiable 2. You can measure it (you have the technical means and the business processes in place) 3. It's key (not just cool, or something that you have easily accessible) 4. It's actionable for your audience 5. It directs individuals in your audience to an action or a goal Module 8: Data Visualization Tools Lecture 9 Data Visualization Tools We will review a number of different data visualization and business intelligence (BI) software packages and platforms. You will also learn how to define your requirements for choosing the right package for you and your organization, considering the features, budget, licensing structure, and security requirements. Source: Effective Data Visualization Data Visualization Training There are lots of sources for learning data visualization nowadays and most certainly google is your friend. You have ebooks, articles, published researches and online training courses. However, I would suggest choosing the most convenient and yet practical way and that is thru online training courses. Take for example the training course Effective Data Visualization where you get to be taught by a Instructor who has 20 years of experience providing technology services to media companies like CNN, PBS, and Disney. He earned a B.S. from Northwestern University & a M.S. in Business Intelligence  Continue Reading",2021-03-05T10:12:38.206Z,"What are the best resources for learning data visualization? ",Quora
