"_id",job_link,answer,date,question,source
60420644ed76476feda1c0d6,https://www.quora.com/What-do-you-think-will-be-the-biggest-change-in-SEO-come-2019?-,"Most likely User Experience. Looking at the new tool that Google has released (Web.dev) or you can use LightHouse, you can see Google are really focusing on User Experience. Just my personal opinion, I believe the will be looking more into. Time on pageMonitoring how quickly you hit that back button after visiting a page.How quickly your page loads (particularly for mobile devices test on 3G or 4G networksAlt tags - I know this sounds over the top, but Google seem to really focus on sites that provide as much info as possible for those who use screen readers (hard at reading).This does not only Continue ReadingMost likely User Experience. Looking at the new tool that Google has released (Web.dev) or you can use LightHouse, you can see Google are really focusing on User Experience. Just my personal opinion, I believe the will be looking more into. Time on pageMonitoring how quickly you hit that back button after visiting a page.How quickly your page loads (particularly for mobile devices test on 3G or 4G networksAlt tags - I know this sounds over the top, but Google seem to really focus on sites that provide as much info as possible for those who use screen readers (hard at reading).This does not only apply to alt tags, but <iframe>, <input>, <object> and any other labels. Ultimately, I believe it is a good idea to add on-page elements to make your page look good and pleasing to the eye… essentially, forget making your page look like a blocks of text that put the user off. Here are some resources I would consider to look at for this: Robbie Richards: SEO Case StudyEric Lancheres: Ultimate SEO Copywriting TipsBrian Dean: On-Page SEONote: The above are good resources to point you in the right direction. But ultimately, it is about looking at your own site / pages and looking at how you can make it more appealing to the eye.Essentially people take a split second to decide if they want to stay on your site or not, consider how to capture their attention within that split second. Most likely User Experience. Looking at the new tool that Google has released (Web.dev) or you can use LightHouse, you can see Google are really focusing on User Experience. Just my personal opinion, I believe the will be looking more into. Time on pageMonitoring how quickly you hit that back button after visiting a page.How quickly your page loads (particularly for mobile devices test on 3G or 4G networksAlt tags - I know this sounds over the top, but Google seem to really focus on sites that provide as much info as possible for those who use screen readers (hard at reading).This does not only Continue Reading",2021-03-05T10:21:56.195Z,"What do you think will be the biggest change in SEO come 2019? ",Quora
6042067eed76476feda1c141,https://www.quora.com/How-does-one-get-a-job-specializing-in-data-visualization-with-an-MS-in-Computer-Science?-,"Enrico Bertini, studied Computer ScienceAnswered 3 years ago Enrico Bertini Here is a tentative list: Learn how to design effective visualizations. If you are still doing your MS you can see if there is a good course in your university. If not, there are quite a few good books out there. I find Stephen Few’s books those that provide the most useful basic knowledge in the most concise way. Note, his visualizations do not look fancy, but he does teach the right stuff that stays with you forever. For inspiration go with the classics and buy the first two of Edward Tufte’s books.Learn how to code effective visualizations. People have different preferences here. If you wantContinue ReadingHere is a tentative list: Learn how to design effective visualizations. If you are still doing your MS you can see if there is a good course in your university. If not, there are quite a few good books out there. I find Stephen Few’s books those that provide the most useful basic knowledge in the most concise way. Note, his visualizations do not look fancy, but he does teach the right stuff that stays with you forever. For inspiration go with the classics and buy the first two of Edward Tufte’s books.Learn how to code effective visualizations. People have different preferences here. If you want to be a data scientist you need to know how to create appropriate and effective graphs with either R (and the ggplot2 library) or Python (many like Seaborn). If you want to get a job specifically in data visualization you however need to be able to code efficient client-based code. The best technologies at this time are: D3 and React. Note: companies want you to be comfortable with the full stack so you’ll need to be a good programmer and familiar with data processing as well as coding web-based applications interfacing with some complex/big data set.Build a portfolio. I can’t stress enough how important this is! Visualization is made to be seen. People want to see what you are capable of. Also, the very step of trying to create projects on your own to build a portfolio is going to make you a better data visualizer. Seek as much feedback as you can. Make a twitter account if you don’t have one, connect with people who work in visualization and show your work. Most people are friendly and happy to give constructive feedback if you are careful with their time.Look out for companies with strong visualization teams and apply. The number of companies with amazing data visualization teams is growing incredibly fast. Off the top of my head: Twitter, Uber, AirBnB, Spotify, Netflix. They all have fantastic teams and they are growing. Some people work more on the journalistic side of things, which is fine and fun, but if you want to use your CS background at best I would rather work for companies like those I mentioned. These are companies who want to hire software engineers.This is a first approximation. I probably missed much. I hope it’s helpful nonetheless.",2021-03-05T10:22:54.402Z,"How does one get a job specializing in data visualization with an MS in Computer Science? ",Quora
604206eced76476feda1c20c,https://www.quora.com/What-are-the-most-common-mistakes-made-by-aspiring-data-scientists?-,"Simon Maby Igor Elbert Real errors that may hurt really bad your business : Wrong cross-validation :You have to validate your results when you train a machine learning model. The common method is to test your algorithm on data it has never seen before, and check the difference between its predictions and the real values. When you go for very complex models with a lot of variables, you may sometimes end up with data leakage, wich is using information that you won't have at the time you will do the prediction in a production environnement. This information is eventually strongly correlated to the value you are trying  Continue ReadingReal errors that may hurt really bad your business : Wrong cross-validation :You have to validate your results when you train a machine learning model. The common method is to test your algorithm on data it has never seen before, and check the difference between its predictions and the real values. When you go for very complex models with a lot of variables, you may sometimes end up with data leakage, wich is using information that you won't have at the time you will do the prediction in a production environnement. This information is eventually strongly correlated to the value you are trying to predict. You will then have an excellent cross-validation score  But it's all fake. These leakages can be very subtle and hard to detect. Wrong validation metric choice :When you do the cross-validation, you also have to choose a metric to measure your accuracy, whether it's RMSE for regression, ROC AUC for binary classification and so on... Rookie mistakes include for example validating a model on the number of right answers for an unbalanced problem : if your target contains 99% ones and 1% of zeros, predicting ones all the time is almost a perfect model according to accuracy...so what? The metric choice can impact strongly what is your business objective. Example of a good choice is looking at the lift metric when you are doing marketing campaigns. Overfitting :This topic has been widely discussed on quora included. The idea is that even if you do a cross-validation, you are still exposed to this phenomenon of not generalizing. Kaggle is a great example of this. Even if people cross-validate their results, we see big movements in the final leaderboard because some people mine variables that are not generalizing over the data, but just finding random correlations between the train set and the public leaderboard test set. Not comparing your model to a naive model:People saying their model is amazing with a 0.142 RMSE, then you try to predict the average of the target, and you get 0.141 RMSE. People doing time series forecasting saying their model is good, then you have a better model by just predicting the value of the next hour to be the same as now. You have many other biais like identifying a correlation between two time series though they both have a trend... (pure random series can have a strong correlation factor with any other one as long as they have the same trend, you have to remove the trends before doing the analysis). This is why data scientists should never work alone, and always challenge themselves really hard. Most of the complexity in datascience is about assessing your model quality, and insure it will get expected performance in production. What needs experience is also understanding and explaining your model to the business, and doing A/B testing over different solutions into production to compare the results.",2021-03-05T10:24:44.811Z,"What are the most common mistakes made by aspiring data scientists? ",Quora
60420724ed76476feda1c275,https://www.quora.com/What-skills-are-necessary-for-an-entry-level-data-analyst-or-data-visualizer?-,"Muqadder IqbalAnswered 5 years ago Muqadder Iqbal Data visualization is just one part of an overarching domain: analytics. Before the newer concepts like big data, data science and such came into being, they were commonly referred to as Business Intelligence (deriving intelligence for businesses from data). Data Visualization is the last leg of this complicated work flow of business intelligence that involves data integration, manipulation, modeling, calculation and distribution. The outcome of all those steps is what feeds into the visualization stage: telling a visual story from the outcome of data analysis process. It is such a tiny (but v Continue ReadingData visualization is just one part of an overarching domain: analytics. Before the newer concepts like big data, data science and such came into being, they were commonly referred to as Business Intelligence (deriving intelligence for businesses from data). Data Visualization is the last leg of this complicated work flow of business intelligence that involves data integration, manipulation, modeling, calculation and distribution. The outcome of all those steps is what feeds into the visualization stage: telling a visual story from the outcome of data analysis process. It is such a tiny (but very crucial) part of business intelligence that the line between all these individual roles has become very thin. If you are still interested in just being a data visualization expert, some of the key skills you'll need are understanding of visual design concepts, effective presentation skills, dashboarding/charting skills and a bit of story telling skills. You'll also have to be skillful in the business area you want to work in and know what various data elements and business terms mean. You can get help learning some of these skills (technical ones mostly) from places like www.coursera.org and www.udacity.com. For the rest, you'll find plenty of help by searching for related terms on the Internet. I hope this helps!",2021-03-05T10:25:40.930Z,"What skills are necessary for an entry-level data analyst or data visualizer? ",Quora
60420759ed76476feda1c2db,https://www.quora.com/How-do-I-analyze-data-from-WiFi-access-points?-,"Alex Friedrich, Marketing, Technology, and Data Business Consultant,Answered 4 years ago Alex Friedrich There are a few ways to do that. If you have the data already, you can use a tool like excel to plot the data or you can use a tool like tableau (free) to illustrate the data. Both have a bit of a learning curve. Wi-Fi data can be incredibly interesting if you have a business. If you have multiple location, or a big store with many access points, you can: Collect identities and contact data of people using the Wi-Fi Track Mac IDs to see where people travel in a store (passive Wi-Fi tracking) Track Mac IDs to see which stores people travel to, and how often, and how long they stay (loyalty). By monit Continue ReadingThere are a few ways to do that. If you have the data already, you can use a tool like excel to plot the data or you can use a tool like tableau (free) to illustrate the data. Both have a bit of a learning curve. Wi-Fi data can be incredibly interesting if you have a business. If you have multiple location, or a big store with many access points, you can: Collect identities and contact data of people using the Wi-Fi Track Mac IDs to see where people travel in a store (passive Wi-Fi tracking) Track Mac IDs to see which stores people travel to, and how often, and how long they stay (loyalty). By monitoring the connection to the internet, you can capture the websites that the Mac Address visits (domain). Which gives you a pretty extensive list of their interests and potential future partners. If you have a social media login (social login) you can even monitor what they are saying about your brand online. Wi-Fi data analysis can tell you so much about your business. For example, by collecting postal codes, and plotting them on a map, you can see the areas where people come from to visit your locations. By comparing that to a map, you can find new locations where your stores should go. By clustering the websites that people visit by demographics, you can have a pretty clear understanding of the customer profile of people that visit your stores. By adding in your own data, you may even be able to figure out why people buy certain things. Companies like Soonsy AG, offer data collection, and analysis services for Wi-Fi access points. a.solms@soonsy.com is my address, send me an email if I can give you any more interesting insights into AP data collection.",2021-03-05T10:26:33.160Z,"How do I analyze data from WiFi access points? ",Quora
6042078ded76476feda1c33b,https://www.quora.com/What-is-the-best-way-to-attract-customers-to-my-Upwork-profile?-,"Pravin Singh, Data Scientist. Digital Nomad.Updated February 8, 2021 · Upvoted by Abhishek Agarwala, Freelancer | Digital Marketer  at Upwork (2016-present) · Author has 56 answers and 67.8K answer views Pravin Singh",2021-03-05T10:27:25.477Z,"What is the best way to attract customers to my Upwork profile? ",Quora
60420806ed76476feda1c418,https://www.quora.com/How-do-I-change-my-career-to-Data-Analytics?-,"The best way to answer your question in my opinion is to break it down. Therefore, I will try to break your question down into two parts what you know and what you should know to get into data analytics. What you know You have learned Tableau and you are into python, this is great but whats the level of expertise and confidence that you have related to these tools is my question to you as you have also stated that you do not have hands on experience with these tools. Therefore, to overcome this barrier there are cost effective courses available on various MOOCs websites like coursera, edx etc. th Continue ReadingThe best way to answer your question in my opinion is to break it down. Therefore, I will try to break your question down into two parts what you know and what you should know to get into data analytics. What you know You have learned Tableau and you are into python, this is great but whats the level of expertise and confidence that you have related to these tools is my question to you as you have also stated that you do not have hands on experience with these tools. Therefore, to overcome this barrier there are cost effective courses available on various MOOCs websites like coursera, edx etc. that can help you to learn in-depth about Tableau as a tool and help you to get a hands on experience by working on capstone projects. Also, the courses offered on these websites are from topnotch universities like John Hopkins, Duke, University of Pennsylvania etc. Similarly these MOOCs websites offer specializations around Data Visualizations and Python Programming. Why you should do these courses? In order for you to transition into Data Analytics domain you have to be well versed with the tools that you already know. This means that by taking these courses you will enhance your skills from merely knowing something to an expert level. Now lets get into the second part i.e. What you don’t know: Data analytics is all about being flexible in mining insights out of disparate data sets using multitude of tools and techniques. Hence, it is my responsibility to help you with the list of some tools and techniques that you should start working on as soon as possible: Data Mining Tools: R and related packages, though it is not a mandate however, this is one the most used and powerful data-mining tools used by the data analytics fraternity. Given the fact that you are already working on Python this should be pretty simple and easy step for you.Rapidminer, this is another high in demand data analysis and predictive analytics workflow tool.OrangeWekaMinitab (Another high in demand statistical tool used by fortune 100 to 500 organizations)I can go on an on with the list of opensource data mining tools as mentioned above. I would urge you to do some curation at your end to get best information that suits your skills and expertise. Data Visualization Tools: MicrostrategyQlikviewTableau (you already have the working knowledge of it but there is more than just doing eye candy visualization, this tool has the capability to do predictive analysis on the fly)PlotlyYou can get some amazing information related to these data visualization tools and their ranking at this link. Statistical techniques and tricks cannot be ignored when you want to get into the field of data analytics. Therefore, get some learning going related to: Sampling TechniquesCentral Limit TheoremsProbabilityHypothesis TestingRegressionAbove are few example and you get great information around statistics techniques and tricks at this link. Transitioning into Data Analytics field is a pains taking process and requires a lot of diligence and is directly proportional to the success that you hope. I have tried to be very succinct ( there are so many other things that I havent’ included) with my response and hope that you will find this response helpful. Till we talk next time…Happy Learning !!! The best way to answer your question in my opinion is to break it down. Therefore, I will try to break your question down into two parts what you know and what you should know to get into data analytics. What you know You have learned Tableau and you are into python, this is great but whats the level of expertise and confidence that you have related to these tools is my question to you as you have also stated that you do not have hands on experience with these tools. Therefore, to overcome this barrier there are cost effective courses available on various MOOCs websites like coursera, edx etc. th Continue Reading",2021-03-05T10:29:26.376Z,"How do I change my career to Data Analytics? ",Quora
6042083ded76476feda1c47e,https://www.quora.com/What-is-a-good-book-on-data-visulization?-,"Thanks for A2A! Both previous answers are very good. I especially liked Peter Flom's  answer for being close to comprehensive and his insights. For the sake  of more completeness in covering the topic, I would add works by Stephen  Few, who has written the following books on data visualization:  Show me the numbers: Designing tables and graphs to enlighten (2004)Information dashboard design: The effective visual communication of data (2006)Now you see it: Simple visualization techniques for quantitative analysis (2009)Some  experts consider these books on par or, even, better (at least, in some Continue ReadingThanks for A2A! Both previous answers are very good. I especially liked Peter Flom's  answer for being close to comprehensive and his insights. For the sake  of more completeness in covering the topic, I would add works by Stephen  Few, who has written the following books on data visualization:  Show me the numbers: Designing tables and graphs to enlighten (2004)Information dashboard design: The effective visual communication of data (2006)Now you see it: Simple visualization techniques for quantitative analysis (2009)Some  experts consider these books on par or, even, better (at least, in some aspects)  than Clevelend's and Tufte's widely-cited and influential works. For example, this is the opinion on ""Show me the numbers"" book by Dr. Pat Hanrahan, professor of computer  science at Stanford University:  More accessible than Cleveland's books and...more practical advice than Tufte's. I highly recommend it. Thanks for A2A! Both previous answers are very good. I especially liked Peter Flom's  answer for being close to comprehensive and his insights. For the sake  of more completeness in covering the topic, I would add works by Stephen  Few, who has written the following books on data visualization:  Show me the numbers: Designing tables and graphs to enlighten (2004)Information dashboard design: The effective visual communication of data (2006)Now you see it: Simple visualization techniques for quantitative analysis (2009)Some  experts consider these books on par or, even, better (at least, in some Continue Reading",2021-03-05T10:30:21.323Z,"What is a good book on data visulization? ",Quora
60420870ed76476feda1c4de,https://www.quora.com/What-are-the-most-interesting-data-visualization-blogs?-,"Ankit Sharma, Technology Expert and Content WriterAnswered January 11, 2021 · Author has 381 answers and 89.2K answer views Ankit Sharma Data Visualization is a multidisciplinary field that deals with the visual representation of data. And, it's an effective way of communicating when the data is huge. Learning data visualization will enhance your career and there is a huge demand for data visualization engineers as the data is rising on a daily basis. Thus, pursuing a data visualization career is worthwhile. Tableau and Power BI are the most popular data visualization tools used today. Thus, learning both these tools will make your career bright. If you’re looking to learn data visualization tools, I suggest you go watch the bel Continue ReadingData Visualization is a multidisciplinary field that deals with the visual representation of data. And, it's an effective way of communicating when the data is huge. Learning data visualization will enhance your career and there is a huge demand for data visualization engineers as the data is rising on a daily basis. Thus, pursuing a data visualization career is worthwhile. Tableau and Power BI are the most popular data visualization tools used today. Thus, learning both these tools will make your career bright. If you’re looking to learn data visualization tools, I suggest you go watch the below video by Intellipaat, which I found useful to gain data visualization skills,  And, it's an ever-growing field, so it's a must to keep you updated in this field. One of the best ways to know the latest news in this field is referring to blogs. There are lots of blogs available to refer to the current news in data visualization. Here are a few which I refer to the most: Information is beautifulData Plus ScienceThe Functional ArtAnyChart blogFlowingDataModern DataPlotly BlogDataquest BlogDriven By DataThe Economist: Graphic detailTableau Blog",2021-03-05T10:31:12.225Z,"What are the most interesting data visualization blogs? ",Quora
