"_id",job_link,answer,date,question,source
60432b51ed76476feda24889,https://www.quora.com/Should-I-learn-SQL-or-MySQL-as-an-aspiring-data-analyst?-,"First, let me correct your question slightly. I assume what you meant to ask was “Should I learn Microsoft SQL Server or MySQL as an aspiring data analyst.” Many people incorrectly refer to MS SQL Server as just SQL, but that leads to needless ambiguity. As you probably already know, SQL stands for Structured Query Language, and is a programming language designed for relational databases. There are dozens of relational database management systems that you may run into as a data analyst: MS SQL Server, MS Access, MySQL, Oracle, PostgreSQL, Teradata, DB2, Informix, Redshift, Hadoop Hive, etc. So Continue ReadingFirst, let me correct your question slightly. I assume what you meant to ask was “Should I learn Microsoft SQL Server or MySQL as an aspiring data analyst.” Many people incorrectly refer to MS SQL Server as just SQL, but that leads to needless ambiguity. As you probably already know, SQL stands for Structured Query Language, and is a programming language designed for relational databases. There are dozens of relational database management systems that you may run into as a data analyst: MS SQL Server, MS Access, MySQL, Oracle, PostgreSQL, Teradata, DB2, Informix, Redshift, Hadoop Hive, etc. So, learn SQL… the language. That said, you probably want a relational database management system (RDBMS) to practice on. Some good systems with a low-barrier-to-entry include both MS SQL Server and MySQL as well as PostgreSQL because they’re readily available. I think that you’ll develop a more transportable and versatile skill base, though, if you start with an open source RDBMS that is cross-platform. MS SQL Server is proprietary, and even though it does run on Linux and Mac now, is still pretty Windows-centric. So, MySQL or PostgreSQL would be my recommendations. I’d also recommend that you, as an aspiring data analyst, try to shy away from using procedural add-ons to SQL, like Microsoft T-SQL or Oracle PL/SQL. Use this opportunity to learn the operations and principles of relational algebra. It won’t solve all of your challenges, but you’ll learn to work with datasets much more effectively. First, let me correct your question slightly. I assume what you meant to ask was “Should I learn Microsoft SQL Server or MySQL as an aspiring data analyst.” Many people incorrectly refer to MS SQL Server as just SQL, but that leads to needless ambiguity. As you probably already know, SQL stands for Structured Query Language, and is a programming language designed for relational databases. There are dozens of relational database management systems that you may run into as a data analyst: MS SQL Server, MS Access, MySQL, Oracle, PostgreSQL, Teradata, DB2, Informix, Redshift, Hadoop Hive, etc. So Continue Reading",2021-03-06T07:12:17.192Z,"Should I learn SQL or MySQL as an aspiring data analyst? ",Quora
60432b77ed76476feda248a7,https://www.quora.com/Data-scientist-vs-Data-analyst-vs-Data-engineer?-,"James LittieCheese, Data Engineer and Cybersecurity AnalystAnswered 1 year ago James LittieCheese I’ll throw my two cents in the ring since a lot of people answering these questions are either scientists or analysts, not data engineers. Too often, I read descriptions of the role and it’s just become a catch-all for “analysts and scientists don’t know how to do this particular thing. So we’ll just get someone who knows how to do all these things they’re not great at.” The job is quickly developing purple squirrel requirements and unreasonable expectations. That being said, it is a job where you need to know a decent amount of a lot of tech from a lot of different areas. I have had to apply k Continue ReadingI’ll throw my two cents in the ring since a lot of people answering these questions are either scientists or analysts, not data engineers. Too often, I read descriptions of the role and it’s just become a catch-all for “analysts and scientists don’t know how to do this particular thing. So we’ll just get someone who knows how to do all these things they’re not great at.” The job is quickly developing purple squirrel requirements and unreasonable expectations. That being said, it is a job where you need to know a decent amount of a lot of tech from a lot of different areas. I have had to apply knowledge ranging from linux server admining to get the tools I want, to efficient algorithm design as a developer, and machine learning experience to guide what the data needs to be transformed into. Expect to pick up new technologies rapidly in this field as a requirement. A good data engineer will never possess all the skills you want. Good data engineers learned how to learn. Advice to hiring managers: if you have someone lacking a few technologies, but has demonstrated that they know how to learn quickly, invest in that person. If you have an engineer that learned XYZ that you use, but they stopped - their knowledge will be obsolete in 3–5 years (max). I see the field as really developing two divisions within it under the same name. There are support engineers (which I am) and warehousing engineers. There is a ton of cross over in skills, but support engineers focus more on availability, warehousing engineers focus on delivery. First, and foremost though - Data Engineers are not big data DBAs. If all they’re doing is moving data supporting your SQL databases into Hadoop, and then building a few things in Hive/Spark/Pig, or that’s all they’re able to do, they’re a DBA with a few extra skills. Engineering skills handle siloed data and availability and deliverability of that data in scope and scale. But what does “availability” mean? It’s a common word that never gets defined. Does it mean that you can just query it in Splunk? NO. Availability means that you can unsilo data and make it available to other groups + you can connect the data with existing or new data sources. Just a dump into Hadoop data lake doesn’t create availability, being able to connect the data is a primary function. In large corps, other engineers get it into a lake and handle proper schema implementation in transitional or end tables (often with an Engineer’s input since they know the future uses). Data Engineers get that data to the point that it’s usable and/or deliver that data to analysts or scientists. Usability is cleaning, feature extraction, feature creation, and connectivity between sources. Deliverability is pipelines, automation, formatting, and putting that into an end interface. In smaller companies, these roles might be blended, but as data grows in a company - and it always will - these roles should be further separated so you’re not just throwing generalists at your data. The reason is that usability is more focused on creating algorithms and translating scientist/analyst needs into code that acts on the raw. It’s a small data development-to-big data implementation. Deliverability is focused on automation and generalizability/robustness/optimizations from designs that make the data usable. This cannot happen in a vacuum either. Engineers need to understand what data is useful in order to do their job. Usefulness comes from input that scientists and analysts provide. Engineers also often have a lot of understanding of what can be immediately extracted and what cannot, but also what could be extracted. It’s a symbiotic system when it works well. Analysts need X, scientists need Y, engineers get as close to those needs as the data allows. Engineers often work with the raw and can say “Hey, I can also get you Z, and that looks like really useful data you didn’t consider or know was available.” It is a primarily a support position. Engineers aren’t your scientists and building the predictive models, or compiling data into daily reporting/analysis in analyst roles. Many good ones often know modeling, statistics, and are capable scientists in their spare time. Many are active on Kaggle doing their own analysis - it’s fun for us. They can help with the other roles, and if they have bandwidth they can be very helpful and insightful, but that’s not their role. From other engineers, this is an area where frustration often starts to come in. Treat your support staff well. If you just treat your engineers as a go-fetch system for data, they’re going to resent you. A) It’s always harder than it sounds. B) They understand the data at a different level and have a lot of insights into how complex systems interact within your company. Treating them as a go-fetch system is underutilizing them and treating them like they provide no useful analytical knowledge. Also - if you get them to automate your entire analysis (note to analysts) - they just eliminated your job function using their spare bandwidth. Engineers are the ones automating white collar data jobs. I believe another function is developing too, and it might be a primary one later on. And that’s feature creation. Because data often can be linked, just a simple extraction in both sources only reveals the picture in each source. Understanding linkages allows the combination, contrasting, and other techniques to utilize multiple sources to even greater advantage than a few treated as separate. Engineers are well suited, based on their daily duties, to adopt this responsibility and share it with scientists. In the end, analysts, scientists, and engineers all make data speak. Engineers can make the raw data speak the languages that analysts and scientists can understand. Scientists make that data speak to critical questions and predictive systems. Analysts make that speak to business concerns and daily value-added analysis.",2021-03-06T07:12:55.417Z,"Data scientist vs Data analyst vs Data engineer? ",Quora
60432b88ed76476feda248b9,https://www.quora.com/How-do-I-land-a-data-analyst-job-at-amazon?-,First thing first to be a Data Analyst you have to be a certified person into various softwares like SAS after that you have to have a good amount of experience say 2–3 years only then amazon or flipkart will be interested in hiring your talent as they are multigiants and they are looking for candidates with good amount of experience and also competetion among the candidates are also high so it is very difficult getting job at amazon as an Data Analyst but yeh you can give it a try… best of luck..(y) Abhishek Anand,2021-03-06T07:13:12.626Z,"How do I land a data analyst job at amazon? ",Quora
60432b9ced76476feda248cc,https://www.quora.com/Can-a-data-analyst-work-from-home?-,"The Milind Jagre Enterprise Yes, why not? The more important question is whether the company is willing to hire you as an online data analyst or not. Most of the time the answer to this question is NO. The problem with hiring someone online for performing data related activities is that you have to give them access to your data and God knows what that person is going to do with that data once they get access to it. Any sane company would not like that the data of their customers is with someone whom they have not met or whom they do not interact physically. That brings up some trust issues, result Continue ReadingThe Milind Jagre Enterprise Yes, why not? The more important question is whether the company is willing to hire you as an online data analyst or not. Most of the time the answer to this question is NO. The problem with hiring someone online for performing data related activities is that you have to give them access to your data and God knows what that person is going to do with that data once they get access to it. Any sane company would not like that the data of their customers is with someone whom they have not met or whom they do not interact physically. That brings up some trust issues, resulting in conflicts. I may be wrong while mentioning above points. Please correct me if I am wrong. Hope this helps.Cheers! The Milind Jagre Enterprise Yes, why not? The more important question is whether the company is willing to hire you as an online data analyst or not. Most of the time the answer to this question is NO. The problem with hiring someone online for performing data related activities is that you have to give them access to your data and God knows what that person is going to do with that data once they get access to it. Any sane company would not like that the data of their customers is with someone whom they have not met or whom they do not interact physically. That brings up some trust issues, result Continue Reading",2021-03-06T07:13:32.074Z,"Can a data analyst work from home? ",Quora
60432be0ed76476feda24901,https://www.quora.com/Does-McKinsey-hire-data-analysts?-,,2021-03-06T07:14:40.086Z,"Does McKinsey hire data analysts? ",Quora
60432c13ed76476feda24928,https://www.quora.com/What-is-the-best-language-to-learn-in-order-to-become-a-data-analyst?-,"Thanks for A2A. The best language to learn in order to become as a data analyst is Python in my view. Though, R is quite easy to learn but Python is more versatile than R. The implementation in Industry (Data science) prefers Python over R. Although, If you want to go into research field, I would recommend R over python. It hard to compare them side-by-side. The main reason for this is that you will find R only in a data science environment; As a general purpose language, Python, on the other hand, is widely used in many fields, such as web development. This often biases the ranking results in Continue ReadingThanks for A2A. The best language to learn in order to become as a data analyst is Python in my view. Though, R is quite easy to learn but Python is more versatile than R. The implementation in Industry (Data science) prefers Python over R. Although, If you want to go into research field, I would recommend R over python. It hard to compare them side-by-side. The main reason for this is that you will find R only in a data science environment; As a general purpose language, Python, on the other hand, is widely used in many fields, such as web development. This often biases the ranking results in favor of Python, while the salaries are affected somewhat negatively. Hope this Figures helps you.   Cheers :) Happy Coding !!",2021-03-06T07:15:31.558Z,"What is the best language to learn in order to become a data analyst? ",Quora
60432c27ed76476feda2493f,https://www.quora.com/Are-Data-engineers-expected-to-also-be-Data-analysts?-,"Data Engineers are expected to put in place the engineering required to allow Data Scientists to gather and manage data to build their models, and to make machine learning applications scale and run smoothly. This means data engineers need to remain cognizant of the concerns analysts and scientists have when it comes to building and deploying models. These concerns are not the same as those that occur in traditional software engineering. Models make assumptions about their inputs that get violated in ways that cannot be known upfront; they need to be ensembled, monitored, matched against user interactions, swapped in-and-out of inference engines and tested against nondeterministic conditions of quality. Data Engineers need to speak some of the high-level language that Data Scientists speak, and understand the most important concepts (and vice versa). Data Engineers should thus have experience building and validating some simple models, and definitely have experience putting those models into production. Data Engineers are not typically expected to analyze/visualize data (unless it’s related to system performance) or build models. If this is happening it is usually a symptom of understaffing or ill-defined requests from the product teams. If an organization has their engineers building models or their scientists locking-in data pipelines they are not leveraging the talent they hired. 7",2021-03-06T07:15:51.354Z,"Are Data engineers expected to also be Data analysts? ",Quora
60432c3aed76476feda24951,https://www.quora.com/Why-are-spreadsheet-champions-considered-to-be-expert-data-analysts-while-computer-science-majors-take-a-back-seat?-,"Ganesh Ramakrishnan Without necessarily agreeing that spreadsheet expertise makes someone an expert data analyst, I would point out that there is an essential difference between ""spreadsheet thinking"" and programming. -Programmers tend to think of a series of steps resulting in a desired outcome. If the algo is right, logical conditions applied to apt data structures are correct, bang, we get a result. -Spreadsheeters deal with a landscape of raw data, and use formulas, formatting and sorting/pivoting/filtering to look at slices of data in different ways. On encountering a task to be accomplished in Excel, most prog Continue ReadingWithout necessarily agreeing that spreadsheet expertise makes someone an expert data analyst, I would point out that there is an essential difference between ""spreadsheet thinking"" and programming. -Programmers tend to think of a series of steps resulting in a desired outcome. If the algo is right, logical conditions applied to apt data structures are correct, bang, we get a result. -Spreadsheeters deal with a landscape of raw data, and use formulas, formatting and sorting/pivoting/filtering to look at slices of data in different ways. On encountering a task to be accomplished in Excel, most programmers jump to writing VBA macros to manipulate the data. When requirements change the code bloats rapidly and becomes a typical software bug-fixing-and-testing scenario. In a situation where we have a programmer and a spreadsheet expert with equal knowledge of relevant statistical functions, I guess the spreadsheet champion's approach would result in a better view of intermediate results, and easier what-if trials. To provide the same level of sophisticated data analysis capability, one would have to program a tool-like interface--in other words, a spreadsheet tool! Continue Reading",2021-03-06T07:16:10.131Z,"Why are spreadsheet champions considered to be expert data analysts while computer science majors take a back seat? ",Quora
60432c4bed76476feda24960,https://www.quora.com/What-SQL-do-I-need-to-learn-as-data-analyst?-,"Jacob Case As a data analyst, you will primarily need to read data from the database you’re querying. I would take this approach: Learn how the SELECT statement works. This includes studying how Logical Query Processing works. Logical Query Processing describes the order in which the database engine executes the clauses of your SELECT statements. Understanding it will lead you to write better, more accurate queries.Study how joins work. Inner joins are the most efficient. Left, right, and full outer joins are less efficient, but sometimes you must use them. Inner joins can cause rows to be filtered out, oContinue ReadingAs a data analyst, you will primarily need to read data from the database you’re querying. I would take this approach: Learn how the SELECT statement works. This includes studying how Logical Query Processing works. Logical Query Processing describes the order in which the database engine executes the clauses of your SELECT statements. Understanding it will lead you to write better, more accurate queries.Study how joins work. Inner joins are the most efficient. Left, right, and full outer joins are less efficient, but sometimes you must use them. Inner joins can cause rows to be filtered out, outer joins cannot cause filtering. Study joins so you know when to use each type. Only the simplest database queries don’t involve joins.Understand how to conduct aggregations using the GROUP BY clause.Understand Window Functions / Ordered Analytical Functions. These are the epitome of conducting analytics within SQL. It will initially be hard to wrap your head around them, but it will be worth it. And once you understand them you will use them all the time.Understand database normalization. If you understand normalization, you will understand the theory of why architects structure databases the way they do. This helps while writing queries and determining which tables to join.Understand how Entity-Relationship Diagrams (ERDs) work. Most ERDs are built using the crow’s foot notation. Be sure to know how cardinality and optionality constraints work, which will help you decipher which join type to use when joining tables.Once you get up to speed with those things, you should probably expand into learning the DML & DDL subcategories of SQL. DML stand for Data Manipulation Language, which the SELECT statement is part of. DDL stands for Data Definition Language, which is what database architects use to create tables. Continue Reading",2021-03-06T07:16:27.416Z,"What SQL do I need to learn as data analyst? ",Quora
