"_id",job_link,answer,date,question,source
604325a4ed76476feda2434a,https://www.quora.com/How-do-I-become-a-self-taught-data-analyst?-,"Thanks for the detailed background! It sounds like there’s not better time for you to become a data analyst. To become a self-taught data analyst, here’s what you’ll need to know. For each tool/technology/concept that you learn, use real datasets to answer business related questions. It helps! Technologies to learn Excel - Excel is a must know for all data analyst. It’s a technology that’s been used for years to help analyst quickly clean, analyze, and visualize data. In fact, of the 3 listed here, this is the most important one to know. SQL - Nowadays most, if not all, of the data used by compan Continue ReadingThanks for the detailed background! It sounds like there’s not better time for you to become a data analyst. To become a self-taught data analyst, here’s what you’ll need to know. For each tool/technology/concept that you learn, use real datasets to answer business related questions. It helps! Technologies to learn Excel - Excel is a must know for all data analyst. It’s a technology that’s been used for years to help analyst quickly clean, analyze, and visualize data. In fact, of the 3 listed here, this is the most important one to know. SQL - Nowadays most, if not all, of the data used by companies is stored in databases. That means you need to learn a database querying language to extract data from these databases and there’s no better language than SQL. It’s the most commonly used DB language and has several variations like PostgeSQL, MySQL, SQL Server, etc. Tableau - A relatively new technology, but Tableau is primarily used for data visualization. Many companies are now looking for Tableau certified specialist or people that just know how to use this tool. It’s definitely a plus to have this listed on your resume. Learn The Data Analytics Cycle Learn more about the data analytics process. To quickly break it down for you, there are 5 main steps. You can break these down further, but be sure to know these 5 at the very least (I’ve combined a few of them together). Data Exploration and Cleaning: You should know how to explore different data sets and clean your data so it is ready for analysis. As a data analyst, you’ll be spending about 70–80% of your time in this phase. Data Analysis: Now it’s time for you to learn how to conduct some analysis. You’ll need to know your basic statistics, probability, and linear algebra to get meaningful insight. Data Visualization & Presentation: Once, you’ve done the analysis, you’ll need to learn how to communicate your findings with others. Things like visual perception, color, presentation, etc. Tableau is great for this! Each step is critical for the data analyst to know and understand. Here’s a Udemy course I created that goes over each of these steps at an introductory level. It might be too basic for you, but just here for anyone interested. Data Analysis Course For Beginners - Udemy Learn About Statistical Analysis You’ll also need to know the basics around statistics, probability, and linear algebra. Brush up on the following (and supporting topics): -measure of central tendency -measure of spread & variability -measure of shape -normal distribution -CTL and confidence intervals -hypothesis testing -simple linear regression Then apply the above topics to conduct the following: Descriptive analysis - This is analysis done using historical data. So this could be something like analyzing last years sales to find any trends in the data that you can use for future promotions. Inferential analysis - This is simply using a sample set to make predictions about the entire population (very common in statistics) Predictive analysis - The practice of extracting information from existing data in order to determine patterns and predict future outcomes and trends. Predictive analytics does not tell you what will happen in the future. It forecasts what might happen in the future with an acceptable level of reliability, and includes what-if scenarios and risk assessment. (using confidence intervals). Much less common for data analyst. ——————————————————————- If you’ve made it down this far and found this post helpful, I’d really appreciate an upvote! These are the same tool and concepts we practice at K2 Labs in our data analysis course. We use real world business cases to teach each concept and use datasets from multiple industries to give you a holistic view.",2021-03-06T06:48:04.232Z,"How do I become a self-taught data analyst? ",Quora
604325bced76476feda24366,https://www.quora.com/What-skills-are-used-by-data-scientists-versus-data-analysts?-,"Ricardo Vladimiro, Data Science Lead @ MiniclipAnswered 4 years ago · Upvoted by Frederick T. Williams, M.S. Data Science, Regis University (2020) · Author has 2K answers and 4.6M answer views Ricardo Vladimiro",2021-03-06T06:48:28.682Z,"What skills are used by data scientists versus data analysts? ",Quora
604325d4ed76476feda2437e,https://www.quora.com/Is-it-worth-paying-for-a-data-analyst-nanodegree?-,"Joe Falkson, Master's of Computer Science student (pilot cohort), Georgia Tech through UdacityAnswered 6 years ago Joe Falkson Yes. I am a member of the first ever graduate cohort for Georgia Tech's OMS CS degree. I can vouch that both my master's degree (about 7k USD) is worth paying for, as well as the Nano degree in data analysis.  A data analyst nano degree is worth it for the skill set (understanding AI, ML, and exploratory data analysis, along with getting more practical experience). The value of the nano degree credential itself is unknown since the job market has yet to decide how much it is worth (no one has completed the degree yet). That being said, the skill set one acquires is much desired for, and I (afte Continue ReadingYes. I am a member of the first ever graduate cohort for Georgia Tech's OMS CS degree. I can vouch that both my master's degree (about 7k USD) is worth paying for, as well as the Nano degree in data analysis.  A data analyst nano degree is worth it for the skill set (understanding AI, ML, and exploratory data analysis, along with getting more practical experience). The value of the nano degree credential itself is unknown since the job market has yet to decide how much it is worth (no one has completed the degree yet). That being said, the skill set one acquires is much desired for, and I (after 3 semesters with G-Tech's Udacity program) can personally vouch for the quality of courses on Udacity in general. While the nano degree isn't an accredited Master's degree, it actually offers a bit more flexibility as Udacity can use instructors from FB and Google who aren't necessarily tied to a university (something hard to do for an accredited degree). Thus, the nano degree students have teachers from the private sector, whereas the master's students on Udacity are confined to professors tied to universities.  Feel free to comment or message me, as this is something I am extremely passionate about, and I truly do believe the Georgia Tech program has changed my life. If I hadn't already been pursuing a Master's degree I would do the data analyst nano degree in a heartbeat.  Joe",2021-03-06T06:48:52.592Z,"Is it worth paying for a data analyst nanodegree? ",Quora
604325e7ed76476feda24391,https://www.quora.com/What-does-Goldman-Sachs-look-for-in-a-data-analyst?-,"The level of expertise required while working as an Analyst largely depends upon the Group you are working with.Since, your question pertains to skills which are looked for during recruitment, I would stick to the same. Generally the skills which the interviewer sees are:( not just GS, but any firm hiring for a quantitative analyst position)1) Decent Programming Skills:Even if you are a  data analyst and dream of using mathematics for cool stuff, you would of course have to implement the same as a code for it to be useful and used in production. Thus, generally companies hiring for data ana Continue ReadingThe level of expertise required while working as an Analyst largely depends upon the Group you are working with.Since, your question pertains to skills which are looked for during recruitment, I would stick to the same. Generally the skills which the interviewer sees are:( not just GS, but any firm hiring for a quantitative analyst position)1) Decent Programming Skills:Even if you are a  data analyst and dream of using mathematics for cool stuff, you would of course have to implement the same as a code for it to be useful and used in production. Thus, generally companies hiring for data analyst positionsA good understanding of Object-oriented programming, and command over one of the basic languages (C/C++, JAVA ) is generally expected. 2) Good Problem solving abilities:Simple but innovative puzzles are generally a part of the interview process.Some resources which might be helpful:Heard on the Street: Quantitative Questions from Wall Street Job Interviews CSE Blog - quant, math, computer science puzzlesIt is always helpful during the interviews, if you have a habit of solving puzzles, and especially if you have seen a similar puzzle before. 3) Soft SkillsApart from the technical knowledge, it is always important ( especially in the terribly competitive environments) to get a few small things correct.For example:No interviewer will start bombarding you with puzzles, he would always ask to introduce yourself. In such cases, it is generally a good idea to prepare a short 30-40 sec introduction ( not too long, he is not interested in your biography), which will highlight things about you which will be useful for the company. Also, every interviewer will generally end by asking the candidate if he has any questions. It is always good to be prepared with 1-2 questions to ask the interviewer, as it does have an impact. The level of expertise required while working as an Analyst largely depends upon the Group you are working with.Since, your question pertains to skills which are looked for during recruitment, I would stick to the same. Generally the skills which the interviewer sees are:( not just GS, but any firm hiring for a quantitative analyst position)1) Decent Programming Skills:Even if you are a  data analyst and dream of using mathematics for cool stuff, you would of course have to implement the same as a code for it to be useful and used in production. Thus, generally companies hiring for data ana Continue Reading",2021-03-06T06:49:11.584Z,"What does Goldman Sachs look for in a data analyst? ",Quora
60432601ed76476feda243ac,https://www.quora.com/How-can-I-start-my-career-as-a-data-analyst-as-a-fresher?-,"Hi, Thanks for A2A! So, What do you think, why and how do people get calls for interviews and jobs? Did any of your friends receive a call for job or interviews? Why do I receive so many messages on LinkedIn[1], Angel List[2] and CofoundersLab [3]for engineering and co-founder roles? Answer is simple:You need to have a strong resume, good networking and little leadership/management quality. You have not mentioned anything about yourself so I’m just considering you are a fresher and looking for jobs. So let’s breakdown each and go in-depth. A Solid Resume:A solid resume contains At least one internship (IContinue ReadingFootnotes[1] https://www.linkedin.com/in/vikeshtiwari[2] Vikesh Tiwari [3] Vikesh Tiwari...Hi, Thanks for A2A! So, What do you think, why and how do people get calls for interviews and jobs? Did any of your friends receive a call for job or interviews? Why do I receive so many messages on LinkedIn[1], Angel List[2] and CofoundersLab [3]for engineering and co-founder roles? Answer is simple:You need to have a strong resume, good networking and little leadership/management quality. You have not mentioned anything about yourself so I’m just considering you are a fresher and looking for jobs. So let’s breakdown each and go in-depth. A Solid Resume:A solid resume contains At least one internship (It’s totally ok, if you don’t have any focus on next points)Knowledge of programming languages, frameworks, AWS, Docker etc.Few super amazing projects which helps other people and involve use of latest technologies. - Python, Go, nodejs, APIs, AWS, shell scripting etc.Few contributions to good open source projectsAchievements in programming, Hackathons, Competitive Programming etc. (To prove you’re good in Algorithms and Data structure)Activities which show you have some leadership qualities.Why networking is important? Networking is extremely and very effective in getting a job or internship. You don’t know when and where you may need someone’s help. Good networking will get you referrals, recommendations etc. Connect with people on LinkedIn, Facebook, Quora, Angel List and ask questions to them.Read more about them first and then write a small message introducing yourself explaining how you can help or contribute in their projects/work etc.Show them your skills and qualities.People usually feel good when you have already done your research about them and give them any suggestions, idea in their projects/work.Don’t start spamming, wait for response at least for 2 weeks before you do a follow up.Attend meet ups, Hackathons, tech talks and conference near you.One is always better than zero so at least try, there is no harm in this. Lastly, leadership will give you much bigger opportunities than just 9 to 5 jobs in front of computer. Work on personal development, it helps a lot in the long term. I hope I answered your question. Thank you! ~ VikeshFounder | Eulercoder - Lastest articles on Computer Science, Internship, Jobs and the web.CTO | SpeedboxPreviously worked at - Slack in San Francisco and Directi (2) in Mumbai. Footnotes[1] https://www.linkedin.com/in/vikeshtiwari[2] Vikesh Tiwari [3] Vikesh Tiwari... Hi, Thanks for A2A! So, What do you think, why and how do people get calls for interviews and jobs? Did any of your friends receive a call for job or interviews? Why do I receive so many messages on LinkedIn[1], Angel List[2] and CofoundersLab [3]for engineering and co-founder roles? Answer is simple:You need to have a strong resume, good networking and little leadership/management quality. You have not mentioned anything about yourself so I’m just considering you are a fresher and looking for jobs. So let’s breakdown each and go in-depth. A Solid Resume:A solid resume contains At least one internship (IContinue ReadingFootnotes[1] https://www.linkedin.com/in/vikeshtiwari[2] Vikesh Tiwari [3] Vikesh Tiwari...",2021-03-06T06:49:37.975Z,"What should I do to get interview calls? ",Quora
60432615ed76476feda243be,https://www.quora.com/What-are-the-biggest-frustrations-that-data-analysts-face?-,"If 'my' data is   self-describingunambiguouswell-documentedconstantrelatively small in terms of number of data pointsalways accessiblestored in a common, well-understood, widely accepted standard formatopenly governedI don't have any 'problems' with it. If these premises do not hold, I will probably run into any of the following issues  I need to make sense of data types and data layout.I need to find out whether X really means X or maybe is it something else but then what could this something else be?I may need to ask around what the 'container name fp_00I' really means. Is it just an arbitrary Continue ReadingIf 'my' data is   self-describingunambiguouswell-documentedconstantrelatively small in terms of number of data pointsalways accessiblestored in a common, well-understood, widely accepted standard formatopenly governedI don't have any 'problems' with it. If these premises do not hold, I will probably run into any of the following issues  I need to make sense of data types and data layout.I need to find out whether X really means X or maybe is it something else but then what could this something else be?I may need to ask around what the 'container name fp_00I' really means. Is it just an arbitrary sequence of floats or is there anything real behind it (maybe something domain specific )?I may need to think about how is the history of some value represented, what happens to data, which is linked to this value. I may need to think about how fast data changes. How fast is this changed visible to me, must I make sure that I take those changes into account. What is relevant only the latest and greatest or the n latest. I may need to ask myself whether the means to access, crunch and store my data are sufficient, or should I move my data some place else, should I partition my data, should I put it all in one place. Haa great I did that now my stupid algorithm crashes because ... what the data is current being locked by what?Am I really the only one accessing this data and it does not matter that I shut down my laptop at 3 in the afternoon or is there someone else who would like to get her hands on that great predictive model I said I was developing.Paah everything is accessible via an API today. If nobody knows maybe Mashable or Quora knows. But why did they give me this crude set of 1GB files I should analyse?! This is not cool. Well let's open it in my favority text editor, the one wich can display that lovely 3D cube  - hmm crashes. Well let's see what the Google says about this file extension, ahhhaaa I should read it like this when this and like this when that and ... what was the first like this again ... So I might think about file format layout and file format interpretation (and the boss said you'd better make it read fast).Well, I have been going to meetings the past 3 weeks, each time asking this guy from the XYZ department to deliver that data file we need. He always says that there is something he needs to do first. Well I'll trust him, since it is in his interest that we want to prove to his boss that his department is a waste of money. Anyhow, I am confident that he is going to deliver that data tomorrow. Well if we eventually tell him the under performers in his department, he might be more cooperative?!Well you see, there are many kinds of frustrations ... technical, domain-model, process, legal, human or algorithmical. Either way I suppose there are many more challenges you may think of. If 'my' data is   self-describingunambiguouswell-documentedconstantrelatively small in terms of number of data pointsalways accessiblestored in a common, well-understood, widely accepted standard formatopenly governedI don't have any 'problems' with it. If these premises do not hold, I will probably run into any of the following issues  I need to make sense of data types and data layout.I need to find out whether X really means X or maybe is it something else but then what could this something else be?I may need to ask around what the 'container name fp_00I' really means. Is it just an arbitrary Continue Reading",2021-03-06T06:49:57.317Z,"What are the biggest frustrations that data analysts face? ",Quora
60432626ed76476feda243d0,https://www.quora.com/Can-learning-sql-help-me-become-a-data-analyst?-,"Yes. it is need to learn SQL, because now a days SQL has the high demand in the market. SQL stands for Structured Query Language. SQL is a programming language that lets you communicate with databases to store, manipulate, and retrieve data, and also modify the structure of the database. A database can be considered as a container for tables and a table is a grid with rows and columns to hold data. Individual statements in SQL are called queries. If anyone wants to learn SQL, here there is no need of any prerequisites . you can directly learn SQL . you should know all main concepts in SQL clearl Continue Reading Yes. it is need to learn SQL, because now a days SQL has the high demand in the market. SQL stands for Structured Query Language. SQL is a programming language that lets you communicate with databases to store, manipulate, and retrieve data, and also modify the structure of the database. A database can be considered as a container for tables and a table is a grid with rows and columns to hold data. Individual statements in SQL are called queries. If anyone wants to learn SQL, here there is no need of any prerequisites . you can directly learn SQL . you should know all main concepts in SQL clearly . Main Concepts of SQL : What is a database? What is MySQL?Introduction to MySQL & MySQL workbenchIntroduction To Database DesignLearn Database Normalization with the help of a case studyLearn ER Modeling with a Case StudyHow To Create A Database & MySQL Data TypesHow to use SELECT in MySQLHow to query data using Where clause in MySQLHow to use Insert Into in MySQLHow to Delete & Update data in MySQLIf you want to learn SQL , Here i recommend you Best SQL Online Courses #1 The Complete SQL Bootcamp #2 The Complete Oracle SQL Certification Course",2021-03-06T06:50:14.407Z,"Can learning sql help me become a data analyst? ",Quora
60432646ed76476feda243ee,https://www.quora.com/What-is-the-difference-between-a-data-scientist-and-a-business-intelligence-analyst?-,"Victor Minh Duc Luu Earlier this year, I was part of a research team that compiled the 2015 Skills & Salary Report for the IAPA (Institute of Analytics Professionals Australia). I will attempt to answer this question generally to provide some intuition, then share a bit of data. But first, let me put up a Venn diagram.  My random forest predicts you rolling your eyes. But bear with me.   I expect many of the readers of this question have come across the other data science Venn of 'hacking skills', 'math and statistics' and 'substantive expertise'. That's a great picture. The problem is that is does not tell you about  Continue ReadingEarlier this year, I was part of a research team that compiled the 2015 Skills & Salary Report for the IAPA (Institute of Analytics Professionals Australia). I will attempt to answer this question generally to provide some intuition, then share a bit of data. But first, let me put up a Venn diagram.  My random forest predicts you rolling your eyes. But bear with me.   I expect many of the readers of this question have come across the other data science Venn of 'hacking skills', 'math and statistics' and 'substantive expertise'. That's a great picture. The problem is that is does not tell you about roles. And with many self-branded data scientists, it gets messy. (The other problem is, well, you try putting any diagram with 'hacking skills' in front of IT departments in large companies and let me know how you go.) So I use this diagram. It is taken from a masters course I am completing, and it was developed by industry professionals in the analytics field. But more importantly, it has roles in the overlaps :)  The answer to this question is in the Venn, but first it is also worth looking at the commonalities.  Both data scientists and BI analysts do visualizations.  Tools are just tools.  BI analysts may be part of deploying a visualisation (or a few of them in a dashboard) in a 'production' environment more than data scientists. But they certainly both 'do' (conceptualize, design and build) visualizations.  Both data scientists and BI analysts work with data sources.  Managing data is just managing data.  Some may work with traditional data warehousing technologies, star schemas, normalised tables and BI cubes. Some may work with more modern distributed or cloud based storage technologies. But they both work with data sources. Both data scientists and BI analysts do programming.  Coding is just coding.  Loading a modelling library in python, writing up scripts or SQL queries to perform and check ETL, or building a D3 app may typically exist in very different parts of an analytics project pipeline. But they all require programming skills. But in addition to that, data scientists are expected to be statistically literate, run experiments, interpret data with a mind on causation and - most often - do modelling. That is the main distinction in my mind, and the high level answer to this question. I am sure BI analysts can do these things if they want to, and I do not doubt that many of them have the capability to. But they would not be responsible for it.  Experimentation, statistical interpretation, plus building, testing and using models - whether they are statistical, optimisation, time series or machine learning - sit primarily with data scientists.    Secondly, at the more detailed level, you will see that these high level statements mask many exceptions. This also partially explains the variability of answers to this question. At the industry level, you will see that the categorisation is full of phrases like 'more likely', 'most common', etc.  This is the underlying reality. There are no absolutes in tools or skills. But this gives a bit more of a flavour of the differences between BI and data scientist roles (at least in the Australian market).    You are welcome to download the paper here. p.s. To the question details, IMHO it is not at all surprising that there are many people 're-branding' into data science. When you put together a higher salary package with a nascent space often misunderstood by recruiters and hiring companies, there are opportunities for people to opportunistically 'trade up'. It is unfortunate as that ultimately hurts the profession, but things are maturing quickly and I hope hiring practices will tighten up soon.",2021-03-06T06:50:46.891Z,"What is the difference between a data scientist and a business intelligence analyst? ",Quora
