"_id",job_link,answer,date,question,source
60431ca5ed76476feda23cd0,https://www.quora.com/How-do-I-become-a-data-analyst?-,"Hi! Before I answer your question, let us understand who is a data analyst? So a Data Analyst is someone who delivers value to their companies by taking information about specific topics and then interprets, analyzes, and presents findings in comprehensive reports. As experts, data analysts are often called on to use their skills and tools to provide competitive analysis and identify trends within industries.  Now, let us see what of the tasks that they will have to perform Gather Hidden Insights – Hidden insights from data are gathered and then analyzed concerning business requirementsGenerate RepContinue ReadingHi! Before I answer your question, let us understand who is a data analyst? So a Data Analyst is someone who delivers value to their companies by taking information about specific topics and then interprets, analyzes, and presents findings in comprehensive reports. As experts, data analysts are often called on to use their skills and tools to provide competitive analysis and identify trends within industries.  Now, let us see what of the tasks that they will have to perform Gather Hidden Insights – Hidden insights from data are gathered and then analyzed concerning business requirementsGenerate Reports – Reports are generated from the data and are passed on to the respective teams and individuals to deal with further actions for a high rise in businessPerform Market Analysis – Market Analysis can be performed to understand the strengths and weaknesses of competitorsImprove Business Requirement – Analysis of Data allows improving Business to customer requirements and experienceAnswering your question on “How do I become a data analyst?” If you can collect data from various sources, analyze the data, gather hidden insights, and generate reports, then you can become a Data Analyst! You must be well versed with most of the tools and languages mentioned below: R programming – This tool is the leading analytics tool used for statistics and data modeling. R compiles and runs on various platforms such as UNIX, Windows, and Mac OS. It also provides tools to automatically install all packages as per user-requirementPython – Python is an open-source, object-oriented programming language that is easy to read, write, and maintain. It provides various machine learning and visualization libraries such as Scikit-learn, TensorFlow, MatPlotLib, Pandas, Keras, etc. It also can be assembled on any platform like an SQL server, a MongoDB database, or JSONTableau Public – This is free software that connects to any data source such as Excel, corporate Data Warehouse, etc. It then creates visualizations, maps, dashboards, etc with real-time updates on the webQlikView – This tool offers in-memory data processing with the results delivered to the end-users quickly. It also offers data association and data visualization with data being compressed to almost 10% of its original sizeSAS – A programming language and environment for data manipulation and analytics, this tool is easily accessible and can analyze data from different sourcesMicrosoft Excel – This tool is one of the most widely used tools for data analytics. Mostly used for clients’ internal data, this tool analyzes the tasks that summarize the data with a preview of pivot tablesRapidMiner – A powerful, integrated platform that can integrate with any data source types such as Access, Excel, Microsoft SQL, Tera data, Oracle, Sybase, etc. This tool is mostly used for predictive analytics, such as data mining, text analytics, MLKNIME – Konstanz Information Miner (KNIME) is an open-source data analytics platform, which allows you to analyze and model data. With the benefit of visual programming, KNIME provides a platform for reporting and integration through its modular data pipeline conceptOpenRefine – Also known as GoogleRefine, this data cleaning software will help you clean up data for analysis. It is used for cleaning messy data, the transformation of data, and parsing data from websitesApache Spark – One of the largest large-scale data processing engine, this tool executes applications in Hadoop clusters 100 times faster in memory and 10 times faster on disk. This tool is also popular for data pipelines and machine learning model developmentAs a data analyst you must also be an expert in some of the roles given below: 1.Determine Organizational Goals: One of the first and most important roles of a Data Analyst is to determine the Organization’s Goal. That involves working with: IT TeamsManagementData Scientists2. Mining Data Data mining is a process to structure the raw data and formulate or recognize the various patterns in the data through mathematical and computational algorithms. It helps to generate new information and unlock the various insights. Data Analysts have to often mine or collect data. Getting data from the company database or extracting it from external sources to do any sort of research is one of the major roles of any Data Analyst. 3. Data Cleaning Data cleansing is the first step in the overall data preparation process and is the process of analyzing, identifying, and correcting messy, raw data. When analyzing organizational data to make strategic decisions Data Analysts must start with a thorough data cleansing process. The good analysis rests on clean data–it’s as simple as that. Cleaning involves removing data that may distort your analysis or standardizing your data into a single format. 4. Analyzing Data  Needless to say, this role is a must for any Data Analyst. Data analytics is the art of exploring the facts from the data with specific to answer a specific question. It is the process of evaluating data using analytical and logical reasoning to examine each component of the data provided. One uses statistical tools to analyze and interpret the data. There are various tools and programming languages used in the analysis. 5. Pinpointing Trends and Patterns  A large time of a Data analyst is spent on finding trends, correlations, and patterns in the complicated datasets. Trends are also important. Data Analysts look for both short-term and long-term trends. Trend analysis helps you understand how your business has performed and predict where current business operations and practices will take you. Done well, it will give you ideas about how you might change things to move your business in the right direction. 6. Creating Reports with Clear Visualizations  Reporting translates raw data into information. Reporting helps companies to monitor their online business and be alerted to when data falls outside of expected ranges. Good reporting should raise questions about the business from its end users. Being able to tell a compelling story with data is crucial to getting your point across and keeping your audience engaged. For this reason, data visualization can have a make-or-break effect when it comes to the impact of your data. Analysts use eye-catching, high-quality charts, and graphs to present their findings clearly and concisely. 7. Maintaining Databases and Data Systems  Data Analysts have to ensure that the storage, availability, and coherence of electronically stored data meet an organization’s needs. Data Analyst needs to have technical expertise regarding data models, database design development to make the best use of it. Always remember to master one or a few skills, Aim to be a master of one rather than a juggler of all! Check out this video for more information  All the best! Hi! Before I answer your question, let us understand who is a data analyst? So a Data Analyst is someone who delivers value to their companies by taking information about specific topics and then interprets, analyzes, and presents findings in comprehensive reports. As experts, data analysts are often called on to use their skills and tools to provide competitive analysis and identify trends within industries.  Now, let us see what of the tasks that they will have to perform Gather Hidden Insights – Hidden insights from data are gathered and then analyzed concerning business requirementsGenerate RepContinue Reading",2021-03-06T06:09:41.002Z,"How do I become a data analyst? ",Quora
60431cc3ed76476feda23cdb,https://www.quora.com/What-is-the-difference-between-a-data-analyst-and-a-data-scientist?-,"Data analyst is anyone who works with data to derive actionable insights. Overall trend is moving towards using data scientist term more than data analysts for such professional. Some companies don’t differentiate between a data scientist and analytics professional (or data analysts) and use these terms interchangeably to define their team members. On the other hand, significant number of companies do have this differentiation. In general, here are the factors that in my opinion can separate the two.  However for being successful either as a Data Scientist or Business Analytics Or Data Analyst prof Continue ReadingData analyst is anyone who works with data to derive actionable insights. Overall trend is moving towards using data scientist term more than data analysts for such professional. Some companies don’t differentiate between a data scientist and analytics professional (or data analysts) and use these terms interchangeably to define their team members. On the other hand, significant number of companies do have this differentiation. In general, here are the factors that in my opinion can separate the two.  However for being successful either as a Data Scientist or Business Analytics Or Data Analyst professional, following are the must have skills- Love for numbers and quantitative stuffGrit to keep on learningLove for coding and programmingStructured thinking approachPassion for solving problemsGood knowledge of statistical conceptsHere are my Top 10 Pointers to ensure durable success in either field- Learn as much as possible. Spend 4 to 5 hours every week on the learning and development and knowing the latest in the industryChallenge status quo. Never assume that whatever is being done is following the most effective approachBelieve that you are equal to everybody else in the hierarchy. Don’t be afraid to speak your mindFocus on Innovation and coming out with the earth shattering ideas rather than doing the business as usual.Focus on developing great communication skills and soft skill as this is one of the biggest gap I have seen in the analytics professionalsDon't become a one trick pony. try to get exposure in different industries and different functional areas.Participate in competitions and events such as Kaggle, to know where you stand vis a vis your peer group.Try to write white papers and blogs on your subject matter expertise.Develop domain expertise as without that analytics is not effective.Finally, always maintain a clear visibility of your strength and opportunities and any blind spots. Actively seek feedback from your peer group and your superiors.Hope this helps. Cheers! Thanks for your upvotes in advance. They Keep me going! Thank You! Disclaimer: The views expressed here are solely those of the writer in his private capacity. Data analyst is anyone who works with data to derive actionable insights. Overall trend is moving towards using data scientist term more than data analysts for such professional. Some companies don’t differentiate between a data scientist and analytics professional (or data analysts) and use these terms interchangeably to define their team members. On the other hand, significant number of companies do have this differentiation. In general, here are the factors that in my opinion can separate the two.  However for being successful either as a Data Scientist or Business Analytics Or Data Analyst prof Continue Reading",2021-03-06T06:10:11.336Z,"What is the difference between a data analyst and a data scientist? ",Quora
60431cd4ed76476feda23ce1,https://www.quora.com/Who-are-data-analysts?-,"Rohit Kshirsagar Like I always do when asked to answer a question, I googled your question and found that there are quite a few good links which can answer your question better than I have below. You might want to go through these results: Google I am hoping better answers follow but here's a little something from a reporting squirrel: Simply put data analysts are people who are hired to draw insights from data.Their role includes but is not limited to: Collecting data (and probably automating the data collection)Use tools like Excel (at the very basic level) to generate charts/reports which help them summarize Continue ReadingLike I always do when asked to answer a question, I googled your question and found that there are quite a few good links which can answer your question better than I have below. You might want to go through these results: Google I am hoping better answers follow but here's a little something from a reporting squirrel: Simply put data analysts are people who are hired to draw insights from data.Their role includes but is not limited to: Collecting data (and probably automating the data collection)Use tools like Excel (at the very basic level) to generate charts/reports which help them summarize the data or look for trendsGenerating reports from the data for decision makers (Managers et al) .This is of course a very low level description of the profile. But for the most part in India at least, you will not find a data analyst go beyond using descriptive statistics.  In terms of skills, being able to use a spreadsheet software like MS Excel and writing SQL queries is a must-have.Also, having an inquisitive mind i.e. asking questions (to oneself and others), forming an hypothesis and then validating it with data, is a prerequisite.  One thing that goes unmentioned is that Data Analysts must have a good understanding about the company's working. This requires that you have at least one point of contact in various teams across the organization. This should get you started. (and those google search results will take you further). Also look for related questions which show  up on the right side  --> Continue Reading",2021-03-06T06:10:28.024Z,"Who are data analysts? ",Quora
60431ceeed76476feda23cf0,https://www.quora.com/What-is-the-job-description-of-a-data-analyst?-,"Sparsha Mishra, B.Tech Electronics and Instrumentation., Kalinga Institute of Industrial Technology (2021)Answered October 2, 2020 · Author has 611 answers and 223.1K answer views Sparsha Mishra Data Analyst interprets data and turns it into information that can offer ways to improve a business, thus affecting business decisions. A Data Analyst gathers information from various sources and interprets patterns and trends. Once data has been gathered and interpreted, the Data Analyst reports back what has been found in a comprehensive study to the business or his team. Data Analysts often make recommendations about the methods and ways in which a company obtains and analyses data to improve the quality and efficiency of data systems. A Data Analyst job description should include, but not b Continue ReadingData Analyst interprets data and turns it into information that can offer ways to improve a business, thus affecting business decisions. A Data Analyst gathers information from various sources and interprets patterns and trends. Once data has been gathered and interpreted, the Data Analyst reports back what has been found in a comprehensive study to the business or his team. Data Analysts often make recommendations about the methods and ways in which a company obtains and analyses data to improve the quality and efficiency of data systems. A Data Analyst job description should include, but not be limited to: Collecting and interpreting dataAnalyzing resultsReporting the results back to the relevant members of the businessIdentifying patterns and trends in data setsWorking alongside teams within the business or the management team to establish business needsDefining new data collection and analysis processesData Analyst job qualifications and requirements: A degree in the following subjects is beneficial in developing a career in data analysis: Mathematics Linear Algebra and Calculus – You can study from Khan Academy, MIT Open Courseware (MIT OCW), Udacity (Linear Algebra Refresher course), or use reference books like Advanced Engineering Mathematics by Kreyszig. Polishing your concepts on linear algebra will be helpful to understand many aspects of Machine Learning like hyper-parameter optimization, regularization functions, and cluster analysis. Linear Algebra | Khan AcademyLinear Algebra and Multivariable Calculus | Department of Mathematics Cornell Arts & ScienceVector Calculus – For Vector Calculus again you can follow the resources mentioned above. And Brilliant | Learn to think is also a very interactive application to help you with clearing the concepts on the same. Vector Calculus Courses | CourseraMultivariable Calculus | Khan AcademyStatistics – Along with the above-mentioned resources, you can complete the ""Intro to Statistics"" course on Udacity to furnish your statistical analyzing skills. Statistics are the most important chapter that every analyst needs to focus on without which you literally cannot do anything. There are also a number of qualities to expect from a candidate to flourish in a Data Analyst role: Experience in data models and reporting packagesAbility to analyze large datasetsAbility to write comprehensive reportsStrong verbal and written communication skillsAn analytical mind and inclination for problem-solvingAttention to intricate detailsResources for Data Analysis Courses: Digital Vidya offers a Certified Data Analysis course which is completely online.Online Data Analysis Courses | Harvard UniversityData Analyst Nanodegree | UdacityLearn Data Analysis with Online Courses | edXHope this helps. Good luck.",2021-03-06T06:10:54.388Z,"What is the job description of a data analyst? ",Quora
604321d5ed76476feda23f8d,https://www.quora.com/Can-a-position-as-a-data-analyst-lead-to-a-position-as-a-data-scientist?-,"Let me propose a simple view. We usually apply for a job X at team Y in company Z. This means we distinguish between the position for data analyst or data scientist at X. We also read about, hear about, work with, or recognize teams. These can call upon data science, analytics, business analytics, or similar departments in Y. Lastly, we learn about the market, government agencies, and a general facility for living in society. People hear about many companies on the public stock market, startups at areas that foster new companies, or government agencies and headquarters. We let Z fit into any o Continue ReadingLet me propose a simple view. We usually apply for a job X at team Y in company Z. This means we distinguish between the position for data analyst or data scientist at X. We also read about, hear about, work with, or recognize teams. These can call upon data science, analytics, business analytics, or similar departments in Y. Lastly, we learn about the market, government agencies, and a general facility for living in society. People hear about many companies on the public stock market, startups at areas that foster new companies, or government agencies and headquarters. We let Z fit into any of these places. You can vary each one, a suggested factor in X, Y, or Z. The simplest answer to your question means that someone with data analyst seeks data scientist in X. They might fix Y and Z during their development. They can satisfy the requirements, skill set, and people relationships toward data scientist in X among the context in Y and Z. If they seek a few more variable changes in Y or Z, they need to account for them. In a community of individuals, working in professions, agreeing to terms at companies, supporting public and private schools, and fostering a community for cities, they deal with a much larger context. In addition, individuals only in X work with city and state officials on behalf of tax collection, city planning, and state government and development. And of course, any person in X regardless of data analyst or data scientist profession, contributes to the federal government. My simple answer for you, without working many years, suggests I have little context to work with. I cannot draw from past experiences, common talks, and a knowledge about our intent. If someone in X talks, walks, and works like a data scientist in Y and Z, they can make the transfer from data analyst. Any more work with Y and Z, particular teams of people and tech, and companies in a market and federal government require investigation.",2021-03-06T06:31:49.310Z,"Can a position as a data analyst lead to a position as a data scientist? ",Quora
604321feed76476feda23fb8,https://www.quora.com/What-is-the-scope-of-data-analyst?-,"Ram Achal, Programmer Analyst at YoungsoftAnswered 4 years ago · Author has 376 answers and 2.3M answer views Ram Achal Data Analyst Responsibilities and Duties -  Coordinate with customers and staff and provide support to all data analysis.Perform audit on data and resolve business related issues for customer base.Coordinate with engineering and product management team and ensure accuracy on all deliverable and prepare summaries.Perform data analysis and facilitate in delivery to all end users. Supervise all client issues and coordinate with managers and supervisors and facilitate in deliverable.Administer all data for customer invoices and provide company metrics.Monitor and resolve all customer invoice data issContinue ReadingData Analyst Responsibilities and Duties -  Coordinate with customers and staff and provide support to all data analysis.Perform audit on data and resolve business related issues for customer base.Coordinate with engineering and product management team and ensure accuracy on all deliverable and prepare summaries.Perform data analysis and facilitate in delivery to all end users. Supervise all client issues and coordinate with managers and supervisors and facilitate in deliverable.Administer all data for customer invoices and provide company metrics.Monitor and resolve all customer invoice data issues and coordinate with various vendors and manage all previous balance. Organize all consumption anomalies and determine defects for data and prepare appropriate resolutions.Supervise process management tools and ensure compliance to all cycle guidelines.Maintain and document library of invoices and resolve all issues in same. Perform internal audit and prepare all invoices and determine quality improvement processes.Maintain and escalate issues to lead analyst if required.Technical Skills Statistical methods and packages (e.g. SPSS)R and/or SAS languagesData warehousing and business intelligence platformsSQL databases and database querying languages Programming (e.g. XML, Javascript or ETL frameworks)Database designData miningData cleaning and mungingData visualization and reporting techniques Working knowledge of Hadoop & MapReduceMachine learning techniquesThanks !!!",2021-03-06T06:32:30.469Z,"What is the scope of data analyst? ",Quora
