"_id",job_link,answer,date,question,source
60432854ed76476feda245b5,https://www.quora.com/Are-data-analysts-being-replaced-by-data-scientists?-,"Pavan Teja, Data scientist at IBM AnalyticsAnswered 2 years ago · Author has 132 answers and 827.5K answer views Pavan Teja At the end of the day what matters is getting the job done correctly. So, depending on the nature of the task at hand data analyst can, in fact, replace data scientist. As always let me illustrate with a simple example, I and one of my friend were debating the necessity of awareness of the government policies and their importance in choosing a leader. So I was trying to gather some data and researches. Let me present you with a snapshot of the data.  Now, some of the results about a few of the survey question as presented in the study. 39 71 Q1  Q2  Q3  Q4   And here is the summary they have submitted  Ok, He Continue Reading At the end of the day what matters is getting the job done correctly. So, depending on the nature of the task at hand data analyst can, in fact, replace data scientist. As always let me illustrate with a simple example, I and one of my friend were debating the necessity of awareness of the government policies and their importance in choosing a leader. So I was trying to gather some data and researches. Let me present you with a snapshot of the data.  Now, some of the results about a few of the survey question as presented in the study. 39 71 Q1  Q2  Q3  Q4   And here is the summary they have submitted  Ok, Here is the question, do you think the findings submitted are inferred correctly?? Here’s the difference between data scientist and data analyst: the data scientist would immediately identify that the second finding is flawed. That is because the sample sizes for both the populations are different hence a direct comparison will lead to similar incorrect findings. Here’s the data: https://www.researchgate.net/profile/Samita_Mahapatra/publication/322368568_A_Study_of_Awareness_among_Youth_about_Digital_India_Initiative/links/5a56473145851547b1bf143d/A-Study-of-Awareness-among-Youth-about-Digital-India-Initiative.pdf?origin=publication_detail  Here’s my conclusion: There’s no statistical significance to the result that either boys or girls are better aware than one another. This is the difference between data scientist and data analyst.",2021-03-06T06:59:32.669Z,"Are data analysts being replaced by data scientists? ",Quora
60432868ed76476feda245c5,https://www.quora.com/Should-I-be-a-web-developer-or-data-analyst?-,"Lakshminarayanan Ganesan, Software Architect, Entrepreneur, Life Hacker, Proud HinduAnswered 6 years ago · Author has 77 answers and 201.2K answer views Lakshminarayanan Ganesan These choices demand entirely different skill sets. Being a web developer requires that you are good at programming. Being a data analyst requires that you are really good at math and statistics. 1. If you have an interest in coding, you may want to look at improving your skill set by getting into web, app and API development (APIs are the future w.r.to software development) . You also have the option of becoming a developer or an architect for big data solutions thereafter. 2. If you have only math and statistics skills but no interest or skill in programming you may want to become a data analy Continue ReadingThese choices demand entirely different skill sets. Being a web developer requires that you are good at programming. Being a data analyst requires that you are really good at math and statistics. 1. If you have an interest in coding, you may want to look at improving your skill set by getting into web, app and API development (APIs are the future w.r.to software development) . You also have the option of becoming a developer or an architect for big data solutions thereafter. 2. If you have only math and statistics skills but no interest or skill in programming you may want to become a data analyst. Experienced data analysts (or data scientists) are rare and most sought after right now. Helps?",2021-03-06T06:59:52.357Z,"Should I be a web developer or data analyst? ",Quora
6043287aed76476feda245d6,https://www.quora.com/How-do-I-become-a-data-analyst-in-india?-,"Gopal Jaiswal, PGDM from IILM Gurgaon (2016)Answered 10 months ago · Author has 114 answers and 50.3K answer views Gopal Jaiswal Hi, Skills Required to Become Data Analyst In order to become a Data Analyst, it is essential to have good analytical, statistical and problem-solving skills.Since the profile requires rigorous research and pattern evaluation, you must also have a decent understanding of coding.Data visualisation and communication skills are also essential in order to perform well in the market.Decision making is another important skill that you are required to have in order to pursue a career as a Data Analyst.One should have experience in reporting packages and data models.It is important to possess the abilitContinue ReadingHi, Skills Required to Become Data Analyst In order to become a Data Analyst, it is essential to have good analytical, statistical and problem-solving skills.Since the profile requires rigorous research and pattern evaluation, you must also have a decent understanding of coding.Data visualisation and communication skills are also essential in order to perform well in the market.Decision making is another important skill that you are required to have in order to pursue a career as a Data Analyst.One should have experience in reporting packages and data models.It is important to possess the ability to analyse large datasets and write comprehensive reports.IILM University Gurugram offers Specialized MBA in Business Analytics MBA Business Analytics | IILM University, Gurugram The syllabus is created keeping in mind that by 2020, more than seven billion people and businesses and at least 30 billion devices will be connected to the internet. With people, businesses and things communicating, transacting, and even negotiating with each other, a new world with humongous data is generated. Taking business decisions based on data and IoT is the order of the day. How does it meet contemporary demands and job opportunities? The overall structure of this program is developed to provide students with the fundamental knowledge and equips them with a range of transferable skills which can be a potential value to future employers. The course will give a comprehensive understanding of the varied concepts and theoretical frameworks required for being a data analytics. This will be able to have a better capacity to think, observe, assess and critically analyze the data and extract meaningful information from it. This information about data is really important in today’s world. List of Courses Understanding of statistical methodsUse of R and/or SAS languagesDatabase designData mining and visualization for reportingMachine learning techniquesAnalytic problem solvingCreative thinkingKnowledge of chosen industry for research on dataBusiness intelligence and reportingData mining and visualizationAnalytic problem solvingEffective communicationCreative thinkingHope This Answer will help you.",2021-03-06T07:00:10.566Z,"How do I become a data analyst in india? ",Quora
6043288ced76476feda245e7,"https://www.quora.com/What-career-can-a-data-analyst-have-in-the-future?-After-years-of-data-mining,-what-role-can-the-data-analyst-take?-","Data Analyst roles are typically those roles which consist of using Excel and SQL and building MIS dashboards or MBRs/WBRs for the company in which they are working. While these roles are considered non-technical in general, some companies have different hierarchy and business titles where Data Analysts work in Predictive Algorithm development scenario. So, If someone has worked as a Data Analyst, depending upon the hierarchy, they can take several roles. For non-technical ones, they can be managing a team of Data Analysts in 4 to 5 years in an MNC and then 8–10 years down the line, they can be  Continue ReadingData Analyst roles are typically those roles which consist of using Excel and SQL and building MIS dashboards or MBRs/WBRs for the company in which they are working. While these roles are considered non-technical in general, some companies have different hierarchy and business titles where Data Analysts work in Predictive Algorithm development scenario. So, If someone has worked as a Data Analyst, depending upon the hierarchy, they can take several roles. For non-technical ones, they can be managing a team of Data Analysts in 4 to 5 years in an MNC and then 8–10 years down the line, they can be director of the operations department. For technical roles, if you have data mining experience, then you have multiple roles up for grab. if you can upskill yourself, Data visualization can be a good thing to Pursue. You can be a Tableau/ Power BI developer. If you have some experience in pre-processing the data, Data Engineering roles are high in demand. You can move to the Data Scientist role after having some coding experience. Data Analyst roles are typically those roles which consist of using Excel and SQL and building MIS dashboards or MBRs/WBRs for the company in which they are working. While these roles are considered non-technical in general, some companies have different hierarchy and business titles where Data Analysts work in Predictive Algorithm development scenario. So, If someone has worked as a Data Analyst, depending upon the hierarchy, they can take several roles. For non-technical ones, they can be managing a team of Data Analysts in 4 to 5 years in an MNC and then 8–10 years down the line, they can be  Continue Reading",2021-03-06T07:00:28.824Z,"What career can a data analyst have in the future? After years of data mining, what role can the data analyst take? ",Quora
6043289ded76476feda245f3,https://www.quora.com/What-is-the-scope-of-big-data-analyst-in-india?-,"Well the scenario for increasing role of Big Data based applications in business operations is quite promising. Simply imagine the scenario of Aadhar card data, which is stored and processed in big data frameworks. All this Aadhar data, is now actively used by multiple services like telecom domain, banking services, income tax services. So the overall purpose here is to track the usage of services by one billion individuals in India. To do the tracking in real time we need techniques on big data analytics, so that means the opportunity for professionals aiming to work in this big data analytics Continue ReadingWell the scenario for increasing role of Big Data based applications in business operations is quite promising. Simply imagine the scenario of Aadhar card data, which is stored and processed in big data frameworks. All this Aadhar data, is now actively used by multiple services like telecom domain, banking services, income tax services. So the overall purpose here is to track the usage of services by one billion individuals in India. To do the tracking in real time we need techniques on big data analytics, so that means the opportunity for professionals aiming to work in this big data analytics domain is vast. Similarly data driven companies like UBER, or e-commerce companies like Amazon generate a lot of data and again the need for professionals who can manage big data and who also can help perform automated analytics in real time on this data to derive business relevant insights is high. So you can start developing the relevant skills in Hadoop, Spark, No Sql technologies,Machine learning & Analytics domains, so that you can target the current in demand jobs in any data driven industry or company. Well the scenario for increasing role of Big Data based applications in business operations is quite promising. Simply imagine the scenario of Aadhar card data, which is stored and processed in big data frameworks. All this Aadhar data, is now actively used by multiple services like telecom domain, banking services, income tax services. So the overall purpose here is to track the usage of services by one billion individuals in India. To do the tracking in real time we need techniques on big data analytics, so that means the opportunity for professionals aiming to work in this big data analytics Continue Reading",2021-03-06T07:00:45.670Z,"What is the scope of big data analyst in india? ",Quora
604328b2ed76476feda24609,https://www.quora.com/Who-is-a-good-data-analyst?-,"Ram Achal Data Analyst Responsibilities and Duties -  Coordinate with customers and staff and provide support to all data analysis.Perform audit on data and resolve business related issues for customer base.Coordinate with engineering and product management team and ensure accuracy on all deliverable and prepare summaries.Perform data analysis and facilitate in delivery to all end users. Supervise all client issues and coordinate with managers and supervisors and facilitate in deliverable.Administer all data for customer invoices and provide company metrics.Monitor and resolve all customer invoice data issContinue ReadingData Analyst Responsibilities and Duties -  Coordinate with customers and staff and provide support to all data analysis.Perform audit on data and resolve business related issues for customer base.Coordinate with engineering and product management team and ensure accuracy on all deliverable and prepare summaries.Perform data analysis and facilitate in delivery to all end users. Supervise all client issues and coordinate with managers and supervisors and facilitate in deliverable.Administer all data for customer invoices and provide company metrics.Monitor and resolve all customer invoice data issues and coordinate with various vendors and manage all previous balance. Organize all consumption anomalies and determine defects for data and prepare appropriate resolutions.Supervise process management tools and ensure compliance to all cycle guidelines.Maintain and document library of invoices and resolve all issues in same. Perform internal audit and prepare all invoices and determine quality improvement processes.Maintain and escalate issues to lead analyst if required.Technical Skills Statistical methods and packages (e.g. SPSS)R and/or SAS languagesData warehousing and business intelligence platformsSQL databases and database querying languages Programming (e.g. XML, Javascript or ETL frameworks)Database designData miningData cleaning and mungingData visualization and reporting techniques Working knowledge of Hadoop & MapReduceMachine learning techniquesIf you have all these capabilities & Technicalities then consider yourself a good Data Analyst. Thanks !! Continue Reading",2021-03-06T07:01:06.543Z,"Who is a good data analyst? ",Quora
604328c4ed76476feda24619,https://www.quora.com/Is-data-analyst-in-global-logic-gurgaon-means-big-data-analyst?-,,2021-03-06T07:01:24.114Z,"Is data analyst in global logic gurgaon means big data analyst? ",Quora
604328d8ed76476feda2462a,https://www.quora.com/What-is-a-typical-day-of-as-a-data-analyst?-,"Sujit Senapati Hi Dhruv, Any data analyst or data miner as we say, does get a lot of data to interpret and solve it each day. For example, You reach the office, you start working on a business project where you have to come up with strategic points on how that business can solve a particular issue. So following are the daily routine (more or less) Creating a roadmap based on the spreadsheet where you have to come up with solution to solve the sales data using various statistical methodologies. It involves running the data, comparing previous sales figures, having multiple categories all using statistics in mind.Continue ReadingHi Dhruv, Any data analyst or data miner as we say, does get a lot of data to interpret and solve it each day. For example, You reach the office, you start working on a business project where you have to come up with strategic points on how that business can solve a particular issue. So following are the daily routine (more or less) Creating a roadmap based on the spreadsheet where you have to come up with solution to solve the sales data using various statistical methodologies. It involves running the data, comparing previous sales figures, having multiple categories all using statistics in mind.Collate all those solved data analysis on to a spreadsheet and categorise them with color coding and other necessary methods as required for the project.By this time it can be afternoon 1 PM if you start your day at 9 AM. It totally depends on the data set quantity, how big it is.Post lunch, You’ve finished the analysis of direct and indirect sales for the last month so now you will move onto gathering data on particular distributors and resellers(based on your project it can vary). From this data you will locate the most popular items, trends in the data, relationships that can be drawn from the findings and generally anything you do find that could be deemed as interesting or relevant.You have all of the data collected for the specific re-seller, and have created graphs and charts of relevant material. Now write in any notes that are relevant to the data, such as assumptions as to why some changes in sales occurred, and highlight trends and changes in sales and the re-seller’s buying patterns. This is important as these changes may not be obvious in the chart/graph set.So by now its evening 6.So it all depends on your project. Somedays you have fewer data to interpret and other days you slog longer hours pulling those data and making meaning out of it. A typical day cannot be defined for a data analyst but largely 80% of the time you would be trying to understand and solve your set of data and extracting it into a simpler form on an excel sheet. Happy Analysis.. Continue Reading",2021-03-06T07:01:44.182Z,"What is a typical day of as a data analyst? ",Quora
604328f9ed76476feda24642,https://www.quora.com/How-do-data-analysts-add-value-to-companies-such-as-Facebook-and-Twitter?-Provide-strong-examples.-,"Jeff Hammerbacher Some links to get this answer started... Yahoo! http://www.businessweek.com/magazine/content/06_41/b4004068.htmhttp://www.sfgate.com/cgi-bin/article.cgi?f=/c/a/2010/01/10/BUQP1BEDSM.DTLFacebook http://www.insidefacebook.com/2008/02/12/jeff-hammerbacher-on-facebook%E2%80%99s-approach-to-data-and-analytics/http://www.scribd.com/doc/18588637/Information-Platforms-and-the-Rise-of-the-Data-Scientisthttp://overstated.nethttp://dataspora.com/blog/predictive-analytics-using-r/http://www.zurb.com/article/515/podcast-of-julie-zhuos-talk-on-how-faceboTwitter http://www.slideshare.net/kevinweil/hadoop-piContinue ReadingSome links to get this answer started... Yahoo! http://www.businessweek.com/magazine/content/06_41/b4004068.htmhttp://www.sfgate.com/cgi-bin/article.cgi?f=/c/a/2010/01/10/BUQP1BEDSM.DTLFacebook http://www.insidefacebook.com/2008/02/12/jeff-hammerbacher-on-facebook%E2%80%99s-approach-to-data-and-analytics/http://www.scribd.com/doc/18588637/Information-Platforms-and-the-Rise-of-the-Data-Scientisthttp://overstated.nethttp://dataspora.com/blog/predictive-analytics-using-r/http://www.zurb.com/article/515/podcast-of-julie-zhuos-talk-on-how-faceboTwitter http://www.slideshare.net/kevinweil/hadoop-pig-and-twitter-nosql-east-2009http://www.slideshare.net/kevinweil/protocol-buffers-and-hadoop-at-twitterZynga http://tdwi.org/Blogs/WayneEckerson/2010/02/Zynga.aspxBooks http://www.amazon.com/Super-Crunchers-Thinking-Numbers-Smart/dp/0553805401http://www.amazon.com/Competing-Analytics-New-Science-Winning/dp/1422103323/http://www.amazon.com/Numerati-Stephen-Baker/dp/0547247931/http://www.amazon.com/gp/product/1422177696/Personal Experiences at FacebookSome things we did I thought added value; I'll add more as I think of them: Published a weekly Growth Report, which included a summary of the critical growth numbers for that week, some charts comparing raw numbers to previous weeks' numbers, and a detailed exploration of a single question about growth (e.g. ""Why are we growing so rapidly in Canada?).Automated tools for producing pre- and post-sales collateral for direct sales clients. For example, if Walmart wanted to advertise on Facebook, our account managers could type ""Walmart"" into a simple web interface and get a bundle of data about how our users related to the Walmart brand.Assisted in defining and building a few different a/b testing frameworks, which automated tests of significance and enabled engineers to rely on data for making small user interface decisions.Built out the backend and some of the frontend for the ""Insights"" product for ads, pages, and applications. Before ""Insights"", we also built out a product for advertisers who purchased Sponsored Groups (remember those?) called ""Group Intelligence"".Built a model for user navigation through the site which could be used as input for intelligent caching and prefetching of site content.Performed several longitudinal studies of user acquisition and retention which helped guide product decisions.Maintained data about special business development relationships which could be used for reporting and billing the third party.Helped define the platform application reputation scoring system, which automatically determines how many invitations, notifications, news feed story insertions, and other activities certain applications are allowed to take per week.Provide infrastructure and guidance to the search team for search quality analysis.Provide a shared infrastructure for the storage of arbitrary amounts of log and application data as well as systems for collecting and querying data.Built a ""social"" BI tool for internal users which allowed for easy charting of data sets and related discussions.Built a language classifier to determine what language a particular user was speaking on the site, using training data from Wikipedia.Worked with the ads team to fight spam and determine ad quality.Worked with the product marketing team on SEO/SEM strategies for advertiser acquisition.Worked with the infrastructure team to inject latency in to the site and evaluate the impact on pageviews and other site metrics.Conducted an analysis of motivations for content production: http://portal.acm.org/citation.cfm?doid=1518701.1518847Conducted an analysis of how content spread through the Facebook social graph: http://cameronmarlow.com/papers/gesundheit-modelingHelped assess the impact of PR stories about Facebook on site growth and user retentionServiced countless ad hoc questions about user and advertiser behavior on the siteInvestigated the impact of News Feed on site growth and user engagement in the days following the launch to determine what modifications, if any, should be made to the product given the negative reaction in the press and user communityBuilt and maintained an inventory estimation service for Facebook adsDuring a Hackathon, an enterprising Data team engineer and a current Quora engineer equipped a few folks with a brain-computer interface in search of a better quality metric for News Feed storiesBuilt two versions of the Lexicon service, which parsed meaningful data out of speech acts captured on the site (e.g. status updates, wall posts): http://www.facebook.com/lexicon/new. Some links to get this answer started... Yahoo! http://www.businessweek.com/magazine/content/06_41/b4004068.htmhttp://www.sfgate.com/cgi-bin/article.cgi?f=/c/a/2010/01/10/BUQP1BEDSM.DTLFacebook http://www.insidefacebook.com/2008/02/12/jeff-hammerbacher-on-facebook%E2%80%99s-approach-to-data-and-analytics/http://www.scribd.com/doc/18588637/Information-Platforms-and-the-Rise-of-the-Data-Scientisthttp://overstated.nethttp://dataspora.com/blog/predictive-analytics-using-r/http://www.zurb.com/article/515/podcast-of-julie-zhuos-talk-on-how-faceboTwitter http://www.slideshare.net/kevinweil/hadoop-piContinue Reading",2021-03-06T07:02:17.090Z,"How do data analysts add value to companies such as Facebook and Twitter? Provide strong examples. ",Quora
