"_id",job_link,answer,date,question,source
6041f662ed76476feda1a2af,https://www.quora.com/How-should-UX-designers-and-data-visualization-experts-work-together?-,"I am primarily a UX designer and one who specializes in information/data visualization. Here’s how I work with data visualization experts. The data visualization experts I’ve worked with are primarily data scientists. Scientific accuracy, exploration and identification of interesting and valuable data is the focus. While they are researching data, I am researching users. Then we work together to define parameters of data fidelity, architectures and user needs. What can we remove without degrading accuracy while improving clarity? This is where prototyping can be extremely valuable. Sampling data Continue ReadingI am primarily a UX designer and one who specializes in information/data visualization. Here’s how I work with data visualization experts. The data visualization experts I’ve worked with are primarily data scientists. Scientific accuracy, exploration and identification of interesting and valuable data is the focus. While they are researching data, I am researching users. Then we work together to define parameters of data fidelity, architectures and user needs. What can we remove without degrading accuracy while improving clarity? This is where prototyping can be extremely valuable. Sampling data, charting and getting user feedback is an effective iterative approach. While both fields are vast and bleed into one another it is not possible to say there is *one* way to work together effectively. Communication is key. As a designer it is important for me to know enough about data visualization to effectively communicate, addressing strategic and tactical design issues. Educating those I work with about UX design help identify common project goals. No one is an expert at all things but when you collaborate, understanding the big picture (both sides) is key. Having said all that, one difference might be in how each defines success: User Experience designer: efficiency, effectiveness; Data Visualization Expert: accuracy, novelty. It would be nice to hear more from the scientific visualization community as well.",2021-03-05T09:14:09.940Z,"How should UX designers and data visualization experts work together? ",Quora
6041f675ed76476feda1a2cd,https://www.quora.com/Who-are-some-of-the-very-best-data-visualization-experts-in-Chicago?-,,2021-03-05T09:14:29.123Z,"Who are some of the very best data visualization experts in Chicago? ",Quora
6041f688ed76476feda1a2f1,https://www.quora.com/How-do-we-become-a-data-visualization-expert?-,"I consider Data Visualization as a way to communicate your findings. With this simple approach, you can become an expert, and your demand in the market can go up. In today’s world of Data science, complex black-box algorithms, cloud computing one is missed by Top management of the company is easy to understand actionable insights and a person capable to do that. Obviously, such a person needs to poses the mindset of a Business Analyst and skill of a Visual Artist. If you can bring Actionable insight from complex data & communicate from your simple charts across domains (Sales, Operations & Finance ), across Industries (Retail, Banking & Manufacturing ) you are way ahead than others. In a nutshell, to become Visualization expert you have to Think like a Business AnalystVisualize like an artistCommunicate like a StorytellerAlso, keep it simple. No one likes to solve a piece of the puzzle. Industry wants you to solve it and present your findings. Here’s an example  Thank you Bhushan Ikhar | My Thoughts https://www.linkedin.com/in/ikharbhushan/",2021-03-05T09:14:48.622Z,"How do we become a data visualization expert? ",Quora
6041f706ed76476feda1a3bd,https://www.quora.com/What-is-the-future-job-market-for-data-visualization-experts?-,,2021-03-05T09:16:54.157Z,"What is the future job market for data visualization experts? ",Quora
6041f7d5ed76476feda1a4f8,https://www.quora.com/What-is-an-easy-read-and-entertaining-book-on-data-visualization-for-non-experts?-,"If want to learn how to create astonishing charts and graphs, Nathan Yau is the guide for you—especially if you are already familiar with graphic apps like Adobe Illustrator. Nathan Yau’s books Data Points: Visualization That Means Something and Visualize This: The FlowingData Guide to Design, Visualization and Statistics are great instructional manuals. They will show you how to visually represent statistical data in a way that makes sense to clueless people like me. But if you want examples of sheer artistry in the presentation of statistical data, see Edward Tufte’s The Visual Display of Quan Continue Reading If want to learn how to create astonishing charts and graphs, Nathan Yau is the guide for you—especially if you are already familiar with graphic apps like Adobe Illustrator. Nathan Yau’s books Data Points: Visualization That Means Something and Visualize This: The FlowingData Guide to Design, Visualization and Statistics are great instructional manuals. They will show you how to visually represent statistical data in a way that makes sense to clueless people like me. But if you want examples of sheer artistry in the presentation of statistical data, see Edward Tufte’s The Visual Display of Quantitative Information and Envisioning Information.  Tufte is professor emeritus of political science, statistics and computer science at Yale. His books present classic charts from around the world, like Charles Joseph Minard’s visual representation of France’s invasion of Russia. This famous chart shows how Napoleon’s Grande Armée destroyed itself after crossing the Neman River on June 24, 1812 (see above). I haven’t read Tufte’s Visual Explanations: Images and Quantities, Evidence and Narrative, but I’m told it’s good. Image: Visualize This: The FlowingData Guide to Design, Visualization and Statistics and Data Points: Visualization That Means Something by Nathan Yau | Photo: David Graham",2021-03-05T09:20:18.626Z,"What is an easy read and entertaining book on data visualization for non-experts? ",Quora
6041f81ced76476feda1a568,https://www.quora.com/Why-are-people-talking-about-data-science-jobs-gradually-losing-its-value?-,Philippe Bouaziz 42,2021-03-05T09:21:31.432Z,"Why are people talking about data science jobs gradually losing its value? ",Quora
6041f842ed76476feda1a5a5,https://www.quora.com/How-can-I-become-an-expert-in-visualization-data-science?-,Jacob S. Ellehauge  Colleen Farrelly,2021-03-05T09:22:10.536Z,"How can I become an expert in visualization data science? ",Quora
6041f860ed76476feda1a5d4,https://www.quora.com/Are-pie-charts-the-most-effective-for-viewing-data?-,"Pie charts work best for obscuring the fact your data is simultaneously sparse and uninteresting. The Worst Chart In The World How (and why) are pie charts considered ""evil"" by data visualization experts? death to pie charts Pie charts: the bad, the worst and the ugly. Countdown of Top 10 Reasons to Never Ever Use a Pie Chart 11",2021-03-05T09:22:39.993Z,"Are pie charts the most effective for viewing data? ",Quora
6041f871ed76476feda1a5f8,https://www.quora.com/What-are-the-most-beautiful-data-visualisations?-,"Aakanksha Mirdha, Product Designer @ UberAnswered 5 years ago Aakanksha Mirdha Beautiful data visualizations seem to have caught an attention like never before.With the coming together of art and information science, the interdisciplinary domain of data visualization not just intrigues anyone interested in studying data science or information design but equally mesmerizes a casual viewer. Below are some of my favorite data visualizations:  Scaled in Miles: Scaled in MilesThe Synapse: SPATIAL INFORMATION DESIGN LABNikeFuel Weather Activity: NikeFuel Weather ActivityBillion Dollar-O-Gram 3013: Billion Dollar-o-Gram 2013 - Information Is BeautifulApart from the above mentione Continue ReadingBeautiful data visualizations seem to have caught an attention like never before.With the coming together of art and information science, the interdisciplinary domain of data visualization not just intrigues anyone interested in studying data science or information design but equally mesmerizes a casual viewer. Below are some of my favorite data visualizations:  Scaled in Miles: Scaled in MilesThe Synapse: SPATIAL INFORMATION DESIGN LABNikeFuel Weather Activity: NikeFuel Weather ActivityBillion Dollar-O-Gram 3013: Billion Dollar-o-Gram 2013 - Information Is BeautifulApart from the above mentioned few, I would like to highlight David McCandless', author of the book ""Knowledge is Beautiful"". If you're an information scientist, a visualization expert or a designer, I would insist you on having a look at McCandless's work David McCandless.",2021-03-05T09:22:57.433Z,"What are the most beautiful data visualisations? ",Quora
6041f886ed76476feda1a61c,https://www.quora.com/What-agencies-or-individuals-are-working-in-interactive-web-based-data-visualization?-,"Hi, I work in the team of FineReport. And FineReport is a “professional, simple and flexible” enterprise reporting software developed by FanRuan Software Co., Ltd. architecturally designed based on ‘No-code’ concept. FineReport has 4 Parameter Query Functions to make the data visualization interactive. As Lewis Chou said, “In data visualization, in addition to visual presentation, there is a core element of human-computer interaction.” For high-dimensional multivariate data visualization systems, interaction is one of the essential elements. For example, if you want to view the sales of each mon Continue ReadingHi, I work in the team of FineReport. And FineReport is a “professional, simple and flexible” enterprise reporting software developed by FanRuan Software Co., Ltd. architecturally designed based on ‘No-code’ concept. FineReport has 4 Parameter Query Functions to make the data visualization interactive. As Lewis Chou said, “In data visualization, in addition to visual presentation, there is a core element of human-computer interaction.” For high-dimensional multivariate data visualization systems, interaction is one of the essential elements. For example, if you want to view the sales of each month, the general method is to make a report every month, and then put them together for comparison. But it is very troublesome to find and compare the data, and it is easy to make mistakes. If we use interactive visualization, we can use the filtering function to query the data at will, which is very convenient.  With FineReport, users can design complex, interactive reports and dashboards and construct data decision-making system through a clean drag-and-drop user interface. But how can we make visualizations interactive in charts or dashboards? At this time, we need to use the parameter query. You can refer to this article — 4 Parameter Query Functions to Make your Data Visualization Interactive which introduces four basic parameter query functions and the interaction scenarios they can be applied to.  (Note: All the pics in this post are made with FineReport. This visualization tool itself has a lot of parameter query functions and there is no need to write code. ) Hope my answer may let you know something about interactive visualization, It’s important to make your table or chart dynamic and to create relationships between different charts. Click here to get your free genuine FineReport. Hi, I work in the team of FineReport. And FineReport is a “professional, simple and flexible” enterprise reporting software developed by FanRuan Software Co., Ltd. architecturally designed based on ‘No-code’ concept. FineReport has 4 Parameter Query Functions to make the data visualization interactive. As Lewis Chou said, “In data visualization, in addition to visual presentation, there is a core element of human-computer interaction.” For high-dimensional multivariate data visualization systems, interaction is one of the essential elements. For example, if you want to view the sales of each mon Continue Reading",2021-03-05T09:23:18.813Z,"What agencies or individuals are working in interactive web-based data visualization? ",Quora
6041f8abed76476feda1a660,https://www.quora.com/What-popular-data-visualization-trends-do-Data-Scientists-hate?-,"Craig Brown, PhD Bad Data There’s an old principle in computer science: “Garbage In, Garbage Out”. In the context of data visualization, this means that bad data will lead to bad visualizations. Start with the basics: is your data clean? Use checks at every stage the data goes through — collection, sourcing, cleaning, and compiling — before it is visualized. Common errors include data duplication, missed data, NA values not marked, and so on. Wrong Choice of Data Visualization Once your data is ready, you should be careful about what type of visualization you use. Too Much Color or Information While it has been est Continue ReadingBad Data There’s an old principle in computer science: “Garbage In, Garbage Out”. In the context of data visualization, this means that bad data will lead to bad visualizations. Start with the basics: is your data clean? Use checks at every stage the data goes through — collection, sourcing, cleaning, and compiling — before it is visualized. Common errors include data duplication, missed data, NA values not marked, and so on. Wrong Choice of Data Visualization Once your data is ready, you should be careful about what type of visualization you use. Too Much Color or Information While it has been established that using different colors help people interpret data visualizations quicker, too much color can confuse the viewer. It is important to choose a limited number of colors — 5 is a good upper limit Misrepresentation of Data The biggest crime in data visualization is leading the viewer to a wrong interpretation. Inconsistent Scales You can, of course, represent multiple variables in a single data visualization. However, it is always a good practice to represent them on a single scale to avoid confusion. There are many many additional factors that can be said about data visualization where it is not a good fit. No technology offers solutions across all levels. The best way to approach DataViz is to use it where it helps and avoid it where it doesn’t. As the technology matures more and more capabilities will surface and where data visualization is not a good fit, that doesn’t mean that this is a permanent condition. Continue Reading",2021-03-05T09:23:55.684Z,"What popular data visualization trends do Data Scientists hate? ",Quora
6041f8eced76476feda1a6c9,https://www.quora.com/What-are-some-tips-for-making-a-great-data-visualization?-,"Getting better at data visualization doesn’t take a rocket scientist’s mind. Creating beautiful charts and intricate infographics may look like a pro designer’s job, but anyone with the willingness to learn and the drive to create can learn to make their own data visualizations (the right tools matter too!) A great way to kick things off is to pick the right resources- ones that are credible, knowledgeable, and verified by those in the field. I would usually recommend our blog on Visme (of which I founded to help empower everyone to communicate through data and visuals) for your data visualizat Continue ReadingGetting better at data visualization doesn’t take a rocket scientist’s mind. Creating beautiful charts and intricate infographics may look like a pro designer’s job, but anyone with the willingness to learn and the drive to create can learn to make their own data visualizations (the right tools matter too!) A great way to kick things off is to pick the right resources- ones that are credible, knowledgeable, and verified by those in the field. I would usually recommend our blog on Visme (of which I founded to help empower everyone to communicate through data and visuals) for your data visualization needs, but I will also recommend other valuable sources available in the market. These are also some of the sources I would look into whenever I would need to study or review: Tableau is one of the best data visualization tools today- they also have a well-curated blog filled with articles and lists recommending the best data visualization resources. Here’s a list with 10 recommendations you can look into. They even included the US Census and FEMA (who would have known!): https://www.tableau.com/learn/articles/best-data-visualization-blogs Towards Data Science is a leading publication in Medium that specializes in many topics that involve Data Visualization. I also contribute my own works as well. You can look around the blog for a specific article you would need, or you can start with this one: https://towardsdatascience.com/5-dataviz-blogs-to-follow-d30dbd90e52c We update our blog on Visme with charts on relevant topics (we even have one about Game of Thrones!) and articles listing tips on how to communicate your data with a visual flow. You can look around to start your own journey, or you can start with this article. It’s a great look into how you can transform boring numbers and charts into entertaining and informative data visualization: https://visme.co/blog/business-intelligence-visualization/. Getting better at data visualization doesn’t take a rocket scientist’s mind. Creating beautiful charts and intricate infographics may look like a pro designer’s job, but anyone with the willingness to learn and the drive to create can learn to make their own data visualizations (the right tools matter too!) A great way to kick things off is to pick the right resources- ones that are credible, knowledgeable, and verified by those in the field. I would usually recommend our blog on Visme (of which I founded to help empower everyone to communicate through data and visuals) for your data visualizat Continue Reading",2021-03-05T09:25:00.222Z,"What are some tips for making a great data visualization? ",Quora
60420292ed76476feda1b9d1,https://www.quora.com/What-computer-applications-use-the-data-visualization-ideas-of-Edward-Tufte?-,"Barry Rountree, Computer Scientist, LLNLAnswered 4 years ago · Author has 6.3K answers and 28.5M answer views Barry Rountree I'm a fan of Tufte, and I don't see his work as advocating one particular kind of visualization over another so much as careful thinking of what you want to visualize and the best methods to accomplish that.   I use R for my own visualization work because it gives me the ability to sketch out what I need a particular graph to look like and then translate that into code.  That can be a nine-dimensional heat map.  That can be three graphs in one image, each zooming out from the one before.  It can be star plots laid out in cartesian space.  It can be bar plots combined with scatterplots combined.  Continue ReadingI'm a fan of Tufte, and I don't see his work as advocating one particular kind of visualization over another so much as careful thinking of what you want to visualize and the best methods to accomplish that.   I use R for my own visualization work because it gives me the ability to sketch out what I need a particular graph to look like and then translate that into code.  That can be a nine-dimensional heat map.  That can be three graphs in one image, each zooming out from the one before.  It can be star plots laid out in cartesian space.  It can be bar plots combined with scatterplots combined. It's been ages since I did any serious visualization work in Excel, but what I remember was a much more cookbook approach:  so long as you wanted to do something anticipated by the creators of Excel, you could do so quickly and efficiently.  As soon as you wanted to do something a bit different, the wheels fell off. And that fine --- Excel is not targeted at data visualization experts.  But that's not where I'd be looking to see Tufte's influence.",2021-03-05T10:06:10.710Z,"What computer applications use the data visualization ideas of Edward Tufte? ",Quora
604202a7ed76476feda1b9f7,https://www.quora.com/How-can-anyone-start-a-career-in-data-visualization-and-what-is-the-required-skill-set-for-it?-,"Data visualization is such a new field that I think anyone with enough time can gain the knowledge of even the most expert data visualizer. I think the key is passion. A passionate, dorky, unrelenting interest in taking data and turning it into something.  It's extremely important to understand the cornerstones of thinking the field. As Alberto Cairo mentions, Edward Tufte and Stephen Few are sort of our ""wise old men"". They should form the foundation of your knowledge. Understanding the basic concepts of Data-Ink ratio, color perception, and statistics are crucial. If you're an absolute beginn Continue ReadingData visualization is such a new field that I think anyone with enough time can gain the knowledge of even the most expert data visualizer. I think the key is passion. A passionate, dorky, unrelenting interest in taking data and turning it into something.  It's extremely important to understand the cornerstones of thinking the field. As Alberto Cairo mentions, Edward Tufte and Stephen Few are sort of our ""wise old men"". They should form the foundation of your knowledge. Understanding the basic concepts of Data-Ink ratio, color perception, and statistics are crucial. If you're an absolute beginner, taking Tufte's one-day workshop wouldn't hurt (and you get all his books included). Find visualizations, from the oldest to the newest that you love. Find the patterns in things you love. Find inspiration in those things. Establish your taste. Become aware of the data visualization community online. There are excellent blogs like http://thewhyaxis.info/ and http://flowingdata.com/ and http://junkcharts.typepad.com/ that provide criticism of dataviz / infographics. Accumulate yourself a folder in your RSS reader with various dataviz blogs. Stay up-to-date with the current trends so you know how to keep your look fresh (ie, not like the things showing up in your RSS reader). Get to know dataviz folks on Twitter (here's my list: https://twitter.com/i/#!/mrejfox/infographics-dataviz ) - so you can know of upcoming events, newly released technologies or datasets, and the general buzz. Follow debates about best practices.  Start turning out projects. There's an insane amount of data in the world, so you have no excuses. Get a dataset and do something cool with it. Do that again and again. Keep finding things you get excited about, whether it's an exciting dataset, an exciting story, an exciting visualization technique, an exciting new piece of software, or an exciting new color-scheme. What's the required skillset? Passion. All of the knowledge needed can be gathered on your journey to making things you like. The best advice on this subject, I think, comes from Ira Glass http://writerunderground.com/2011/04/28/ira-glass-on-creativity-or-the-gap-between-our-taste-and-our-work/:  What nobody tells people who are beginners — and I really wish someone had told this to me . . . is that all of us who do creative work, we get into it because we have good taste. But there is this gap. For the first couple years you make stuff, and it’s just not that good. It’s trying to be good, it has potential, but it’s not. But your taste, the thing that got you into the game, is still killer. And your taste is why your work disappoints you. A lot of people never get past this phase. They quit. Most people I know who do interesting, creative work went through years of this...  ...It is only by going through a volume of work that you will close that gap, and your work will be as good as your ambitions. Data visualization is such a new field that I think anyone with enough time can gain the knowledge of even the most expert data visualizer. I think the key is passion. A passionate, dorky, unrelenting interest in taking data and turning it into something.  It's extremely important to understand the cornerstones of thinking the field. As Alberto Cairo mentions, Edward Tufte and Stephen Few are sort of our ""wise old men"". They should form the foundation of your knowledge. Understanding the basic concepts of Data-Ink ratio, color perception, and statistics are crucial. If you're an absolute beginn Continue Reading",2021-03-05T10:06:31.598Z,"How can anyone start a career in data visualization and what is the required skill set for it? ",Quora
604202bbed76476feda1ba21,https://www.quora.com/What-are-people-called-who-can-visualize-the-data?-,"Data Artist, Data Visualization Expert, Info-graphic Artist, Data-journalist, Information designer are few titles among others.",2021-03-05T10:06:51.501Z,"What are people called who can visualize the data? ",Quora
