"_id",job_link,answer,date,question,source
604360aded76476feda29712,https://www.quora.com/Do-you-need-a-license-to-fly-a-drone-for-professional-photography?-,"Yes, You need to be a certified remote pilot through the FAA to fly a drone for any type of compensation in any U.S. territory. The following is from Certificated Remote Pilots including Commercial Operators Certificated Remote Pilots including Commercial Operators If you have a small drone that is less than 55 pounds, you can fly for work or business by following the Part 107 guidelines. To fly under Part 107 rules, there are 3 main steps: Step 1: Learn the Rules Make sure you understand what is and is not allowed under Part 107 rules. Review a summary of the Part 107 rules (PDF) .Still unsure if PaContinue ReadingYes, You need to be a certified remote pilot through the FAA to fly a drone for any type of compensation in any U.S. territory. The following is from Certificated Remote Pilots including Commercial Operators Certificated Remote Pilots including Commercial Operators If you have a small drone that is less than 55 pounds, you can fly for work or business by following the Part 107 guidelines. To fly under Part 107 rules, there are 3 main steps: Step 1: Learn the Rules Make sure you understand what is and is not allowed under Part 107 rules. Review a summary of the Part 107 rules (PDF) .Still unsure if Part 107 rules work for you and your intended operation? Check our user identification tool.Some operations are not covered by Part 107 and will require a waiver. Here are some common examples of Part 107 sections that are subject to waiver:Operation from a moving vehicle or aircraft (§ 107.25) *Daylight operation (§ 107.29)Visual line of sight aircraft operation (§ 107.31) *Visual observer (§ 107.33)Operation of multiple small unmanned aircraft systems (§ 107.35)Yielding the right of way (§ 107.37(a))Operation over people (§ 107.39)Operation in certain airspace (§ 107.41)Operating limitations for small unmanned aircraft (§ 107.51)*The FAA will not waive this section to allow the carriage of property of another by aircraft for compensation or hire.If your operation will require a waiver, read about the Part 107 Waiver application process.Step 2: Become an FAA-Certified Drone Pilot by Passing the Knowledge Test To be eligible to get your Remote Pilot Certificate, you must be:At least 16 years oldAble to read, write, speak, and understand EnglishBe in a physical and mental condition to safely fly a UASReview the full process to get your Remote Pilot Certificate.Study for the Knowledge Test by reviewing the Test Prep materials provided by the FAA.Schedule an appointment to take the Knowledge Test at an FAA-approved Knowledge Testing Center (PDF).Once you've passed your test, complete FAA Form 8710-13 for a remote pilot certificate (FAA Airman Certificate and/or Rating Application) using the electronic FAA Integrated Airman Certificate and/or Rating Application system (IACRA)*Step 3: Register your Drone with the FAA Registration costs $5 and is valid for 3 years. You'll need a credit or debit card and the make and model of your drone handy in order to register.Visit dronezone.faa.gov and select ""Fly sUAS under Part 107"" to create an account and register your drone.Once you've registered, mark your drone with your registration number in case it gets lost or stolen.Remember: Always be sure to fly your drone safely and within FAA guidelines and regulations.It is up to you as a drone pilot to know the Rules of the Sky, and where it is and is not safe to fly.Aren't sure if Part 107 is right for you and your operation? Try our user identification tool or contact usfor more information.Page last modified: December 18, 2018 4:32:18 PM EST Yes, You need to be a certified remote pilot through the FAA to fly a drone for any type of compensation in any U.S. territory. The following is from Certificated Remote Pilots including Commercial Operators Certificated Remote Pilots including Commercial Operators If you have a small drone that is less than 55 pounds, you can fly for work or business by following the Part 107 guidelines. To fly under Part 107 rules, there are 3 main steps: Step 1: Learn the Rules Make sure you understand what is and is not allowed under Part 107 rules. Review a summary of the Part 107 rules (PDF) .Still unsure if PaContinue Reading",2021-03-06T10:59:57.425Z,"Do you need a license to fly a drone for professional photography? ",Quora
604360c2ed76476feda29738,https://www.quora.com/How-has-your-photography-career-been-helped-by-adding-drone-capability?-,"I’m at the stage of thinking that I can make enough off flying drones to pay for one or two of the collection. I had expected to be retired by now but stayed on to help out and revel in the double and triple-dipping to buy lots of drones. I regularly get asked for a card or asked if I can do this or that thing when I’’m out practicing my hobby. But, I don’t have the FAA 107 Remote Pilot Small UAV endorsement on my ancient commercial pilot certificate so I must avoid anything like commercial work, ie used for advertisement, and amuse myself, my friends, and some park managers with my hobby. In r Continue ReadingI’m at the stage of thinking that I can make enough off flying drones to pay for one or two of the collection. I had expected to be retired by now but stayed on to help out and revel in the double and triple-dipping to buy lots of drones. I regularly get asked for a card or asked if I can do this or that thing when I’’m out practicing my hobby. But, I don’t have the FAA 107 Remote Pilot Small UAV endorsement on my ancient commercial pilot certificate so I must avoid anything like commercial work, ie used for advertisement, and amuse myself, my friends, and some park managers with my hobby. In recent weeks I’ve seen a few articles where the FAA reports that of the certificates issued since the regulations were passed a few years ago, about 80% that have expired have not renewed. I see a lot of ads and eBay auctions for dream rigs that somebody could make a living with, maybe $20,000 of equipment going for dimes on the dollar. The best advice I can glean is you need a lot of drones to do work with drones, don’t go into debt to get them, and don’t quit your regular job until you’ve got your FAA 107 certificate and a good liability insurance policy. A nephew-in-law, an engineer who was making a good living surveying sites for his employer, including gas and power line inspections, got handed a P4 last year and given a week or two off to get his 107 Certificate. Now he sports about the region with a fleet of drones, smart ground reference points, and a GPS ground station to get high-definition maps, accurate to the centimeter out of his P4 RTK. It’s sure made a difference for his photography career. It’s too early to tell for mine… I’m at the stage of thinking that I can make enough off flying drones to pay for one or two of the collection. I had expected to be retired by now but stayed on to help out and revel in the double and triple-dipping to buy lots of drones. I regularly get asked for a card or asked if I can do this or that thing when I’’m out practicing my hobby. But, I don’t have the FAA 107 Remote Pilot Small UAV endorsement on my ancient commercial pilot certificate so I must avoid anything like commercial work, ie used for advertisement, and amuse myself, my friends, and some park managers with my hobby. In r Continue Reading",2021-03-06T11:00:18.780Z,"How has your photography career been helped by adding drone capability? ",Quora
604360dbed76476feda2976b,https://www.quora.com/Which-low-cost-drone-is-good-for-photography-and-taking-videos-in-India?-,Souradip Mukherjee Anish Debnath,2021-03-06T11:00:43.171Z,"Which low cost drone is good for photography and taking videos in India? ",Quora
60436107ed76476feda297bc,https://www.quora.com/Where-can-I-hire-a-wedding-aerial-photography-drone-pilot?-,"How do I start a drone photography business? Drones have single-handedly changed the aerial photography industry. Thanks to advanced technology and dropping drone prices, becoming a drone photographer is easier than ever. In fact, you can survey land, explore hard to reach places or even create a unique aerial video for the cost of a simple drone. Drones offer you the chance to capture stunning aerial shots and help improve your portfolio, get started can be a challenge. That’s why if you want to start your own drone photography business, you should follow these steps if you want to push ahead of the competition and be a success. 1. Learn  Continue ReadingDrones have single-handedly changed the aerial photography industry. Thanks to advanced technology and dropping drone prices, becoming a drone photographer is easier than ever. In fact, you can survey land, explore hard to reach places or even create a unique aerial video for the cost of a simple drone. Drones offer you the chance to capture stunning aerial shots and help improve your portfolio, get started can be a challenge. That’s why if you want to start your own drone photography business, you should follow these steps if you want to push ahead of the competition and be a success. 1. Learn the Basics This may seem obvious, but learning the basics about drones with cameras before starting your business can be helpful. Drones can be expensive. Investing a lot of money into something that may not work the way you expect it to may not be the best idea. 2. Experiment with Different Drone Genres to Find Your Favourite(s) This is one of the most important steps of your business plan. As mentioned before, drone photography comes with a lot of sub-genres. Here are just a few categories that drone photographers can get into: - Real estate - Surveillance - Agriculture - Weddings 3. Create a Checklist to Ensure a Smooth Operation Before you make your business official, you can make a list of everything you’d like to focus on. This can be a to-do list or simply a list of questions. The more prepared you are, the easier you’ll find it to keep your business strong, no matter what you experience. 4. Update Yourself on the Laws There are many places that have strict rules regarding drones, their flight patterns, and the types of images they can capture. This is especially true if you are near any private property, federal buildings, schools, or airports. 5. Build a Strong Portfolio to Highlight Your Skills Without an outstanding style, drone photos all look the same. You can naturally develop your style by taking lots of photos by drone photography. Experiment with different angles, heights, editing skills, and videography techniques. The more you do this, the closer you’ll get to discovering your unique preferences.",2021-03-06T11:01:27.634Z,"Where can I hire a wedding aerial photography drone pilot? ",Quora
60436187ed76476feda2989b,https://www.quora.com/Do-I-need-to-get-some-permission-for-using-drone-for-photography-in-Kolkata?-,"It depends on the place you fly. If its going to be within any educational institution within 200ft, no permission required. If you’re flying for a commercial purpose, you are required to get a local police permission, etc., For more information, refer recent DGCA regulations on RPA. -Hunter",2021-03-06T11:03:35.760Z,"Do I need to get some permission for using drone for photography in Kolkata? ",Quora
604361d3ed76476feda2991e,https://www.quora.com/Should-I-buy-a-drone-for-aerial-landscape-photography-work-to-enhance-my-normal-landscape-portfolio?-,"Q: Should I buy a drone for aerial landscape photography work to enhance my normal landscape portfolio? As a commercial operator and particularly as a customer. I’d want some sort of liability insurance, if you lose control you could easily damage property, cause injury and/or lose the drone. A quick quote suggests you (c|w)ould be looking at £30–45 per month for insurance (for a DJI Phantom 4) So the question you really need to answer is, can you can you make enough each month to cover insurance and recoup the expense of buying the equipment. A limited Googling suggests rates of £500/day is a g Continue ReadingQ: Should I buy a drone for aerial landscape photography work to enhance my normal landscape portfolio? As a commercial operator and particularly as a customer. I’d want some sort of liability insurance, if you lose control you could easily damage property, cause injury and/or lose the drone. A quick quote suggests you (c|w)ould be looking at £30–45 per month for insurance (for a DJI Phantom 4) So the question you really need to answer is, can you can you make enough each month to cover insurance and recoup the expense of buying the equipment. A limited Googling suggests rates of £500/day is a going rate. I also came across Advice to Consider When Starting an Aerial Photography Company - DRONELIFE which you may find interesting. Q: Should I buy a drone for aerial landscape photography work to enhance my normal landscape portfolio? As a commercial operator and particularly as a customer. I’d want some sort of liability insurance, if you lose control you could easily damage property, cause injury and/or lose the drone. A quick quote suggests you (c|w)ould be looking at £30–45 per month for insurance (for a DJI Phantom 4) So the question you really need to answer is, can you can you make enough each month to cover insurance and recoup the expense of buying the equipment. A limited Googling suggests rates of £500/day is a g Continue Reading",2021-03-06T11:04:51.019Z,"Should I buy a drone for aerial landscape photography work to enhance my normal landscape portfolio? ",Quora
60436212ed76476feda29994,https://www.quora.com/How-much-do-drone-pilots-charge-for-real-estate-photography?-,"There are a lot of factors that affect real estate drone photography. Some of these factors are the type of listings, Setup cost, Add on services, and many more. Based on a survey of last year’s costs for a real estate drone shoot it totaled; $150-$300 for 10 or less still images (no editing), $300-$1,000 for a 1-5 minute drone video, and $500-$1,000 for editing images or video.",2021-03-06T11:05:54.052Z,"How much do drone pilots charge for real estate photography? ",Quora
60436241ed76476feda299ed,https://www.quora.com/Is-it-okay-to-fly-a-drone-for-photography-in-the-Andaman-Islands-in-India?-,"Well if speaking in terms of photography. Using a drone for photography over Andaman Island is perfectly okey. I can assure you this because m also from Andaman and nicobar islands. But it greatly depends upon the drone also. can it withstand that atmospheric conditions and situation like it should have a better camera as it is sea shore hence lot luminating effect can occur. Saltyness in the air, better propeller for greater thrust as over water, thrust loss by propeller is more as compaired to land. If shooting over water. For this a better drone and professionals are required. For better res Continue ReadingWell if speaking in terms of photography. Using a drone for photography over Andaman Island is perfectly okey. I can assure you this because m also from Andaman and nicobar islands. But it greatly depends upon the drone also. can it withstand that atmospheric conditions and situation like it should have a better camera as it is sea shore hence lot luminating effect can occur. Saltyness in the air, better propeller for greater thrust as over water, thrust loss by propeller is more as compaired to land. If shooting over water. For this a better drone and professionals are required. For better results. DJI drones are always good for photography. I do recommend DJI phantom 4. But even thn one should concern a administrative officer",2021-03-06T11:06:41.829Z,"Is it okay to fly a drone for photography in the Andaman Islands in India? ",Quora
60436289ed76476feda29a68,https://www.quora.com/What-are-the-legal-limitations-associated-with-using-drones-for-amateur-aerial-photography?-,"This would be impossible to accurately answer since many towns and locates have their own regulations concerning model aircraft. That is, certain parks and beaches, etc. specifically exclude R/C aircraft. However, on a national level, the FAA just lost a case in court where they tried to tell a judge that a drone photographer was under their jurisdiction. Pilot wins case against FAA over commercial drone flight The FAA, in theory, has control over the airspace starting at the ground level - yes, even on your lawn and above your house. But they have failed to actually create the rules and regulations concerning this. As it stands, it's somewhat like the Wild West. That is, there is really little or nothing formal in legal limitations - rather there are some guidelines which are generally agreed upon and others which are common sense. The Academy of Model Aeronautics and the FAA have come to basic agreements about the safety of unmanned aerial hobby vehicles. These include:1. Flying within Line of Sight and under operator control - as opposed to complete autonomous control. In other words, flying miles away using GPS is not regarded as legal and/or common sense (insurable). 2. Staying under certain heights when within a few miles of an airport - 400 feet is suggested when within 3 miles of an airport. Lots of other regs - but these are not legal or illegal in the strictest sense, just that the FAA as well as other groups work closely with the AMA and they are in basic agreement. In fact, many FAA employees also fly model aircraft! Page on modelaircraft.org In summary, the basics are keep it in your control, keep it in sight and don't fly over people (except perhaps yourself)....",2021-03-06T11:07:53.464Z,"What are the legal limitations associated with using drones for amateur aerial photography? ",Quora
604362a2ed76476feda29a95,https://www.quora.com/Which-drone-is-best-for-travel-photography?-,Here are list of few best travel drones: DJI Mavic 2 ProDJI Mavic AirDJI Mavic Pro / Mavic Pro PlatniumDJI Phantom 4 & Phantom 4 ProDJI Spark.,2021-03-06T11:08:18.404Z,"Which drone is best for travel photography? ",Quora
604362baed76476feda29ac2,https://www.quora.com/Can-a-common-person-use-a-drone-for-photography-and-videography?-,"As long as you fly your drone legally, a common person can use a drone for photography and videography. Many people who could be considered amateurs/hobbyists, including myself, take tons of photos and videos using drones. You should just make sure that you are flying your drone legally by checking this map out. It’s a map created by DJI, a world leader in drone technology based out of China. To check out some of my work as examples of what an “amateur/hobbyist” can do with drones, check out my YouTube channel Thunderscape+Films.",2021-03-06T11:08:42.256Z,"Can a common person use a drone for photography and videography? ",Quora
604362d8ed76476feda29af7,https://www.quora.com/What-advice-can-commercial-drone-operators-provide-me-as-I-consider-flying-drones-for-commercial-photography?-,"G Saunders Go to federaldroneregistration.com, fill in the form, check the 8 boxes acknowledging basic safety rules, and get your fleet certificate number. Print the certificate, laminate it, plan to keep it with you because it’s enough to stop some complaints short. Put your fleet number on your drones, is required for any that weigh more than .55 pounds. Fly by the rules. Get a log book and start logging all your flights. Keep track of the locations, weather, and which drones and batteries you’re using. Get several drones and lots of batteries and SD cards and find places to fly where you can practice, p Continue ReadingGo to federaldroneregistration.com, fill in the form, check the 8 boxes acknowledging basic safety rules, and get your fleet certificate number. Print the certificate, laminate it, plan to keep it with you because it’s enough to stop some complaints short. Put your fleet number on your drones, is required for any that weigh more than .55 pounds. Fly by the rules. Get a log book and start logging all your flights. Keep track of the locations, weather, and which drones and batteries you’re using. Get several drones and lots of batteries and SD cards and find places to fly where you can practice, practice, practice, then review your videos and practice some more. Around here, a few parks and school yards were recommended to me by a police officer. They’re often empty and you can practice mundane stuff like tracing the infield or lines on the football field. Learn how to control the drone using the sticks, especially when it’s headed toward you. Start with cheaper drones like Parrot Bebop or DJI Spark so crashes aren’t so very expensive. Move up to Mavic Air or Pro to use for close in work, get an Inspire or two, or Yuneec Typhoon H, that can heft a really good camera over a large area. Think about getting a better camera with telephoto lens if you’re going to be doing inspections, maybe a thermal camera if you can swing it. Figure out how RTH - Return To Home works and keep it set appropriately for where you’re at. The default RTH under trees on a wooded lot is a sure way to self-destruct a drone, can be quick, or you can listen to it confused and chewing on leaves until the battery gives out. Investigate mapping apps like DroneDeploy. They do a good job of figuring out how many images they need to stitch together to make a detailed map, and can even make oblique passes and do a good job of detailing structures. You set up the mission on your tablet, do the checklist, push the button, and watch the app fly the mission, ready to take over manually if needed. They are no substitute for actually learning to fly the things, but they automate one of the most requested jobs. Airplane student pilots have a list of precision maneuvers like S turns across a road, turns about a point, pylon turns, a few kinds of take-offs and landings, and other ways to demonstrate flight skills for the practical exam. Commercial pilots add lazy 8s and chandelles to the list and get coached on exactly how the examiner wants them flown. I haven’t found a definitive list for drone pilots yet, but have spent a lot of time working to perfect things like scanning a roof, 8s around two light poles, reversing around a stake or tree, tracing lines on a soccer field. I also do a lot of zooming through the woods and following the creek bed, enough that I don’t crash much anymore. When you go for an insurance policy you might be asked for a demo video showing you can control the drone, or even the website you’ll use to show off your stuff. Practice working the camera and gimbal so you can fly scenes of a few or several minutes smoothly. Get Camtasia, Adobe Premiere or other video compositor so you can put video up that somebody would pay for. Photoshop or one of the specialized photo editors Start checking out study guides for FAA 107 Small UAS - Unmanned Aircraft Systems and plan to sit for the exam. When you’ve got the certificate, register each drone you’ll use commercially and find an insurance policy that suits what you’ll be doing. I think drones are harder to fly than sitting in a cockpit, even though the modern drones pretty much fly themselves. A private pilot certificate takes all of 30 to 40 hours to get proficient on the maneuvers and fly a few cross-country flights to work on navigation. Most students can be ready to fly solo in four or five hours, never pull a wrong lever, but it’s easier when you’re sitting in the thing you’re controlling. I learned to land in a couple hours when I was 9, barely able to see over the panel. Dad was a pilot that loved to see me operate his stuff. It took me more than eight hours before I could fly a figure eight with a drone without spazzing out and crashing into a shrub or tree. Enjoy it all, learn from the crashes. I hope this ramble helps you consider a commercial drone certificate? The other answers also bring up good points. Continue Reading",2021-03-06T11:09:12.564Z,"What advice can commercial drone operators provide me as I consider flying drones for commercial photography? ",Quora
