"_id",job_link,answer,date,question,source
6043510bed76476feda274ef,https://www.quora.com/What-is-Drone-Photography?-,"“Drone Photography” or “Aerial Photography,” in the purest form, can be defined as capturing the Aerial views, Bird’s eye view by using a Drone, UAV or by any other means. Clicking a picture from a height can also define the same. You will find many theories for this, but, Drones are not limited to photography only but now drones are used for Commercial Aerial Photography Services. Today drones are utilized to achieve various requirements for public and government organizations. Drones are playing a vital role in commercial photography. Following services are offered by Drones to achieve multip Continue Reading“Drone Photography” or “Aerial Photography,” in the purest form, can be defined as capturing the Aerial views, Bird’s eye view by using a Drone, UAV or by any other means. Clicking a picture from a height can also define the same. You will find many theories for this, but, Drones are not limited to photography only but now drones are used for Commercial Aerial Photography Services. Today drones are utilized to achieve various requirements for public and government organizations. Drones are playing a vital role in commercial photography. Following services are offered by Drones to achieve multiple goals: Aerial Photography of Hotels and Resorts Tourism Industry is growing at a high pace so as the hotels and resorts are improving their services to be a step ahead in all the competition. But to express the quality of services offered, the business owners prefer Aerial Photography as there is nothing better than an Aerial View. An Aerial View of your Hotel can tempt visitors to visit your hotel. Aerial Photography of Real Estate Real Estate Sector is multiplying day by day, and people are investing a vast amount of money in this sector. Now by opting Aerial Photography Services for Real Estate Properties will give the excellent price for your property. Construction Site Filming Drones offer a lot of services for the construction sites including Photography, Construction SIte Filming, as well as Surveying and Monitoring Services. Also, drones are used to check the progress of the project. Drone Survey Services Drones are widely used for survey services. Drones are fast, quick and can be used in critical areas where a man can not go easily without any risk. The advance cameras and high-end sensors equipped on the drone can quickly gather all the information. Drones offer a wide variety of services for public and govt organisations. Also, Mapping and Modelling is also done by the drones along with the survey. Virtual Tour Service 360 Degree Virtual Tour or Virtual Tour Service is getting favourite day by day as this service offers an actual representation of your place offering a 360 view of your environment showing the attractions and beauty of your place more significantly. “Drone Photography” or “Aerial Photography,” in the purest form, can be defined as capturing the Aerial views, Bird’s eye view by using a Drone, UAV or by any other means. Clicking a picture from a height can also define the same. You will find many theories for this, but, Drones are not limited to photography only but now drones are used for Commercial Aerial Photography Services. Today drones are utilized to achieve various requirements for public and government organizations. Drones are playing a vital role in commercial photography. Following services are offered by Drones to achieve multip Continue Reading",2021-03-06T09:53:14.828Z,"What is Drone Photography? ",Quora
60435130ed76476feda27543,https://www.quora.com/How-can-I-make-money-with-drone-photography?-,There are numerous possibilities to make money with your drones. One of the most possible way to make money with your drones is selling the aerial pics and videos to the people. A Drone take photos and can also record a terrestrial places that are difficult to or impossible for a normal people to reach and measure from the ground.,2021-03-06T09:53:52.698Z,"How can I make money with drone photography? ",Quora
60435154ed76476feda2758d,https://www.quora.com/How-do-I-start-a-drone-photography-business?-,"Drones have single-handedly changed the aerial photography industry. Thanks to advanced technology and dropping drone prices, becoming a drone photographer is easier than ever. In fact, you can survey land, explore hard to reach places or even create a unique aerial video for the cost of a simple drone. Drones offer you the chance to capture stunning aerial shots and help improve your portfolio, get started can be a challenge. That’s why if you want to start your own drone photography business, you should follow these steps if you want to push ahead of the competition and be a success. 1. Learn  Continue ReadingDrones have single-handedly changed the aerial photography industry. Thanks to advanced technology and dropping drone prices, becoming a drone photographer is easier than ever. In fact, you can survey land, explore hard to reach places or even create a unique aerial video for the cost of a simple drone. Drones offer you the chance to capture stunning aerial shots and help improve your portfolio, get started can be a challenge. That’s why if you want to start your own drone photography business, you should follow these steps if you want to push ahead of the competition and be a success. 1. Learn the Basics This may seem obvious, but learning the basics about drones with cameras before starting your business can be helpful. Drones can be expensive. Investing a lot of money into something that may not work the way you expect it to may not be the best idea. 2. Experiment with Different Drone Genres to Find Your Favourite(s) This is one of the most important steps of your business plan. As mentioned before, drone photography comes with a lot of sub-genres. Here are just a few categories that drone photographers can get into: - Real estate - Surveillance - Agriculture - Weddings 3. Create a Checklist to Ensure a Smooth Operation Before you make your business official, you can make a list of everything you’d like to focus on. This can be a to-do list or simply a list of questions. The more prepared you are, the easier you’ll find it to keep your business strong, no matter what you experience. 4. Update Yourself on the Laws There are many places that have strict rules regarding drones, their flight patterns, and the types of images they can capture. This is especially true if you are near any private property, federal buildings, schools, or airports. 5. Build a Strong Portfolio to Highlight Your Skills Without an outstanding style, drone photos all look the same. You can naturally develop your style by taking lots of photos by drone photography. Experiment with different angles, heights, editing skills, and videography techniques. The more you do this, the closer you’ll get to discovering your unique preferences. Drones have single-handedly changed the aerial photography industry. Thanks to advanced technology and dropping drone prices, becoming a drone photographer is easier than ever. In fact, you can survey land, explore hard to reach places or even create a unique aerial video for the cost of a simple drone. Drones offer you the chance to capture stunning aerial shots and help improve your portfolio, get started can be a challenge. That’s why if you want to start your own drone photography business, you should follow these steps if you want to push ahead of the competition and be a success. 1. Learn  Continue Reading",2021-03-06T09:54:28.326Z,"How do I start a drone photography business? ",Quora
