"_id",job_link,answer,date,question,source
6043569ced76476feda28119,https://www.quora.com/Which-videographer-in-Delhi-offers-drone-photography-and-360-videography?-,"Hi , thanks for answering this , I worked with one of the Photography and videography firms in Delhi who was very hardworking as well as smart , I want to mention it's name because it's work totally delighted me.The company name is - Swork Studio . It offers all types of photography and videography in Delhi , NCR 1. Drone photography 2. Architectural Photography 3. 360 Videos making 4. Complete Advertisement films 5. Corporate documentaries 6. Corporate Events photo-shoots 7. Product shoots 8. High wedding photography and Videography Phone - +91 9818711274 , 011-41548497, 9599296644 Thanks , Hope that will help 3",2021-03-06T10:17:00.456Z,"Which videographer in Delhi offers drone photography and 360 videography? ",Quora
604356c7ed76476feda28172,https://www.quora.com/How-do-I-make-money-from-drone-photography-in-Dubai?-,Maurice Kealoha Sallave,2021-03-06T10:17:43.937Z,"How do I make money from drone photography in Dubai? ",Quora
60435713ed76476feda2820b,https://www.quora.com/Is-aerial-drone-photography-a-good-career-option-in-the-USA?-,"no its not…too many laws, too many issues. The drone world is now better with AI.. 1",2021-03-06T10:18:59.298Z,"Is aerial drone photography a good career option in the USA? ",Quora
6043574aed76476feda2827d,https://www.quora.com/What-is-the-significant-preferred-position-in-drone-photography?-,,2021-03-06T10:19:54.403Z,"What is the significant preferred position in drone photography? ",Quora
6043576ced76476feda282c8,https://www.quora.com/What-is-the-need-for-commercial-real-estate-drone-photography?-,"It has become common for photographers to use drones for commercial photography. They are easier to operate, are priced much more cost effectively than hiring a helicopter, and provide eye-catching pictures from amazing angles. With the advent of technology, drones provide breathtaking and high-quality pictures and videos. Here are some ways in which the drone has changed commercial photography: Become Widespread: The use of drones has opened new options for photographers. Some of the best commercial photographers use drones to cover commercial events and seminars for realistic shots. Unique perspective: The angles through which shots can be taken were not available before the introduction of drones in photography. Offer better angles and photos: With drones, the photographers can provide a view which most people want. There is nothing in the sports event to hinder their maneuverability. Therefore, a photographer can provide pictures taken from better angles. Photography has become more realistic: The way we view the news has changed drastically after drone commercial photography services. Rather than relying on pre-recorded videos and captures, we get realistic footage of events such as disasters, political events, and crimes. Also Read: How Drones Have Changed Commercial Photography",2021-03-06T10:20:28.974Z,"What is the need for commercial real estate drone photography? ",Quora
604357aaed76476feda28349,https://www.quora.com/What-equipment-would-you-recommend-for-a-beginner-interested-in-drone-photography-in-2020?-,"Thanks for the A2A Daniele I’ll avoid any comment on current regulatory issues and changes in the various countries or rationale behind my suggestions. They are relevant but I’ll just skip strait to the answers. Currently as of May 2020 the best equipment without under or over spending to get started in drone photography at a high end enthusiast / low end professional level is as follows. DJI Mavic 2 Pro based on it’s camera alone. 10bit colour, 20 megapixel, fully adjustable. There are better but not at anything like the price point. There are cheaper but nothing like as capable. Battery life an Continue ReadingThanks for the A2A Daniele I’ll avoid any comment on current regulatory issues and changes in the various countries or rationale behind my suggestions. They are relevant but I’ll just skip strait to the answers. Currently as of May 2020 the best equipment without under or over spending to get started in drone photography at a high end enthusiast / low end professional level is as follows. DJI Mavic 2 Pro based on it’s camera alone. 10bit colour, 20 megapixel, fully adjustable. There are better but not at anything like the price point. There are cheaper but nothing like as capable. Battery life and other factors are quite good too. Several batteries and a mobile charger help a lot. Most important accessories are a good controller, DJI’s own smart controller is good or as I use an Apple mobile device. ND and Polarisiing filters are a must to be able to shoot in all light and glare conditions. A decent PC and software editing package and some practice in using them rounds out the essentials. There are many more things ytou could add to the list but the above will get you up and going. You can add the rest later. Hope this helps Ari Thanks for the A2A Daniele I’ll avoid any comment on current regulatory issues and changes in the various countries or rationale behind my suggestions. They are relevant but I’ll just skip strait to the answers. Currently as of May 2020 the best equipment without under or over spending to get started in drone photography at a high end enthusiast / low end professional level is as follows. DJI Mavic 2 Pro based on it’s camera alone. 10bit colour, 20 megapixel, fully adjustable. There are better but not at anything like the price point. There are cheaper but nothing like as capable. Battery life an Continue Reading",2021-03-06T10:21:30.511Z,"What equipment would you recommend for a beginner interested in drone photography in 2020? ",Quora
604357d5ed76476feda283a2,https://www.quora.com/Why-is-drone-photography-in-Dubai-no-friend-to-small-businesses?-,,2021-03-06T10:22:13.610Z,"Why is drone photography in Dubai no friend to small businesses? ",Quora
60435848ed76476feda2848e,https://www.quora.com/Which-is-the-best-event-drone-photography-in-New-Zealand?-,"John E. McNair, American living in VirginiaAnswered October 13, 2020Which country is the best: Australia, Canada or New Zealand? John E. McNair Which country is the best? Well, best is a pretty vague term but I’ll try and answer the question regarding many aspects of life. Also I am an American that hasn’t lived in any of these countries, so I will be able to give an unbiased answer. Aspects - Which country is the best? Population Out of the three countries, New Zealand is the least populous country. Australia’s estimated 2020 population is 25,679,100, Canada’s estimated 2020 population is 38,005,238, and New Zealand’s estimated 2020 population is 5,092,750. Having a small or large population has its ups and downs. Countries with a larger Continue ReadingWhich country is the best? Well, best is a pretty vague term but I’ll try and answer the question regarding many aspects of life. Also I am an American that hasn’t lived in any of these countries, so I will be able to give an unbiased answer. Aspects - Which country is the best? Population Out of the three countries, New Zealand is the least populous country. Australia’s estimated 2020 population is 25,679,100, Canada’s estimated 2020 population is 38,005,238, and New Zealand’s estimated 2020 population is 5,092,750. Having a small or large population has its ups and downs. Countries with a larger population tend to have more jobs and a well developed infrastructure, while countries with a smaller population tend to be more relaxed and feel spacious. Cities Out of the three countries, New Zealand has the least amount of cities. For this answer I have counted cities as large human settlements with over 1,000,000 people living in them. Australia has 5 cities with over 1,000,000 people living in them, Sydney in New South Wales being the most populated. Canada has 3 cities with over 1,000,000 people living in them, Toronto in Ontario being the most populated. New Zealand has 1 city with over 1,000,000 people living in them, Auckland being the only one. Economy Out of the three countries, New Zealand has the lowest unemployment rate. As of October 2020, Australia’s unemployment rate is 6.8%, Canada’s unemployment rate is 9%, and New Zealand’s unemployment rate is 4%. Unemployment rates don’t say everything about a country, but it could signal how hard it is to find employment in certain country, especially for immigrants. Politics and Government *Disclaimer - When I say left and right wing, I mean it in broad terms.* All three countries are similar when it comes to politics and government. Both Australia and Canada are Federal Parliamentary Constitutional Monarchies, while New Zealand is a Unitary Parliamentary Constitutional Monarchy. All three countries have a two-party dominant system. Australia has the Labor Party (left-wing) and Liberal Party (right-wing), Canada has the Liberal Party (left-wing) and Conservative Party (right-wing), and New Zealand has the Labour Party (left-wing) and National Party (right-wing). All three countries have Queen Elizabeth II as the Head of State and Monarch, and all three have Prime Ministers as the Head of Government. On the 2019 Democracy Index, which scores countries based electoral process, functioning of government, political participation, political culture, and civil liberties, New Zealand ranked the highest. Australia received a 9.09/10 on the Democracy Index placing Australia 9th place out of 167 countries, Canada received a 9.24/10 on the Democracy Index placing Canada 7th place out of 167 countries, and New Zealand received a 9.26/10 on the Democracy Index placing New Zealand 4th place out of 167 countries. Language All three countries are dominantly English-speaking countries. Around 99% of Australia’s population speaks English, around 86.2% of Canada’s population speaks English, and around 95.4% of New Zealand’s population speaks English. Out of three countries, only Canada is an officially bilingual country, the Government of Canada stating that English and French are the country’s two official languages. However, only 17% of Canada’s population is fluently bilingual. People All three countries have a dominant European ancestry population. Around 76% of Australians are of European descent, around 73% of Canadians are of European descent, and around 74% of New Zealanders are of European descent. Weather and Climate Out of three countries, Canada is the coldest. Canada’s winters are the coldest. It is also much more rainy in Canada. Out of the twelve months, Canada can experience rain during ten months. Australia and New Zealand tend to be warmer on average, but Australian and New Zealand winters are also cold. Cost of Living Out of three countries, Australia has the highest cost of living. Compared to Toronto and Auckland, Sydney is the most expensive to live in costing $1,029 (USD) a month excluding rent. Auckland was in second place, costing $959 (USD) a month excluding rent. Toronto was the cheapest to live in out of the three, costing $934 (USD) a month excluding rent. I understand that Australia isn’t just Sydney, Canada isn’t just Toronto, and New Zealand isn’t just Auckland, but if you plan on living or immigrating to one of the countries, these are the cities you will most likely end up in. Quality of Life Out of three countries, Australia has the highest quality of life rating on the Quality of Life Index. The Quality of Life Index takes many factors into account such as safety, healthcare, pollution, climate, etc. Australia ranked the highest being in 4th place, Canada ranked 21st place, and New Zealand ranked 8th place. Conclusion Overall, Australia seemed to do the best in many aspects. However, here is my conclusion. If you want to live in a country where there is larger population and larger economy… Choose Canada If you want to live in a country where there is a moderate population, but more cities and places to explore… Choose Australia If you want to live in a country where there is more space for you and your family, and overall more relaxed… Choose New Zealand",2021-03-06T10:24:08.350Z,"Which is the best event drone photography in New Zealand? ",Quora
60435881ed76476feda28504,https://www.quora.com/How-do-I-use-drone-photography-for-real-estate-marketing?-,,2021-03-06T10:25:05.494Z,"How do I use drone photography for real estate marketing? ",Quora
604358c7ed76476feda28595,https://www.quora.com/What-type-of-non-traditional-business-can-benefit-from-the-use-of-drone-photography?-,"Ralph Seeder, Technology Enthusiast, EntrepreneurAnswered 2 years ago Ralph Seeder Not all businesses are created equal and not all businesses run the same way.Most non-traditional businesses today have a customer service-centered approach. The effort is to ensure 100% customer satisfaction, such that you build loyalty. Companies are using drone photography and videography to come up with creative ways to showcase their products and services. It can also help customers see what you have to offer and understand your skills. Although this can be done using traditional methods too, drone photography certainly showcases your business as one that stays with the times and is open to Continue ReadingNot all businesses are created equal and not all businesses run the same way.Most non-traditional businesses today have a customer service-centered approach. The effort is to ensure 100% customer satisfaction, such that you build loyalty. Companies are using drone photography and videography to come up with creative ways to showcase their products and services. It can also help customers see what you have to offer and understand your skills. Although this can be done using traditional methods too, drone photography certainly showcases your business as one that stays with the times and is open to innovation and technological advancements. This is especially useful given that the largest customer base today is made up of millennials, who are digital natives. To know more about how commercial drones are used for business, visit: https://www.cvpnj.com/corporate-video-services/drone-cinematography",2021-03-06T10:26:15.821Z,"What type of non-traditional business can benefit from the use of drone photography? ",Quora
6043591ded76476feda28643,https://www.quora.com/What-measures-are-being-taken-to-combat-the-over-aggressive-bans-on-drone-photography-in-state-and-national-parks?-,"Drones represent a significant threat to Homeland security. The technologies embedded in these adult toys are derived from cruise missles and military first person view video of a generation ago. Any reasonably capable hobbiest could adapt these drones to create flying bombs that would be very inexpensive and deadly accurate. It's just a matter of time before some nutjob uses drones for fomenting some nefarious end. In addition, drones are fantastic reconnaissance tools that could be used to recon the government. The government is aware of these threats and is moving to curtail drone use where Continue ReadingDrones represent a significant threat to Homeland security. The technologies embedded in these adult toys are derived from cruise missles and military first person view video of a generation ago. Any reasonably capable hobbiest could adapt these drones to create flying bombs that would be very inexpensive and deadly accurate. It's just a matter of time before some nutjob uses drones for fomenting some nefarious end. In addition, drones are fantastic reconnaissance tools that could be used to recon the government. The government is aware of these threats and is moving to curtail drone use wherever possible. Their use in national parks represents just one tacit among many where drones lack government oversight. Homeland security will press to restrict drones and drone technology wherever possible. Hobbiest’s efforts to resist drone legislation will be overwhelmed by Homeland Security’s desire to completely dominate any hobbiest’s use of this technology. If this technology is used by terrorists in the future expect the technology to become illegal except for very limit uses by licensed individuals. Drones represent a significant threat to Homeland security. The technologies embedded in these adult toys are derived from cruise missles and military first person view video of a generation ago. Any reasonably capable hobbiest could adapt these drones to create flying bombs that would be very inexpensive and deadly accurate. It's just a matter of time before some nutjob uses drones for fomenting some nefarious end. In addition, drones are fantastic reconnaissance tools that could be used to recon the government. The government is aware of these threats and is moving to curtail drone use where Continue Reading",2021-03-06T10:27:41.696Z,"What measures are being taken to combat the over-aggressive bans on drone photography in state and national parks? ",Quora
60435966ed76476feda286e4,https://www.quora.com/Is-there-any-permit-required-for-drone-photography-in-USA?-,,2021-03-06T10:28:54.854Z,"Is there any permit required for drone photography in USA? ",Quora
604359aded76476feda2877f,https://www.quora.com/Is-there-any-US-state-that-allows-for-unrestricted-non-commercial-drone-photography?-,"The FAA is the law of the land for airspace as far as I know and they’ve got lots of airspace that’s unrestricted, even or especially for ‘non-commercial’ drone photography. Federal Parks, airports, and other facilities restrict drone traffic and may be difficult to get a waiver for commercial work. Any of the several parks, sports fields, and schoolyards in our fair city are mostly empty and properly registered drones are welcome if there’s no event in progress. Many/most states have adopted legislation in the past few years making it unlawful for local councils and governments making restrict Continue ReadingThe FAA is the law of the land for airspace as far as I know and they’ve got lots of airspace that’s unrestricted, even or especially for ‘non-commercial’ drone photography. Federal Parks, airports, and other facilities restrict drone traffic and may be difficult to get a waiver for commercial work. Any of the several parks, sports fields, and schoolyards in our fair city are mostly empty and properly registered drones are welcome if there’s no event in progress. Many/most states have adopted legislation in the past few years making it unlawful for local councils and governments making restrictive drone ordinances and also authorizing local law enforcement to issue citations for drone violations, including flying unregistered drones. For the time-being, what you propose is very easy to do, only requires you to check off a list of safety rules, pay $5 to seal the deal, and download a certificate to print and carry with you with a number to post on your drones. Soon, any day now, there will be a test to pass, but that hasn’t come to pass quite yet. You’re a ‘recreational’ or ‘hobby’ remote pilot, similar to RC pilots since the ‘40s and represented by the AMA-Academy of Model Aeronautics, which sanctions hundreds and hundreds of fields for flying fixed-wing models, some of them co-located with airports. Multi-rotor drones don’t need a runway, but AMA represents us and offers liability insurance for its members. There are several routes to the rules and the FAA Drone Registry as another answer snidely suggests. One of them is FAADroneZone. I think you’ll find that you can fly your drone in practically all states except for where you can’t, like near airports, over prisons…. DJI GO4 and other apps for controlling drones update their ‘geofencing’ database a couple or few times a month and will show you where you can and can’t fly, are pretty much accurate. ‘Compensation’ and ‘commercial’ are broadly applied, so even a monetized social media blog, vlog, or dlog is considered commercial. Any operations for any kind of compensation need FAA Part 107 certification, which is covered in the FAA Drone Zone. There is another category for government employees flying drones in their work, like a park manager or the poleece… Please don’t fly a drone weighing more than .55 pounds off your property without proper registration, is my best advice… I wouldn’t want to be the person operating an unregistered drone in our fair county, or be without my FAA certificate when trying to get the perfect fly by of a house. There are drone-haters out there, beware, easy to piss them off… The FAA is the law of the land for airspace as far as I know and they’ve got lots of airspace that’s unrestricted, even or especially for ‘non-commercial’ drone photography. Federal Parks, airports, and other facilities restrict drone traffic and may be difficult to get a waiver for commercial work. Any of the several parks, sports fields, and schoolyards in our fair city are mostly empty and properly registered drones are welcome if there’s no event in progress. Many/most states have adopted legislation in the past few years making it unlawful for local councils and governments making restrict Continue Reading",2021-03-06T10:30:05.560Z,"Is there any US state that allows for unrestricted non-commercial drone photography? ",Quora
