"_id",job_link,answer,date,question,source
604293d8ed76476feda23088,https://www.quora.com/Is-there-any-SEO-experts-who-can-help-me-in-getting-an-SEO-done?-,"Hugh Ellison 5 experts tell you how to become Google's best friend! Here In the below Article I briefly explained about the 5 SEO experts who can help you in getting an SEO done, for more related article check out this site immediately. Nothing like a site optimized for Google to become a junkie of your content. You think it's simple? Think again, we are no longer in 2010 and optimization ""on-site"" is not as easy as before. See what these 22 SEO experts are saying and we'll talk about it again! Admittedly, when we talk about SEO, netlinking is a must. Yet, too much to focus on the links, we often forget the bas Continue Reading5 experts tell you how to become Google's best friend! Here In the below Article I briefly explained about the 5 SEO experts who can help you in getting an SEO done, for more related article check out this site immediately. Nothing like a site optimized for Google to become a junkie of your content. You think it's simple? Think again, we are no longer in 2010 and optimization ""on-site"" is not as easy as before. See what these 22 SEO experts are saying and we'll talk about it again! Admittedly, when we talk about SEO, netlinking is a must. Yet, too much to focus on the links, we often forget the basics. I'm talking about optimizing your site (SEO on-site). How many of you spent weeks looking for links without even checking that your site was optimized for search engines? You can have as many links as you want, if your pages do not please Google, you will remain invisible and your Analytics curve will remain at the floor level. Needless to say that without traffic, the only thing you will win is frustration ... By inviting experts in this article, I was hoping to highlight the essential elements that make in 2016 (and 2017), the basics of good on-site optimization. We can see a real consensus emerging around the content that must more than ever be at the heart of your SEO strategy So, experts, how do you make Google addicted to your sites and get your traffic off the ground without getting backlinks? Olivier Andrieu For my part, I will of course push open doors saying that I pay the greatest possible attention to the editorial structure of the content, the presence of my main request in the ""hot zones"", the to offer a lexical field as rich as possible, to offer internal mesh to other content and external to other relevant websites, etc. In short, the base. But that can take a lot of time. With, of course, a huge focus on the quality of the information offered and the least possible typing and spelling mistakes (which for me, who is dyslexic on the keyboard, is a real test: multiple proofreading required!). But there are two fields on which I pay even more attention: the Title (so the H1 because most often, I copy the H1 at the beginning of the Title)The meta description(so the chapo because most often ... see previously ).These two fields seem to me to be essential because they will be taken over by Google in its SERPs. And so it is they who will click the user or not . It would be a shame to position yourself and not be clicked, right? The idea is to make interesting, incentive , without ever going to ""putaclic"", of course ... My titles are also most often in ""Camel case"" to improve readability in the results. The meta description is here to make it all sexy . And as Google is currently modifying all its algorithms to gradually bring them to voice search, I always ask myself the following question: ""What the user will look for in an article such as I'm trying to describe ?"" The title of the article will often be used to ask the question determined beforehand (because that's how we work in voice search: we ask a question rather than align keywords) ... And I try in the content, to answer it. Joshua Vilys In our agency, we practice very few Netlinking campaigns. We play on the quality of editorial content to improve indexing and ipso facto recover natural links without maneuvering with the different techniques of acquisition of backlinks. For the quality of your website to propel you among the top results of search engines, build around the following indicators: Irreproachable grammar and spelling: for that, hire a web editor; or learn to write better.Reliability, expertise, authority: the content must be useful and well-developed. Your rewards and certifications are welcome. Do not hide the links to contact you, and highlight the general conditions of sale, the conditions of returns and the privacy policy.Positive feedback: look for the opinions of your best customers / readers.Useful clicks: use fewer banners. On less visited pages, place products and merchandise.Specific answers to users' requests: find your niche, and bring the right answers to customer queries. Choose the keywords based on their relevance, not just the number. Think about what the user is waiting for.Keep track of how much time users spend on your site - offer good design to improve the user experience and make your pages more engaging. Add images and videos as needed. Using Google Analytics, identify your best sources of traffic and set a strategy to improve traffic from those sources.Improve the conversion rate: test several versions of your pages with Internet users using an ""A / B testing"". Take inspiration from CRO's best practices to achieve this.Fewer banner ads: Limit the number and avoid them above the main pages of the website.Improve the clickthrough rate of user requests: fine tune the descriptions, URLs and titles of your web pages. Make them attractive and rewarding.Bet on the mobile: adapt the design, place fewer texts, write short sentences and reduce the loading time for the mobile version of your website.Remember that it is also essential to properly and regularly prune your website to keep a good ""QualityRank"" score. Detect pages and content to be removed from the site. Many companies do not know how much this technique is saving. Alexandre Santoni How to improve your SEO without additional link? Of course, the interrogation at this stage is complex insofar as the key lies in the analysis of acquired and unvested a target website. Beyond these unconditional parameters, here are three tips that I can provide through the cases I worked on: Defend your choices : we can end up with conflicts of interest between different poles of the web or applications of recommendations bordering the 20%. Knowing how to defend your SEO choices is the key to your success and more globally one of the keys to the success of a website. Knowing how to defend your on-site optimization choices and then having them applied is a real challenge for certain types of clients. Architecture planning and development : where possible, redesign and / or densification of the architecture brings results that can be spectacular. I study the keywords, I rework the levels, the titles according to the possible content. Be imaginative not to get stuck. In e-commerce for example, we all talk about faceted navigation and optimization of it. In fact 2016, a broad fringe of customers can not optimize SEO. Secondary solutions may exist to operate the long tail keywords. Think (also) about the quantity of pages : we are all focusing on quality, on real content, demented articles and product sheets without flaws. Yes, it is clearly a factor of success, it is an absolute obviousness. Now, having many perfectly worked pages give way to a more quantitative input with interesting results at the end. Semi-automation can have a map to play here. William Troillard This is not a natural reflex for us marketers, and yet it is a fact that we have been able to observe ourselves and which is further supported by this study : the pages containing external links are potentially getting better. Google SEO. Creating external links is disruptive in many ways: we fear for our reputation; we are afraid of creating exit doors; and / or that it creates a negative impact on his SEO. And yet! It's the opposite effect: it works! Search engines tend to reward sites that point outward and especially when they make it to reliable sources. In practice : Make links to blogs that you find credible;Make links to your influencers: these outbound links tend to bring you inbound links;Make outbound links to help your users: Before writing for robots, you write for your readers, outbound links should be a help for them to understand a concept or to deepen a topic.Christian Vilela The value and the tags to optimizeThe goal of SEO is to increase the quality, understanding, but especially the visibility of a website within the search engine results. To increase traffic , there is no magic. I invest very little time on social networks, but I use tools and methodologies that allow me to better position myself on these search engines. First and foremost, I write articles that may be of interest to my readers. The more interesting, relevant and quality content is, the more the content becomes ""shareable"" , so over time I increase my chances of finding myself on the first page of Google search results. The keyword to remember on the web, as in business, is: ""value"". ""Value"" is your best marketing tool. I would prefer that 10 visitors stay on my website for 5 minutes rather than 100 visitors for 5 seconds. Basically, for my articles and the pages of my website, I'm only trying to optimize the keywords of tags TITLE, H1, H2, file name and ALT tags. H1, aim readers, TITLE, aim at robotsFor blogs and small corporate websites, WordPress is my favorite platform. However, basically with WordPress, the content of the title of your articles and pages will also be used for the values ​​of tags TITLE, H1 and the link of this new article / page. I suggest you use one of the following extensions to allow you to independently edit the TITLE and H1 tags of your articles and pages . The reason why it is sometimes useful to have different TITLE and H1 tags is that the H1 tag is usually more visible to the reader because it is part of the content of your page. As the title of a newspaper article, the H1 tag must first and foremost catch the attention of the reader who is already on your website. Any good copywriter knows that the title of an article is the advertisement of the article itself. If a title can not hold the attention, your potential customer will not go further. With the H1 tag, it is therefore necessary to find the angle that will capture the attention. If possible, dot this one with some important keywords for the SEO of your page. Finally, I suggest to bet more on the TITLE tag to help you with optimization for search engine robots. Keep in mind: The first words of the TITLE tag have more weight (SEO) than the last ones. Take the following title as an example: ""Effective marketing strategies to increase your profits"". The keywords ""Marketing Strategies"" may perform better than the keywords ""increase your profits"". Warning, sometimes search engines choose the ""bad"" keywords of your tags to display your pages in the search results. I recently published a Webapp article or mobile application, which route to take for your project , but doing a little analysis later, I found that Google posted my article for the following keywords: ""which road "","" take the road "","" which road to take "". So I rectified the shooting by modifying my tags H1 and TITLE for ""Webapp or native mobile application for your project?"" Nothing spectacular, I know, but a little more likely to attract ""qualified"" readers this time. Continue Reading",2021-03-05T20:26:00.782Z,"Is there any SEO experts who can help me in getting an SEO done? ",Quora
604293eded76476feda2309b,https://www.quora.com/What-are-some-ways-SEO-experts-are-changing-internet-marketing?-,"SEO experts are left with no choice but to change their marketing strategies from time to time. That's because of the search engines becoming smarter and artificially intelligent every day. And the other reason is the aggressively growing competition. SEO experts had to opt for smarter and effective strategies to stay or improve their presence in the search engine. Effective techniques and tools keep changing from time to time. However, the best practices and guidelines will remain intact for a longer period of time. We can categorize these techniques into three main groups. On-site SEOOn-page SContinue ReadingSEO experts are left with no choice but to change their marketing strategies from time to time. That's because of the search engines becoming smarter and artificially intelligent every day. And the other reason is the aggressively growing competition. SEO experts had to opt for smarter and effective strategies to stay or improve their presence in the search engine. Effective techniques and tools keep changing from time to time. However, the best practices and guidelines will remain intact for a longer period of time. We can categorize these techniques into three main groups. On-site SEOOn-page SEOOff-page SEOOn-Site SEO: As its name suggests, on-site SEO involves site-wide optimizations and techniques pertaining to the below factors, Site Speed - To optimize the website’s loading time. This can be done by compressing the page size. removing the unwanted scripts and codes and increasing the server’s response time. Google’s Page Speed Insights, Pingdom Tools and GT Metrix are some of the popular tools for analyzing the areas to improve the site speed. User Experience - To make sure that the UI and navigation are user-friendly and doesn’t mislead or confuse the user at any cost. SEO-friendly/User-friendly URLs will also help improve the search rankings On-Page SEO: This optimization type involves improvisation of page-level elements to gain search engine rankings. Below are the popular factors, Content - For digital marketing, content is the King. The more significant content a site has, the better are the chances to rank higher on a search engine. Meta Tags - Meta tags are the HTML tags that provide additional information about the websites. Some of the important meta tags include title tag, description tag, canonical tag, ALT attribute etc. Structured Data - Like Meta tags, Structured data is also used to provide additional information about a website. In fact, this JSON or Microdata code can provide extensive information like breadcrumb, reviews, rating and organization details to the search engines Off-Page SEO: The most crucial and complex SEO activities are Off-Page SEO activities. This is because of the unpredictable and irreplicable nature of Off-Page SEO factors like, Link Building - Comprehensive link tree and scheme is very important to gain search engine ranking. Modern-day search engines are super-smart that it can easily identify artificially built links and the natural links. Only the natural link scheme will have a positive impact whereas the unnatural links are identified and penalized by the search engines. Social Profile / Bookmarks - The presence and performance of a brand/business in popular social mediums has a great impact in boosting the search engine rankings.  Hope this information is helpful SEO experts are left with no choice but to change their marketing strategies from time to time. That's because of the search engines becoming smarter and artificially intelligent every day. And the other reason is the aggressively growing competition. SEO experts had to opt for smarter and effective strategies to stay or improve their presence in the search engine. Effective techniques and tools keep changing from time to time. However, the best practices and guidelines will remain intact for a longer period of time. We can categorize these techniques into three main groups. On-site SEOOn-page SContinue Reading",2021-03-05T20:26:21.547Z,"What are some ways SEO experts are changing internet marketing? ",Quora
60429402ed76476feda230ae,https://www.quora.com/How-do-I-hire-SEO-experts-in-Rajkot-Gujarat?-,"Akash Kumar Hi, First of all you have to decide you are looking for freelancer SEO expert or Full time freelancer for your organization For Freelancer - then take a help of freelancing job portal like upwork, guru, toptal etc. For Full time - you can take the help of naukri.com, monster.com, indded.com, shine.com, or you can also take the help consultancy they will provide the candidate as per your requirement. Now a days you can also take the help of linkedin to find your SEO expert. Just share your job description, location, etc and lots of responses come over there. So now a days, it’s quite easy to find so Continue ReadingHi, First of all you have to decide you are looking for freelancer SEO expert or Full time freelancer for your organization For Freelancer - then take a help of freelancing job portal like upwork, guru, toptal etc. For Full time - you can take the help of naukri.com, monster.com, indded.com, shine.com, or you can also take the help consultancy they will provide the candidate as per your requirement. Now a days you can also take the help of linkedin to find your SEO expert. Just share your job description, location, etc and lots of responses come over there. So now a days, it’s quite easy to find someone because in market too many resources are available. I hope, it will helpful for you. Thanks & Regards Akash Continue Reading",2021-03-05T20:26:42.636Z,"How do I hire SEO experts in Rajkot Gujarat? ",Quora
60429416ed76476feda230c2,https://www.quora.com/What-is-the-best-place-to-hire-an-SEO-expert?-,"Nurul Amin Shah, knows BengaliAnswered 1 year ago Nurul Amin Shah Search Engine Optimization Company Best SEO services that generates result oriented leads, traffic and sales for your business websites. Best SEO service provider company in Bangladesh. Everyone wants to be on the first page of search engines. We provide your company page rank 1 with hard work and dedication to achieve that objective. We put our best expertise to ensure that you reach your desirable position. We are top dedicated Search Engine Optimization (SEO) company in Bangladesh. Search engine optimization (SEO) is a method of getting your website to rank higher in search engines—such as Goo Continue ReadingSearch Engine Optimization Company Best SEO services that generates result oriented leads, traffic and sales for your business websites. Best SEO service provider company in Bangladesh. Everyone wants to be on the first page of search engines. We provide your company page rank 1 with hard work and dedication to achieve that objective. We put our best expertise to ensure that you reach your desirable position. We are top dedicated Search Engine Optimization (SEO) company in Bangladesh. Search engine optimization (SEO) is a method of getting your website to rank higher in search engines—such as Google, Yahoo or Bing. Although it’s the search engines that rank your site, we believe that good SEO is a result of initiatives that provide value for those visiting your site. If you have any query or question related to Search Engine Optimization Services or if you are ready to make the final hiring decision, feel free to contact us drop in a message to help us get back to you! Keyword Research Search the best key for your website. An effective SEO campaign isn’t about simply generating a large amount of traffic; it’s about generating a large amount of targeted traffic, and starts with extremely in-depth keyword research. All of our strategy is data based. Keyword Analysis We perform deep research and add on competitive keywords in the list of your targeted search terms by understanding your prospects. Content writing Content writing is one of main part of SEO. Content that are really good and authentic. We offer you an more affordable SEO services at reasonable rate. We make sure that your website will rank higher in Search engine results pages, this helps in reaching your target goals both locally and Globally. On-Page SEO On Page SEO, this includes many factors including, the meta tag, contents, keywords optimization, site speed, Schemes and much more factors. On-page SEO refers to optimizing multiple components within a website. The goal is to set up your site’s pages to land at the top of search engine results and capture more traffic. Off-Page SEO We will start work with Off page seo, this is also known as link building, the main backbone of SEO. Off-site SEO. These include things like: Social media marketing, Guest blogging, Linked and unlinked brand mentions and Influencer marketing.",2021-03-05T20:27:02.415Z,"What is the best place to hire an SEO expert? ",Quora
60429428ed76476feda230d3,https://www.quora.com/Which-SEO-experts-should-be-ignored?-,"First of all, you have to take an interview then can easily understand about your candidate. Before taking an interview you must have to know about your targeting interview",2021-03-05T20:27:20.116Z,"Which SEO experts should be ignored? ",Quora
6042943eed76476feda230e9,https://www.quora.com/What-are-the-basic-techniques-of-SEO-experts?-,"Chris Slesarchik, SEO Specialist at Page One Web SolutionsAnswered 3 years ago · Author has 60 answers and 22K answer views Chris Slesarchik Any SEO “expert” worth their salt will begin with the understanding that the right tactic or technique will be totally dependent on the goals of the site/company they are working for. In that sense, the first technique to employ with a new SEO client is a technical audit of the current site and an analysis of its strengths and weaknesses. One client of mine already had a ton of backlinks and brand recognition, but the structure of their site made it confusing to navigate and internal linking was almost non-existent. In this case, it made the most sense to get an organized URL structure in place Continue ReadingAny SEO “expert” worth their salt will begin with the understanding that the right tactic or technique will be totally dependent on the goals of the site/company they are working for. In that sense, the first technique to employ with a new SEO client is a technical audit of the current site and an analysis of its strengths and weaknesses. One client of mine already had a ton of backlinks and brand recognition, but the structure of their site made it confusing to navigate and internal linking was almost non-existent. In this case, it made the most sense to get an organized URL structure in place with a sensical hierarchy of topics/pages. Another client had a great site (fast, well-structured, responsive, etc.) but had no links and little content. For them it made the most sense to create a content and link building strategy. There is no silver bullet. After major technical issues are sorted out (or at least on their way to being sorted out), one can begin to piece together how to optimize the site so it can better suit the company or organization’s unique business goals. Some companies just want organic traffic (think sites like BuzzFeed; those that generate revenue from AdWords and the like), while others are eCommerce (think sites like Amazon; those that make sales online), and still others are looking to generate leads or quote requests (think General Steel; those that generate revenue from custom jobs or appointments). How well of a job you’re doing as an SEO expert is judged heavily on how well you are able to pair the results you get with the business goals of your client. The definition of an “SEO Expert” has seemed to become diluted over the years. I’d make the point that an SEO Expert is someone who can oversee the entire process of organic search marketing, from the technical to creative. It’s not only about content writing or keywording for title and description tags. A true SEO Expert manages the whole experience of a potential client, from the moment they go online to the point they finally make a purchase decision.",2021-03-05T20:27:42.538Z,"What are the basic techniques of SEO experts? ",Quora
