"_id",job_link,answer,date,question,source
60428e51ed76476feda22ba1,https://www.quora.com/How-can-I-improve-my-SEO-without-a-SEO-expert?-,"Speaking as a digital marketer- I would recommend to you that if you are willing to do SEO without helping SEO expert so you can do before going to do you will have to do practical work on your own website then you can handle any project of clients other wise you will waste your time and energy. So here i’m going to share some SEO technique which will you help you to understand basic of SEO or how to do SEO. As we know SEO divided into two parts- On Page SEOOff Page SEOWhat is On Page SEO? On page SEO is the process of web page optimizing, where we optimize web page title, description, keywords, co Continue ReadingSpeaking as a digital marketer- I would recommend to you that if you are willing to do SEO without helping SEO expert so you can do before going to do you will have to do practical work on your own website then you can handle any project of clients other wise you will waste your time and energy. So here i’m going to share some SEO technique which will you help you to understand basic of SEO or how to do SEO. As we know SEO divided into two parts- On Page SEOOff Page SEOWhat is On Page SEO? On page SEO is the process of web page optimizing, where we optimize web page title, description, keywords, content and much more- How to do On Page SEO?  First try to figure out keywords for your website according to your website niche.Select 3–4 keywords for your each page of the website. Must find out 1–2 long tail keywords.Having chosen keywords now you have to place it at the right place of your web page.Put your one high searchable keywords in your web page title, description, H1, H2, Subheading and also put in first paragraph of your web page content.Your content must be unique and readability and 2–3% keywords should be in 100 words content.Do internal linkingCheck sitemap is active or not, if not then must add sitemap on your website because it’s give full information about your website pages.Add robot.txt file on your website.Optimize your image size before uploading on your web page and don’t forget to add your targeted keywords in your image alt text.Keep short url of your each web pages, try to put your targeted keywords in your website url as well as in your page url. Don’t use broken url because it’s not readable.Check your website speed and if not good then you must need to boost it.Make your mobile responsive because according to google we get 75% traffic through mobile devices.You must have to link building from high DA, PA website, be careful that website should be relevant to your website.Add schemaCustom 404 pages for all non-available page.How to do Off Page SEO?  Follow all those above technique which are in off page seo image. Speaking as a digital marketer- I would recommend to you that if you are willing to do SEO without helping SEO expert so you can do before going to do you will have to do practical work on your own website then you can handle any project of clients other wise you will waste your time and energy. So here i’m going to share some SEO technique which will you help you to understand basic of SEO or how to do SEO. As we know SEO divided into two parts- On Page SEOOff Page SEOWhat is On Page SEO? On page SEO is the process of web page optimizing, where we optimize web page title, description, keywords, co Continue Reading",2021-03-05T20:02:25.170Z,"How can I improve my SEO without a SEO expert? ",Quora
60428e66ed76476feda22bb2,https://www.quora.com/Why-are-SEO-experts-important?-,"There are numerous reasons as to why SEO experts are important. It is very important for the search engine optimization professionals to ensure that the right keywords are being used by all users of the web. By doing this, they will be able to get higher rankings in the various search engines. The more that a particular website has a high ranking in the search engine results, the better it will be in terms of traffic. By getting more traffic, one can be sure that the website will also have a higher conversion rate and it will also help it to increase its revenue. However, for this to happen, o Continue ReadingThere are numerous reasons as to why SEO experts are important. It is very important for the search engine optimization professionals to ensure that the right keywords are being used by all users of the web. By doing this, they will be able to get higher rankings in the various search engines. The more that a particular website has a high ranking in the search engine results, the better it will be in terms of traffic. By getting more traffic, one can be sure that the website will also have a higher conversion rate and it will also help it to increase its revenue. However, for this to happen, one must make sure that the website is actually performing well. A number of websites use SEO as a way of generating more income, but many websites lose out when it comes to converting the visitors into customers. What happens here is that a person using a specific keyword will simply click on a link and visit the site. However, it is the website that makes the visitor aware of the benefits that they will get if they go through the links on the website. This is where the website will be able to provide the visitor with the information that they need. By getting these visitors to read the content on the website, the website will be able to convert them into potential customers. Another reason as to why SEO professionals are important is that this can help the website to maintain its ranking in the search engines. It is very important for the search engine optimization professionals to make sure that the websites are being updated regularly so that the changes that the website is making can be reflected in the rankings of the different search engines. This will be possible only if the website is constantly being used by all the people who use the internet. A website which is constantly being used is a better website. There are numerous reasons as to why SEO experts are important. It is very important for the search engine optimization professionals to ensure that the right keywords are being used by all users of the web. By doing this, they will be able to get higher rankings in the various search engines. The more that a particular website has a high ranking in the search engine results, the better it will be in terms of traffic. By getting more traffic, one can be sure that the website will also have a higher conversion rate and it will also help it to increase its revenue. However, for this to happen, o Continue Reading",2021-03-05T20:02:46.644Z,"Why are SEO experts important? ",Quora
60428e78ed76476feda22bc5,https://www.quora.com/Who-is-the-best-SEO-expert-in-Dallas?-,"New to SEO? Need to polish up your knowledge? The Beginner's Guide to SEO has been read over 3 million times and provides comprehensive information you need to get on the road to professional quality Search Engine Optimization, or SEO. SEO is a marketing discipline focused on growing visibility in organic (non-paid) search engine results. SEO encompasses both the technical and creative elements required to improve rankings, drive traffic, and increase awareness in search engines. There are many aspects to SEO, from the words on your page to the way other sites link to you on the web. Sometimes S Continue ReadingNew to SEO? Need to polish up your knowledge? The Beginner's Guide to SEO has been read over 3 million times and provides comprehensive information you need to get on the road to professional quality Search Engine Optimization, or SEO. SEO is a marketing discipline focused on growing visibility in organic (non-paid) search engine results. SEO encompasses both the technical and creative elements required to improve rankings, drive traffic, and increase awareness in search engines. There are many aspects to SEO, from the words on your page to the way other sites link to you on the web. Sometimes SEO is simply a matter of making sure your site is structured in a way that search engines understand. SEO isn't just about building search engine-friendly websites. It's about making your site better for people too. The majority of web traffic is driven by the major commercial search engines, Google, Bing, and Yahoo!. Although social media and other types of traffic can generate visits to your website, search engines are the primary method of navigation for most Internet users. This is true whether your site provides content, services, products, information, or just about anything else. Search engines are unique in that they provide targeted traffic, people looking for what you offer and are the roadways that make this happen. If search engines cannot find your site, or add your content to their databases, you miss out on incredible opportunities to drive traffic to your site. Here is the list of the top 5 SEO in Dallas: 1. ClickGiant 2. BlueMatrix Media 3. DMA 4. HigherVisibility 5. OuterBox Need to learn more about SEO and Web designs which is a sure fire ticket to success? Read the link provided. New to SEO? Need to polish up your knowledge? The Beginner's Guide to SEO has been read over 3 million times and provides comprehensive information you need to get on the road to professional quality Search Engine Optimization, or SEO. SEO is a marketing discipline focused on growing visibility in organic (non-paid) search engine results. SEO encompasses both the technical and creative elements required to improve rankings, drive traffic, and increase awareness in search engines. There are many aspects to SEO, from the words on your page to the way other sites link to you on the web. Sometimes S Continue Reading",2021-03-05T20:03:04.636Z,"Who is the best SEO expert in Dallas? ",Quora
60428e9fed76476feda22be6,https://www.quora.com/How-can-I-start-my-career-as-SEO-expert?-,Questions 9,2021-03-05T20:03:43.201Z,"How can I start my career as SEO expert? ",Quora
60428f0fed76476feda22c46,https://www.quora.com/Why-should-one-hire-an-SEO-expert-to-get-online-exposure?-,"Laytoya Thomas, worked at Insightful Medical Informatics, Inc.Answered 3 years ago · Author has 100 answers and 149.6K answer views Laytoya Thomas Here are some reason why one hire seo expert internet Marketing and SEO strategies are the only form of marketing that puts your business, product or service in front of your targeted market and prospective customers who are actively seeking exactly what your company offers. Brand Awareness and increase visibility is important as 8 out of 10 people using the internet to find a product or service eventually does business online. Your competition is not sitting on the side line waiting to see what others will be doing as the stats speak for themselves, Web SEO utilization is at 39% of all e-commerc Continue ReadingHere are some reason why one hire seo expert internet Marketing and SEO strategies are the only form of marketing that puts your business, product or service in front of your targeted market and prospective customers who are actively seeking exactly what your company offers. Brand Awareness and increase visibility is important as 8 out of 10 people using the internet to find a product or service eventually does business online. Your competition is not sitting on the side line waiting to see what others will be doing as the stats speak for themselves, Web SEO utilization is at 39% of all e-commerce websites, up from 19% in 2007. Get your Website working for you and get back your ROI. Your website and Web Marketing applying SEO Optimization strategies works for you 24/7 365 days a years vs traditional ads on the Radio, Newspaper, Tv and Billboards are time sensitive. Recommended Site: Zeerk.  You can hire a SEO expert from here with very cheap rate. Also you can Hire a Traffic Generator Expert from here.",2021-03-05T20:05:35.740Z,"Why should one hire an SEO expert to get online exposure? ",Quora
60428f28ed76476feda22c5c,https://www.quora.com/Which-is-the-best-tool-to-use-being-an-SEO-expert?-,"As an SEO expert, you already know the tricks and techniques to get your content and website to rank. You may even know which tools to use for research and auditing - several good tools have already been listed here. But I would recommend using a ranking and tracking tool like Unamo SEO. One of the best tools to use as an SEO expert is one that helps you track all your SEO campaigns from one place. Here are some of Unamo SEO’s features that you might find useful as an SEO expert: Daily Keyword Rankings for Mobile and DesktopCompetitor Tracking and RankingsSERP FeaturesMultiregional Tracking fromContinue ReadingAs an SEO expert, you already know the tricks and techniques to get your content and website to rank. You may even know which tools to use for research and auditing - several good tools have already been listed here. But I would recommend using a ranking and tracking tool like Unamo SEO. One of the best tools to use as an SEO expert is one that helps you track all your SEO campaigns from one place. Here are some of Unamo SEO’s features that you might find useful as an SEO expert: Daily Keyword Rankings for Mobile and DesktopCompetitor Tracking and RankingsSERP FeaturesMultiregional Tracking from a Single CampaignPreferred URL SelectionComplete Backlink ProfileOn-page Optimization ChecksSimple and Advanced Keyword, Backlink, or Traffic ReportsGoogle Analytics and Search Console IntegrationsMobile and Desktop Tracking From Unamo SEO’s dashboard, you get an overview of your average daily keyword rankings first thing. The tool allows you to toggle between mobile and desktop rankings. Plus, it integrates your Google Analytics profile so you can compare different traffic sources to your organic keyword results.  Individual Keyword Rankings Here you can add or delete individual keywords. Unamo SEO shows you their individual desktop/mobile rankings, SERP links, competition, search volume, and groups. Placing keywords in groups helps you keep track of keyword campaigns separately if need be.  By clicking on a keyword, you’ll get a graph of it’s desktop and/or mobile rankings over the dates you choose. Plus, you’ll see it’s comparison to competitor rankings over the same time period.  Competitor Analysis Which brings us to competitor analysis. To track competitors, you can add them yourself or enable auto-tracking. The auto-tracking feature identifies competitors based on a keyword overlap percentage that you deem fit.  Once you have your competitors, you can enable side-by-side comparison for as many as you deem necessary. You can also view singular comparisons in blocks below the graph.  SERP Feature Tracking Unamo SEO allows you to monitor SERP feature rankings for your website and for individual keywords. Once you see that a keyword or competitor is ranking for a SERP feature - e.g., featured snippet - you can re-optimize your content and attempt to rank for that SERP feature. A great strategy for boosting traffic to your website.  Multiregional Tracking Not all content will perform the same in every region. You can track your SEO success in different country regions all from a single campaign.  This feature lets you know where your SEO visibility is most prominent. We track locally in over 35,000 regions around the world for Google. Preferred URL Selection Multiple pages ranking for the same keyword? No problem. With Unamo SEO you simply select a default page. You will still receive daily rankings for every URL from your website that ranks for that keyword.  On-page Optimization Audit Unamo SEO will tell you when there are any on-page issues for as many singular webpages as you want.  Backlinks With a complete backlink profile, you can monitor where your strongest links are coming from and the strength of your backlink profile in aggregate.  Plus, you can also find lost or no-follow links, which allows you to reclaim links. Unamo SEO also shows you the source domain, source country and anchor text for each backlink. Reports Create simple, advanced, link, or traffic reports that you can send to anyone at any time. You can also automate reports.    With Unamo SEO, you’ll have all the functionalities you need as an expert to streamline and monitor your strategies all from one platform. Plans start at 19$/mo up to enterprise plans suitable for any large business. Free trials are also available. Disclaimer: I work at Unamo. As an SEO expert, you already know the tricks and techniques to get your content and website to rank. You may even know which tools to use for research and auditing - several good tools have already been listed here. But I would recommend using a ranking and tracking tool like Unamo SEO. One of the best tools to use as an SEO expert is one that helps you track all your SEO campaigns from one place. Here are some of Unamo SEO’s features that you might find useful as an SEO expert: Daily Keyword Rankings for Mobile and DesktopCompetitor Tracking and RankingsSERP FeaturesMultiregional Tracking fromContinue Reading",2021-03-05T20:06:00.188Z,"Which is the best tool to use being an SEO expert? ",Quora
60428f3ded76476feda22c70,https://www.quora.com/Where-do-I-start-to-become-an-SEO-expert?-,"Chris Slesarchik, SEO Specialist at Page One Web SolutionsAnswered 3 years ago · Author has 60 answers and 22K answer views Chris Slesarchik The specific skills you should develop will depend upon whether you are looking to get hired by an agency, work in-house at a company, or strike out on your own as a freelancer. Without that knowledge, I’ll try to give as broad of an answer as possible. For starters, if you know absolutely nothing about SEO do yourself a favor and read Moz’s beginners guide to SEO. It will give you a good foundation. From there, becoming an SEO “expert” will give you a few options in where exactly you want to specialize and focus your expertise… The way I look at it, SEO can be broken down into 2 broad categorie Continue ReadingThe specific skills you should develop will depend upon whether you are looking to get hired by an agency, work in-house at a company, or strike out on your own as a freelancer. Without that knowledge, I’ll try to give as broad of an answer as possible. For starters, if you know absolutely nothing about SEO do yourself a favor and read Moz’s beginners guide to SEO. It will give you a good foundation. From there, becoming an SEO “expert” will give you a few options in where exactly you want to specialize and focus your expertise… The way I look at it, SEO can be broken down into 2 broad categories: Technical (coding, HTML, web dev, etc)Non-technical (marketing, content, strategy, etc)With a background in software engineering you will certainly have a leg up on the technical side. If you don’t already, a knowledge of HTML (most importantly), javascript, and PHP will help you out in the SEO industry. However companies and agencies are usually dependant on their development team for more in-depth coding skills. SEO experts or specialists are usually hired for their expertise in the marketing and strategy side of the field, with coding and technical knowledge being a secondary benefit. If you are looking to get hired at a company or agency, focus on learning about the wider realm of digital marketing and how all the pieces fit together (as an SEO you will need to work alongside PPC, social, email, and other teams. Collective success will be based on cooperation). I personally like the way Hubspot academy (free sign up required to access) explains inbound marketing. It also gives you a comprehensive picture as to how the sales funnel works and where SEO fits into the picture. Most of all, as an SEO expert you should understand and appreciate the power of search engines! So don’t be afraid to use them! A majority of my education in SEO has come as a result of careful googling and attentive reading. When you encounter a problem, challenge, or question in SEO, try googling it! (Or Binging or whatever you prefer)",2021-03-05T20:06:21.491Z,"Where do I start to become an SEO expert? ",Quora
60428f62ed76476feda22c8f,https://www.quora.com/How-Do-I-find-a-Miami-SEO-Expert?-,"A modern SEO company is defined as the best one for its customers success. MMS AGENCY has many customers from multiple fields with a very high position on google. In English and Spanish. Lets mention some of them: 7wireless.com - 1rst page of google (reparacion de celulares en Miami, reparacion de iphone en Miami, reparacion de samsung en Miami, reparacion de computadoras en Miami, cell phone repair in Miami, iphone repair in Miami). PlanetSecurityUSA.com - 1rst page of google Map (Security Camera Miami, security cameras distributor in Miami, wholesale security camera in Miami, wholesale security  Continue ReadingA modern SEO company is defined as the best one for its customers success. MMS AGENCY has many customers from multiple fields with a very high position on google. In English and Spanish. Lets mention some of them: 7wireless.com - 1rst page of google (reparacion de celulares en Miami, reparacion de iphone en Miami, reparacion de samsung en Miami, reparacion de computadoras en Miami, cell phone repair in Miami, iphone repair in Miami). PlanetSecurityUSA.com - 1rst page of google Map (Security Camera Miami, security cameras distributor in Miami, wholesale security camera in Miami, wholesale security camera in USA, hikvision camera in Miami, security camera installers in Miami) GAIA Stone Gallery - 1rst page of google (marble Orlando, marble store in Orlando, marble store in Tallahassee, marble store in Sarasota, marble store in Panama City Beach, marble store in Lakeland) AllAutoTech.com - 1rst page of google + map (auto repair in doral, car repair in doral, change oil in doral, change tires in Miami, car electrical services in doral, doral mechanics) Thirdeyevision - 1rst page of google (security camera Orlando, cabling orlando, security camera installer in orlando, security camera distributor in orlando, wholesale security camera orlando) SVMSeguros - 1rst page google - spanish site (seguro de salud en miami, agencia de seguros en miami, aseguradora en miami, seguro medico en miami, mejores seguros medicos en miami) CSSTech.net - 1rst page of google (Seurity Camera Installers in Miami, security camera installer in kendall, security camera installer in coral gables, security camera installer in doral, security camera installation miami, hikvision camera installer in miami, home security camera installer in miami) A modern SEO company is defined as the best one for its customers success. MMS AGENCY has many customers from multiple fields with a very high position on google. In English and Spanish. Lets mention some of them: 7wireless.com - 1rst page of google (reparacion de celulares en Miami, reparacion de iphone en Miami, reparacion de samsung en Miami, reparacion de computadoras en Miami, cell phone repair in Miami, iphone repair in Miami). PlanetSecurityUSA.com - 1rst page of google Map (Security Camera Miami, security cameras distributor in Miami, wholesale security camera in Miami, wholesale security  Continue Reading",2021-03-05T20:06:58.989Z,"How Do I find a Miami SEO Expert? ",Quora
