"_id",job_link,answer,date,question,source
60428c7aed76476feda229f8,https://www.quora.com/Who-are-best-SEO-experts-in-the-world?-,"Anand Kumar Jha, 7+ Years Experience in Search Engine Optimization and PPCUpdated January 9, 2021 · Author has 336 answers and 911.7K answer views Anand Kumar Jha Before reading the answer, go through this Kindle ebook to know the latest and ACTIONABLE SEO Secrets Tested SEO Secrets for Business Website Owners eBook: Jha (Anandkjha), Anand Kumar: Amazon.in: Kindle Store  Read this latest SEO book here Tested SEO Secrets for Business Website Owners eBook: Jha (Anandkjha), Anand Kumar: Amazon.in: Kindle Store Digital marketing is a growth-oriented marketing trend for business promotion. Digital marketing is different from traditional marketing. Digital marketing is a combination of marketing of products and services on digital platforms like computers, mobiles Continue ReadingBefore reading the answer, go through this Kindle ebook to know the latest and ACTIONABLE SEO Secrets Tested SEO Secrets for Business Website Owners eBook: Jha (Anandkjha), Anand Kumar: Amazon.in: Kindle Store  Read this latest SEO book here Tested SEO Secrets for Business Website Owners eBook: Jha (Anandkjha), Anand Kumar: Amazon.in: Kindle Store Digital marketing is a growth-oriented marketing trend for business promotion. Digital marketing is different from traditional marketing. Digital marketing is a combination of marketing of products and services on digital platforms like computers, mobiles, and tablets. Why Digital Marketing? We are in the digital era, where people like to use the internet on their computers, mobiles and tablets for searching information on products and services. These digital era users are in billions of numbers in the world. There are lots of opportunities to connect with potential buyers on the internet. Digital marketing consists of marketing techniques that promote your business, product, and services on the internet and give you valuable leads and sales. Benefits of Digital Marketing Digital marketing goes for 24 hours and 7 days of the week. That’s why this marketing technique is growth-oriented.This marketing technique uses PPC (pay per click) means you have to pay only when any user clicks on your ad or show interest.This marketing technique not only emphasis on paid services it also uses the freeways to reach your right customers through search engine optimization, content marketing, and social media optimization.This is the best platform to reach the right customers when they are not in the market, it means in any weather, day and situation your product and services will reach the right customers.Digital Marketing Services Digital marketing services include practices and services like Search Engine Marketing (SEM)Search Engine Optimization (SEO)Social Media Marketing (SMM)Social Media Optimization (SMO)Email Marketing (EM)Content Marketing (CM)Video Marketing (VM)Affiliate Marketing (AM)Why SEO or Search Engine Optimization? SEO stands for search engine optimization. Today every day billion of searches happen on search engines. There are 2 types of search results, one is paid and the other is free or organic. A good SEO expert does everything with a white hat strategy to optimize the landing pages to improve their ranking on search results. Let’s say you want to get top rank on search engine results quickly, then you have to opt for PPC or SEM (Search engine marketing). Here you have to spend lots of money to get leads or sales. This is temporary and depends upon the CPC Bid. In SEO, you can achieve top rank on those keywords in the long run where users are actually searching for your services and products. This is free. You no need to spend lots of money on this. You have to hire an SEO Expert for this. Whatever you will pay to an SEO experts never gone waste because SEO takes time but in long run, it gives sweet fruits. Here we take an example of a mathematical calculation of money spending on PPC and SEO Money Spent on PPC Example- $50/month*Each Keyword- $2-5*Total Clicks- 10 to 25*Total Conversion- 1-2* leads (If you have taken the help PPC expert)ROI- $40-60**= This varies on the type of business, online competition, knowledge of the expert. Money Spent on SEO Example- $50/month*Each Keyword- No costTotal Clicks- more than 25*Total Conversion- 10-15 leads* (If you have hired the best SEO expert)ROI- $100+**= SEO takes time to depend upon online competition, expert knowledge, content strength, and user experience. I hope, now you have understood the value of SEO and Digital Marketing.  How Can Anand Help You? Anand Kumar Jha is a well-educated SEO EXPERT in Chandigarh, India, and has more than 5 years of experience in search engine optimization. He has experience working with informative and e-commerce websites. He is delivering content on search engine optimization.  He has taught the techniques of SEO for beginners. He has also knowledge in inbound marketing, PPC, and email marketing.He will give you a good strategy for your online business promotion.He will help you and the business to grow 24 hours and 7 days a week.He will reply to you with your online business marketing solutions and best result oriented strategy. We do reputable result driven digital marketing services. Get a quote for your online business promotion. Give him a mail or call him on the given number. Free consultation.No charges or refund of your money if no result found.24×7 hours of support and services.If you want to hire Anand SEO EXPERT in Chandigarh, India for your online business branding and digital marketing then contact him on the following details. Certifications Achieved Till Now 1. Google Digital Unlocked by Google India (the Year 2017)  Google India 2. Google Analytics Beginners Certified by Google, USA (Year 2017)  Google, USA 3. Google Analytics Advanced Certified by Google, USA (Year 2017)  Google, USA 4. Inbound Marketing Certification by Hubspot INC, USA , and More… Here are the details: Contact Number:- +91–8872732615 You can text him also. Expert Location Chandigarh, India Skype:- anandjha797 Email:- anandkjha72@gmail.com hello@anandkjha.com Working Hours: Always Open  Websites www.anandkjha.comLearn Some SEO and Digital Marketing Techniques, If you haven’t planned for hiring Read these posts and I am sure you will love to invest time to earn by building an online presence. #1 A Comprehensive Guide on Google Adsense Revenue and its Optimization #2 7 Lucrative Lead Generation Strategies Through SEO #3 5 Secret Basics of Google SEO to Know #4 11 Advanced Tactics to Crack Google SEO in 2018 #5 7 Points to Know for Doing Right Google SEO #6 5 Remarkable Ways of Online Business Reputation Protection #7 7 Proven Ways to Rectify Your Business Online Reputation #8 7 All Time Best Social Bookmarking Sites List #9 9 Free Unbeatable SEO Tools for Online Competitor Analysis #10 Top 10 Link Building Strategies for Traffic Flood",2021-03-05T19:54:30.846Z,"Who are best SEO experts in the world? ",Quora
60428c8aed76476feda22a0d,https://www.quora.com/What-is-the-best-way-to-be-a-professional-SEO-specialist?-,"To be an SEO specialist, you have to have knowledge about a lot of things regarding general and advanced SEO and experiences of your own. One can only do freelancing with Back-linking but it will never be going to make you a Professional SEO Expert or Specialist. If you want to be a successful Search Engine Optimizer, you have to be concerned about a lot of things. Only Off-page Optimization is not enough to be an SEO-Guru; you must achieve expertise on On-Page, Off-Page, Key-Word Research, Content and other related topics. This post is for the ones who think themselves as an SEO expert with th Continue ReadingTo be an SEO specialist, you have to have knowledge about a lot of things regarding general and advanced SEO and experiences of your own. One can only do freelancing with Back-linking but it will never be going to make you a Professional SEO Expert or Specialist. If you want to be a successful Search Engine Optimizer, you have to be concerned about a lot of things. Only Off-page Optimization is not enough to be an SEO-Guru; you must achieve expertise on On-Page, Off-Page, Key-Word Research, Content and other related topics. This post is for the ones who think themselves as an SEO expert with their little knowledge. Here, I will also discuss what you have to do to be an SEO expert and how can you get a high-level job for this. So shall we start? First you have to know properly about The Web Let me tell you something in plain simple English, “You Can Never Be an SEO Expert Unless You Have a Proper Knowledge about the Web since You Are Going to Do SEO on Websites”. So, you must have to know how to manage, customize and run websites, how does the server, domain, hosting, IP signal, CMS, etc. works because you might need to work on the Structure of Websites at any time. You have to be prepared to take any necessary steps if there is any problem in the Website and must know how you are going to apply SEO Optimization to provide solutions. It is a myth that you need to learn about Web Development to gain concepts about The Web. You can do it with just Google Searching. To have better knowledge of HTML HTML is the primary part of a Website. It gives birth the Website. A Search Engine only indexes the HTML code of a Website to index a particular site. So, you have to know HTML well to be a professional Search Engine Optimizer. You must know how to work with these specific fundamental tags such as <a>, alt, meta, title, <h1>, <strong>, <img> etc. Knowing HTML does not include all the tags. So, do not panic. You can rapidly learn to use and work these tags with Google Search. It is a must to know Keyword Research Only a single mistaken keyword is enough to demolish an SEO project. On the other hand, a single accurate keyword is sufficient for your desired success. Some people believe that choosing an ideal/correct keyword means the half of the SEO is done And to elect the accurate and lucrative keywords, you have to perceive keyword research. One thing is for sure, if you want to be an SEO expert you must perceive keyword research, how to ferret out a niche, how to detect low competition keywords, how to do competitor analysis etc. You need to know about keyword trends therewithal. Which keyword is being searched oft-times, Which country is searching for the keyword more often, How many CPCs are therein etc. because, if you do not exert the particular keyword neither you will be able to get your desired number of visitors, nor you will be able to make room in Search parameter. Thus, you have to have detailed knowledge about keywords if you intend to become an SEO specialist. You Have to gain expertise in Content Writing There is an epigram, “Content is the king of SEO”. That means SEO is just a fantasy without Content. So, if you claim yourself as an SEO expert then you better have proper knowledge of Content Writing so that you can expertly write about any topic. A professional Search Engine Optimizer means a good content writer since a better content attracts visitor and provides support to keep them in reach of your league as well. Why would anyone visit your website if it does not have informative and accurate content? Therefore, ask yourself, How you are going to write content? For whom you will be writing content, What are you going to write? How much should you write? When to write? Well, it is not that easy to be a good content writer. You have to be fluent in English. Even if you are not fluent, keep writing and trying and practicing until you reach a point where you can, at least, write correct English. Take help from Other’s writings, follow their style, check where your mistakes are and correct them. Sooner or Later, your English will gradually improve. You Must Know How to do proper On-Page optimization On-page is one of the most significant parts of Search Engine Optimization. Without On-page, SEO is like walking a blind road and whoever walks on this road shall be called Blind SEO Experts. So, if you want not to be a Blind SEO Expert you better learn the A-Z of On-Page Optimization. There are different classes of On-Page Optimization. To do On-page Optimization, you have to know- How To Use Meta Tags.How To Do Title Optimization.How To Do Description Optimization.Keyword Density And Keyword Replacement.The Usages Of Sitemap.XML, Robots.Txt, Webmaster Tools, Analytics.Website Structure And Layout.URL Optimization.Image Optimization.The Usages Of Heading Tags (H1, H2, H3).How To Do Internal Linking Etc.So, if you want to be an SEO-Guru, you should learn about On-Page Optimization in details. Otherwise, you will never get quality freelancing projects and even if you do, you would not be able complete them accurately. You have to be an expert in Off-Page Optimization as well Only On-Page optimization is not enough. To be a professional, you have to know Off-Page optimization too as it comes right after the On-page optimization. The word Off-Page Optimization refers to Promotion. Again, only Back-link Building and Off-Page Optimization will not do any help if there is no planning. An SEO expert will always do Off-Page Optimization with proper planning. Plan will raise these questions in an SEO expert’s mind- How many back-linking are needed for the website? What types of back-linking are required? Where to get the back-links? Etc. Below are the things that you need to attain to be an Off-page Optimization Expert- The Ability to Build Up Links In All Platforms.Anchor Text Optimization.Ferreting Out the Back-Link Websites In An Exact Way.Link-Wheel and Tire-Back-Linking.Page-Rank, Page/Domain Authority.Link Management.Citation (For Local SEO).Content Marketing and Promotion.Concept About Google Penguin Update..There are a lot of other factors than the above ones but to be an expert; you have to achieve at least these significant factors. Without On-Page Optimization, one cannot think about building a search-engine friendly website. On the contrary, without Off-page optimization, you can do the ranking of a website. Hence, to be an SEO specialist you have to master your skills on both of these matters. Expertise on Analysis, Tracking and Budget Planning is also necessary A Professional SEO Optimizer is the one who analyzes his work. So, you have to come up with the expertise on Analysis, Tracking, and Planning as well. An SEO Expert is a solution provider and is also concerned about things such as How many visitors are visiting the website, Which keywords are attracting the visitors, Which keyword got the ranking, Why a keyword is not getting ranked, finding out the obstacles and how to fix them. Besides, if he uses anything that is paid, he will determine the budget and Return on Investment (ROI) and operate his work and link-tracking according to that. If you are not yet an expert on these matters, then you are still not an Expert in SEO too. If you want to build up your career on Search Engine Optimization, then follow my instructions and advice. Whatever you do, do it properly. Claiming yourself as an expert in SEO with lesser knowledge is like a being a failure in the troop. It is hard to become an SEO expert in a short period but if you follow my above discussions and work as I have said then there could be a chance for you to become an expert in few months and build up your career along the way. There is a huge demand for SEO experts in he whole world. Latterly in Bangladesh, the demand of SEO experts is gradually touching the heights of the sky. A lot of organizations are asking for Search Engine Optimizers. But the sad fact is the demanders are not even expert in SEO and thus, many people are losing work. This is not just only happening in local works but is happening in freelancing as well. People are losing works in Marketplaces because they are failing to fulfill the requirements of the buyers. But how long you will survive like this? A little hard work can make you a successful Search Engine Optimizer. Stop wasting your precious time in bidding and other useless stuff and start learning. The accurate knowledge in SEO can help you to make a bright career as this sector is coming to everyone’s concern lately. Soon it will be huge and there will be a lot of SEO experts. So, are you preparing yourself to make room in the Ocean of SEO experts? To be an SEO specialist, you have to have knowledge about a lot of things regarding general and advanced SEO and experiences of your own. One can only do freelancing with Back-linking but it will never be going to make you a Professional SEO Expert or Specialist. If you want to be a successful Search Engine Optimizer, you have to be concerned about a lot of things. Only Off-page Optimization is not enough to be an SEO-Guru; you must achieve expertise on On-Page, Off-Page, Key-Word Research, Content and other related topics. This post is for the ones who think themselves as an SEO expert with th Continue Reading",2021-03-05T19:54:50.907Z,"What is the best way to be a professional SEO specialist? ",Quora
60428ca2ed76476feda22a21,https://www.quora.com/Is-there-any-SEO-expert?-,"Urmila Singh, studied at University of CalcuttaAnswered 9 months ago · Author has 1.2K answers and 1.1M answer views Urmila Singh Search Engine Optimization or S.E.O. helps any business to create fast, powerful, and user-friendly websites that ranks higher in search engine’s results pages like Google, which in turn assists to bring more potential customers to their sites and eventually increases the conversion rates. For all the businesses across Kolkata and India, I would like to recommend We Love Digital Marketing as one of the best SEO Experts In Kolkata for all of their SEO needs. This company has solutions to all of your Digital Marketing needs for your business, they are not only expert in SEO, but are expert in Goo Continue ReadingSearch Engine Optimization or S.E.O. helps any business to create fast, powerful, and user-friendly websites that ranks higher in search engine’s results pages like Google, which in turn assists to bring more potential customers to their sites and eventually increases the conversion rates. For all the businesses across Kolkata and India, I would like to recommend We Love Digital Marketing as one of the best SEO Experts In Kolkata for all of their SEO needs. This company has solutions to all of your Digital Marketing needs for your business, they are not only expert in SEO, but are expert in Google Ads, Social Media Marketing , Content Marketing, Website Designing, Graphic Designing, Email Marketing, SMS Marketing and lots more. Their prime objective is to reach the target audience, get brand recognition, generate inbound sales and obtain better ROI. This company is Google Adwords, Google Analytics and Google Adsense certified, so you can trust it without having any doubt. The company currently do have some of the top companies across India and Abroad as their clientele since in Digital Marketing , geographical barriers are not an issue. So, no matter where you and your business is, We Love Digital Marketing is always there to take your business into the next level. The team of We Love Digital Marketing does everything that your brand needs to make a true mark in the online marketplace in this highly competitive world",2021-03-05T19:55:14.122Z,"Is there any SEO expert? ",Quora
60428cc8ed76476feda22a42,https://www.quora.com/What-do-scientists-make-of-SEO-experts?-,"Dustin Woodard, Web Consultant, Filmmaker, EntrepreneurAnswered 5 years ago Dustin Woodard I've been married to a scientist for 16 years & feel quite comfortable calling myself an SEO expert. I've been doing it for 17 years, accepting invitations to speak at advanced search conferences on advanced topics & have a long and impressive track record of growing sites. The thing is, I rarely write articles, nor do most of the advanced SEOs I know. And when we present at conferences, we usually can't share the details of our strategies due to client contracts and competitive reasons. Plus every site has its own unique challenges.  My wife doesn't read SEO articles - heck, I barely do. But s Continue ReadingI've been married to a scientist for 16 years & feel quite comfortable calling myself an SEO expert. I've been doing it for 17 years, accepting invitations to speak at advanced search conferences on advanced topics & have a long and impressive track record of growing sites. The thing is, I rarely write articles, nor do most of the advanced SEOs I know. And when we present at conferences, we usually can't share the details of our strategies due to client contracts and competitive reasons. Plus every site has its own unique challenges.  My wife doesn't read SEO articles - heck, I barely do. But she does understand the value an SEO brings. She is actually much more critical of US scientific research (follow the funding). She also understands that SEO isn't cut and dry like traditional science. As Peter points out, SEO is an incredibly complex moving target.  I've worked with a number of scientists who tried to enter this field who failed miserably. For example, about 10 years ago one scientist I worked with shared a study he did where he measured the pixel count of the nav bars for the top 100 websites, as if that were the secret to driving mass amounts of traffic to a site.  Even Google itself has stop hiring as many scientists - they used to rely on them almost entirely, but now they admit that GPA, degrees, and even the college turned out to be meaningless. Unless Google makes their search algorithm publicly available, you won't be seeing very many sources or references in SEO articles. There are certainly studies out there & some very solid, but they are few & far between and can become outdated with the next algorithm change. The best SEOs rely on experience, experiments, and a thorough understanding of what search engines consider valuable content and what internal & external signals they will key off of long-term. And remember, only half of is SEO science - the other half is more of an art (how do you get websites to link to yours naturally?).   When I used to work in the financial industry, there were a few services that tracked the buy & sell recommendations of financial newsletters and published their track record. It would never happen, but it would be cool if we could do that for SEO experts (pull in all their client's organic search traffic growth figures).",2021-03-05T19:55:52.122Z,"What do scientists make of SEO experts? ",Quora
