"_id",job_link,answer,date,question,source
60429109ed76476feda22e0c,https://www.quora.com/Are-you-an-SEO-expert?-,Yes! Our SEO agency services include on-page and off-page SEO activities to improve brand discovery and search engine rankings SEO Essentials We identify keywords that are critical for your business success and improve your website rankings Website Audit Competitive Analysis Technical Markup Mapping optimization Keyword targeting \On-page optimization Local SEO Our SEO team has experience in ranking several websites in top local searches to effectively target potential customers Local search optimization Google My Business Listing Citation Setup & Optimization Localized Content Creation Technical SEO We ensur Continue ReadingYes! Our SEO agency services include on-page and off-page SEO activities to improve brand discovery and search engine rankings SEO Essentials We identify keywords that are critical for your business success and improve your website rankings Website Audit Competitive Analysis Technical Markup Mapping optimization Keyword targeting \On-page optimization Local SEO Our SEO team has experience in ranking several websites in top local searches to effectively target potential customers Local search optimization Google My Business Listing Citation Setup & Optimization Localized Content Creation Technical SEO We ensure that your website is performing at peak efficiency with faster load time and reduced bounce rate Backlink analysis Website migrations Schema markup Image optimization Page-speed optimization SEO Analytics Our SEO team keeps you up-to-date with the latest analytics reports to measure your website’s performance and our SEO efforts Google Analytics Google Tag Manager User behavior data Reporting and insights Yes! Our SEO agency services include on-page and off-page SEO activities to improve brand discovery and search engine rankings SEO Essentials We identify keywords that are critical for your business success and improve your website rankings Website Audit Competitive Analysis Technical Markup Mapping optimization Keyword targeting \On-page optimization Local SEO Our SEO team has experience in ranking several websites in top local searches to effectively target potential customers Local search optimization Google My Business Listing Citation Setup & Optimization Localized Content Creation Technical SEO We ensur Continue Reading,2021-03-05T20:14:01.757Z,"Are you an SEO expert? ",Quora
60429130ed76476feda22e2b,https://www.quora.com/What-is-at-least-qualification-of-an-SEO-expert?-,"To properly answer this question one needs to know the employers SEO knowledge to better evaluate an SEO expert… Let's say you have fundamental understanding of SEO processes then I would follow next set of questions to get a full scope of their ranking strategies / focus: Can they name any successfully ranked projects / keywords? What were the ranking benchmarks prior to working with the client? What was the average traffic / lead increase after hitting the early keyword page #1’s? What methods they used in those particular projects to achieve the rankings? Technical SEOOn-site SEOOff-site SEO (LinContinue ReadingTo properly answer this question one needs to know the employers SEO knowledge to better evaluate an SEO expert… Let's say you have fundamental understanding of SEO processes then I would follow next set of questions to get a full scope of their ranking strategies / focus: Can they name any successfully ranked projects / keywords? What were the ranking benchmarks prior to working with the client? What was the average traffic / lead increase after hitting the early keyword page #1’s? What methods they used in those particular projects to achieve the rankings? Technical SEOOn-site SEOOff-site SEO (Link-Building)Evaluate the answers! Combination of these answers should give you a pretty good grip on their capabilities to rank a website. First, you will understand type of compition site they ranked. Second, you will get a full understanding on their ranking techniques and third, you will know if they actually made money for their client. Traffic and leads don't lie while rankings can be a bit misleading at times. — Hope this helps! To properly answer this question one needs to know the employers SEO knowledge to better evaluate an SEO expert… Let's say you have fundamental understanding of SEO processes then I would follow next set of questions to get a full scope of their ranking strategies / focus: Can they name any successfully ranked projects / keywords? What were the ranking benchmarks prior to working with the client? What was the average traffic / lead increase after hitting the early keyword page #1’s? What methods they used in those particular projects to achieve the rankings? Technical SEOOn-site SEOOff-site SEO (LinContinue Reading",2021-03-05T20:14:40.403Z,"What is at least qualification of an SEO expert? ",Quora
60429149ed76476feda22e46,https://www.quora.com/Which-SEO-experts-do-you-trust-and-follow?-,"Kris Phils Search Engine Optimisation is the juice that keeps Internet Marketing alive and kicking, so the experts that make it happen should be so revered and well respected. In that regard I'll be mentioning some of the experts that make this industry thick and what it has grown to be now #1. Rand Fishkin  He is the CEO and co founder of Washington based tech company - SEO MOZ. BusinessWeek listed him among their 30 Best Young Tech Entrepreneurs Under 30. He is a real authority on everything SEO so following him up on his blog, Twitter handle and more is truly ideal. #2 Neil Patel:  British Born entrepreneur  Continue ReadingSearch Engine Optimisation is the juice that keeps Internet Marketing alive and kicking, so the experts that make it happen should be so revered and well respected. In that regard I'll be mentioning some of the experts that make this industry thick and what it has grown to be now #1. Rand Fishkin  He is the CEO and co founder of Washington based tech company - SEO MOZ. BusinessWeek listed him among their 30 Best Young Tech Entrepreneurs Under 30. He is a real authority on everything SEO so following him up on his blog, Twitter handle and more is truly ideal. #2 Neil Patel:  British Born entrepreneur and top Internet marketer and founder of companies like kissmetrics, crazy egg and ubersuggest (one of the best keyword research tools). Dude is well respected and an SEO authority. #3: Matt Cutts  Former Head of Spam units at Google and one of the most respected figure in the SEO community. Matt has carved a niche for himself, he put so many Internet Marketers on their toes especially during the Panda and Penguin updates, his tweets on SEO practices especially as it concerns Google were followed like ants on a sugar. 4. Brian Halligan:  Brian is the CEO and co founder of Hubspot, a digital marketing and inbound sales marketing software company based in Cambridge Massachusetts USA. He is also a lecturer, best selling author and more. #5: Dhamersh Shah  Co founder and Chief Technology Officer of Hubspot alongside his friend Brian Halligan. Dhamersh is a serial Entrepreneur and has founded companies and invested in others too. He is a blogger and author, and has been one of the most influential characters in the SEO community. 6: Gabriel Weinberg:  Founder of Pennsylvania based billion dollar company and Google challenger - duckduckgo. Gabriel is also the co author of - Super thinking and Traction. He is one of the most followed figures on Quora and his articles on medium gets millions of views every month. Honorable mentions- Seth Godin, Gary Vayernuck. These are some of the figures I personally respect anytime the subject of SEO comes up. Feel free to add yours. Continue Reading",2021-03-05T20:15:05.202Z,"Which SEO experts do you trust and follow? ",Quora
6042916eed76476feda22e64,https://www.quora.com/How-can-hiring-a-proper-SEO-expert-make-your-website-run-successfully?-,"First off I definitely wouldn’t get SEO done by someone from India. Bad bad idea. SEO is a far-teaching term that includes all practices that may result in the increased visibility of your website. So, though I’m unaware of the current status of your site, I can confidently say SEO performed intentionally and with knowledge can improve your website in many ways! SEO covers much much more than what the other comment described. A website created without SEO in mind is unlikely to get any organic traffic and is thus required to pay for leads if it is a lead based business. Without SEO, a site is lik Continue ReadingFirst off I definitely wouldn’t get SEO done by someone from India. Bad bad idea. SEO is a far-teaching term that includes all practices that may result in the increased visibility of your website. So, though I’m unaware of the current status of your site, I can confidently say SEO performed intentionally and with knowledge can improve your website in many ways! SEO covers much much more than what the other comment described. A website created without SEO in mind is unlikely to get any organic traffic and is thus required to pay for leads if it is a lead based business. Without SEO, a site is likely to be slow, ranked after the first page (if at all), and unlikely to grab visitors that stay on the site for more than a second or two. SEO solves these problems and many more and can be the difference between zero or thousands of monthly visitors. Any business that cannot totally rely upon word of mouth for customers needs SEO, and what SEO does is follow Googles guidelines on how they want websites to be. This in turn drives constant traffic to your site. This is done in dozens of different ways, but some would include tagging correctly, optimizing for keywords site wide and in particular pieces of content, link building (internally and externally), optimizing images for speed and quality, setting up post campaigns and user engagement with online citations, social media listings, and business listings, among many more things. I’d love to answer more questions if you have any. Also, I’d you want to quickly check out the current status of your site, I offer a free automated audit here: Web Design, Local SEO, and More. I also give out free SEO consultations and SEO reports which go in more depth than any automated Audit. hope it helps :) First off I definitely wouldn’t get SEO done by someone from India. Bad bad idea. SEO is a far-teaching term that includes all practices that may result in the increased visibility of your website. So, though I’m unaware of the current status of your site, I can confidently say SEO performed intentionally and with knowledge can improve your website in many ways! SEO covers much much more than what the other comment described. A website created without SEO in mind is unlikely to get any organic traffic and is thus required to pay for leads if it is a lead based business. Without SEO, a site is lik Continue Reading",2021-03-05T20:15:42.480Z,"How can hiring a proper SEO expert make your website run successfully? ",Quora
604291a8ed76476feda22e92,https://www.quora.com/What-would-you-offer-as-a-local-SEO-expert?-,"Antoine Delanglade I will offer you local SEO services, and a beer (and even a cookie if you are moody coming to work...). More seriously, though the above is completely serious too, first things first is you will have to have your website optimize like any another. Maybe this can help if you are not sure how to tackle this step What are the best white-hat SEO techniques for a new website? Now to be more specific about local SEO, guess what you will have to focus on local parameters... I ll bullet point my answer from here. Optimize your Google My business page, don't forget to have your business address on your oContinue ReadingI will offer you local SEO services, and a beer (and even a cookie if you are moody coming to work...). More seriously, though the above is completely serious too, first things first is you will have to have your website optimize like any another. Maybe this can help if you are not sure how to tackle this step What are the best white-hat SEO techniques for a new website? Now to be more specific about local SEO, guess what you will have to focus on local parameters... I ll bullet point my answer from here. Optimize your Google My business page, don't forget to have your business address on your other social profiles (and on your website obviously)Optimize landing pages with local data and keywords. In your titles, a google maps, etc...Submit your website to local directories (Yelp, Foursquare, Google...) and get your customers to give you a review Build local links and citations. For exemple if your business get cited in a local journalHope this help. Best, Antoine Continue Reading",2021-03-05T20:16:40.523Z,"What would you offer as a local SEO expert? ",Quora
604291c4ed76476feda22eab,https://www.quora.com/How-can-become-an-SEO-expert-in-2020?-,Questions Neel Patel,2021-03-05T20:17:08.428Z,"How can become an SEO expert in 2020? ",Quora
604291eeed76476feda22ed0,https://www.quora.com/Who-are-the-top-five-global-SEO-experts?-,Russell Matson  Rand FishkinWill CritchlowTom CritchlowDanny SullivanMichael King These are the ones I admire most. There are many others to whom I follow regularly.,2021-03-05T20:17:50.149Z,"Who are the top five global SEO experts? ",Quora
6042920aed76476feda22ee7,https://www.quora.com/What-do-most-SEO-experts-rank-with-Private-Blog-Networks?-,"The answer to the above question is quite obvious. It is true that nowadays, most of the SEO experts use PBN or Private Blog Network to rank website in Google and in other search engines. They are using PBN simply because they are getting the result which they are trying to achieve. At the same time you also need to make sure that you are not overusing PBN links to rank a certain keywords. In that case the PBN linking startegy may backfire as well. To avoid such cases, it is always suggested to use quality PBN links that have decent domain metrics. You also need to ensure the PBN domains have z Continue ReadingThe answer to the above question is quite obvious. It is true that nowadays, most of the SEO experts use PBN or Private Blog Network to rank website in Google and in other search engines. They are using PBN simply because they are getting the result which they are trying to achieve. At the same time you also need to make sure that you are not overusing PBN links to rank a certain keywords. In that case the PBN linking startegy may backfire as well. To avoid such cases, it is always suggested to use quality PBN links that have decent domain metrics. You also need to ensure the PBN domains have zero spam score. It is one of the most important domain metrics that most of the SEO experts tend to forget. If you can ensure about these vital factors, there is no doubt your PBN links will be effective.  That’s why it would be wise to rely on reputed agency like DieselMarketer for PBN backlinks. They regularly check their domain metrics and compile PBN list to maintain the effectiveness of their Private Blog network. As a result, you are always on safe hands. The answer to the above question is quite obvious. It is true that nowadays, most of the SEO experts use PBN or Private Blog Network to rank website in Google and in other search engines. They are using PBN simply because they are getting the result which they are trying to achieve. At the same time you also need to make sure that you are not overusing PBN links to rank a certain keywords. In that case the PBN linking startegy may backfire as well. To avoid such cases, it is always suggested to use quality PBN links that have decent domain metrics. You also need to ensure the PBN domains have z Continue Reading",2021-03-05T20:18:18.298Z,"What do most SEO experts rank with Private Blog Networks? ",Quora
