"_id",job_link,answer,date,question,source
604224fced76476feda1f396,https://www.quora.com/Would-a-Shopify-expert-or-partner-consider-a-bot-builder-company-for-partnership?-,"Do Shopify drop shipping businesses actually make money to make a living? Short answer: Yes, absolutely. Many do. Longer answer: First separate the platform from the business model. Many people equate Shopify with drop shipping due to Shopify’s low barrier to entry both in terms of cost and technical knowledge. It’s very easy to use. It is also easy to list products from AliExpress on Shopify (more on this later). There are other platforms however that would perform equally well as a base for a drop shipping business such as BigCommerce, Magento or Wordpress with WooCommerce. Now to using the drop shipping business model to generate enough net profit to provide a comfor Continue ReadingShort answer: Yes, absolutely. Many do. Longer answer: First separate the platform from the business model. Many people equate Shopify with drop shipping due to Shopify’s low barrier to entry both in terms of cost and technical knowledge. It’s very easy to use. It is also easy to list products from AliExpress on Shopify (more on this later). There are other platforms however that would perform equally well as a base for a drop shipping business such as BigCommerce, Magento or Wordpress with WooCommerce. Now to using the drop shipping business model to generate enough net profit to provide a comfortable living wage. Let’s assume that your target living “wage” is $10K per month (that would be very comfortable for alot of people). I’m going to rough out how you would get to this amount using two different drop shipping methods that can work below. I’ve been lucky enough to one on one coach over 200 drop ship business owners, I make the following observations based on this; Here’s where people go wrong with drop shipping and ultimately why so many people don’t find success with drop shipping; They believe it’s easy (this myth is peddled by a number of less than scrupulous online courses)They believe that you don’t need capital to be successfulThey don’t understand that they are really running a marketing businessThey either don’t or can’t be bothered to learn how to apply and master the marketing techniques that are a best fit for the products they want to sellThey don’t know how to pick the right products to sell using a drop shipping modelBroadly speaking here is what you need to master to reach $10K per month in net profit using drop shipping; Product and niche (market) selectionIntermediate web design (could be outsourced)Basic sales copywritingCustomer service (could be outsourced)How to pick the right marketing channels for your products (e.g. Google Adwords, Facebook Ads, Instagram)How to generate profitable sales using which ever marketing channels you pick from number 5.If you are choosing to produce most of your initial website traffic using paid traffic sources like Google Adwords or Facebook Ads then you should have a small amount of start up capital (e.g $3K - $5K). It is possible to do it with none but I have seen that done successfully very rarely.I would have to stress points 5 and 6, this is where most people fall down. If you want to market your products using Facebook Ads for example you need to develop strong knowledge in how to successfully run Facebook Ads. If you don’t you will fail. Now here’s two models of drop shipping that can be used successfully in 2017. Here’s an overview; High Value Dropshipping using local suppliers This method involves identifying a specific niche market and set of products in the country you want to sell in. Generally you would aim for products that retail for $500 USD or more. My example could be that I want to sell wine fridges (also known as wine coolers) to wine lovers in the United States. Here’s an example of such a product  While there are cheap wine fridges the average is probably around $1000 USD. I would source my products from suppliers of wine fridges based in the US. My target market would only be wine lovers based in the US. I would market these products using a combination of Google Adwords, Facebook, organic traffic (SEO) and email. If I know what I am doing I should be able to generate sales at cost of $50 or less (this includes platform and transaction fees). The average gross profit margin for this type of drop shipping is 30%. So if I sell at $1000 I will be buying the product at $700. I then minus my $50 cost of sale and I am left with $250. This equation may vary depending on whether you are offering free shipping or not. So if I can make $250 per sale, to reach $10K per month I need to sell 40 wine fridges or about 1.3 per day. Not that hard. Keep in mind also that wine fridges can retail for up to $3K+ so if I sell a couple at that price point I need to sell even less per month. I personally use this model and I have seen many others do it successfully. I’ve also seen a lot of people fail at it. Low Value Dropshipping The second method of drop shipping that could generate $10K in your pocket per month is low value dropshipping. This is the method that most people are talking about at the moment and most people equate with Shopify and drop shipping. In this method you are selecting products in the impulse buy zone. Maybe $20 - $40 USD. A price point that people don’t need to think to hard about. The idea is to source those products at a very low price so that your profit margin is much higher. To achieve this most people turn to manufacturers in China via AliExpress. I mentioned earlier that Shopify is popular with people operating this model. This is because it is extremely easy to list products from AliExpress to your Shopify store using an app called Oberlo. In this model you might be buying a product for $4USD and selling it for $25USD with free shipping from China to your customer. So your goal here is to acquire customers at a price that leaves you a profit from the margin of $21USD.  I might sell something like these little hip bags. I would go through a similar process as with high value drop shipping. Identify a target audience and market products to them based on their interest. There are four things that are particularly crucial to making this model of drop shipping successful; Identifying your target audience and their interests.Picking the right product to suit your identified target audience. Many products are duds from a quality perspective and many are already being flogged to death.Being able to acquire traffic at the right price. It is most common to use Facebook/Instagram to market you products. You can only find success if you properly understand how to use these platforms. This takes time, practice and a little bit of money.Having upsells to squeeze more money out of each customer. This could be onsite or via email.In this example I should be able to walk away from each sale with at least $8 net profit. If I was selling just this one item I would have to sell 1250 per month to get to my $10K profit. Sounds like a lot but I wouldn’t just be selling this one product. I would have a range of upsells and other products to double or triple the value of many orders. What I’ve outlined above are very broad and limited explanations. A lot more goes into making either model of drop shipping successful. The crux is however that drop shipping can work and quite well. But like every business model more people will fail than succeed. Many people at the moment like to prattle on that “drop shipping is dead”. They are wrong. I will clarify that as well as coaching people who run drop shipping businesses I also have run and sold my own drop shipping businesses for the last 4 years. I hope this helps.",2021-03-05T12:33:00.507Z,"Would a Shopify expert or partner consider a bot builder company for partnership? ",Quora
60422511ed76476feda1f3b7,https://www.quora.com/Why-many-Shopify-developers-freelancers-do-not-have-Shopify-Expert-certification?-,,2021-03-05T12:33:21.321Z,"Why many Shopify developers-freelancers do not have Shopify Expert certification? ",Quora
6042253ced76476feda1f3f5,https://www.quora.com/Why-and-how-should-you-hire-a-Shopify-expert-for-your-growing-business?-,,2021-03-05T12:34:04.369Z,"Why and how should you hire a Shopify expert for your growing business? ",Quora
60422552ed76476feda1f419,https://www.quora.com/When-do-you-need-to-hire-a-Shopify-expert-for-your-site?-,,2021-03-05T12:34:26.353Z,"When do you need to hire a Shopify expert for your site? ",Quora
6042257bed76476feda1f456,https://www.quora.com/How-do-we-connect-with-a-Shopify-expert-in-India-to-customize-our-website?-,"Ayush Mehta, Owner of an Ecommerce BusinessAnswered 1 year agoWho is the best Shopify expert? Ayush Mehta So you’re looking to make an attractive Shopify storefront, or hire a team of Shopify developers to look after your store: a good website is critical in getting the leg up on your competitors. The problem is, your competitors want to get a leg up on you too—if you want a better site than them, you need to hire shopify experts. Shopify’s own Experts Directory is a good place to start, but it gives a pretty limited window into the opportunities available. What do you do? Well, you know the old saying: you can have it fast, cheap or good but you can’t have all three. Start weighing up what’s more  Continue ReadingSo you’re looking to make an attractive Shopify storefront, or hire a team of Shopify developers to look after your store: a good website is critical in getting the leg up on your competitors. The problem is, your competitors want to get a leg up on you too—if you want a better site than them, you need to hire shopify experts. Shopify’s own Experts Directory is a good place to start, but it gives a pretty limited window into the opportunities available. What do you do? Well, you know the old saying: you can have it fast, cheap or good but you can’t have all three. Start weighing up what’s more important to you: Fast: you need your site up yesterday. Your competitor already has the lead, and you need to get yourself moving as soon as possible. Often here, you want to look at teams with offices spread over multiple time zones: an international company can have its Shopify developers work in shifts, to get your storefront up as quickly as possible.Cheap: you’re on a budget. You’re a smart businessman, and you know smart business is about knowing where to spend and where to save. Again, it’s good to look internationally: outsourcing is a great way to save those extra pennies.Good: you’re willing to pay extra for quality. You want a boutique experience that will make your customers feel like kings. A quality UX is one of the hardest things to find, and requires real Shopify experts to pull off.Personally, when I need a Shopify developer, I go to CodeClouds. They’re a rare breed: fast, cheap and good. Most other developers wash their hands with a site as soon as they’re done with it, but their team of Shopify experts offered me support, maintenance and updates that keep my storefront on the bleeding edge. Their subscription billing model let me choose the deal that was right for me. Their company is based in India but has offices in the US, Australia and New Zealand that let you get the best of both worlds. It took me a long time to find the Shopify developer that was right for me, but it was definitely worth it in the end.",2021-03-05T12:35:07.396Z,"How do we connect with a Shopify expert in India to customize our website? ",Quora
604225abed76476feda1f498,https://www.quora.com/What-is-the-best-website-in-India-to-find-Shopify-experts-to-create-an-online-web-and-mobile-knitwear-store?-,,2021-03-05T12:35:55.708Z,"What is the best website in India to find Shopify experts to create an online web and mobile knitwear store? ",Quora
604225dbed76476feda1f4e0,https://www.quora.com/What-are-the-key-things-to-consider-before-you-hire-a-Shopify-expert?-,"Damien Defranco, Serial Entrepreneur, Venture Capitalist, Consultant & MentorAnswered 3 years ago · Author has 1K answers and 5.2M answer viewsCan I start a decent Shopify (dropshipping) business with 2000$, if so, what difference would it make for me than for someone starting with 100$ (or even 0$)? Damien Defranco Well you can start a dropshipping business and turn it into a multi-million dollar business with just the cost of a domain ($15). Most dropshippers today build up their site with anywhere between $300–500 budget. So having a $2000 budget puts you at an advantage to others. But most people also fail. Dropshipping stores in general have a massive fail rate. 29/30 will not profit within 6 months. Most people quit. It’s very possible to make it in dropshipping, if you are willing to put in the time and passion needed for it. The advantage you get is that you have $2000 to put towards paid advertisin Continue ReadingWell you can start a dropshipping business and turn it into a multi-million dollar business with just the cost of a domain ($15). Most dropshippers today build up their site with anywhere between $300–500 budget. So having a $2000 budget puts you at an advantage to others. But most people also fail. Dropshipping stores in general have a massive fail rate. 29/30 will not profit within 6 months. Most people quit. It’s very possible to make it in dropshipping, if you are willing to put in the time and passion needed for it. The advantage you get is that you have $2000 to put towards paid advertising which can make or break you. $2000 can go a long ways to advertising 3–4 products using Instagram Influencer Marketing and Facebook Re-Targeting ads. I would spend about 4–6 months learning about Instagram Influencer Marketing and Facebook Ads before jumping into it. I’ve seen people pay $2000 on ads and generate 0 sales. If you don’t know what you are doing, you are setting yourself up for failure. Another option is to use that money to teach yourself, first hand how to market. $2000 should be enough if spread thinly for you to get some experience in Ads and learn targeting, and the various methods of Facebook Advertising. But then you’ll need to come up with more money once you’re confident enough in your abilities to put it use. During all this, you can still start your store. There are many free methods of advertising you can do to start building up your content, SEO, and brand trust. Post on Facebok, Twitter, Instagram, and Pinterest of your own 2–3 times a day, each and every day consistently. You can write a blog post each and every day. This will slowly build up your brand while you figure out the paid advertising of things. The other option is hiring a marketing expert. But even some of them fail, and you’d be spending $800–900 in service costs and only have $1100–1200 left for actual Advertising content. And that’s for an amateur marketer. Professional marketers who have more experience and better chance of making you sales easily cost $3000–4000 a month or more in service fees. But you’ll want to be spending $12,000 or more in Ads to be worth it for them. Finally, you can hire a coach. Someone to teach you how to spend that $2000 on ads. Much better than learning it yourself. You’ll probably pay them $400–800 in coaching fees and use that $1200 on ads, but you’ll have learned more, learned faster than doing it by yourself, you probably will generate sales too using a coach where you might not doing it by yourself. Damien Defranco  Original Question: Can I start a decent Shopify (dropshipping) business with 2000$, if so, what difference would it make for me than for someone starting with 100$ (or even 0$)?",2021-03-05T12:36:43.423Z,"What are the key things to consider before you hire a Shopify expert? ",Quora
60422600ed76476feda1f516,https://www.quora.com/Where-can-I-find-the-Shopify-expert-that-everyone-needs-when-building-a-Shopify-store?-,,2021-03-05T12:37:20.663Z,"Where can I find the Shopify expert that everyone needs when building a Shopify store? ",Quora
6042261fed76476feda1f545,https://www.quora.com/Where-can-I-find-the-Shopify-expert-everyone-needs-when-building-a-Shopify-store?-,"Supriya Srivastava, Technical Content Writer at Webkul Software Pvt LtdAnswered 6 months ago · Author has 65 answers and 76.7K answer viewsIs it worth starting a Shopify store in 2020? Supriya Srivastava Yes! In fact, it’s the best time to start an online store with Shopify. In the COVID era when every small and medium-sized business is shifting off-line business to online, Shopify has come with some really amazing resources to let you start an online essential store. Shopify’s 90 Days Free Trial comes as an opportunity for the merchants who want to get started with a new business amid COVID-19! Moreover, you will find some really promising apps to be installed to your Shopify store that will help you to rich and grow your business-like ever. Listing some of the newly-launched Shopify Apps:- DELI Continue ReadingYes! In fact, it’s the best time to start an online store with Shopify. In the COVID era when every small and medium-sized business is shifting off-line business to online, Shopify has come with some really amazing resources to let you start an online essential store. Shopify’s 90 Days Free Trial comes as an opportunity for the merchants who want to get started with a new business amid COVID-19! Moreover, you will find some really promising apps to be installed to your Shopify store that will help you to rich and grow your business-like ever. Listing some of the newly-launched Shopify Apps:- DELIVERY BOY APP FOR SHOPIFYIn case you start a delivery-based business, you definitely need delivery agents to manage the order deliveries. So, With the Delivery Boy App, you can add delivery agents to the app and assign the orders created on your Shopify store. On the other hand, the delivery agents will have the Android/iOS mobile app to accept the orders from the app and deliver them to the customers. DELIVERY SLOT MANAGEMENT APP FOR SHOPIFYA streamlined order delivery process leads to the most satisfactory delivery experience to the customers. Thus, with the delivery slot management app, you can add delivery methods and delivery slots for the customers to let them choose their preferred slots when they wish to get the order delivered to their address. Other Useful Apps for Shopify! Create a Multi-vendor Marketplace App for Shopify and integrate Hyperlocal Near me Delivery based system. Product Zipcode Validator App:- Let customers check the product availability via Zipcode if the item is available to deliver at the entered zip code or not.  Hope this helps!",2021-03-05T12:37:51.090Z,"Where can I find the Shopify expert everyone needs when building a Shopify store? ",Quora
6042265eed76476feda1f59f,https://www.quora.com/How-can-I-find-someone-here-expert-on-Shopify-for-help?-,"Shopify offers a direct solution for problems you may with your theme. Just follow the link Shopify provides their own Tech & Support, But if you want to Hire Shopify Experts from outside to get a satisfied Work & boost your eCommerce business to the top level I personally suggest Softpulse Infotech, As a top rated Shopify Expert Partner India if you have not believed then go to our site. We are able to provide all kind of Shopify Design Service and solutions in the right directions with an affordable prize.  To know more about our Services, Visit our website 1",2021-03-05T12:38:54.224Z,"How can I find someone here expert on Shopify for help? ",Quora
60422672ed76476feda1f5c0,https://www.quora.com/Where-can-I-find-marketing-experts-for-my-Shopify-store?-,Nicole Gray  Many service-based networks are available just like Fiverr Freelancer etc just go through one of the websites and search for your requirement and fill your need Even I am good in digital marketing and I personally have an online store where I sell my products with the 7 lakhs turnover per month I hope I am good at marketing Thank You,2021-03-05T12:39:14.586Z,"Where can I find marketing experts for my Shopify store? ",Quora
60422685ed76476feda1f5dd,https://www.quora.com/How-did-Shopify-get-its-experts-program-started?-,,2021-03-05T12:39:33.884Z,"How did Shopify get its experts program started? ",Quora
604226f5ed76476feda1f67f,https://www.quora.com/Where-can-I-get-an-expert-to-handle-my-Shopify-store?-,"Shiv Technolabs PVT. LTD., former CEO at Shiv Technolab Pvt. LtdAnswered December 14, 2020 · Author has 481 answers and 79.9K answer views Shiv Technolabs PVT. LTD. Shopify is one of the most famous e-commerce platforms globally. It is developed for online web stores and know the best practices regarding web development so that your website works flawlessly on any device. Nowadays you have multiple options to choose from the list of experts. Before that you can go through their profile and decide whether they are suitable for your store requirement or not. If you are working alone on your Shopify project and struggling with your Shopify store? Yes, we understand using Shopify applications isn’t enough for a successful store. You need to hire a dedicated Shop Continue ReadingShopify is one of the most famous e-commerce platforms globally. It is developed for online web stores and know the best practices regarding web development so that your website works flawlessly on any device. Nowadays you have multiple options to choose from the list of experts. Before that you can go through their profile and decide whether they are suitable for your store requirement or not. If you are working alone on your Shopify project and struggling with your Shopify store? Yes, we understand using Shopify applications isn’t enough for a successful store. You need to hire a dedicated Shopify expert. As a Shopify expert, we will help you set-up your own online Shopify store. We help you to design your page layout, run marketing campaigns to build traffic and exposure for your store. Wrapping-up: Either you want to complex UI or simple one, or what features you’d like your online store to have. Hire Shopify Developers from Hire Shopify Experts.",2021-03-05T12:41:25.513Z,"Where can I get an expert to handle my Shopify store? ",Quora
60422711ed76476feda1f6a8,https://www.quora.com/Does-a-Shopify-web-expert-offer-a-good-speed-optimization?-,"Not everyone can do Code/ Speed/ performance optimisation. It takes proper understanding of browser stack, HTTP protocol, HTML , Javascript, JQuery , and finally shopify to squeeze performance. Only experts who have in-depth knowledge and experience can do this. This cant be done effectively using any Apps so stop wasting money on them and before going to any agency ask them to prove their claim.",2021-03-05T12:41:53.711Z,"Does a Shopify web expert offer a good speed optimization? ",Quora
60422723ed76476feda1f6c3,https://www.quora.com/Who-will-assist-me-to-set-up-a-ecommerce-website-thru-SaaS-like-Shopify?-,"Hi there, There are a lot of Shopify Experts that can help you successfully launch your business online or seamlessly migrate your shop from another platform. You can browse for them here: Shopify Experts. You’ll find Designers, Developers, Marketers, Photographers and more across different locations. A quick word of advice, have a clear understanding of your business requirements and budget before you start your search. Good luck with your ecommerce endeavor. Cheers!",2021-03-05T12:42:11.430Z,"Who will assist me to set up a ecommerce website thru SaaS like Shopify? ",Quora
