"_id",job_link,answer,date,question,source
60422a78ed76476feda1fbc8,https://www.quora.com/Do-you-need-to-be-a-web-developer-to-use-Shopify?-,"Miley Wattson, B.E. Electrical and Computer Engineering, University of Toronto (2013)Answered 1 year ago Miley Wattson You need not be a web developer to 'USE' a platform like Shopify. So if you own a business and let us consider for the moment, a small business that has limited product variation and counts, it is one of the preferred ways in today's date to proceed with a simple Shopify store. The User-Interface and experience that this SaaS-based platform provides are very handy and you won't find too much trouble understanding the knick and tricks on how to basically use the platform and set up a good-to-go store. The core idea as on why this platform was built would clear the fact that it was meant to provid Continue ReadingYou need not be a web developer to 'USE' a platform like Shopify. So if you own a business and let us consider for the moment, a small business that has limited product variation and counts, it is one of the preferred ways in today's date to proceed with a simple Shopify store. The User-Interface and experience that this SaaS-based platform provides are very handy and you won't find too much trouble understanding the knick and tricks on how to basically use the platform and set up a good-to-go store. The core idea as on why this platform was built would clear the fact that it was meant to provide the various merchants and businesses with a place where they can build their online presence and sell their products and services online. Considering the merchants and business owners to be a part of their end users, they created a platform that is easy to setup and use. Thus, Shopify provides benefits to all its users alike. So if you are an amateur or newbie looking for ways to establish your store online, Shopify is one of the easiest possible ways on how to do it so. BUT, these are the facts that weigh up more for the asked question, where more emphasis is on the fact that whether one can USE Shopify for his/her store set up without any need of web developer skills. So why is there a need for web development skills to run a store on Shopify? Before we put up a valid answer to this, let us look at some related facts first! 1. Shopify has nearly 800,000+ merchants and this number is on a constant rise!  2. The best way to take advantage of technology is to use technology itself!  The very first factor puts up enough emphasis on the fact that if you really need to make a difference in the market, you will have to try something different. The only thing that exists here is to make good leverage of technology for doing so.  Fortunately, there are a variety of technological benefits that Shopify provides by itself such as custom themes, mobile application creation for your store and various other extensions to enhance your store applicability for users. And in order to make a feasible and workable impact of the use of Shopify, you will need to hire an expert Shopify developer to do make use of all these benefits. To create an online presence that replicated your business, you will need to have a proper store developed from an expert and for that, you would need to hire an expert. As a business owner, if you have this strong feeling that going online can be helpful for your business, the benefits of hiring an expert Shopify developer are endless. You can customize the look of your store - from the visual design to the back-end extensions. You can connect a variety of your brick and mortar store elements with your online store! Moreover, this all can come to you at a price that is cheaper than buying the actual elements from Shopify itself.   To conclude it all, if you are talking about 'using' Shopify for your store, you wouldn't be needing any high-end software development skills, but if you are seeking to make an impact with it, you might want to hire an expert Shopify developer in order to get your website developed. You can connect with us for that as well.",2021-03-05T12:56:24.140Z,"Do you need to be a web developer to use Shopify? ",Quora
60422a8bed76476feda1fbe4,https://www.quora.com/Which-is-the-agency-with-the-best-delivery-and-price-to-customize-and-set-up-a-store-on-Shopify?-,"Have you checked the Shopify experts page: Shopify Experts Your best bet will be to send an inquiry with your requirements to all the experts. One thing I have learnt is that customers tend to choose the agency that shows the best understanding of the task at hand, asks questions and gets on board right from the start. If they demonstrate expertise and commitment with the very first answer to your inquiry, strongly consider them. I am assuming that you are also looking for a good price but do also mind this old saying: ""I am not so wealthy as to spend money on cheap goods."" I hope this is useful! C",2021-03-05T12:56:43.029Z,"Which is the agency with the best delivery and price to customize and set up a store on Shopify? ",Quora
60422aaeed76476feda1fc19,https://www.quora.com/What-is-the-best-shopify-template?-,"Henry Pham, Certified Shopify Experts at Shopify (2016-present)Answered 1 year ago · Author has 51 answers and 11.9K answer views Henry Pham 1. Gecko is a responsive Shopify theme with a range of subtly different homepages and layouts. It’s clear and inviting, and takes advantage of all Shopify’s selling features. Gecko comes with a powerful theme options panel, an array of shortcodes, product bundles, and even integration with Instagram. Recently updated, Gecko also gives you access to discounted use of Ryviu, the popular product reviews platform. 2. Basel, recently updated to version 3.0, is a multipurpose Shopify theme, offering a classic-looking storefront for many types of ecommerce businesses including fashion, electronics, and Continue Reading1. Gecko is a responsive Shopify theme with a range of subtly different homepages and layouts. It’s clear and inviting, and takes advantage of all Shopify’s selling features. Gecko comes with a powerful theme options panel, an array of shortcodes, product bundles, and even integration with Instagram. Recently updated, Gecko also gives you access to discounted use of Ryviu, the popular product reviews platform. 2. Basel, recently updated to version 3.0, is a multipurpose Shopify theme, offering a classic-looking storefront for many types of ecommerce businesses including fashion, electronics, and (as you can see from the screenshot) food and drink. Customization options allow you to customize the color scheme and use the Drag & Drop page builder, as well as upload your own logo if you choose. And Basel is compatible with the Nitro Apps range, including Product Bundle, Product Lookbook, Fontify, Stockify, Cartify, and Nitro Live Coupon. 3. Boutique has attitude, cold hard style, and a touch of raw finesse. Although pitched as a fashion store, its clean lines could be turned to a wide array of store types. Check out the demo for a better idea of how it could suit your eCommerce project. 4. Elessi is a perfect Shopify template for those with large eCommerce stores. It handles browsing extremely well. Elessi is highly optimized for speed which makes it ideal for handling large inventories. Additionally, it’s one of the first themes to support Shopify AR! If you’re into exploring new technologies, Shopify AR is the perfect opportunity for you to take shopping experiences for your visitors to the next level.",2021-03-05T12:57:18.974Z,"What is the best shopify template? ",Quora
604221d2ed76476feda1ef04,https://www.quora.com/What-are-Shopify-experts?-,"Dorie R. Miller, M.B.A National Basketball Association & Waking Up, New York City (2016)Answered 7 months ago Dorie R. Miller Shopify is a complete turn-key e-commerce solution that helps you to installation an internet keep to sell your goods. It helps you to set up your products, customize your storefront, receive credit card payments, song and respond to orders — all with some snaps of the mouse.  It’s form of like hiring a trendy contractor to build your private home, over being the contractor and hiring sub-contractors yourself. You’re still in control, however you allow the general contractor use their know-how to make the assignment occur. Shopify lets in you to construct your save at fair charge.You can rent hel Continue ReadingShopify is a complete turn-key e-commerce solution that helps you to installation an internet keep to sell your goods. It helps you to set up your products, customize your storefront, receive credit card payments, song and respond to orders — all with some snaps of the mouse.  It’s form of like hiring a trendy contractor to build your private home, over being the contractor and hiring sub-contractors yourself. You’re still in control, however you allow the general contractor use their know-how to make the assignment occur. Shopify lets in you to construct your save at fair charge.You can rent help from the specialists.There are lot of class of specialists within the Shopify Experts",2021-03-05T12:19:30.113Z,"What are Shopify experts? ",Quora
604221d2ed76476feda1ef06,https://www.quora.com/Should-I-hire-a-Shopify-expert?-,"There are multiple reasons to hire a Shopify Expert, but before that let’s understand what roles can a Shopify Expert play - Setup your online store - A Shopify Developer can help you set up a store from scratch which involves setting up the domain, hosting, theme, and making the Shopify store functional and open to the public.Customize an existing theme - A Shopify Developer can help you customize the existing theme as per your choices. This can involve making changes in the design changes, structural changes, or even customize it with custom-code.Make Integrations/Add-ons - Shopify allows mulContinue ReadingThere are multiple reasons to hire a Shopify Expert, but before that let’s understand what roles can a Shopify Expert play - Setup your online store - A Shopify Developer can help you set up a store from scratch which involves setting up the domain, hosting, theme, and making the Shopify store functional and open to the public.Customize an existing theme - A Shopify Developer can help you customize the existing theme as per your choices. This can involve making changes in the design changes, structural changes, or even customize it with custom-code.Make Integrations/Add-ons - Shopify allows multiple 3rd party integrations to enable Online stores to do more. For example - MailChimp can be used to collect emails, and build mailing lists. Other integrations can be for Dropshipping, Billing, etcOptimize Store Performance - There is always scope to optimize the current Shopify store to make it perform better. Performance enhancements can be in terms of Speed, presentation, UI/UX, etc.Optimize for Marketing performance - Various Marketing activities need to be monitored extensively to grow the store, and that calls for the need for integrations of Pixels, setting up Tag Managers, etc. A Shopify Expert can help you optimize your store for Marketing analyticsOptimize for SEO - A major chunk of traffic can be driven free of cost if the store is optimized to be found on the first page of Google, and other Search Engines. A Shopify Expert can help you optimize for SEO by writing blogs, creating backlinks, creating a schema of the store, and a lot more.Debug and Fix errors - Running online stores involves working with various apps, and technologies, and with time there can be occasional bugs thrown by either the Shopify theme, or some 3rd party plugins, and at such stages, a Freelance Shopify Developer can help identify and fix bugs. Although there are instances when you can develop your website yourself, I would recommend you measure “Opportunity Cost”, and see if your time and efforts can be better used somewhere else. Hire the best Shopify Experts here. There are multiple reasons to hire a Shopify Expert, but before that let’s understand what roles can a Shopify Expert play - Setup your online store - A Shopify Developer can help you set up a store from scratch which involves setting up the domain, hosting, theme, and making the Shopify store functional and open to the public.Customize an existing theme - A Shopify Developer can help you customize the existing theme as per your choices. This can involve making changes in the design changes, structural changes, or even customize it with custom-code.Make Integrations/Add-ons - Shopify allows mulContinue Reading",2021-03-05T12:19:30.336Z,"Should I hire a Shopify expert? ",Quora
604221d2ed76476feda1ef08,https://www.quora.com/Who-are-Shopify-Experts-in-Switzerland?-,"Andrey Gadashevich, Over 70 successful project development casesAnswered 1 year ago · Author has 122 answers and 132K answer viewsWhich is the best Shopify Experts company? Andrey Gadashevich All agencies and private entrepreneurs usually say that they are exceptional and the best in a particular industry. This is a good approach to promoting your brand. But how can a consumer understand this? I think that it is better than anyone to tell about the best Shopify Experts that consumers themselves. It is they who decide who is better. And this can be seen on the global clutch ranking: Top Shopify Designers & Developers. Avex DesignsPivofyeHouse StudioPointerHUEMORWebContriveGenovaWebArtOlibro DesignBTown WebAeolidiaDynamic DreamzItransitionBlue Polo InteractiveMakeBeCoolCommand CAmong th Continue ReadingAll agencies and private entrepreneurs usually say that they are exceptional and the best in a particular industry. This is a good approach to promoting your brand. But how can a consumer understand this? I think that it is better than anyone to tell about the best Shopify Experts that consumers themselves. It is they who decide who is better. And this can be seen on the global clutch ranking: Top Shopify Designers & Developers. Avex DesignsPivofyeHouse StudioPointerHUEMORWebContriveGenovaWebArtOlibro DesignBTown WebAeolidiaDynamic DreamzItransitionBlue Polo InteractiveMakeBeCoolCommand CAmong them are rising stars, these are companies that have recently entered the list and continue to move forward aggressively. I think this is a good chance for a consumer to get a high-quality service, at a price significantly lower than market leaders ($ 150 per hour versus $ 37 per hour) For example, MakeBeCool.",2021-03-05T12:19:30.344Z,"Who are Shopify Experts in Switzerland? ",Quora
604221d2ed76476feda1ef0a,https://www.quora.com/How-do-I-become-a-Shopify-expert?-,"Hi , Becoming shopify expert is not as easy as people say online. The marketing techniques they tell you become old and don't work anymore. If you want to be successful and become a shopify expert as you see on youtube. You should not follow them. You need to learn every part of the shopify and marketing channels. Some shopify experts show only their winning campaigns. They don't tell you the reality. Because finding good product and marketing it online is not like before. Here are my suggestions to become expert. First figure out your niche. If you can find a good niche and good product you canContinue ReadingHi , Becoming shopify expert is not as easy as people say online. The marketing techniques they tell you become old and don't work anymore. If you want to be successful and become a shopify expert as you see on youtube. You should not follow them. You need to learn every part of the shopify and marketing channels. Some shopify experts show only their winning campaigns. They don't tell you the reality. Because finding good product and marketing it online is not like before. Here are my suggestions to become expert. First figure out your niche. If you can find a good niche and good product you can win easily. Finding niche is so easy. You can use Facebook Audience insights to figure out the audience size. And also be unique and different when figuring out the niche.Second I wanna tell you most is try to give more to the customer than expecting money from them. If you can give some quality stuff and better experience. You can easily get good amount of sale. Don't expect return first. You try to improve landing page experience. And also make them feel you're taking care of them so much. Reply to their email, comments and engage with them. Offer some discounts etc.,Most people struggling about Facebook ads and losing their money. But the actual thing is you need to understand Facebook is just a advertising platform. People come to Facebook entertain themselves not to buy. So you need to create a creative video or inage for your ad. Test multiple different types. And you should use the best working one. And also you should understand that you cannot spend 1000$ in a day and make 5000$ as you think. It takes lot pf time to figure out. Instead of finding winning product that sell 1000 product every day. You can find 10 product that sell 100 product each every day.Once you find the strategy that works for you. You can do it for long run and make some good amount of money. And I also again tell you. People expect some good amount of value from you. So you need to give them best. You can use email marketing or remarketing as others do and increase your presence. Branding your store instead of selling products give you high profit.You need to be updated with others , I mean you should spy them and find what they do for the success and also you should know their strategy and you need to do better than them.If you're getting started means. I suggest you to find a good mentor and learn from him. You should be clear finding your mentor because there's a lot of fake guru they haven't run a shopify before. Hi , Becoming shopify expert is not as easy as people say online. The marketing techniques they tell you become old and don't work anymore. If you want to be successful and become a shopify expert as you see on youtube. You should not follow them. You need to learn every part of the shopify and marketing channels. Some shopify experts show only their winning campaigns. They don't tell you the reality. Because finding good product and marketing it online is not like before. Here are my suggestions to become expert. First figure out your niche. If you can find a good niche and good product you canContinue Reading",2021-03-05T12:19:30.352Z,"How do I become a Shopify expert? ",Quora
604221d2ed76476feda1ef0c,https://www.quora.com/Who-is-the-best-Shopify-expert?-,"So you’re looking to make an attractive Shopify storefront, or hire a team of Shopify developers to look after your store: a good website is critical in getting the leg up on your competitors. The problem is, your competitors want to get a leg up on you too—if you want a better site than them, you need to hire shopify experts. Shopify’s own Experts Directory is a good place to start, but it gives a pretty limited window into the opportunities available. What do you do? Well, you know the old saying: you can have it fast, cheap or good but you can’t have all three. Start weighing up what’s more  Continue ReadingSo you’re looking to make an attractive Shopify storefront, or hire a team of Shopify developers to look after your store: a good website is critical in getting the leg up on your competitors. The problem is, your competitors want to get a leg up on you too—if you want a better site than them, you need to hire shopify experts. Shopify’s own Experts Directory is a good place to start, but it gives a pretty limited window into the opportunities available. What do you do? Well, you know the old saying: you can have it fast, cheap or good but you can’t have all three. Start weighing up what’s more important to you: Fast: you need your site up yesterday. Your competitor already has the lead, and you need to get yourself moving as soon as possible. Often here, you want to look at teams with offices spread over multiple time zones: an international company can have its Shopify developers work in shifts, to get your storefront up as quickly as possible.Cheap: you’re on a budget. You’re a smart businessman, and you know smart business is about knowing where to spend and where to save. Again, it’s good to look internationally: outsourcing is a great way to save those extra pennies.Good: you’re willing to pay extra for quality. You want a boutique experience that will make your customers feel like kings. A quality UX is one of the hardest things to find, and requires real Shopify experts to pull off.Personally, when I need a Shopify developer, I go to CodeClouds. They’re a rare breed: fast, cheap and good. Most other developers wash their hands with a site as soon as they’re done with it, but their team of Shopify experts offered me support, maintenance and updates that keep my storefront on the bleeding edge. Their subscription billing model let me choose the deal that was right for me. Their company is based in India but has offices in the US, Australia and New Zealand that let you get the best of both worlds. It took me a long time to find the Shopify developer that was right for me, but it was definitely worth it in the end.",2021-03-05T12:19:30.415Z,"Who is the best Shopify expert? ",Quora
604221d2ed76476feda1ef0e,https://www.quora.com/What-are-the-benefits-of-hiring-Shopify-experts?-,"BLive Web Solutions If you are having a Shopify store and just started out with this amazing e-commerce platform than there are multiple benefits of hiring Shopify Experts: First of all- Who are Shopify Experts? ‘Shopify experts are web developers, web designers, marketing professionals, consultants, and digital marketers, who can help you in developing, designing, maintaining, marketing and optimizing your e-commerce business using the Shopify platform to increase conversions and help you meet your business goals.’ Benefits of Hiring a Shopify expert: If you are not a technical person and don’t have much knowledge aContinue ReadingIf you are having a Shopify store and just started out with this amazing e-commerce platform than there are multiple benefits of hiring Shopify Experts: First of all- Who are Shopify Experts? ‘Shopify experts are web developers, web designers, marketing professionals, consultants, and digital marketers, who can help you in developing, designing, maintaining, marketing and optimizing your e-commerce business using the Shopify platform to increase conversions and help you meet your business goals.’ Benefits of Hiring a Shopify expert: If you are not a technical person and don’t have much knowledge about programming, hiring a Shopify expert to build an online store for you will save a lot of time.If you already built the store but it is not performing quite well in terms of conversion than hiring a Shopify Marketer can help you in increasing your revenue overall.If you are expanding your market and looking to add some complex functionality to your e-commerce business, then an Expert can help you and save your time on research.If you are looking for a team to help you maintain the inventory and order processing or data analysis then hiring Shopify developer can give you a good strategic advantage. Continue Reading",2021-03-05T12:19:30.491Z,"What are the benefits of hiring Shopify experts? ",Quora
604221d2ed76476feda1ef10,https://www.quora.com/Where-can-I-get-Shopify-expert-professionals?-,"Shiv Technolabs PVT. LTD., former CEO at Shiv Technolab Pvt. LtdAnswered October 8, 2020 · Author has 481 answers and 79.9K answer views Shiv Technolabs PVT. LTD. Every store owner wants their e-commerce store to stand out. They want to provide the ease of accessibility to their customers. Whether you’re a beginner or an experienced store owner, hiring dedicated Shopify experts will always add value to your store. Because Shopify experts can help you to rest easy knowing that your store is in capable hands. Now don’t forget that hiring a Shopify expert can be a game-changer to your e-commerce store. Simply opt for someone professional you already have a good number of hands-on experience with e-commerce platform. At Hire Shopify Experts you will get help f Continue ReadingEvery store owner wants their e-commerce store to stand out. They want to provide the ease of accessibility to their customers. Whether you’re a beginner or an experienced store owner, hiring dedicated Shopify experts will always add value to your store. Because Shopify experts can help you to rest easy knowing that your store is in capable hands. Now don’t forget that hiring a Shopify expert can be a game-changer to your e-commerce store. Simply opt for someone professional you already have a good number of hands-on experience with e-commerce platform. At Hire Shopify Experts you will get help from experts for your e-commerce store with the best Shopify expert services. Our team of Dedicated Shopify Expert developers is experienced and knowledgeable in several specialized web design techniques. Our main goal is to help you with your brand journey. Wrapping up: From the above, we have seen that Shopify is the best choice for any size of business. It is not easy to develop an E-Commerce Store that establishes perfectly and generates Profits. So, with the help of the Shopify platform, you may develop your Store that can create your ideal brand value among your competitors.",2021-03-05T12:19:30.497Z,"Where can I get Shopify expert professionals? ",Quora
