"_id",job_link,answer,date,question,source
604221e7ed76476feda1ef3b,https://www.quora.com/How-much-do-Shopify-experts-make?-,,2021-03-05T12:19:51.055Z,"How much do Shopify experts make? ",Quora
6042220ded76476feda1ef71,https://www.quora.com/Who-are-the-Shopify-experts-in-Philadelphia?-,,2021-03-05T12:20:29.392Z,"Who are the Shopify experts in Philadelphia? ",Quora
60422220ed76476feda1ef8f,https://www.quora.com/Where-can-I-get-a-Shopify-Expert-in-Bangalore-for-API-Integration?-,"I’m a certified Shopify expert based in Bangalore, India. My team has expertise in theme liquid customisation, Shopify app development and store setups. https://experts.shopify.com/claritytech You can find other experts here Shopify Experts Girish Nayak",2021-03-05T12:20:48.018Z,"Where can I get a Shopify Expert in Bangalore for API Integration? ",Quora
60422245ed76476feda1efc9,https://www.quora.com/Do-you-have-to-pay-to-become-a-Shopify-Expert?-,Nicholas Joseph Lim Jowanna Daley,2021-03-05T12:21:25.615Z,"Do you have to pay to become a Shopify Expert? ",Quora
60422268ed76476feda1effb,https://www.quora.com/Why-we-are-hiring-Shopify-experts?-,"First, tell me why anyone doesn’t like to hire Shopify experts? Hiring Shopify experts is one of the best choices for your e-commerce store. They are trusted and motivated community members that work to help companies as yours grow. Shopify is a significant factor that grows your business. Today, Shopify is one of the leading e-commerce platforms globally, it enables you to create your brand & sell your products online. Shopify store-setup is not a difficult process, but scaling it & achieving consistent sales requires expertise, consistency, & experienced. As a business owner, you might don’t hold these attributes, that’s where Shopify experts help you out. Let’s have a look over the benefits of hiring Shopify experts. Best-quality design and developmentSuperior SEOPowerful brandingUnbiased expert opinionEffective marketingFinal Words: When it comes to Hire Shopify Developer online to manage all the processes, it is because you want to focus your time on running your business instead of mastering every specialty. Hire Shopify Experts helps you with the best comprehensive range of services offered under the Shopify store development and maintenance domain.",2021-03-05T12:22:00.773Z,"Why we are hiring Shopify experts? ",Quora
604222b7ed76476feda1f05b,https://www.quora.com/Is-there-a-Shopify-expert-team-available-for-B2B?-,Abhishek Modi,2021-03-05T12:23:19.763Z,"Is there a Shopify expert team available for B2B? ",Quora
604222cbed76476feda1f074,https://www.quora.com/How-much-does-it-cost-to-hire-a-Shopify-expert?-,"Jennifer Dixey, Shopify Partner with CMS Experience (WP and Drupal)Answered 2 years ago · Author has 154 answers and 194.5K answer views Jennifer Dixey The Shopify Experts page lists each expert along with the price range of their typical projects, the types of companies they work with, etc. If you consult the list, you can compare what your project is like to the projects that Experts have done, and find an Expert that matches with your needs. If you find it too daunting to figure out what you need to do, or you just want a simple ecommerce store setup, you can hire a Shopify Partner instead. Partners may or may not have as much experience as Experts, but even if they have as much or more experience as an Expert, they might be easier to hire  Continue ReadingThe Shopify Experts page lists each expert along with the price range of their typical projects, the types of companies they work with, etc. If you consult the list, you can compare what your project is like to the projects that Experts have done, and find an Expert that matches with your needs. If you find it too daunting to figure out what you need to do, or you just want a simple ecommerce store setup, you can hire a Shopify Partner instead. Partners may or may not have as much experience as Experts, but even if they have as much or more experience as an Expert, they might be easier to hire for a small project — many Experts have a minimum consulting fee, which they should list in their Experts listing. Unfortunately, there is no directory of Partners, although there is a directory of Shopify Plus Partners. (Shopify Plus is Shopify’s premium product for large enterprises and high-volume ecommerce, so I would recommend starting with the Experts page or asking around locally to find a Partner, unless you have a large enterprise or high-volume ecommerce project in mind.)",2021-03-05T12:23:39.545Z,"How much does it cost to hire a Shopify expert? ",Quora
604222deed76476feda1f08c,https://www.quora.com/How-do-we-find-the-best-Shopify-expert-company-in-Singapore?-,Andrew Baisley John Smith,2021-03-05T12:23:58.725Z,"How do we find the best Shopify expert company in Singapore? ",Quora
604222f3ed76476feda1f0a8,https://www.quora.com/Where-can-I-find-best-shopify-experts-to-design-and-develop-my-store?-,"Shiv Technolabs PVT. LTD. Before hiring a Shopify expert, you should know how a Shopify expert can help you with your store development? Well, Shopify experts are trusted and motivated community members that work to help companies as your business grows. They provide you the high-quality services and empowers your prosperity through exclusive partner resources & learning opportunities. While starting an online store, you may think hiring a few designers, developers and marketers is enough to get your store online. But this isn’t always the case. Because the initial decisions can affect your company in the long run. There Continue ReadingBefore hiring a Shopify expert, you should know how a Shopify expert can help you with your store development? Well, Shopify experts are trusted and motivated community members that work to help companies as your business grows. They provide you the high-quality services and empowers your prosperity through exclusive partner resources & learning opportunities. While starting an online store, you may think hiring a few designers, developers and marketers is enough to get your store online. But this isn’t always the case. Because the initial decisions can affect your company in the long run. Therefore, you need to form a solid plan, strategize the best way to complete tasks promptly, & execute that plan to completion. For hiring a dedicated Shopify expert, you need to screen potential hires, go through the onboarding, and take time for the actual training process. Be aware of hiring a potential candidate because hiring one bad employee initially, can sink your boat. Wrapping-up: Apart from the above, if you need more details about Shopify e-commerce services and packages and the Shopify expert scheme then visit us at Hire Shopify experts. Our team of Dedicated Shopify Expert developers is experienced and knowledgeable in several specialized web design techniques. Our Shopify-friendly Experts are always willing to help you with your brand journey. Continue Reading",2021-03-05T12:24:19.797Z,"Where can I find best shopify experts to design and develop my store? ",Quora
60422305ed76476feda1f0c3,https://www.quora.com/How-do-I-hire-Shopify-experts-in-India?-,"Hey, Shopify experts play a vital role to tweak Shopify websites. Being the owner of a Shopify store, you can hire experts who specialize in building up to higher conversion for your website. They will help you with the store set up, liquid files, and much more. These experts are highly-skilled developers, designers, and consultants who help you bring potential customers to your website. These are some of the services offered by Shopify experts: Store Setup, Marketing & Sales, Content Writing, Visual Content & branding, development & troubleshooting, expert guidance. In the COVID-19 crisis, these experts are all set to help the merchants in-store to online store setups, set up shipping options, store setup guidance, and much more. Contact Shopify Experts Useful Shopify Apps",2021-03-05T12:24:37.067Z,"How do I hire Shopify experts in India? ",Quora
60422317ed76476feda1f0da,https://www.quora.com/Who-are-the-top-Shopify-experts-in-2019?-,Here are the top Shopify experts which will solve all your Shopify store problems in no time Click on the link Behance,2021-03-05T12:24:55.098Z,"Who are the top Shopify experts in 2019? ",Quora
6042232ded76476feda1f0f7,https://www.quora.com/How-do-I-hire-a-Shopify-expert-to-expand-my-business?-,"First of all, why to opt for Shopify Experts? One of the major reasons is that Shopify experts can simply assist you with several tasks such as help you to migrate your store from one platform to another platform, help in creating a new e-commerce site from scratch. You might be thinking that whether the cost is worth it? How a Shopify Expert will help you out to build your online store? Hiring the Right Shopify ExpertAsk the CommunityGo through the Experts DirectoryEvaluate the ExpertsOutlining the Project ScopeCommunication is the KeyConclusion: Hiring the right candidate for your team makes a huge positive difference to your project. Want to know more, visit Hire Shopify Experts, our Expertise helps us to give your e-commerce store a special and advanced environment. 1",2021-03-05T12:25:17.065Z,"How do I hire a Shopify expert to expand my business? ",Quora
6042233fed76476feda1f10f,https://www.quora.com/How-can-I-choose-a-Shopify-expert?-,"state your objectives.identify your key audience and competitors.work out your budget.list the project's key technical features, look and feel, and timescales.",2021-03-05T12:25:35.907Z,"How can I choose a Shopify expert? ",Quora
6042237ded76476feda1f15e,https://www.quora.com/Can-you-measure-your-Shopify-store-by-a-Shopify-expert?-,,2021-03-05T12:26:37.404Z,"Can you measure your Shopify store by a Shopify expert? ",Quora
604223a5ed76476feda1f19a,https://www.quora.com/Any-Shopify-expert-here?-I-need-help-to-import-my-products-from-AliExpress-to-my-Shopify-store.-,,2021-03-05T12:27:17.486Z,"how to change shopify theme to display as collage? ",Quora
604223beed76476feda1f1c2,https://www.quora.com/Who-is-the-best-Shopify-expert-developer-in-Singapore?-,"Over the years, Shopify has emerged as one of the leading eCommerce platforms because of its rich and distinguished features. Shopify eCommerce development gives you an amazing buying experience with ease of management. With Shopify, you can create dynamic, responsive, easy to use eCommerce stores. I would recommend to hire Ranosys for your Shopify development projects. Ranosys has experienced Shopify developers to deliver a complete range of Shopify development services, including configuration and setup, design, customization, integration, maintenance & support to global clients. Sudipta Mondal",2021-03-05T12:27:42.127Z,"Who is the best Shopify expert developer in Singapore? ",Quora
604223d5ed76476feda1f1e7,https://www.quora.com/How-can-I-get-more-clients-as-a-Shopify-expert?-,"very simple and easy, firs you should understand to whom you should reach and who would be interested in your store. then start a digital marketing campaign after you setup the strategy that will work with the same target audience. and you get traffic = potential customers then you will get customers. 2",2021-03-05T12:28:05.920Z,"How can I get more clients as a Shopify expert? ",Quora
60422412ed76476feda1f238,https://www.quora.com/Who-are-the-best-freelance-Shopify-experts-in-San-Jose?-,,2021-03-05T12:29:06.167Z,"Who are the best freelance Shopify experts in San Jose? ",Quora
60422424ed76476feda1f258,https://www.quora.com/Who-are-the-best-freelance-Shopify-experts-in-Dallas?-,,2021-03-05T12:29:24.987Z,"Who are the best freelance Shopify experts in Dallas? ",Quora
60422438ed76476feda1f275,https://www.quora.com/What-is-the-need-to-hire-a-Shopify-expert?-,Shiv Technolabs PVT. LTD.,2021-03-05T12:29:44.312Z,"What is the need to hire a Shopify expert? ",Quora
60422463ed76476feda1f2b6,https://www.quora.com/How-do-I-find-Shopify-experts-for-small-themes-or-design-fixes?-,"Shiv Technolabs PVT. LTD., former CEO at Shiv Technolab Pvt. LtdAnswered September 22, 2020 · Author has 481 answers and 79.9K answer views Shiv Technolabs PVT. LTD. Today, Shopify is one of the top & user-friendly e-commerce platform. Shopify experts can help you with the small and large design fixes in Shopify website as per your requirement, search for setup experts, & designers so on. It’s not that difficult but quite confusing when you browse the list of experts, where you find more information through their profile and decide whether they are proper fit or not for your website requirement. Now let see how to find Shopify experts for small themes or design fixes? Go through the Experts DirectoryLinks to their portfolio of Shopify storesServices offeredMiContinue ReadingToday, Shopify is one of the top & user-friendly e-commerce platform. Shopify experts can help you with the small and large design fixes in Shopify website as per your requirement, search for setup experts, & designers so on. It’s not that difficult but quite confusing when you browse the list of experts, where you find more information through their profile and decide whether they are proper fit or not for your website requirement. Now let see how to find Shopify experts for small themes or design fixes? Go through the Experts DirectoryLinks to their portfolio of Shopify storesServices offeredMinimum project budgetTestimonials ReviewWrapping-up: If you find yourself trying a new strategy with no results, this is also a good time to consider calling in an expert. At Hire Shopify Experts, our Expertise helps us to give your e-commerce store a special and advanced environment. Hire Dedicated Expert Shopify developers to establish extremely scalable stores.",2021-03-05T12:30:27.839Z,"How do I find Shopify experts for small themes or design fixes? ",Quora
60422478ed76476feda1f2d2,https://www.quora.com/How-can-I-make-the-most-money-as-a-Shopify-Expert?-,I’m looking for a Shopify expert. Please email me.,2021-03-05T12:30:48.825Z,"How can I make the most money as a Shopify Expert? ",Quora
6042248eed76476feda1f2f6,https://www.quora.com/Who-are-the-best-Shopify-experts-for-developing-an-e-commerce-website-in-NCR-region?-,Do you want an awesome Shopify store? Get yourself one of the best Shopify experts. Check out here: Yo Gesh Gupta,2021-03-05T12:31:10.177Z,"Who are the best Shopify experts for developing an e-commerce website in NCR region? ",Quora
604224a8ed76476feda1f31d,https://www.quora.com/How-can-I-join-the-Shopify-Experts-platform-since-all-my-clients-come-already-with-a-store-created?-,"Muralidharan, Running Shopify storeAnswered 1 year agoHow do I become a Shopify expert? Muralidharan Hi , Becoming shopify expert is not as easy as people say online. The marketing techniques they tell you become old and don't work anymore. If you want to be successful and become a shopify expert as you see on youtube. You should not follow them. You need to learn every part of the shopify and marketing channels. Some shopify experts show only their winning campaigns. They don't tell you the reality. Because finding good product and marketing it online is not like before. Here are my suggestions to become expert. First figure out your niche. If you can find a good niche and good product you canContinue ReadingHi , Becoming shopify expert is not as easy as people say online. The marketing techniques they tell you become old and don't work anymore. If you want to be successful and become a shopify expert as you see on youtube. You should not follow them. You need to learn every part of the shopify and marketing channels. Some shopify experts show only their winning campaigns. They don't tell you the reality. Because finding good product and marketing it online is not like before. Here are my suggestions to become expert. First figure out your niche. If you can find a good niche and good product you can win easily. Finding niche is so easy. You can use Facebook Audience insights to figure out the audience size. And also be unique and different when figuring out the niche.Second I wanna tell you most is try to give more to the customer than expecting money from them. If you can give some quality stuff and better experience. You can easily get good amount of sale. Don't expect return first. You try to improve landing page experience. And also make them feel you're taking care of them so much. Reply to their email, comments and engage with them. Offer some discounts etc.,Most people struggling about Facebook ads and losing their money. But the actual thing is you need to understand Facebook is just a advertising platform. People come to Facebook entertain themselves not to buy. So you need to create a creative video or inage for your ad. Test multiple different types. And you should use the best working one. And also you should understand that you cannot spend 1000$ in a day and make 5000$ as you think. It takes lot pf time to figure out. Instead of finding winning product that sell 1000 product every day. You can find 10 product that sell 100 product each every day.Once you find the strategy that works for you. You can do it for long run and make some good amount of money. And I also again tell you. People expect some good amount of value from you. So you need to give them best. You can use email marketing or remarketing as others do and increase your presence. Branding your store instead of selling products give you high profit.You need to be updated with others , I mean you should spy them and find what they do for the success and also you should know their strategy and you need to do better than them.If you're getting started means. I suggest you to find a good mentor and learn from him. You should be clear finding your mentor because there's a lot of fake guru they haven't run a shopify before.",2021-03-05T12:31:36.573Z,"How can I join the Shopify Experts platform since all my clients come already with a store created? ",Quora
604224ceed76476feda1f353,https://www.quora.com/Where-can-I-find-a-great-freelance-Shopify-expert-for-mobile-and-web-development-in-India?-,,2021-03-05T12:32:14.294Z,"Where can I find a great freelance Shopify expert for mobile and web development in India? ",Quora
604224e6ed76476feda1f374,https://www.quora.com/How-much-should-a-Shopify-expert-charge-for-setting-up-a-custom-Shopify-store-for-a-client?-,,2021-03-05T12:32:38.030Z,"How much should a Shopify expert charge for setting up a custom Shopify store for a client? ",Quora
