"_id",job_link,answer,date,question,source
60422749ed76476feda1f6fa,https://www.quora.com/Why-did-Shopify-stop-accepting-applications-for-experts?-,"Jeffrey Conrad, CEO and Blogger at WealthBuildersJournal.Com (2001-present)Answered 1 year ago · Author has 611 answers and 348.8K answer viewsDo people make money on shopify? Jeffrey Conrad To make money with Shopify you have to do three things. This may seem simple, but people struggle with Shopify because they ignore one of these three. First, you need to set up a business around a product that is already selling. In other words, you have to sell merchandise that already has demand. Let's put it this way. Just because you're excited about a hot new product doesn't necessarily mean that there will be other people out there in sufficient numbers who share your excitement. Second, you have to drive the right traffic. In other words, you have to know where people who are interested i Continue ReadingTo make money with Shopify you have to do three things. This may seem simple, but people struggle with Shopify because they ignore one of these three. First, you need to set up a business around a product that is already selling. In other words, you have to sell merchandise that already has demand. Let's put it this way. Just because you're excited about a hot new product doesn't necessarily mean that there will be other people out there in sufficient numbers who share your excitement. Second, you have to drive the right traffic. In other words, you have to know where people who are interested in your product hang out online and get their eyeballs to your shop. This is easier said than done. A lot of people think that you just need to slap on an ad at Facebook and that's that, No, You have to know their interests. You have to psychologically profile them, you have to understand how their minds work to get to where they are on Facebook. That's how it works. Finally, and most importantly, you need to have the right product descriptions. It breaks my heart to tell you this but a lot of people who are able to finally figure out how Facebook works and gets one penny clicks. from American consumers end up dropping the ball. Why? They master Facebook, but they screw up when it comes to their Shopify store. Now from the looks of it, it seems that they did everything right. They have the right pictures. The online store seems to be set up properly, everything's formatted well. There's something missing. The product descriptions are copied and pasted from the manufacturer. In other words, it says if they found a fishing spot where fish are just jumping out of the water and ready to bite anything, but they drop their line with a hook that has the wrong bait. It is no surprise that these Shopify store owners fail to make the kind of money they could be making. They drop the ball where it matters most. They screwed up their product descriptions. Thankfully, you don't have to commit this error. You can put in the time, effort and energy to write product descriptions to work. You need to get into the minds of your target audience members and really appeal to their needs. This takes months. If you're a lousy writer to begin with it can even take years. Thankfully, there is a shortcut. You can hire expert product description writers who have a track record of success like Gene Eugenio to write solid product descriptions for you. The few pennies that you pay expert writers are going to be pale in comparison to the profit you could be making because you figured out how to play the game the right way.",2021-03-05T12:42:49.674Z,"Why did Shopify stop accepting applications for experts? ",Quora
6042275ded76476feda1f716,https://www.quora.com/What-are-your-thoughts-on-this-24-hour-Shopify-challenge-from-a-dropshipping-expert?-,"No legit eCommerce dropship expert would ever consider a 1-product store a viable business model. No legit eCommerce dropship expert would be using Aliexpress. No legit eCommerce dropship expert would say that you don’t need money to make money. No legit eCommerce dropship expert would rush a brand. No legit eCommerce dropship expert would be using stock photos from supplier. Aliexpress is considered the low end supplier for training grounds, not for viable long term business (its for new Entrepreneurs to learn about eCommerce, that’s it). Products on Aliexpress are sold by resellers who get it fro Continue ReadingNo legit eCommerce dropship expert would ever consider a 1-product store a viable business model. No legit eCommerce dropship expert would be using Aliexpress. No legit eCommerce dropship expert would say that you don’t need money to make money. No legit eCommerce dropship expert would rush a brand. No legit eCommerce dropship expert would be using stock photos from supplier. Aliexpress is considered the low end supplier for training grounds, not for viable long term business (its for new Entrepreneurs to learn about eCommerce, that’s it). Products on Aliexpress are sold by resellers who get it from resellers who get it from resellers, it’s full retail pricing. Most professional eCommerce players that are doing dropship are using proper suppliers in China that are at least half the price of Aliexpress. In other words, using sourcing agents. You also can’t sort Aliexpress from orders because that data is faked by brands wholesale orders. Not actual order orders. Anyone who ever gets brands to 7, 8, even 9+ figures (real professionals), would never do a 1-product store because there is no room for retargeting, upsells, cross sells, downsells, post sale purchases, re-orders and more. 99% of profits in a eCommerce brand comes from having a high LTV (Life time value). It comes from repeat orders, getting customers to come back to buy more stuff without paying marketing costs. Email marketing funnels are hugely powerful. You should 100% never rely on a brands first sale. There is no money there. Because there is little to no profits from 1-product stores, you don’t have money to scale, you need to get to thousands and thousands a month in marketing costs. Facebook AdsInstragram Influencer MarketingPinterest AdsQuora AdsReddit AdsGoogle AdwordsYoutube Influencer Marketing and more, and this costs money. A lot of work goes into building a proper brand, if you don’t have a large team, you should be spending weeks to setup. Hundreds to thousands of hours go into setting up a high converting brand. Brands that are slapped together in 24 hours don’t convert and don’t make money. Customers can see through that bull-crap. The expectations of consumers these days are extremely high. Want to know why 97% of people fail at this type of eCommerce? Because they listen to the fake gurus. There are no shortcuts to success. No legit eCommerce dropship expert would ever consider a 1-product store a viable business model. No legit eCommerce dropship expert would be using Aliexpress. No legit eCommerce dropship expert would say that you don’t need money to make money. No legit eCommerce dropship expert would rush a brand. No legit eCommerce dropship expert would be using stock photos from supplier. Aliexpress is considered the low end supplier for training grounds, not for viable long term business (its for new Entrepreneurs to learn about eCommerce, that’s it). Products on Aliexpress are sold by resellers who get it fro Continue Reading",2021-03-05T12:43:09.939Z,"What are your thoughts on this 24-hour Shopify challenge from a dropshipping expert? ",Quora
60422777ed76476feda1f741,https://www.quora.com/How-does-a-Shopify-marketing-expert-boost-your-online-store-sales?-,"There is many methods they use, all of it comes back to SEO. Here are some methods to optimize and build links and exposure: Shopify Store Directory - Shopify DirectoryInfluence marketingSocial Media (Facebook, Twitter, Instagram)Email lists in your market (only method cost you money)Affiliate Marketing (dont pay unless they sell)Upsell to existing customersAdd new Shopify Features (they may promote you)Understand Google landscape for your productUse your customers to sell for youStart a blog on your productUsing Apps (like Translate & Currency Converter Pro - free version increase conversion ofContinue ReadingThere is many methods they use, all of it comes back to SEO. Here are some methods to optimize and build links and exposure: Shopify Store Directory - Shopify DirectoryInfluence marketingSocial Media (Facebook, Twitter, Instagram)Email lists in your market (only method cost you money)Affiliate Marketing (dont pay unless they sell)Upsell to existing customersAdd new Shopify Features (they may promote you)Understand Google landscape for your productUse your customers to sell for youStart a blog on your productUsing Apps (like Translate & Currency Converter Pro - free version increase conversion of store visitors and access to people in more countries)Then you can get into paid marketing which dont help on link, but can boost sales. Facebook marketingBuying subscriber listsGoogle AdsI think the easiest and free one is submitting to a Shopify Store Directory There is many methods they use, all of it comes back to SEO. Here are some methods to optimize and build links and exposure: Shopify Store Directory - Shopify DirectoryInfluence marketingSocial Media (Facebook, Twitter, Instagram)Email lists in your market (only method cost you money)Affiliate Marketing (dont pay unless they sell)Upsell to existing customersAdd new Shopify Features (they may promote you)Understand Google landscape for your productUse your customers to sell for youStart a blog on your productUsing Apps (like Translate & Currency Converter Pro - free version increase conversion ofContinue Reading",2021-03-05T12:43:35.656Z,"How does a Shopify marketing expert boost your online store sales? ",Quora
6042278ded76476feda1f763,https://www.quora.com/How-do-I-hire-an-expert-to-help-me-customize-the-Fastor-theme-on-Shopify?-,"Fastor is the leading and powerful Shopify theme that provides you several options including many modules with Shopify Sections supported, which allows you to create a store without additional costs. Demo content is the perfect solution to have store ready in just a few clicks. This theme is designed to use with Shopify only. It’s not that difficult but quite confusing when you browse the list of experts, where you find more information through their profile and decide whether they are a proper fit or not for your website requirement. Now let see how to find Shopify experts for Fastorthemes on S Continue ReadingFastor is the leading and powerful Shopify theme that provides you several options including many modules with Shopify Sections supported, which allows you to create a store without additional costs. Demo content is the perfect solution to have store ready in just a few clicks. This theme is designed to use with Shopify only. It’s not that difficult but quite confusing when you browse the list of experts, where you find more information through their profile and decide whether they are a proper fit or not for your website requirement. Now let see how to find Shopify experts for Fastorthemes on Shopify? Go through the Experts DirectoryLinks to their portfolio of Shopify storesServices offeredMinimum project budgetTestimonials ReviewWrapping-up: If you find yourself trying a new strategy with no results, this is also a good time to consider calling in an expert. At Hire Shopify Experts, our Expertise helps us to give your e-commerce store a special and advanced environment. Hire Shopify developers to establish extremely scalable stores. Fastor is the leading and powerful Shopify theme that provides you several options including many modules with Shopify Sections supported, which allows you to create a store without additional costs. Demo content is the perfect solution to have store ready in just a few clicks. This theme is designed to use with Shopify only. It’s not that difficult but quite confusing when you browse the list of experts, where you find more information through their profile and decide whether they are a proper fit or not for your website requirement. Now let see how to find Shopify experts for Fastorthemes on S Continue Reading",2021-03-05T12:43:57.774Z,"How do I hire an expert to help me customize the Fastor theme on Shopify? ",Quora
604227a1ed76476feda1f783,https://www.quora.com/Why-should-I-hire-Shopify-SEO-experts?-,,2021-03-05T12:44:17.742Z,"Why should I hire Shopify SEO experts? ",Quora
604227ceed76476feda1f7c4,https://www.quora.com/Why-does-the-Shopify-site-need-a-marketing-expert?-,"Shiv Technolabs PVT. LTD., former CEO at Shiv Technolab Pvt. LtdAnswered September 28, 2020 · Author has 481 answers and 79.9K answer viewsWhat is the need to hire a Shopify expert? Shiv Technolabs PVT. LTD. While building your online store, you can feel like you are drowning in to-do lists. You have to play every role by yourself from the accountant, content manager to the CEO of the store. Working on so many profiles at once can be an exhausting experience. That is the reason you require a Shopify expert. Because Shopify experts understand your company’s requirements and fulfill it successfully. Generally, Shopify Experts have experienced professionals and as a Shopify partner, they know what your buyers are looking for as they in the business every day. Shopify is a user-friendly platform. The fol Continue ReadingWhile building your online store, you can feel like you are drowning in to-do lists. You have to play every role by yourself from the accountant, content manager to the CEO of the store. Working on so many profiles at once can be an exhausting experience. That is the reason you require a Shopify expert. Because Shopify experts understand your company’s requirements and fulfill it successfully. Generally, Shopify Experts have experienced professionals and as a Shopify partner, they know what your buyers are looking for as they in the business every day. Shopify is a user-friendly platform. The following are the top reasons to Hire A Shopify Expert? Better brandingSearch engine optimizationOngoing adviceOutsourcing makes senseWrapping-up: Hiring a Shopify expert is not an easy task thought above details will help you out to choose wisely for your Shopify Expert in the market. Seeking for a Shopify Expert? Visit Hire Shopify Experts. Our expertise helps us to give your e-commerce store a special and advanced environment. Hire Dedicated Shopify developers to establish extremely scalable stores.",2021-03-05T12:45:02.882Z,"Why does the Shopify site need a marketing expert? ",Quora
6042280aed76476feda1f81c,https://www.quora.com/How-does-the-Shopify-marketing-expert-increase-traffic-to-your-website?-,"The expert may use these methods Shopify Store Directory - Shopify DirectoryOpitmizing your store for SEOInfluence marketingSocial Media (Facebook, Twitter, InstagramEmail lists in your market (only method cost you money)Affiliate Marketing (dont pay unless they sell)Upsell to existing customersAdd new Shopify Features (they may promote you)Understand Google landscape for your productUse your customers to sell for youStart a blog on your productUsing Apps (like Translate & Currency Converter Pro - free version increase conversion of store visitors and access to people in more countries)Then you can get into paid marketing Facebook marketingBuying subscriber listsGoogle AdsI think the easiest and free one is submitting to a Shopify Store Directory",2021-03-05T12:46:02.802Z,"How does the Shopify marketing expert increase traffic to your website? ",Quora
60422834ed76476feda1f85b,https://www.quora.com/When-do-you-need-to-hire-a-Shopify-marketing-expert?-,"Shashank Shekhar, Entrepreneur Turned Freelancer (2020-present)Answered February 23, 2021 · Author has 239 answers and 6.5M answer viewsShould I hire a Shopify expert? Shashank Shekhar There are multiple reasons to hire a Shopify Expert, but before that let’s understand what roles can a Shopify Expert play - Setup your online store - A Shopify Developer can help you set up a store from scratch which involves setting up the domain, hosting, theme, and making the Shopify store functional and open to the public.Customize an existing theme - A Shopify Developer can help you customize the existing theme as per your choices. This can involve making changes in the design changes, structural changes, or even customize it with custom-code.Make Integrations/Add-ons - Shopify allows mulContinue ReadingThere are multiple reasons to hire a Shopify Expert, but before that let’s understand what roles can a Shopify Expert play - Setup your online store - A Shopify Developer can help you set up a store from scratch which involves setting up the domain, hosting, theme, and making the Shopify store functional and open to the public.Customize an existing theme - A Shopify Developer can help you customize the existing theme as per your choices. This can involve making changes in the design changes, structural changes, or even customize it with custom-code.Make Integrations/Add-ons - Shopify allows multiple 3rd party integrations to enable Online stores to do more. For example - MailChimp can be used to collect emails, and build mailing lists. Other integrations can be for Dropshipping, Billing, etcOptimize Store Performance - There is always scope to optimize the current Shopify store to make it perform better. Performance enhancements can be in terms of Speed, presentation, UI/UX, etc.Optimize for Marketing performance - Various Marketing activities need to be monitored extensively to grow the store, and that calls for the need for integrations of Pixels, setting up Tag Managers, etc. A Shopify Expert can help you optimize your store for Marketing analyticsOptimize for SEO - A major chunk of traffic can be driven free of cost if the store is optimized to be found on the first page of Google, and other Search Engines. A Shopify Expert can help you optimize for SEO by writing blogs, creating backlinks, creating a schema of the store, and a lot more.Debug and Fix errors - Running online stores involves working with various apps, and technologies, and with time there can be occasional bugs thrown by either the Shopify theme, or some 3rd party plugins, and at such stages, a Freelance Shopify Developer can help identify and fix bugs. Although there are instances when you can develop your website yourself, I would recommend you measure “Opportunity Cost”, and see if your time and efforts can be better used somewhere else. Hire the best Shopify Experts here.",2021-03-05T12:46:44.768Z,"When do you need to hire a Shopify marketing expert? ",Quora
60422846ed76476feda1f873,https://www.quora.com/How-do-I-hire-an-expert-to-submit-your-Shopify-store-coupon-code-to-the-top-30-coupon-sites?-,,2021-03-05T12:47:02.568Z,"How do I hire an expert to submit your Shopify store coupon code to the top 30 coupon sites? ",Quora
6042285ced76476feda1f894,https://www.quora.com/How-do-I-find-potential-Shopify-store-owners-who-are-looking-for-product-upload-experts?-,Jeffrey Conrad 1,2021-03-05T12:47:24.385Z,"How do I find potential Shopify store owners who are looking for product upload experts? ",Quora
6042286fed76476feda1f8b3,https://www.quora.com/How-do-you-increase-traffic-to-your-online-store-and-grow-your-business-sales-with-a-Shopify-marketing-expert?-,,2021-03-05T12:47:43.858Z,"How do you increase traffic to your online store and grow your business sales with a Shopify marketing expert? ",Quora
60422881ed76476feda1f8d0,https://www.quora.com/What-is-a-Shopify-marketing-expert-and-how-does-he-help-increase-sales-to-your-online-store?-,"Sandip Harkhani Hire Shopify Marketing Experts & Grow Your Ecommerce Sales. SEO for Shopify is the process of optimizing both on and off page content of your Shopify store to display top rankings for all your best keywords. Before we consider building ads or campaigns, we work with our customers to get to the core of what they do, the very core of their company, and use that information to build an overarching strategies that not only drives results, but serves the brand correctly in every form, on every platform and every channel. We are the best Shopify Website Development Company India. Read these blogs to un Continue ReadingHire Shopify Marketing Experts & Grow Your Ecommerce Sales. SEO for Shopify is the process of optimizing both on and off page content of your Shopify store to display top rankings for all your best keywords. Before we consider building ads or campaigns, we work with our customers to get to the core of what they do, the very core of their company, and use that information to build an overarching strategies that not only drives results, but serves the brand correctly in every form, on every platform and every channel. We are the best Shopify Website Development Company India. Read these blogs to understand how to increase sales to your online store. 4 Powerful Shopify SEO Points to Increase Organic Traffic for Your Store A Guide on how to Increase Your Sales on Shopify - Shopify Experts Continue Reading",2021-03-05T12:48:01.831Z,"What is a Shopify marketing expert and how does he help increase sales to your online store? ",Quora
604228bbed76476feda1f923,https://www.quora.com/What-are-the-things-to-consider-before-hiring-a-Shopify-marketing-expert-for-your-online-store?-,"Consider my rule #1 in business: Don’t consider a Shopify expert to help with your online store. Reason: don’t have a cookie cutter store. Make it different. Be noticed. The biggest different between Sears and Amazon is style. Dare to be different. Amazon got big but it was not advertising, marketing or knowledge that did it. Their biggest difference was how they were styled and presented themselves that made them interesting. More people said right out, “that company will be big!” Further, DO NOT be another Ebay or Etsy, they are franchise hosts for suckers. Anyone of them are people who think t Continue ReadingConsider my rule #1 in business: Don’t consider a Shopify expert to help with your online store. Reason: don’t have a cookie cutter store. Make it different. Be noticed. The biggest different between Sears and Amazon is style. Dare to be different. Amazon got big but it was not advertising, marketing or knowledge that did it. Their biggest difference was how they were styled and presented themselves that made them interesting. More people said right out, “that company will be big!” Further, DO NOT be another Ebay or Etsy, they are franchise hosts for suckers. Anyone of them are people who think they will be noticed while another company (the host) does their advertising. BUT in the end they need to pay a fee for that advertising AND rent to their host to be there in the first place. (dull) Do your own (cheaper) advertising and marketing, then build a REAL business. Better yet, build another Ebay or Etsy and host other suckers who want to build a franchise onto a YOUR host site. Make it a one word name. They did. Consider my rule #1 in business: Don’t consider a Shopify expert to help with your online store. Reason: don’t have a cookie cutter store. Make it different. Be noticed. The biggest different between Sears and Amazon is style. Dare to be different. Amazon got big but it was not advertising, marketing or knowledge that did it. Their biggest difference was how they were styled and presented themselves that made them interesting. More people said right out, “that company will be big!” Further, DO NOT be another Ebay or Etsy, they are franchise hosts for suckers. Anyone of them are people who think t Continue Reading",2021-03-05T12:48:59.174Z,"What are the things to consider before hiring a Shopify marketing expert for your online store? ",Quora
604228faed76476feda1f97d,https://www.quora.com/Where-can-I-find-instructional-designers-who-will-work-as-freelancers?-,"Anita Kumar, Instructional Designer (2012-present)Updated 1 year ago Anita Kumar I am a freelance instructional designer; my clients have nearly always found me on LinkedIn or through word-of-mouth. IMO, LinkedIn is one of the best sites to find freelance IDs. You can search for “freelance instructional designer” on LI and filter the results by People and Location. You can then shortlist them after going through their posts and portfolios. (The professional ones always have links to their portfolio on their LinkedIn profile.) Here’s my LI profile https://www.linkedin.com/in/anitak and my Online Portfolio. If you are specifically looking for freelance elearning developers, yo Continue ReadingI am a freelance instructional designer; my clients have nearly always found me on LinkedIn or through word-of-mouth. IMO, LinkedIn is one of the best sites to find freelance IDs. You can search for “freelance instructional designer” on LI and filter the results by People and Location. You can then shortlist them after going through their posts and portfolios. (The professional ones always have links to their portfolio on their LinkedIn profile.) Here’s my LI profile https://www.linkedin.com/in/anitak and my Online Portfolio. If you are specifically looking for freelance elearning developers, you may check out the Articulate E-Learning Heroes Community. Their E-Learning Challenges section has learning samples created by many different developers.",2021-03-05T12:50:02.046Z,"Where can I find instructional designers who will work as freelancers? ",Quora
6042290ced76476feda1f99c,https://www.quora.com/How-do-you-become-an-expert-on-Shopify-web-app-programming?-,,2021-03-05T12:50:20.951Z,"How do you become an expert on Shopify web app programming? ",Quora
